Sheet: Sheet1
A1: 8x79/VIETTEL/2015
A2: Tháng 1 | L2: Tháng 2 | W2: Tháng 3 | AH2: Tháng 4 | AS2: Tháng 5 | BD2: Tháng 6 | BO2: Tháng 7 | BZ2: Tháng 8 | CK2: Tháng 9 | CV2: Tháng 10 | DG2: Tháng 11 | DR2: Tháng 12 | EC2: Lũy kế đến tháng báo cáo
A3: Tên đối tác | B3: Số liệu hệ thống/tạm tính | F3: Số liệu quyết toán theo biên bản đối soát | J3: C/lệch Quyết toán - Tạm tính | L3: Tên đối tác | M3: Số liệu hệ thống/tạm tính | Q3: Số liệu quyết toán theo biên bản đối soát | U3: C/lệch Quyết toán - Tạm tính | W3: Tên đối tác | X3: Số liệu hệ thống/tạm tính | AB3: Số liệu quyết toán theo biên bản đối soát | AF3: C/lệch Quyết toán - Tạm tính | AH3: Tên đối tác | AI3: Số liệu hệ thống/tạm tính | AM3: Số liệu quyết toán theo biên bản đối soát | AQ3: C/lệch Quyết toán - Tạm tính | AS3: Tên đối tác | AT3: Số liệu hệ thống/tạm tính | AX3: Số liệu quyết toán theo biên bản đối soát | BB3: C/lệch Quyết toán - Tạm tính | BD3: Tên đối tác | BE3: Số liệu hệ thống/tạm tính | BI3: Số liệu quyết toán theo biên bản đối soát | BM3: C/lệch Quyết toán - Tạm tính | BO3: Tên đối tác | BP3: Số liệu hệ thống/tạm tính | BT3: Số liệu quyết toán theo biên bản đối soát | BX3: C/lệch Quyết toán - Tạm tính | BZ3: Tên đối tác | CA3: Số liệu hệ thống/tạm tính | CE3: Số liệu quyết toán theo biên bản đối soát | CI3: C/lệch Quyết toán - Tạm tính | CK3: Tên đối tác | CL3: Số liệu hệ thống/tạm tính | CP3: Số liệu quyết toán theo biên bản đối soát | CT3: C/lệch Quyết toán - Tạm tính | CV3: Tên đối tác | CW3: Số liệu hệ thống/tạm tính | DA3: Số liệu quyết toán theo biên bản đối soát | DE3: C/lệch Quyết toán - Tạm tính | DG3: Tên đối tác | DH3: Số liệu hệ thống/tạm tính | DL3: Số liệu quyết toán theo biên bản đối soát | DP3: C/lệch Quyết toán - Tạm tính | DR3: Tên đối tác | DS3: Số liệu hệ thống/tạm tính | DW3: Số liệu quyết toán theo biên bản đối soát | EA3: C/lệch Quyết toán - Tạm tính | EC3: Tên đối tác | ED3: Số liệu hệ thống/tạm tính | EH3: Số liệu quyết toán theo biên bản đối soát | EL3: C/lệch Quyết toán - Tạm tính
B4: Doanh thu | C4: MT vượt | D4: Trả đối tác | E4: DT về đơn vị | F4: Doanh thu | G4: Trả đối tác | H4: MT | I4: DT về đơn vị | M4: Doanh thu | N4: MT vượt | O4: Trả đối tác | P4: DT về đơn vị | Q4: Doanh thu | R4: Trả đối tác | S4: MT | T4: DT về đơn vị | X4: Doanh thu | Y4: MT vượt | Z4: Trả đối tác | AA4: DT về đơn vị | AB4: Doanh thu | AC4: Trả đối tác | AD4: MT | AE4: DT về đơn vị | AI4: Doanh thu | AJ4: MT vượt | AK4: Trả đối tác | AL4: DT về đơn vị | AM4: Doanh thu | AN4: Trả đối tác | AO4: MT | AP4: DT về đơn vị | AT4: Doanh thu | AU4: MT vượt | AV4: Trả đối tác | AW4: DT về đơn vị | AX4: Doanh thu | AY4: Trả đối tác | AZ4: MT | BA4: DT về đơn vị | BE4: Doanh thu | BF4: MT vượt | BG4: Trả đối tác | BH4: DT về đơn vị | BI4: Doanh thu | BJ4: Trả đối tác | BK4: MT | BL4: DT về đơn vị | BP4: Doanh thu | BQ4: MT vượt | BR4: Trả đối tác | BS4: DT về đơn vị | BT4: Doanh thu | BU4: Trả đối tác | BV4: MT | BW4: DT về đơn vị | CA4: Doanh thu | CB4: MT vượt | CC4: Trả đối tác | CD4: DT về đơn vị | CE4: Doanh thu | CF4: Trả đối tác | CG4: MT | CH4: DT về đơn vị | CL4: Doanh thu | CM4: MT vượt | CN4: Trả đối tác | CO4: DT về đơn vị | CP4: Doanh thu | CQ4: Trả đối tác | CR4: MT | CS4: DT về đơn vị | CW4: Doanh thu | CX4: MT vượt | CY4: Trả đối tác | CZ4: DT về đơn vị | DA4: Doanh thu | DB4: Trả đối tác | DC4: MT | DD4: DT về đơn vị | DH4: Doanh thu | DI4: MT vượt | DJ4: Trả đối tác | DK4: DT về đơn vị | DL4: Doanh thu | DM4: Trả đối tác | DN4: MT | DO4: DT về đơn vị | DS4: Doanh thu | DT4: MT vượt | DU4: Trả đối tác | DV4: DT về đơn vị | DW4: Doanh thu | DX4: Trả đối tác | DY4: MT | DZ4: DT về đơn vị | ED4: Doanh thu | EE4: MT vượt | EF4: Trả đối tác | EG4: DT về đơn vị | EH4: Doanh thu | EI4: Trả đối tác | EJ4: MT | EK4: DT về đơn vị
B5: (1) | C5: (2) | D5: (3) = (2) *x% | E5: (4) = (1) - (3) - (2) | F5: (5) | G5: (6) | H5: (7) | I5: (8) = (5) - (6) - (7) | J5: (9) = (4) - (8) | M5: (1) | N5: (2) = ( MO - MT) *91 | O5: (3) = (2) *15% | P5: (4) = (1) - (3) - (2) | Q5: (5) | R5: (6) | S5: (7) | T5: (8) = (5) - (6) - (7) | U5: (9) = (4) - (8) | X5: (1) | Y5: (2) = ( MO - MT) *91 | Z5: (3) = (2) *15% | AA5: (4) = (1) - (3) - (2) | AB5: (5) | AC5: (6) | AD5: (7) | AE5: (8) = (5) - (6) - (7) | AF5: (9) = (4) - (8) | AI5: (1) | AJ5: (2) = ( MO - MT) *91 | AK5: (3) = (2) *15% | AL5: (4) = (1) - (3) - (2) | AM5: (5) | AN5: (6) | AO5: (7) | AP5: (8) = (5) - (6) - (7) | AQ5: (9) = (4) - (8) | AT5: (1) | AU5: (2) = ( MO - MT) *91 | AV5: (3) = (2) *15% | AW5: (4) = (1) - (3) - (2) | AX5: (5) | AY5: (6) | AZ5: (7) | BA5: (8) = (5) - (6) - (7) | BB5: (9) = (4) - (8) | BE5: (1) | BF5: (2) = ( MO - MT) *91 | BG5: (3) = (2) *15% | BH5: (4) = (1) - (3) - (2) | BI5: (5) | BJ5: (6) | BK5: (7) | BL5: (8) = (5) - (6) - (7) | BM5: (9) = (4) - (8) | BP5: (1) | BQ5: (2) | BR5: (3) = (2) *15% | BS5: (4) = (1) - (3) - (2) | BT5: (5) | BU5: (6) | BV5: (7) | BW5: (8) = (5) - (6) - (7) | BX5: (9) = (4) - (8) | CA5: (1) | CB5: (2) = ( MO - MT) *91 | CC5: (3) = (2) *15% | CD5: (4) = (1) - (3) - (2) | CE5: (5) | CF5: (6) | CG5: (7) | CH5: (8) = (5) - (6) - (7) | CI5: (9) = (4) - (8) | CL5: (1) | CM5: (2) = ( MO - MT) *91 | CN5: (3) = (2) *15% | CO5: (4) = (1) - (3) - (2) | CP5: (5) | CQ5: (6) | CR5: (7) | CS5: (8) = (5) - (6) - (7) | CT5: (9) = (4) - (8) | CW5: (1) | CX5: (2) = ( MO - MT) *91 | CY5: (3) = (2) *15% | CZ5: (4) = (1) - (3) - (2) | DA5: (5) | DB5: (6) | DC5: (7) | DD5: (8) = (5) - (6) - (7) | DE5: (9) = (4) - (8) | DH5: (1) | DI5: (2) = ( MO - MT) *91 | DJ5: (3) = (2) *15% | DK5: (4) = (1) - (3) - (2) | DL5: (5) | DM5: (6) | DN5: (7) | DO5: (8) = (5) - (6) - (7) | DP5: (9) = (4) - (8) | DS5: (1) | DT5: (2) = ( MO - MT) *91 | DU5: (3) = (2) *15% | DV5: (4) = (1) - (3) - (2) | DW5: (5) | DX5: (6) | DY5: (7) | DZ5: (8) = (5) - (6) - (7) | EA5: (9) = (4) - (8) | ED5: (1) | EE5: (2) = ( MO - MT) *91 | EF5: (3) = (2) *15% | EG5: (4) = (1) - (3) - (2) | EH5: (5) | EI5: (6) | EJ5: (7) | EK5: (8) = (5) - (6) - (7) | EL5: (9) = (4) - (8)
A6: SUBCPS | B6: 99643676 | C6: 127580 | D6: 0 | E6: =RC[-3]-RC[-1]-RC[-2] ->  | F6: =R17C6*RC[-4] ->  | G6: =RC[-1]*15% ->  | H6: =R17C8*RC[-5] ->  | I6: =RC[-3]-RC[-2]-RC[-1] ->  | J6: =RC[-1]-RC[-5] ->  | L6: SUBCPS | M6: 159484089 | N6: 82264 | O6: 0 | P6: =RC[-3]-RC[-1]-RC[-2] -> 2467006.9 | Q6: =R17C17*RC[-4] -> 3000383.6278659259 | R6: =RC[-1]*15% -> 450057.54417988885 | S6: =R17C19*RC[-5] -> 108517.5 | T6: =RC[-3]-RC[-2]-RC[-1] -> 2441808.583686037 | U6: =RC[-1]-RC[-5] -> -25198.316313962918 | W6: SUBCPS | X6: 117885507 | Y6: 211939 | Z6: 0 | AA6: =RC[-3]-RC[-1]-RC[-2] -> 0 | AB6: =R17C28*RC[-4] -> 875000000 | AC6: =RC[-1]*15% -> 131250000 | AD6: =R17C19*RC[-5] -> 1.8 | AE6: =RC[-3]-RC[-2]-RC[-1] -> 743749998.20000005 | AF6: =RC[-1]-RC[-5] -> 743749998.20000005 | AH6: SUBCPS | AI6: 114484526 | AJ6: 791345 | AK6: 0 | AL6: =RC[-3]-RC[-1]-RC[-2] -> 0.54999999999999982 | AM6: =R17C39*RC[-4] -> 875000000 | AN6: =RC[-1]*15% -> 131250000 | AO6: =R17C19*RC[-5] -> 1.8 | AP6: =RC[-3]-RC[-2]-RC[-1] -> 743749998.20000005 | AQ6: =RC[-1]-RC[-5] -> 743749997.6500001 | AS6: SUBCPS | AT6: 131700551 | AU6: 344434 | AV6: 0 | AW6: =RC[-3]-RC[-1]-RC[-2] -> 0.54999999999999982 | AX6: =R17C50*RC[-4] -> 875000000 | AY6: =RC[-1]*15% -> 131250000 | AZ6: =R17C19*RC[-5] -> 1.8 | BA6: =RC[-3]-RC[-2]-RC[-1] -> 743749998.20000005 | BB6: =RC[-1]-RC[-5] -> 743749997.6500001 | BD6: SUBCPS | BE6: 144528070 | BF6: 723631 | BG6: 0 | BH6: =RC[-3]-RC[-1]-RC[-2] -> 0.54999999999999982 | BI6: =R17C61*RC[-4] -> 875000000 | BJ6: =RC[-1]*15% -> 131250000 | BK6: =R17C19*RC[-5] -> 1.8 | BL6: =RC[-3]-RC[-2]-RC[-1] -> 743749998.20000005 | BM6: =RC[-1]-RC[-5] -> 743749997.6500001 | BO6: SUBCPS | BP6: 0 | BQ6: 0 | BR6: 0 | BS6: =RC[-3]-RC[-1]-RC[-2] -> 0.54999999999999982 | BT6: =R17C72*RC[-4] -> 875000000 | BU6: =RC[-1]*15% -> 131250000 | BV6: =R17C8*RC[-5] -> 1.8 | BW6: =RC[-3]-RC[-2]-RC[-1] -> 743749998.20000005 | BX6: =RC[-1]-RC[-5] -> 743749997.6500001 | BZ6: SUBCPS | CA6: 0 | CB6: 0 | CC6: 0 | CD6: =RC[-3]-RC[-1]-RC[-2] -> 0.54999999999999982 | CE6: =R17C83*RC[-4] -> 875000000 | CF6: =RC[-1]*15% -> 131250000 | CG6: =R17C19*RC[-5] -> 1.8 | CH6: =RC[-3]-RC[-2]-RC[-1] -> 743749998.20000005 | CI6: =RC[-1]-RC[-5] -> 743749997.6500001 | CK6: SUBCPS | CL6: 0 | CM6: 0 | CN6: 0 | CO6: =RC[-3]-RC[-1]-RC[-2] -> 0.54999999999999982 | CP6: =R17C94*RC[-4] -> 875000000 | CQ6: =RC[-1]*15% -> 131250000 | CR6: =R17C19*RC[-5] -> 1.8 | CS6: =RC[-3]-RC[-2]-RC[-1] -> 743749998.20000005 | CT6: =RC[-1]-RC[-5] -> 743749997.6500001 | CV6: SUBCPS | CW6: 0 | CX6: 0 | CY6: 0 | CZ6: =RC[-3]-RC[-1]-RC[-2] -> 0.54999999999999982 | DA6: =R17C105*RC[-4] -> 875000000 | DB6: =RC[-1]*15% -> 131250000 | DC6: =R17C19*RC[-5] -> 1.8 | DD6: =RC[-3]-RC[-2]-RC[-1] -> 743749998.20000005 | DE6: =RC[-1]-RC[-5] -> 743749997.6500001 | DG6: SUBCPS | DH6: 0 | DI6: 0 | DJ6: 0 | DK6: =RC[-3]-RC[-1]-RC[-2] -> 0.54999999999999982 | DL6: =R17C116*RC[-4] -> 807692307.69230771 | DM6: =RC[-1]*15% -> 121153846.15384614 | DN6: =R17C19*RC[-5] -> 1.8 | DO6: =RC[-3]-RC[-2]-RC[-1] -> 686538459.73846161 | DP6: =RC[-1]-RC[-5] -> 686538459.18846166 | DR6: SUBCPS | DS6: 0 | DT6: 0 | DU6: 0 | DV6: =RC[-3]-RC[-1]-RC[-2] -> 0.54999999999999982 | DW6: =R17C127*RC[-4] -> 875000000 | DX6: =RC[-1]*15% -> 131250000 | DY6: =R17C19*RC[-5] -> 1.8 | DZ6: =RC[-3]-RC[-2]-RC[-1] -> 743749998.20000005 | EA6: =RC[-1]-RC[-5] -> 743749997.6500001 | EC6: SUBCPS | ED6: =RC[-132]+RC[-121]+RC[-110]+RC[-99]+RC[-88]+RC[-77]+RC[-66]+RC[-55]+RC[-44]+RC[-33]+RC[-22]+RC[-11] ->  | EE6: =RC[-132]+RC[-121]+RC[-110]+RC[-99]+RC[-88]+RC[-77]+RC[-66]+RC[-55]+RC[-44]+RC[-33]+RC[-22]+RC[-11] ->  | EF6: =RC[-132]+RC[-121]+RC[-110]+RC[-99]+RC[-88]+RC[-77]+RC[-66]+RC[-55]+RC[-44]+RC[-33]+RC[-22]+RC[-11] ->  | EG6: =RC[-132]+RC[-121]+RC[-110]+RC[-99]+RC[-88]+RC[-77]+RC[-66]+RC[-55]+RC[-44]+RC[-33]+RC[-22]+RC[-11] ->  | EH6: =RC[-132]+RC[-121]+RC[-110]+RC[-99]+RC[-88]+RC[-77]+RC[-66]+RC[-55]+RC[-44]+RC[-33]+RC[-22]+RC[-11] ->  | EI6: =RC[-132]+RC[-121]+RC[-110]+RC[-99]+RC[-88]+RC[-77]+RC[-66]+RC[-55]+RC[-44]+RC[-33]+RC[-22]+RC[-11] ->  | EJ6: =RC[-132]+RC[-121]+RC[-110]+RC[-99]+RC[-88]+RC[-77]+RC[-66]+RC[-55]+RC[-44]+RC[-33]+RC[-22]+RC[-11] ->  | EK6: =RC[-132]+RC[-121]+RC[-110]+RC[-99]+RC[-88]+RC[-77]+RC[-66]+RC[-55]+RC[-44]+RC[-33]+RC[-22]+RC[-11] ->  | EL6: =RC[-132]+RC[-121]+RC[-110]+RC[-99]+RC[-88]+RC[-77]+RC[-66]+RC[-55]+RC[-44]+RC[-33]+RC[-22]+RC[-11] -> 
A7: LUCKY_FONE | B7: 209253748 | C7: 13501700 | D7: 0 | E7: =RC[-3]-RC[-1]-RC[-2] ->  | F7: =R17C6*RC[-4] ->  | G7: =RC[-1]*15% ->  | H7: =R17C8*RC[-5] ->  | I7: =RC[-3]-RC[-2]-RC[-1] ->  | J7: =RC[-1]-RC[-5] ->  | L7: LUCKY_FONE | M7: 200781497 | N7: 10792189 | O7: 0 | P7: =RC[-3]-RC[-1]-RC[-2] -> 2467006.9 | Q7: =R17C17*RC[-4] -> 3000383.6278659259 | R7: =RC[-1]*15% -> 450057.54417988885 | S7: =R17C19*RC[-5] -> 108517.5 | T7: =RC[-3]-RC[-2]-RC[-1] -> 2441808.583686037 | U7: =RC[-1]-RC[-5] -> -25198.316313962918 | W7: LUCKY_FONE | X7: 199414365 | Y7: 12880446 | Z7: 0 | AA7: =RC[-3]-RC[-1]-RC[-2] -> 0 | AB7: =R17C28*RC[-4] -> 875000000 | AC7: =RC[-1]*15% -> 131250000 | AD7: =R17C19*RC[-5] -> 1.8 | AE7: =RC[-3]-RC[-2]-RC[-1] -> 743749998.20000005 | AF7: =RC[-1]-RC[-5] -> 743749998.20000005 | AH7: LUCKY_FONE | AI7: 226631932 | AJ7: 15048100 | AK7: 0 | AL7: =RC[-3]-RC[-1]-RC[-2] -> 0.54999999999999982 | AM7: =R17C39*RC[-4] -> 875000000 | AN7: =RC[-1]*15% -> 131250000 | AO7: =R17C19*RC[-5] -> 1.8 | AP7: =RC[-3]-RC[-2]-RC[-1] -> 743749998.20000005 | AQ7: =RC[-1]-RC[-5] -> 743749997.6500001 | AS7: LUCKY_FONE | AT7: 240276756 | AU7: 17064707 | AV7: 0 | AW7: =RC[-3]-RC[-1]-RC[-2] -> 0.54999999999999982 | AX7: =R17C50*RC[-4] -> 875000000 | AY7: =RC[-1]*15% -> 131250000 | AZ7: =R17C19*RC[-5] -> 1.8 | BA7: =RC[-3]-RC[-2]-RC[-1] -> 743749998.20000005 | BB7: =RC[-1]-RC[-5] -> 743749997.6500001 | BD7: LUCKY_FONE | BE7: 222677643 | BF7: 16473663 | BG7: 0 | BH7: =RC[-3]-RC[-1]-RC[-2] -> 0.54999999999999982 | BI7: =R17C61*RC[-4] -> 875000000 | BJ7: =RC[-1]*15% -> 131250000 | BK7: =R17C19*RC[-5] -> 1.8 | BL7: =RC[-3]-RC[-2]-RC[-1] -> 743749998.20000005 | BM7: =RC[-1]-RC[-5] -> 743749997.6500001 | BO7: LUCKY_FONE | BP7: 0 | BQ7: 0 | BR7: 0 | BS7: =RC[-3]-RC[-1]-RC[-2] -> 0.54999999999999982 | BT7: =R17C72*RC[-4] -> 875000000 | BU7: =RC[-1]*15% -> 131250000 | BV7: =R17C8*RC[-5] -> 1.8 | BW7: =RC[-3]-RC[-2]-RC[-1] -> 743749998.20000005 | BX7: =RC[-1]-RC[-5] -> 743749997.6500001 | BZ7: LUCKY_FONE | CA7: 0 | CB7: 0 | CC7: 0 | CD7: =RC[-3]-RC[-1]-RC[-2] -> 0.54999999999999982 | CE7: =R17C83*RC[-4] -> 875000000 | CF7: =RC[-1]*15% -> 131250000 | CG7: =R17C19*RC[-5] -> 1.8 | CH7: =RC[-3]-RC[-2]-RC[-1] -> 743749998.20000005 | CI7: =RC[-1]-RC[-5] -> 743749997.6500001 | CK7: LUCKY_FONE | CL7: 0 | CM7: 0 | CN7: 0 | CO7: =RC[-3]-RC[-1]-RC[-2] -> 0.54999999999999982 | CP7: =R17C94*RC[-4] -> 875000000 | CQ7: =RC[-1]*15% -> 131250000 | CR7: =R17C19*RC[-5] -> 1.8 | CS7: =RC[-3]-RC[-2]-RC[-1] -> 743749998.20000005 | CT7: =RC[-1]-RC[-5] -> 743749997.6500001 | CV7: LUCKY_FONE | CW7: 0 | CX7: 0 | CY7: 0 | CZ7: =RC[-3]-RC[-1]-RC[-2] -> 0.54999999999999982 | DA7: =R17C105*RC[-4] -> 875000000 | DB7: =RC[-1]*15% -> 131250000 | DC7: =R17C19*RC[-5] -> 1.8 | DD7: =RC[-3]-RC[-2]-RC[-1] -> 743749998.20000005 | DE7: =RC[-1]-RC[-5] -> 743749997.6500001 | DG7: LUCKY_FONE | DH7: 0 | DI7: 0 | DJ7: 0 | DK7: =RC[-3]-RC[-1]-RC[-2] -> 0.54999999999999982 | DL7: =R17C116*RC[-4] -> 807692307.69230771 | DM7: =RC[-1]*15% -> 121153846.15384614 | DN7: =R17C19*RC[-5] -> 1.8 | DO7: =RC[-3]-RC[-2]-RC[-1] -> 686538459.73846161 | DP7: =RC[-1]-RC[-5] -> 686538459.18846166 | DR7: LUCKY_FONE | DS7: 0 | DT7: 0 | DU7: 0 | DV7: =RC[-3]-RC[-1]-RC[-2] -> 0.54999999999999982 | DW7: =R17C127*RC[-4] -> 875000000 | DX7: =RC[-1]*15% -> 131250000 | DY7: =R17C19*RC[-5] -> 1.8 | DZ7: =RC[-3]-RC[-2]-RC[-1] -> 743749998.20000005 | EA7: =RC[-1]-RC[-5] -> 743749997.6500001 | EC7: LUCKY_FONE | ED7: =RC[-132]+RC[-121]+RC[-110]+RC[-99]+RC[-88]+RC[-77]+RC[-66]+RC[-55]+RC[-44]+RC[-33]+RC[-22]+RC[-11] ->  | EE7: =RC[-132]+RC[-121]+RC[-110]+RC[-99]+RC[-88]+RC[-77]+RC[-66]+RC[-55]+RC[-44]+RC[-33]+RC[-22]+RC[-11] ->  | EF7: =RC[-132]+RC[-121]+RC[-110]+RC[-99]+RC[-88]+RC[-77]+RC[-66]+RC[-55]+RC[-44]+RC[-33]+RC[-22]+RC[-11] ->  | EG7: =RC[-132]+RC[-121]+RC[-110]+RC[-99]+RC[-88]+RC[-77]+RC[-66]+RC[-55]+RC[-44]+RC[-33]+RC[-22]+RC[-11] ->  | EH7: =RC[-132]+RC[-121]+RC[-110]+RC[-99]+RC[-88]+RC[-77]+RC[-66]+RC[-55]+RC[-44]+RC[-33]+RC[-22]+RC[-11] ->  | EI7: =RC[-132]+RC[-121]+RC[-110]+RC[-99]+RC[-88]+RC[-77]+RC[-66]+RC[-55]+RC[-44]+RC[-33]+RC[-22]+RC[-11] ->  | EJ7: =RC[-132]+RC[-121]+RC[-110]+RC[-99]+RC[-88]+RC[-77]+RC[-66]+RC[-55]+RC[-44]+RC[-33]+RC[-22]+RC[-11] ->  | EK7: =RC[-132]+RC[-121]+RC[-110]+RC[-99]+RC[-88]+RC[-77]+RC[-66]+RC[-55]+RC[-44]+RC[-33]+RC[-22]+RC[-11] ->  | EL7: =RC[-132]+RC[-121]+RC[-110]+RC[-99]+RC[-88]+RC[-77]+RC[-66]+RC[-55]+RC[-44]+RC[-33]+RC[-22]+RC[-11] -> 
A8: TT PTKD | B8: 221706449 | C8: 121969 | D8: 0 | E8: =RC[-3]-RC[-1]-RC[-2] ->  | F8: =R17C6*RC[-4] ->  | G8: =RC[-1]*15% ->  | H8: =R17C8*RC[-5] ->  | I8: =RC[-3]-RC[-2]-RC[-1] ->  | J8: =RC[-1]-RC[-5] ->  | L8: TT PTKD | M8: 206265994 | N8: 85718 | O8: 0 | P8: =RC[-3]-RC[-1]-RC[-2] -> 2467006.9 | Q8: =R17C17*RC[-4] -> 3000383.6278659259 | R8: =RC[-1]*15% -> 450057.54417988885 | S8: =R17C19*RC[-5] -> 108517.5 | T8: =RC[-3]-RC[-2]-RC[-1] -> 2441808.583686037 | U8: =RC[-1]-RC[-5] -> -25198.316313962918 | W8: TT PTKD | X8: 234829988 | Y8: 106647 | Z8: 0 | AA8: =RC[-3]-RC[-1]-RC[-2] -> 0 | AB8: =R17C28*RC[-4] -> 875000000 | AC8: =RC[-1]*15% -> 131250000 | AD8: =R17C19*RC[-5] -> 1.8 | AE8: =RC[-3]-RC[-2]-RC[-1] -> 743749998.20000005 | AF8: =RC[-1]-RC[-5] -> 743749998.20000005 | AH8: TT PTKD | AI8: 171235842 | AJ8: 118902651 | AK8: 0 | AL8: =RC[-3]-RC[-1]-RC[-2] -> 0.54999999999999982 | AM8: =R17C39*RC[-4] -> 875000000 | AN8: =RC[-1]*15% -> 131250000 | AO8: =R17C19*RC[-5] -> 1.8 | AP8: =RC[-3]-RC[-2]-RC[-1] -> 743749998.20000005 | AQ8: =RC[-1]-RC[-5] -> 743749997.6500001 | AS8: TT PTKD | AT8: 131065027 | AU8: 133488 | AV8: 0 | AW8: =RC[-3]-RC[-1]-RC[-2] -> 0.54999999999999982 | AX8: =R17C50*RC[-4] -> 875000000 | AY8: =RC[-1]*15% -> 131250000 | AZ8: =R17C19*RC[-5] -> 1.8 | BA8: =RC[-3]-RC[-2]-RC[-1] -> 743749998.20000005 | BB8: =RC[-1]-RC[-5] -> 743749997.6500001 | BD8: TT PTKD | BE8: 100638962 | BF8: 121670 | BG8: 0 | BH8: =RC[-3]-RC[-1]-RC[-2] -> 0.54999999999999982 | BI8: =R17C61*RC[-4] -> 875000000 | BJ8: =RC[-1]*15% -> 131250000 | BK8: =R17C19*RC[-5] -> 1.8 | BL8: =RC[-3]-RC[-2]-RC[-1] -> 743749998.20000005 | BM8: =RC[-1]-RC[-5] -> 743749997.6500001 | BO8: TT PTKD | BP8: 0 | BQ8: 0 | BR8: 0 | BS8: =RC[-3]-RC[-1]-RC[-2] -> 0.54999999999999982 | BT8: =R17C72*RC[-4] -> 875000000 | BU8: =RC[-1]*15% -> 131250000 | BV8: =R17C8*RC[-5] -> 1.8 | BW8: =RC[-3]-RC[-2]-RC[-1] -> 743749998.20000005 | BX8: =RC[-1]-RC[-5] -> 743749997.6500001 | BZ8: TT PTKD | CA8: 0 | CB8: 0 | CC8: 0 | CD8: =RC[-3]-RC[-1]-RC[-2] -> 0.54999999999999982 | CE8: =R17C83*RC[-4] -> 875000000 | CF8: =RC[-1]*15% -> 131250000 | CG8: =R17C19*RC[-5] -> 1.8 | CH8: =RC[-3]-RC[-2]-RC[-1] -> 743749998.20000005 | CI8: =RC[-1]-RC[-5] -> 743749997.6500001 | CK8: TT PTKD | CL8: 0 | CM8: 0 | CN8: 0 | CO8: =RC[-3]-RC[-1]-RC[-2] -> 0.54999999999999982 | CP8: =R17C94*RC[-4] -> 875000000 | CQ8: =RC[-1]*15% -> 131250000 | CR8: =R17C19*RC[-5] -> 1.8 | CS8: =RC[-3]-RC[-2]-RC[-1] -> 743749998.20000005 | CT8: =RC[-1]-RC[-5] -> 743749997.6500001 | CV8: TT PTKD | CW8: 0 | CX8: 0 | CY8: 0 | CZ8: =RC[-3]-RC[-1]-RC[-2] -> 0.54999999999999982 | DA8: =R17C105*RC[-4] -> 875000000 | DB8: =RC[-1]*15% -> 131250000 | DC8: =R17C19*RC[-5] -> 1.8 | DD8: =RC[-3]-RC[-2]-RC[-1] -> 743749998.20000005 | DE8: =RC[-1]-RC[-5] -> 743749997.6500001 | DG8: TT PTKD | DH8: 0 | DI8: 0 | DJ8: 0 | DK8: =RC[-3]-RC[-1]-RC[-2] -> 0.54999999999999982 | DL8: =R17C116*RC[-4] -> 807692307.69230771 | DM8: =RC[-1]*15% -> 121153846.15384614 | DN8: =R17C19*RC[-5] -> 1.8 | DO8: =RC[-3]-RC[-2]-RC[-1] -> 686538459.73846161 | DP8: =RC[-1]-RC[-5] -> 686538459.18846166 | DR8: TT PTKD | DS8: 0 | DT8: 0 | DU8: 0 | DV8: =RC[-3]-RC[-1]-RC[-2] -> 0.54999999999999982 | DW8: =R17C127*RC[-4] -> 875000000 | DX8: =RC[-1]*15% -> 131250000 | DY8: =R17C19*RC[-5] -> 1.8 | DZ8: =RC[-3]-RC[-2]-RC[-1] -> 743749998.20000005 | EA8: =RC[-1]-RC[-5] -> 743749997.6500001 | EC8: TT PTKD | ED8: =RC[-132]+RC[-121]+RC[-110]+RC[-99]+RC[-88]+RC[-77]+RC[-66]+RC[-55]+RC[-44]+RC[-33]+RC[-22]+RC[-11] ->  | EE8: =RC[-132]+RC[-121]+RC[-110]+RC[-99]+RC[-88]+RC[-77]+RC[-66]+RC[-55]+RC[-44]+RC[-33]+RC[-22]+RC[-11] ->  | EF8: =RC[-132]+RC[-121]+RC[-110]+RC[-99]+RC[-88]+RC[-77]+RC[-66]+RC[-55]+RC[-44]+RC[-33]+RC[-22]+RC[-11] ->  | EG8: =RC[-132]+RC[-121]+RC[-110]+RC[-99]+RC[-88]+RC[-77]+RC[-66]+RC[-55]+RC[-44]+RC[-33]+RC[-22]+RC[-11] ->  | EH8: =RC[-132]+RC[-121]+RC[-110]+RC[-99]+RC[-88]+RC[-77]+RC[-66]+RC[-55]+RC[-44]+RC[-33]+RC[-22]+RC[-11] ->  | EI8: =RC[-132]+RC[-121]+RC[-110]+RC[-99]+RC[-88]+RC[-77]+RC[-66]+RC[-55]+RC[-44]+RC[-33]+RC[-22]+RC[-11] ->  | EJ8: =RC[-132]+RC[-121]+RC[-110]+RC[-99]+RC[-88]+RC[-77]+RC[-66]+RC[-55]+RC[-44]+RC[-33]+RC[-22]+RC[-11] ->  | EK8: =RC[-132]+RC[-121]+RC[-110]+RC[-99]+RC[-88]+RC[-77]+RC[-66]+RC[-55]+RC[-44]+RC[-33]+RC[-22]+RC[-11] ->  | EL8: =RC[-132]+RC[-121]+RC[-110]+RC[-99]+RC[-88]+RC[-77]+RC[-66]+RC[-55]+RC[-44]+RC[-33]+RC[-22]+RC[-11] -> 
A9: TT PTND | B9: 606796297 | C9: 18863137 | D9: 0 | E9: =RC[-3]-RC[-1]-RC[-2] ->  | F9: =R17C6*RC[-4] ->  | G9: =RC[-1]*15% ->  | H9: =R17C8*RC[-5] ->  | I9: =RC[-3]-RC[-2]-RC[-1] ->  | J9: =RC[-1]-RC[-5] ->  | L9: TT PTND | M9: 657414043 | N9: 21378084 | O9: 0 | P9: =RC[-3]-RC[-1]-RC[-2] -> 2467006.9 | Q9: =R17C17*RC[-4] -> 3000383.6278659259 | R9: =RC[-1]*15% -> 450057.54417988885 | S9: =R17C19*RC[-5] -> 108517.5 | T9: =RC[-3]-RC[-2]-RC[-1] -> 2441808.583686037 | U9: =RC[-1]-RC[-5] -> -25198.316313962918 | W9: TT PTND | X9: 703798135 | Y9: 27941186 | Z9: 0 | AA9: =RC[-3]-RC[-1]-RC[-2] -> 0 | AB9: =R17C28*RC[-4] -> 875000000 | AC9: =RC[-1]*15% -> 131250000 | AD9: =R17C19*RC[-5] -> 1.8 | AE9: =RC[-3]-RC[-2]-RC[-1] -> 743749998.20000005 | AF9: =RC[-1]-RC[-5] -> 743749998.20000005 | AH9: TT PTND | AI9: 553630682 | AJ9: 14017458 | AK9: 0 | AL9: =RC[-3]-RC[-1]-RC[-2] -> 0.54999999999999982 | AM9: =R17C39*RC[-4] -> 875000000 | AN9: =RC[-1]*15% -> 131250000 | AO9: =R17C19*RC[-5] -> 1.8 | AP9: =RC[-3]-RC[-2]-RC[-1] -> 743749998.20000005 | AQ9: =RC[-1]-RC[-5] -> 743749997.6500001 | AS9: TT PTND | AT9: 590096191 | AU9: 15067285 | AV9: 0 | AW9: =RC[-3]-RC[-1]-RC[-2] -> 0.54999999999999982 | AX9: =R17C50*RC[-4] -> 875000000 | AY9: =RC[-1]*15% -> 131250000 | AZ9: =R17C19*RC[-5] -> 1.8 | BA9: =RC[-3]-RC[-2]-RC[-1] -> 743749998.20000005 | BB9: =RC[-1]-RC[-5] -> 743749997.6500001 | BD9: TT PTND | BE9: 580408319 | BF9: 14424592 | BG9: 0 | BH9: =RC[-3]-RC[-1]-RC[-2] -> 0.54999999999999982 | BI9: =R17C61*RC[-4] -> 875000000 | BJ9: =RC[-1]*15% -> 131250000 | BK9: =R17C19*RC[-5] -> 1.8 | BL9: =RC[-3]-RC[-2]-RC[-1] -> 743749998.20000005 | BM9: =RC[-1]-RC[-5] -> 743749997.6500001 | BO9: TT PTND | BP9: 0 | BQ9: 0 | BR9: 0 | BS9: =RC[-3]-RC[-1]-RC[-2] -> 0.54999999999999982 | BT9: =R17C72*RC[-4] -> 875000000 | BU9: =RC[-1]*15% -> 131250000 | BV9: =R17C8*RC[-5] -> 1.8 | BW9: =RC[-3]-RC[-2]-RC[-1] -> 743749998.20000005 | BX9: =RC[-1]-RC[-5] -> 743749997.6500001 | BZ9: TT PTND | CA9: 0 | CB9: 0 | CC9: 0 | CD9: =RC[-3]-RC[-1]-RC[-2] -> 0.54999999999999982 | CE9: =R17C83*RC[-4] -> 875000000 | CF9: =RC[-1]*15% -> 131250000 | CG9: =R17C19*RC[-5] -> 1.8 | CH9: =RC[-3]-RC[-2]-RC[-1] -> 743749998.20000005 | CI9: =RC[-1]-RC[-5] -> 743749997.6500001 | CK9: TT PTND | CL9: 0 | CM9: 0 | CN9: 0 | CO9: =RC[-3]-RC[-1]-RC[-2] -> 0.54999999999999982 | CP9: =R17C94*RC[-4] -> 875000000 | CQ9: =RC[-1]*15% -> 131250000 | CR9: =R17C19*RC[-5] -> 1.8 | CS9: =RC[-3]-RC[-2]-RC[-1] -> 743749998.20000005 | CT9: =RC[-1]-RC[-5] -> 743749997.6500001 | CV9: TT PTND | CW9: 0 | CX9: 0 | CY9: 0 | CZ9: =RC[-3]-RC[-1]-RC[-2] -> 0.54999999999999982 | DA9: =R17C105*RC[-4] -> 875000000 | DB9: =RC[-1]*15% -> 131250000 | DC9: =R17C19*RC[-5] -> 1.8 | DD9: =RC[-3]-RC[-2]-RC[-1] -> 743749998.20000005 | DE9: =RC[-1]-RC[-5] -> 743749997.6500001 | DG9: TT PTND | DH9: 0 | DI9: 0 | DJ9: 0 | DK9: =RC[-3]-RC[-1]-RC[-2] -> 0.54999999999999982 | DL9: =R17C116*RC[-4] -> 807692307.69230771 | DM9: =RC[-1]*15% -> 121153846.15384614 | DN9: =R17C19*RC[-5] -> 1.8 | DO9: =RC[-3]-RC[-2]-RC[-1] -> 686538459.73846161 | DP9: =RC[-1]-RC[-5] -> 686538459.18846166 | DR9: TT PTND | DS9: 0 | DT9: 0 | DU9: 0 | DV9: =RC[-3]-RC[-1]-RC[-2] -> 0.54999999999999982 | DW9: =R17C127*RC[-4] -> 875000000 | DX9: =RC[-1]*15% -> 131250000 | DY9: =R17C19*RC[-5] -> 1.8 | DZ9: =RC[-3]-RC[-2]-RC[-1] -> 743749998.20000005 | EA9: =RC[-1]-RC[-5] -> 743749997.6500001 | EC9: TT PTND | ED9: =RC[-132]+RC[-121]+RC[-110]+RC[-99]+RC[-88]+RC[-77]+RC[-66]+RC[-55]+RC[-44]+RC[-33]+RC[-22]+RC[-11] ->  | EE9: =RC[-132]+RC[-121]+RC[-110]+RC[-99]+RC[-88]+RC[-77]+RC[-66]+RC[-55]+RC[-44]+RC[-33]+RC[-22]+RC[-11] ->  | EF9: =RC[-132]+RC[-121]+RC[-110]+RC[-99]+RC[-88]+RC[-77]+RC[-66]+RC[-55]+RC[-44]+RC[-33]+RC[-22]+RC[-11] ->  | EG9: =RC[-132]+RC[-121]+RC[-110]+RC[-99]+RC[-88]+RC[-77]+RC[-66]+RC[-55]+RC[-44]+RC[-33]+RC[-22]+RC[-11] ->  | EH9: =RC[-132]+RC[-121]+RC[-110]+RC[-99]+RC[-88]+RC[-77]+RC[-66]+RC[-55]+RC[-44]+RC[-33]+RC[-22]+RC[-11] ->  | EI9: =RC[-132]+RC[-121]+RC[-110]+RC[-99]+RC[-88]+RC[-77]+RC[-66]+RC[-55]+RC[-44]+RC[-33]+RC[-22]+RC[-11] ->  | EJ9: =RC[-132]+RC[-121]+RC[-110]+RC[-99]+RC[-88]+RC[-77]+RC[-66]+RC[-55]+RC[-44]+RC[-33]+RC[-22]+RC[-11] ->  | EK9: =RC[-132]+RC[-121]+RC[-110]+RC[-99]+RC[-88]+RC[-77]+RC[-66]+RC[-55]+RC[-44]+RC[-33]+RC[-22]+RC[-11] ->  | EL9: =RC[-132]+RC[-121]+RC[-110]+RC[-99]+RC[-88]+RC[-77]+RC[-66]+RC[-55]+RC[-44]+RC[-33]+RC[-22]+RC[-11] -> 
A10: HQ | B10: 20815433 | C10: 32104951 | D10: 0 | E10: =RC[-3]-RC[-1]-RC[-2] ->  | F10: =R17C6*RC[-4] ->  | G10: =RC[-1]*15% ->  | H10: =R17C8*RC[-5] ->  | I10: =RC[-3]-RC[-2]-RC[-1] ->  | J10: =RC[-1]-RC[-5] ->  | L10: HQ | M10: 17969343 | N10: 28664265 | O10: 0 | P10: =RC[-3]-RC[-1]-RC[-2] -> 2467006.9 | Q10: =R17C17*RC[-4] -> 3000383.6278659259 | R10: =RC[-1]*15% -> 450057.54417988885 | S10: =R17C19*RC[-5] -> 108517.5 | T10: =RC[-3]-RC[-2]-RC[-1] -> 2441808.583686037 | U10: =RC[-1]-RC[-5] -> -25198.316313962918 | W10: HQ | X10: 19334512 | Y10: 32502801 | Z10: 0 | AA10: =RC[-3]-RC[-1]-RC[-2] -> 0 | AB10: =R17C28*RC[-4] -> 875000000 | AC10: =RC[-1]*15% -> 131250000 | AD10: =R17C19*RC[-5] -> 1.8 | AE10: =RC[-3]-RC[-2]-RC[-1] -> 743749998.20000005 | AF10: =RC[-1]-RC[-5] -> 743749998.20000005 | AH10: HQ | AI10: 18126068 | AJ10: 29886589 | AK10: 0 | AL10: =RC[-3]-RC[-1]-RC[-2] -> 0.54999999999999982 | AM10: =R17C39*RC[-4] -> 875000000 | AN10: =RC[-1]*15% -> 131250000 | AO10: =R17C19*RC[-5] -> 1.8 | AP10: =RC[-3]-RC[-2]-RC[-1] -> 743749998.20000005 | AQ10: =RC[-1]-RC[-5] -> 743749997.6500001 | AS10: HQ | AT10: 18476390 | AU10: 30110596 | AV10: 0 | AW10: =RC[-3]-RC[-1]-RC[-2] -> 0.54999999999999982 | AX10: =R17C50*RC[-4] -> 875000000 | AY10: =RC[-1]*15% -> 131250000 | AZ10: =R17C19*RC[-5] -> 1.8 | BA10: =RC[-3]-RC[-2]-RC[-1] -> 743749998.20000005 | BB10: =RC[-1]-RC[-5] -> 743749997.6500001 | BD10: HQ | BE10: 18025077 | BF10: 29950867 | BG10: 0 | BH10: =RC[-3]-RC[-1]-RC[-2] -> 0.54999999999999982 | BI10: =R17C61*RC[-4] -> 875000000 | BJ10: =RC[-1]*15% -> 131250000 | BK10: =R17C19*RC[-5] -> 1.8 | BL10: =RC[-3]-RC[-2]-RC[-1] -> 743749998.20000005 | BM10: =RC[-1]-RC[-5] -> 743749997.6500001 | BO10: HQ | BP10: 0 | BQ10: 0 | BR10: 0 | BS10: =RC[-3]-RC[-1]-RC[-2] -> 0.54999999999999982 | BT10: =R17C72*RC[-4] -> 875000000 | BU10: =RC[-1]*15% -> 131250000 | BV10: =R17C8*RC[-5] -> 1.8 | BW10: =RC[-3]-RC[-2]-RC[-1] -> 743749998.20000005 | BX10: =RC[-1]-RC[-5] -> 743749997.6500001 | BZ10: HQ | CA10: 0 | CB10: 0 | CC10: 0 | CD10: =RC[-3]-RC[-1]-RC[-2] -> 0.54999999999999982 | CE10: =R17C83*RC[-4] -> 875000000 | CF10: =RC[-1]*15% -> 131250000 | CG10: =R17C19*RC[-5] -> 1.8 | CH10: =RC[-3]-RC[-2]-RC[-1] -> 743749998.20000005 | CI10: =RC[-1]-RC[-5] -> 743749997.6500001 | CK10: HQ | CL10: 0 | CM10: 0 | CN10: 0 | CO10: =RC[-3]-RC[-1]-RC[-2] -> 0.54999999999999982 | CP10: =R17C94*RC[-4] -> 875000000 | CQ10: =RC[-1]*15% -> 131250000 | CR10: =R17C19*RC[-5] -> 1.8 | CS10: =RC[-3]-RC[-2]-RC[-1] -> 743749998.20000005 | CT10: =RC[-1]-RC[-5] -> 743749997.6500001 | CV10: HQ | CW10: 0 | CX10: 0 | CY10: 0 | CZ10: =RC[-3]-RC[-1]-RC[-2] -> 0.54999999999999982 | DA10: =R17C105*RC[-4] -> 875000000 | DB10: =RC[-1]*15% -> 131250000 | DC10: =R17C19*RC[-5] -> 1.8 | DD10: =RC[-3]-RC[-2]-RC[-1] -> 743749998.20000005 | DE10: =RC[-1]-RC[-5] -> 743749997.6500001 | DG10: HQ | DH10: 0 | DI10: 0 | DJ10: 0 | DK10: =RC[-3]-RC[-1]-RC[-2] -> 0.54999999999999982 | DL10: =R17C116*RC[-4] -> 807692307.69230771 | DM10: =RC[-1]*15% -> 121153846.15384614 | DN10: =R17C19*RC[-5] -> 1.8 | DO10: =RC[-3]-RC[-2]-RC[-1] -> 686538459.73846161 | DP10: =RC[-1]-RC[-5] -> 686538459.18846166 | DR10: HQ | DS10: 0 | DT10: 0 | DU10: 0 | DV10: =RC[-3]-RC[-1]-RC[-2] -> 0.54999999999999982 | DW10: =R17C127*RC[-4] -> 875000000 | DX10: =RC[-1]*15% -> 131250000 | DY10: =R17C19*RC[-5] -> 1.8 | DZ10: =RC[-3]-RC[-2]-RC[-1] -> 743749998.20000005 | EA10: =RC[-1]-RC[-5] -> 743749997.6500001 | EC10: HQ | ED10: =RC[-132]+RC[-121]+RC[-110]+RC[-99]+RC[-88]+RC[-77]+RC[-66]+RC[-55]+RC[-44]+RC[-33]+RC[-22]+RC[-11] ->  | EE10: =RC[-132]+RC[-121]+RC[-110]+RC[-99]+RC[-88]+RC[-77]+RC[-66]+RC[-55]+RC[-44]+RC[-33]+RC[-22]+RC[-11] ->  | EF10: =RC[-132]+RC[-121]+RC[-110]+RC[-99]+RC[-88]+RC[-77]+RC[-66]+RC[-55]+RC[-44]+RC[-33]+RC[-22]+RC[-11] ->  | EG10: =RC[-132]+RC[-121]+RC[-110]+RC[-99]+RC[-88]+RC[-77]+RC[-66]+RC[-55]+RC[-44]+RC[-33]+RC[-22]+RC[-11] ->  | EH10: =RC[-132]+RC[-121]+RC[-110]+RC[-99]+RC[-88]+RC[-77]+RC[-66]+RC[-55]+RC[-44]+RC[-33]+RC[-22]+RC[-11] ->  | EI10: =RC[-132]+RC[-121]+RC[-110]+RC[-99]+RC[-88]+RC[-77]+RC[-66]+RC[-55]+RC[-44]+RC[-33]+RC[-22]+RC[-11] ->  | EJ10: =RC[-132]+RC[-121]+RC[-110]+RC[-99]+RC[-88]+RC[-77]+RC[-66]+RC[-55]+RC[-44]+RC[-33]+RC[-22]+RC[-11] ->  | EK10: =RC[-132]+RC[-121]+RC[-110]+RC[-99]+RC[-88]+RC[-77]+RC[-66]+RC[-55]+RC[-44]+RC[-33]+RC[-22]+RC[-11] ->  | EL10: =RC[-132]+RC[-121]+RC[-110]+RC[-99]+RC[-88]+RC[-77]+RC[-66]+RC[-55]+RC[-44]+RC[-33]+RC[-22]+RC[-11] -> 
A11: Tổng | B11: =SUM(R[-5]C:R[-1]C) -> 3551128896 | C11: =SUM(R[-5]C:R[-1]C) -> -619983 | D11: =SUM(R[-5]C:R[-1]C) -> 532669334.39999998 | E11: =SUM(R[-5]C:R[-1]C) -> 3019079544.5999999 | F11: =SUM(R[-5]C:R[-1]C) -> 3499999999.9999995 | G11: =SUM(R[-5]C:R[-1]C) -> 525000000 | H11: =SUM(R[-5]C:R[-1]C) -> -557984.69999999995 | I11: =SUM(R[-5]C:R[-1]C) -> 2975557984.6999998 | J11: =SUM(R[-5]C:R[-1]C) -> -43521559.899999849 | L11: Tổng | M11: =SUM(R[-5]C:R[-1]C) -> 3551128896 | N11: =SUM(R[-5]C:R[-1]C) -> -619983 | O11: =SUM(R[-5]C:R[-1]C) -> 532669334.39999998 | P11: =SUM(R[-5]C:R[-1]C) -> 3019079544.5999999 | Q11: =SUM(R[-5]C:R[-1]C) -> 3499999999.9999995 | R11: =SUM(R[-5]C:R[-1]C) -> 525000000 | S11: =SUM(R[-5]C:R[-1]C) -> -557984.69999999995 | T11: =SUM(R[-5]C:R[-1]C) -> 2975557984.6999998 | U11: =SUM(R[-5]C:R[-1]C) -> -43521559.899999849 | W11: Tổng | X11: =SUM(R[-5]C:R[-1]C) -> 12 | Y11: =SUM(R[-5]C:R[-1]C) -> 9 | Z11: =SUM(R[-5]C:R[-1]C) -> 2.35 | AA11: =SUM(R[-5]C:R[-1]C) -> 0.64999999999999991 | AB11: =SUM(R[-5]C:R[-1]C) -> 3500000000 | AC11: =SUM(R[-5]C:R[-1]C) -> 525000000 | AD11: =SUM(R[-5]C:R[-1]C) -> 8.1 | AE11: =SUM(R[-5]C:R[-1]C) -> 2974999991.9000006 | AF11: =SUM(R[-5]C:R[-1]C) -> 2974999991.2500005 | AH11: Tổng | AI11: =SUM(R[-5]C:R[-1]C) -> 12 | AJ11: =SUM(R[-5]C:R[-1]C) -> 9 | AK11: =SUM(R[-5]C:R[-1]C) -> 1.7999999999999998 | AL11: =SUM(R[-5]C:R[-1]C) -> 1.1999999999999997 | AM11: =SUM(R[-5]C:R[-1]C) -> 3500000000 | AN11: =SUM(R[-5]C:R[-1]C) -> 525000000 | AO11: =SUM(R[-5]C:R[-1]C) -> 8.1 | AP11: =SUM(R[-5]C:R[-1]C) -> 2974999991.9000006 | AQ11: =SUM(R[-5]C:R[-1]C) -> 2974999990.7000003 | AS11: Tổng | AT11: =SUM(R[-5]C:R[-1]C) -> 12 | AU11: =SUM(R[-5]C:R[-1]C) -> 9 | AV11: =SUM(R[-5]C:R[-1]C) -> 1.7999999999999998 | AW11: =SUM(R[-5]C:R[-1]C) -> 1.1999999999999997 | AX11: =SUM(R[-5]C:R[-1]C) -> 3500000000 | AY11: =SUM(R[-5]C:R[-1]C) -> 525000000 | AZ11: =SUM(R[-5]C:R[-1]C) -> 8.1 | BA11: =SUM(R[-5]C:R[-1]C) -> 2974999991.9000006 | BB11: =SUM(R[-5]C:R[-1]C) -> 2974999990.7000003 | BD11: Tổng | BE11: =SUM(R[-5]C:R[-1]C) -> 12 | BF11: =SUM(R[-5]C:R[-1]C) -> 9 | BG11: =SUM(R[-5]C:R[-1]C) -> 1.7999999999999998 | BH11: =SUM(R[-5]C:R[-1]C) -> 1.1999999999999997 | BI11: =SUM(R[-5]C:R[-1]C) -> 3500000000 | BJ11: =SUM(R[-5]C:R[-1]C) -> 525000000 | BK11: =SUM(R[-5]C:R[-1]C) -> 8.1 | BL11: =SUM(R[-5]C:R[-1]C) -> 2974999991.9000006 | BM11: =SUM(R[-5]C:R[-1]C) -> 2974999990.7000003 | BO11: Tổng | BP11: =SUM(R[-5]C:R[-1]C) -> 12 | BQ11: =SUM(R[-5]C:R[-1]C) -> 9 | BR11: =SUM(R[-5]C:R[-1]C) -> 1.7999999999999998 | BS11: =SUM(R[-5]C:R[-1]C) -> 1.1999999999999997 | BT11: =SUM(R[-5]C:R[-1]C) -> 3500000000 | BU11: =SUM(R[-5]C:R[-1]C) -> 525000000 | BV11: =SUM(R[-5]C:R[-1]C) -> 8.1 | BW11: =SUM(R[-5]C:R[-1]C) -> 2974999991.9000006 | BX11: =SUM(R[-5]C:R[-1]C) -> 2974999990.7000003 | BZ11: Tổng | CA11: =SUM(R[-5]C:R[-1]C) -> 12 | CB11: =SUM(R[-5]C:R[-1]C) -> 9 | CC11: =SUM(R[-5]C:R[-1]C) -> 1.7999999999999998 | CD11: =SUM(R[-5]C:R[-1]C) -> 1.1999999999999997 | CE11: =SUM(R[-5]C:R[-1]C) -> 3500000000 | CF11: =SUM(R[-5]C:R[-1]C) -> 525000000 | CG11: =SUM(R[-5]C:R[-1]C) -> 8.1 | CH11: =SUM(R[-5]C:R[-1]C) -> 2974999991.9000006 | CI11: =SUM(R[-5]C:R[-1]C) -> 2974999990.7000003 | CK11: Tổng | CL11: =SUM(R[-5]C:R[-1]C) -> 12 | CM11: =SUM(R[-5]C:R[-1]C) -> 9 | CN11: =SUM(R[-5]C:R[-1]C) -> 1.7999999999999998 | CO11: =SUM(R[-5]C:R[-1]C) -> 1.1999999999999997 | CP11: =SUM(R[-5]C:R[-1]C) -> 3500000000 | CQ11: =SUM(R[-5]C:R[-1]C) -> 525000000 | CR11: =SUM(R[-5]C:R[-1]C) -> 8.1 | CS11: =SUM(R[-5]C:R[-1]C) -> 2974999991.9000006 | CT11: =SUM(R[-5]C:R[-1]C) -> 2974999990.7000003 | CV11: Tổng | CW11: =SUM(R[-5]C:R[-1]C) -> 12 | CX11: =SUM(R[-5]C:R[-1]C) -> 9 | CY11: =SUM(R[-5]C:R[-1]C) -> 1.7999999999999998 | CZ11: =SUM(R[-5]C:R[-1]C) -> 1.1999999999999997 | DA11: =SUM(R[-5]C:R[-1]C) -> 3500000000 | DB11: =SUM(R[-5]C:R[-1]C) -> 525000000 | DC11: =SUM(R[-5]C:R[-1]C) -> 8.1 | DD11: =SUM(R[-5]C:R[-1]C) -> 2974999991.9000006 | DE11: =SUM(R[-5]C:R[-1]C) -> 2974999990.7000003 | DG11: Tổng | DH11: =SUM(R[-5]C:R[-1]C) -> 13 | DI11: =SUM(R[-5]C:R[-1]C) -> 9 | DJ11: =SUM(R[-5]C:R[-1]C) -> 1.9499999999999997 | DK11: =SUM(R[-5]C:R[-1]C) -> 2.0499999999999994 | DL11: =SUM(R[-5]C:R[-1]C) -> 3500000000 | DM11: =SUM(R[-5]C:R[-1]C) -> 525000000 | DN11: =SUM(R[-5]C:R[-1]C) -> 8.1 | DO11: =SUM(R[-5]C:R[-1]C) -> 2974999991.9000001 | DP11: =SUM(R[-5]C:R[-1]C) -> 2974999989.8500004 | DR11: Tổng | DS11: =SUM(R[-5]C:R[-1]C) -> 12 | DT11: =SUM(R[-5]C:R[-1]C) -> 9 | DU11: =SUM(R[-5]C:R[-1]C) -> 1.7999999999999998 | DV11: =SUM(R[-5]C:R[-1]C) -> 1.1999999999999997 | DW11: =SUM(R[-5]C:R[-1]C) -> 3500000000 | DX11: =SUM(R[-5]C:R[-1]C) -> 525000000 | DY11: =SUM(R[-5]C:R[-1]C) -> 8.1 | DZ11: =SUM(R[-5]C:R[-1]C) -> 2974999991.9000006 | EA11: =SUM(R[-5]C:R[-1]C) -> 2974999990.7000003 | EC11: Tổng | ED11: =SUM(R[-5]C:R[-1]C) -> 7102257913 | EE11: =SUM(R[-5]C:R[-1]C) -> -1239876 | EF11: =SUM(R[-5]C:R[-1]C) -> 1065338687.5000002 | EG11: =SUM(R[-5]C:R[-1]C) -> 6038159101.4999962 | EH11: =SUM(R[-5]C:R[-1]C) -> 42000000000 | EI11: =SUM(R[-5]C:R[-1]C) -> 6300000000 | EJ11: =SUM(R[-5]C:R[-1]C) -> -1115888.4000000006 | EK11: =SUM(R[-5]C:R[-1]C) -> 35701115888.400009 | EL11: =SUM(R[-5]C:R[-1]C) -> 29662956786.900002
E13: Số liệu theo biên bản đối soát thực tế với Viettel | P13: Số liệu theo biên bản đối soát thực tế với Viettel | AA13: Số liệu theo biên bản đối soát thực tế với Viettel | AL13: Số liệu theo biên bản đối soát thực tế với Viettel | AW13: Số liệu theo biên bản đối soát thực tế với Viettel | BH13: Số liệu theo biên bản đối soát thực tế với Viettel | BS13: Số liệu theo biên bản đối soát thực tế với Viettel | CD13: Số liệu theo biên bản đối soát thực tế với Viettel | CO13: Số liệu theo biên bản đối soát thực tế với Viettel | CZ13: Số liệu theo biên bản đối soát thực tế với Viettel | DK13: Số liệu theo biên bản đối soát thực tế với Viettel | DV13: Số liệu theo biên bản đối soát thực tế với Viettel
E14: Doanh thu | G14: MT vượt | P14: Doanh thu | R14: MT vượt | AA14: Doanh thu | AC14: MT vượt | AL14: Doanh thu | AN14: MT vượt | AW14: Doanh thu | AY14: MT vượt | BH14: Doanh thu | BJ14: MT vượt | BS14: Doanh thu | BU14: MT vượt | CD14: Doanh thu | CF14: MT vượt | CO14: Doanh thu | CQ14: MT vượt | CZ14: Doanh thu | DB14: MT vượt | DK14: Doanh thu | DM14: MT vượt | DV14: Doanh thu | DX14: MT vượt
E15: Doanh thu hệ thống | F15: =R[-4]C[-4] -> 3551128896 | G15: MT hệ thống | H15: 10 | P15: Doanh thu hệ thống | Q15: =R[-4]C[-4] -> 3551128896 | R15: MT hệ thống | S15: 10 | AA15: Doanh thu hệ thống | AB15: =R[-4]C[-4] -> 12 | AC15: MT hệ thống | AD15: 10 | AL15: Doanh thu hệ thống | AM15: =R[-4]C[-4] -> 12 | AN15: MT hệ thống | AO15: 10 | AW15: Doanh thu hệ thống | AX15: =R[-4]C[-4] -> 12 | AY15: MT hệ thống | AZ15: 10 | BH15: Doanh thu hệ thống | BI15: =R[-4]C[-4] -> 12 | BJ15: MT hệ thống | BK15: 10 | BS15: Doanh thu hệ thống | BT15: =R[-4]C[-4] -> 12 | BU15: MT hệ thống | BV15: 10 | CD15: Doanh thu hệ thống | CE15: =R[-4]C[-4] -> 12 | CF15: MT hệ thống | CG15: 10 | CO15: Doanh thu hệ thống | CP15: =R[-4]C[-4] -> 12 | CQ15: MT hệ thống | CR15: 10 | CZ15: Doanh thu hệ thống | DA15: =R[-4]C[-4] -> 12 | DB15: MT hệ thống | DC15: 10 | DK15: Doanh thu hệ thống | DL15: =R[-4]C[-4] -> 13 | DM15: MT hệ thống | DN15: 10 | DV15: Doanh thu hệ thống | DW15: =R[-4]C[-4] -> 12 | DX15: MT hệ thống | DY15: 10
E16: Doanh thu thực tế | F16: 3500000000 | G16: MT thực tế | H16: 9 | P16: Doanh thu thực tế | Q16: 3500000000 | R16: MT thực tế | S16: 9 | AA16: Doanh thu thực tế | AB16: 3500000000 | AC16: MT thực tế | AD16: 9 | AL16: Doanh thu thực tế | AM16: 3500000000 | AN16: MT thực tế | AO16: 9 | AW16: Doanh thu thực tế | AX16: 3500000000 | AY16: MT thực tế | AZ16: 9 | BH16: Doanh thu thực tế | BI16: 3500000000 | BJ16: MT thực tế | BK16: 9 | BS16: Doanh thu thực tế | BT16: 3500000000 | BU16: MT thực tế | BV16: 9 | CD16: Doanh thu thực tế | CE16: 3500000000 | CF16: MT thực tế | CG16: 9 | CO16: Doanh thu thực tế | CP16: 3500000000 | CQ16: MT thực tế | CR16: 9 | CZ16: Doanh thu thực tế | DA16: 3500000000 | DB16: MT thực tế | DC16: 9 | DK16: Doanh thu thực tế | DL16: 3500000000 | DM16: MT thực tế | DN16: 9 | DV16: Doanh thu thực tế | DW16: 3500000000 | DX16: MT thực tế | DY16: 9
E17: DT QT/DT HT | F17: =R[-1]C/R[-2]C -> 0.9856020726091943 | G17: MT QT/ HT | H17: =R[-1]C/R[-2]C -> 0.9 | P17: DT QT/DT HT | Q17: =R[-1]C/R[-2]C -> 0.9856020726091943 | R17: MT QT/ HT | S17: =R[-1]C/R[-2]C -> 0.9 | AA17: DT QT/DT HT | AB17: =R[-1]C/R[-2]C -> 291666666.66666669 | AC17: MT QT/ HT | AD17: =R[-1]C/R[-2]C -> 0.9 | AL17: DT QT/DT HT | AM17: =R[-1]C/R[-2]C -> 291666666.66666669 | AN17: MT QT/ HT | AO17: =R[-1]C/R[-2]C -> 0.9 | AW17: DT QT/DT HT | AX17: =R[-1]C/R[-2]C -> 291666666.66666669 | AY17: MT QT/ HT | AZ17: =R[-1]C/R[-2]C -> 0.9 | BH17: DT QT/DT HT | BI17: =R[-1]C/R[-2]C -> 291666666.66666669 | BJ17: MT QT/ HT | BK17: =R[-1]C/R[-2]C -> 0.9 | BS17: DT QT/DT HT | BT17: =R[-1]C/R[-2]C -> 291666666.66666669 | BU17: MT QT/ HT | BV17: =R[-1]C/R[-2]C -> 0.9 | CD17: DT QT/DT HT | CE17: =R[-1]C/R[-2]C -> 291666666.66666669 | CF17: MT QT/ HT | CG17: =R[-1]C/R[-2]C -> 0.9 | CO17: DT QT/DT HT | CP17: =R[-1]C/R[-2]C -> 291666666.66666669 | CQ17: MT QT/ HT | CR17: =R[-1]C/R[-2]C -> 0.9 | CZ17: DT QT/DT HT | DA17: =R[-1]C/R[-2]C -> 291666666.66666669 | DB17: MT QT/ HT | DC17: =R[-1]C/R[-2]C -> 0.9 | DK17: DT QT/DT HT | DL17: =R[-1]C/R[-2]C -> 269230769.23076922 | DM17: MT QT/ HT | DN17: =R[-1]C/R[-2]C -> 0.9 | DV17: DT QT/DT HT | DW17: =R[-1]C/R[-2]C -> 291666666.66666669 | DX17: MT QT/ HT | DY17: =R[-1]C/R[-2]C -> 0.9
E18: Tỷ lệ thất thoát | F18: =100%-R[-1]C -> 1.4397927390805698E-2 | G18: Tỷ lệ chênh lệch | H18: =100%-R[-1]C -> 9.9999999999999978E-2 | P18: Tỷ lệ thất thoát | Q18: =100%-R[-1]C -> 1.4397927390805698E-2 | R18: Tỷ lệ chênh lệch | S18: =100%-R[-1]C -> 9.9999999999999978E-2 | AA18: Tỷ lệ thất thoát | AB18: =100%-R[-1]C -> -291666665.66666669 | AC18: Tỷ lệ chênh lệch | AD18: =100%-R[-1]C -> 9.9999999999999978E-2 | AL18: Tỷ lệ thất thoát | AM18: =100%-R[-1]C -> -291666665.66666669 | AN18: Tỷ lệ chênh lệch | AO18: =100%-R[-1]C -> 9.9999999999999978E-2 | AW18: Tỷ lệ thất thoát | AX18: =100%-R[-1]C -> -291666665.66666669 | AY18: Tỷ lệ chênh lệch | AZ18: =100%-R[-1]C -> 9.9999999999999978E-2 | BH18: Tỷ lệ thất thoát | BI18: =100%-R[-1]C -> -291666665.66666669 | BJ18: Tỷ lệ chênh lệch | BK18: =100%-R[-1]C -> 9.9999999999999978E-2 | BS18: Tỷ lệ thất thoát | BT18: =100%-R[-1]C -> -291666665.66666669 | BU18: Tỷ lệ chênh lệch | BV18: =100%-R[-1]C -> 9.9999999999999978E-2 | CD18: Tỷ lệ thất thoát | CE18: =100%-R[-1]C -> -291666665.66666669 | CF18: Tỷ lệ chênh lệch | CG18: =100%-R[-1]C -> 9.9999999999999978E-2 | CO18: Tỷ lệ thất thoát | CP18: =100%-R[-1]C -> -291666665.66666669 | CQ18: Tỷ lệ chênh lệch | CR18: =100%-R[-1]C -> 9.9999999999999978E-2 | CZ18: Tỷ lệ thất thoát | DA18: =100%-R[-1]C -> -291666665.66666669 | DB18: Tỷ lệ chênh lệch | DC18: =100%-R[-1]C -> 9.9999999999999978E-2 | DK18: Tỷ lệ thất thoát | DL18: =100%-R[-1]C -> -269230768.23076922 | DM18: Tỷ lệ chênh lệch | DN18: =100%-R[-1]C -> 9.9999999999999978E-2 | DV18: Tỷ lệ thất thoát | DW18: =100%-R[-1]C -> -291666665.66666669 | DX18: Tỷ lệ chênh lệch | DY18: =100%-R[-1]C -> 9.9999999999999978E-2
E19: Doanh thu khuyến khích | P19: Doanh thu khuyến khích | AA19: Doanh thu khuyến khích | AL19: Doanh thu khuyến khích | AW19: Doanh thu khuyến khích | BH19: Doanh thu khuyến khích | BS19: Doanh thu khuyến khích | CD19: Doanh thu khuyến khích | CO19: Doanh thu khuyến khích | CZ19: Doanh thu khuyến khích | DK19: Doanh thu khuyến khích | DV19: Doanh thu khuyến khích
A24: 8x79/VMS/2015
A25: Tháng 1 | L25: Tháng 2 | W25: Tháng 3 | AH25: Tháng 4 | AS25: Tháng 5 | BD25: Tháng 6 | BO25: Tháng 7 | BZ25: Tháng 8 | CK25: Tháng 9 | CV25: Tháng 10 | DG25: Tháng 11 | DR25: Tháng 12 | EC25: Lũy kế đến tháng báo cáo
A26: Tên đối tác | B26: Số liệu hệ thống/tạm tính | F26: Số liệu quyết toán theo biên bản đối soát | J26: C/lệch Quyết toán - Tạm tính | L26: Tên đối tác | M26: Số liệu hệ thống/tạm tính | Q26: Số liệu quyết toán theo biên bản đối soát | U26: C/lệch Quyết toán - Tạm tính | W26: Tên đối tác | X26: Số liệu hệ thống/tạm tính | AB26: Số liệu quyết toán theo biên bản đối soát | AF26: C/lệch Quyết toán - Tạm tính | AH26: Tên đối tác | AI26: Số liệu hệ thống/tạm tính | AM26: Số liệu quyết toán theo biên bản đối soát | AQ26: C/lệch Quyết toán - Tạm tính | AS26: Tên đối tác | AT26: Số liệu hệ thống/tạm tính | AX26: Số liệu quyết toán theo biên bản đối soát | BB26: C/lệch Quyết toán - Tạm tính | BD26: Tên đối tác | BE26: Số liệu hệ thống/tạm tính | BI26: Số liệu quyết toán theo biên bản đối soát | BM26: C/lệch Quyết toán - Tạm tính | BO26: Tên đối tác | BP26: Số liệu hệ thống/tạm tính | BT26: Số liệu quyết toán theo biên bản đối soát | BX26: C/lệch Quyết toán - Tạm tính | BZ26: Tên đối tác | CA26: Số liệu hệ thống/tạm tính | CE26: Số liệu quyết toán theo biên bản đối soát | CI26: C/lệch Quyết toán - Tạm tính | CK26: Tên đối tác | CL26: Số liệu hệ thống/tạm tính | CP26: Số liệu quyết toán theo biên bản đối soát | CT26: C/lệch Quyết toán - Tạm tính | CV26: Tên đối tác | CW26: Số liệu hệ thống/tạm tính | DA26: Số liệu quyết toán theo biên bản đối soát | DE26: C/lệch Quyết toán - Tạm tính | DG26: Tên đối tác | DH26: Số liệu hệ thống/tạm tính | DL26: Số liệu quyết toán theo biên bản đối soát | DP26: C/lệch Quyết toán - Tạm tính | DR26: Tên đối tác | DS26: Số liệu hệ thống/tạm tính | DW26: Số liệu quyết toán theo biên bản đối soát | EA26: C/lệch Quyết toán - Tạm tính | EC26: Tên đối tác | ED26: Số liệu hệ thống/tạm tính | EH26: Số liệu quyết toán theo biên bản đối soát | EL26: C/lệch Quyết toán - Tạm tính
B27: Doanh thu | C27: MT vượt | D27: Trả đối tác | E27: DT về đơn vị | F27: Doanh thu | G27: Trả đối tác | H27: MT | I27: DT về đơn vị | M27: Doanh thu | N27: MT vượt | O27: Trả đối tác | P27: DT về đơn vị | Q27: Doanh thu | R27: Trả đối tác | S27: MT | T27: DT về đơn vị | X27: Doanh thu | Y27: MT vượt | Z27: Trả đối tác | AA27: DT về đơn vị | AB27: Doanh thu | AC27: Trả đối tác | AD27: MT | AE27: DT về đơn vị | AI27: Doanh thu | AJ27: MT vượt | AK27: Trả đối tác | AL27: DT về đơn vị | AM27: Doanh thu | AN27: Trả đối tác | AO27: MT | AP27: DT về đơn vị | AT27: Doanh thu | AU27: MT vượt | AV27: Trả đối tác | AW27: DT về đơn vị | AX27: Doanh thu | AY27: Trả đối tác | AZ27: MT | BA27: DT về đơn vị | BE27: Doanh thu | BF27: MT vượt | BG27: Trả đối tác | BH27: DT về đơn vị | BI27: Doanh thu | BJ27: Trả đối tác | BK27: MT | BL27: DT về đơn vị | BP27: Doanh thu | BQ27: MT vượt | BR27: Trả đối tác | BS27: DT về đơn vị | BT27: Doanh thu | BU27: Trả đối tác | BV27: MT | BW27: DT về đơn vị | CA27: Doanh thu | CB27: MT vượt | CC27: Trả đối tác | CD27: DT về đơn vị | CE27: Doanh thu | CF27: Trả đối tác | CG27: MT | CH27: DT về đơn vị | CL27: Doanh thu | CM27: MT vượt | CN27: Trả đối tác | CO27: DT về đơn vị | CP27: Doanh thu | CQ27: Trả đối tác | CR27: MT | CS27: DT về đơn vị | CW27: Doanh thu | CX27: MT vượt | CY27: Trả đối tác | CZ27: DT về đơn vị | DA27: Doanh thu | DB27: Trả đối tác | DC27: MT | DD27: DT về đơn vị | DH27: Doanh thu | DI27: MT vượt | DJ27: Trả đối tác | DK27: DT về đơn vị | DL27: Doanh thu | DM27: Trả đối tác | DN27: MT | DO27: DT về đơn vị | DS27: Doanh thu | DT27: MT vượt | DU27: Trả đối tác | DV27: DT về đơn vị | DW27: Doanh thu | DX27: Trả đối tác | DY27: MT | DZ27: DT về đơn vị | ED27: Doanh thu | EE27: MT vượt | EF27: Trả đối tác | EG27: DT về đơn vị | EH27: Doanh thu | EI27: Trả đối tác | EJ27: MT | EK27: DT về đơn vị
B28: (1) | C28: (2) | D28: (3) = (2) *x% | E28: (4) = (1) - (3) - (2) | F28: (5) | G28: (6) | H28: (7) | I28: (8) = (5) - (6) - (7) | J28: (9) = (4) - (8) | M28: (1) | N28: (2) = ( MO - MT) *91 | O28: (3) = (2) *15% | P28: (4) = (1) - (3) - (2) | Q28: (5) | R28: (6) | S28: (7) | T28: (8) = (5) - (6) - (7) | U28: (9) = (4) - (8) | X28: (1) | Y28: (2) = ( MO - MT) *91 | Z28: (3) = (2) *15% | AA28: (4) = (1) - (3) - (2) | AB28: (5) | AC28: (6) | AD28: (7) | AE28: (8) = (5) - (6) - (7) | AF28: (9) = (4) - (8) | AI28: (1) | AJ28: (2) = ( MO - MT) *91 | AK28: (3) = (2) *15% | AL28: (4) = (1) - (3) - (2) | AM28: (5) | AN28: (6) | AO28: (7) | AP28: (8) = (5) - (6) - (7) | AQ28: (9) = (4) - (8) | AT28: (1) | AU28: (2) = ( MO - MT) *91 | AV28: (3) = (2) *15% | AW28: (4) = (1) - (3) - (2) | AX28: (5) | AY28: (6) | AZ28: (7) | BA28: (8) = (5) - (6) - (7) | BB28: (9) = (4) - (8) | BE28: (1) | BF28: (2) = ( MO - MT) *91 | BG28: (3) = (2) *15% | BH28: (4) = (1) - (3) - (2) | BI28: (5) | BJ28: (6) | BK28: (7) | BL28: (8) = (5) - (6) - (7) | BM28: (9) = (4) - (8) | BP28: (1) | BQ28: (2) | BR28: (3) = (2) *15% | BS28: (4) = (1) - (3) - (2) | BT28: (5) | BU28: (6) | BV28: (7) | BW28: (8) = (5) - (6) - (7) | BX28: (9) = (4) - (8) | CA28: (1) | CB28: (2) = ( MO - MT) *91 | CC28: (3) = (2) *15% | CD28: (4) = (1) - (3) - (2) | CE28: (5) | CF28: (6) | CG28: (7) | CH28: (8) = (5) - (6) - (7) | CI28: (9) = (4) - (8) | CL28: (1) | CM28: (2) = ( MO - MT) *91 | CN28: (3) = (2) *15% | CO28: (4) = (1) - (3) - (2) | CP28: (5) | CQ28: (6) | CR28: (7) | CS28: (8) = (5) - (6) - (7) | CT28: (9) = (4) - (8) | CW28: (1) | CX28: (2) = ( MO - MT) *91 | CY28: (3) = (2) *15% | CZ28: (4) = (1) - (3) - (2) | DA28: (5) | DB28: (6) | DC28: (7) | DD28: (8) = (5) - (6) - (7) | DE28: (9) = (4) - (8) | DH28: (1) | DI28: (2) = ( MO - MT) *91 | DJ28: (3) = (2) *15% | DK28: (4) = (1) - (3) - (2) | DL28: (5) | DM28: (6) | DN28: (7) | DO28: (8) = (5) - (6) - (7) | DP28: (9) = (4) - (8) | DS28: (1) | DT28: (2) = ( MO - MT) *91 | DU28: (3) = (2) *15% | DV28: (4) = (1) - (3) - (2) | DW28: (5) | DX28: (6) | DY28: (7) | DZ28: (8) = (5) - (6) - (7) | EA28: (9) = (4) - (8) | ED28: (1) | EE28: (2) = ( MO - MT) *91 | EF28: (3) = (2) *15% | EG28: (4) = (1) - (3) - (2) | EH28: (5) | EI28: (6) | EJ28: (7) | EK28: (8) = (5) - (6) - (7) | EL28: (9) = (4) - (8)
A29: SUBCPS | B29: 36198499 | C29: 93638 | D29: 0 | E29: =RC[-3]-RC[-1]-RC[-2] ->  | F29: =R40C6*RC[-4] ->  | G29: =RC[-1]*15% ->  | H29: =R40C8*RC[-5] ->  | I29: =RC[-3]-RC[-2]-RC[-1] ->  | J29: =RC[-1]-RC[-5] ->  | L29: SUBCPS | M29: 48306863 | N29: 3367 | O29: 0 | P29: =RC[-3]-RC[-1]-RC[-2] -> 2467006.9 | Q29: =R40C17*RC[-4] -> 3000383.6278659259 | R29: =RC[-1]*15% -> 450057.54417988885 | S29: =R40C19*RC[-5] -> 108517.5 | T29: =RC[-3]-RC[-2]-RC[-1] -> 2441808.583686037 | U29: =RC[-1]-RC[-5] -> -25198.316313962918 | W29: SUBCPS | X29: 38056977 | Y29: 11283 | Z29: 0 | AA29: =RC[-3]-RC[-1]-RC[-2] -> 0 | AB29: =R40C28*RC[-4] -> 875000000 | AC29: =RC[-1]*15% -> 131250000 | AD29: =R40C19*RC[-5] -> 1.8 | AE29: =RC[-3]-RC[-2]-RC[-1] -> 743749998.20000005 | AF29: =RC[-1]-RC[-5] -> 743749998.20000005 | AH29: SUBCPS | AI29: 34418372 | AJ29: 133405 | AK29: 0 | AL29: =RC[-3]-RC[-1]-RC[-2] -> 0.54999999999999982 | AM29: =R40C39*RC[-4] -> 875000000 | AN29: =RC[-1]*15% -> 131250000 | AO29: =R40C19*RC[-5] -> 1.8 | AP29: =RC[-3]-RC[-2]-RC[-1] -> 743749998.20000005 | AQ29: =RC[-1]-RC[-5] -> 743749997.6500001 | AS29: SUBCPS | AT29: 37675815 | AU29: 2111564 | AV29: 0 | AW29: =RC[-3]-RC[-1]-RC[-2] -> 0.54999999999999982 | AX29: =R40C50*RC[-4] -> 875000000 | AY29: =RC[-1]*15% -> 131250000 | AZ29: =R40C19*RC[-5] -> 1.8 | BA29: =RC[-3]-RC[-2]-RC[-1] -> 743749998.20000005 | BB29: =RC[-1]-RC[-5] -> 743749997.6500001 | BD29: SUBCPS | BE29: 37926979 | BF29: 2691658 | BG29: 0 | BH29: =RC[-3]-RC[-1]-RC[-2] -> 0.54999999999999982 | BI29: =R40C61*RC[-4] -> 875000000 | BJ29: =RC[-1]*15% -> 131250000 | BK29: =R40C19*RC[-5] -> 1.8 | BL29: =RC[-3]-RC[-2]-RC[-1] -> 743749998.20000005 | BM29: =RC[-1]-RC[-5] -> 743749997.6500001 | BO29: SUBCPS | BP29: 0 | BQ29: 0 | BR29: 0 | BS29: =RC[-3]-RC[-1]-RC[-2] -> 0.54999999999999982 | BT29: =R40C72*RC[-4] -> 875000000 | BU29: =RC[-1]*15% -> 131250000 | BV29: =R40C8*RC[-5] -> 1.8 | BW29: =RC[-3]-RC[-2]-RC[-1] -> 743749998.20000005 | BX29: =RC[-1]-RC[-5] -> 743749997.6500001 | BZ29: SUBCPS | CA29: 0 | CB29: 0 | CC29: 0 | CD29: =RC[-3]-RC[-1]-RC[-2] -> 0.54999999999999982 | CE29: =R40C83*RC[-4] -> 875000000 | CF29: =RC[-1]*15% -> 131250000 | CG29: =R40C19*RC[-5] -> 1.8 | CH29: =RC[-3]-RC[-2]-RC[-1] -> 743749998.20000005 | CI29: =RC[-1]-RC[-5] -> 743749997.6500001 | CK29: SUBCPS | CL29: 0 | CM29: 0 | CN29: 0 | CO29: =RC[-3]-RC[-1]-RC[-2] -> 0.54999999999999982 | CP29: =R40C94*RC[-4] -> 875000000 | CQ29: =RC[-1]*15% -> 131250000 | CR29: =R40C19*RC[-5] -> 1.8 | CS29: =RC[-3]-RC[-2]-RC[-1] -> 743749998.20000005 | CT29: =RC[-1]-RC[-5] -> 743749997.6500001 | CV29: SUBCPS | CW29: 0 | CX29: 0 | CY29: 0 | CZ29: =RC[-3]-RC[-1]-RC[-2] -> 0.54999999999999982 | DA29: =R40C105*RC[-4] -> 875000000 | DB29: =RC[-1]*15% -> 131250000 | DC29: =R40C19*RC[-5] -> 1.8 | DD29: =RC[-3]-RC[-2]-RC[-1] -> 743749998.20000005 | DE29: =RC[-1]-RC[-5] -> 743749997.6500001 | DG29: SUBCPS | DH29: 0 | DI29: 0 | DJ29: 0 | DK29: =RC[-3]-RC[-1]-RC[-2] -> 0.54999999999999982 | DL29: =R40C116*RC[-4] -> 807692307.69230771 | DM29: =RC[-1]*15% -> 121153846.15384614 | DN29: =R40C19*RC[-5] -> 1.8 | DO29: =RC[-3]-RC[-2]-RC[-1] -> 686538459.73846161 | DP29: =RC[-1]-RC[-5] -> 686538459.18846166 | DR29: SUBCPS | DS29: 0 | DT29: 0 | DU29: 0 | DV29: =RC[-3]-RC[-1]-RC[-2] -> 0.54999999999999982 | DW29: =R40C127*RC[-4] -> 875000000 | DX29: =RC[-1]*15% -> 131250000 | DY29: =R40C19*RC[-5] -> 1.8 | DZ29: =RC[-3]-RC[-2]-RC[-1] -> 743749998.20000005 | EA29: =RC[-1]-RC[-5] -> 743749997.6500001 | EC29: SUBCPS | ED29: =RC[-132]+RC[-121]+RC[-110]+RC[-99]+RC[-88]+RC[-77]+RC[-66]+RC[-55]+RC[-44]+RC[-33]+RC[-22]+RC[-11] ->  | EE29: =RC[-132]+RC[-121]+RC[-110]+RC[-99]+RC[-88]+RC[-77]+RC[-66]+RC[-55]+RC[-44]+RC[-33]+RC[-22]+RC[-11] ->  | EF29: =RC[-132]+RC[-121]+RC[-110]+RC[-99]+RC[-88]+RC[-77]+RC[-66]+RC[-55]+RC[-44]+RC[-33]+RC[-22]+RC[-11] ->  | EG29: =RC[-132]+RC[-121]+RC[-110]+RC[-99]+RC[-88]+RC[-77]+RC[-66]+RC[-55]+RC[-44]+RC[-33]+RC[-22]+RC[-11] ->  | EH29: =RC[-132]+RC[-121]+RC[-110]+RC[-99]+RC[-88]+RC[-77]+RC[-66]+RC[-55]+RC[-44]+RC[-33]+RC[-22]+RC[-11] ->  | EI29: =RC[-132]+RC[-121]+RC[-110]+RC[-99]+RC[-88]+RC[-77]+RC[-66]+RC[-55]+RC[-44]+RC[-33]+RC[-22]+RC[-11] ->  | EJ29: =RC[-132]+RC[-121]+RC[-110]+RC[-99]+RC[-88]+RC[-77]+RC[-66]+RC[-55]+RC[-44]+RC[-33]+RC[-22]+RC[-11] ->  | EK29: =RC[-132]+RC[-121]+RC[-110]+RC[-99]+RC[-88]+RC[-77]+RC[-66]+RC[-55]+RC[-44]+RC[-33]+RC[-22]+RC[-11] ->  | EL29: =RC[-132]+RC[-121]+RC[-110]+RC[-99]+RC[-88]+RC[-77]+RC[-66]+RC[-55]+RC[-44]+RC[-33]+RC[-22]+RC[-11] -> 
A30: LUCKY_FONE | B30: 161255729 | C30: 14735629 | D30: 0 | E30: =RC[-3]-RC[-1]-RC[-2] ->  | F30: =R40C6*RC[-4] ->  | G30: =RC[-1]*15% ->  | H30: =R40C8*RC[-5] ->  | I30: =RC[-3]-RC[-2]-RC[-1] ->  | J30: =RC[-1]-RC[-5] ->  | L30: LUCKY_FONE | M30: 149970751 | N30: 12624863 | O30: 0 | P30: =RC[-3]-RC[-1]-RC[-2] -> 2467006.9 | Q30: =R40C17*RC[-4] -> 3000383.6278659259 | R30: =RC[-1]*15% -> 450057.54417988885 | S30: =R40C19*RC[-5] -> 108517.5 | T30: =RC[-3]-RC[-2]-RC[-1] -> 2441808.583686037 | U30: =RC[-1]-RC[-5] -> -25198.316313962918 | W30: LUCKY_FONE | X30: 167283592 | Y30: 15643173 | Z30: 0 | AA30: =RC[-3]-RC[-1]-RC[-2] -> 0 | AB30: =R40C28*RC[-4] -> 875000000 | AC30: =RC[-1]*15% -> 131250000 | AD30: =R40C19*RC[-5] -> 1.8 | AE30: =RC[-3]-RC[-2]-RC[-1] -> 743749998.20000005 | AF30: =RC[-1]-RC[-5] -> 743749998.20000005 | AH30: LUCKY_FONE | AI30: 154384545 | AJ30: 14531179 | AK30: 0 | AL30: =RC[-3]-RC[-1]-RC[-2] -> 0.54999999999999982 | AM30: =R40C39*RC[-4] -> 875000000 | AN30: =RC[-1]*15% -> 131250000 | AO30: =R40C19*RC[-5] -> 1.8 | AP30: =RC[-3]-RC[-2]-RC[-1] -> 743749998.20000005 | AQ30: =RC[-1]-RC[-5] -> 743749997.6500001 | AS30: LUCKY_FONE | AT30: 156161427 | AU30: 14945663 | AV30: 0 | AW30: =RC[-3]-RC[-1]-RC[-2] -> 0.54999999999999982 | AX30: =R40C50*RC[-4] -> 875000000 | AY30: =RC[-1]*15% -> 131250000 | AZ30: =R40C19*RC[-5] -> 1.8 | BA30: =RC[-3]-RC[-2]-RC[-1] -> 743749998.20000005 | BB30: =RC[-1]-RC[-5] -> 743749997.6500001 | BD30: LUCKY_FONE | BE30: 143922166 | BF30: 13933387 | BG30: 0 | BH30: =RC[-3]-RC[-1]-RC[-2] -> 0.54999999999999982 | BI30: =R40C61*RC[-4] -> 875000000 | BJ30: =RC[-1]*15% -> 131250000 | BK30: =R40C19*RC[-5] -> 1.8 | BL30: =RC[-3]-RC[-2]-RC[-1] -> 743749998.20000005 | BM30: =RC[-1]-RC[-5] -> 743749997.6500001 | BO30: LUCKY_FONE | BP30: 0 | BQ30: 0 | BR30: 0 | BS30: =RC[-3]-RC[-1]-RC[-2] -> 0.54999999999999982 | BT30: =R40C72*RC[-4] -> 875000000 | BU30: =RC[-1]*15% -> 131250000 | BV30: =R40C8*RC[-5] -> 1.8 | BW30: =RC[-3]-RC[-2]-RC[-1] -> 743749998.20000005 | BX30: =RC[-1]-RC[-5] -> 743749997.6500001 | BZ30: LUCKY_FONE | CA30: 0 | CB30: 0 | CC30: 0 | CD30: =RC[-3]-RC[-1]-RC[-2] -> 0.54999999999999982 | CE30: =R40C83*RC[-4] -> 875000000 | CF30: =RC[-1]*15% -> 131250000 | CG30: =R40C19*RC[-5] -> 1.8 | CH30: =RC[-3]-RC[-2]-RC[-1] -> 743749998.20000005 | CI30: =RC[-1]-RC[-5] -> 743749997.6500001 | CK30: LUCKY_FONE | CL30: 0 | CM30: 0 | CN30: 0 | CO30: =RC[-3]-RC[-1]-RC[-2] -> 0.54999999999999982 | CP30: =R40C94*RC[-4] -> 875000000 | CQ30: =RC[-1]*15% -> 131250000 | CR30: =R40C19*RC[-5] -> 1.8 | CS30: =RC[-3]-RC[-2]-RC[-1] -> 743749998.20000005 | CT30: =RC[-1]-RC[-5] -> 743749997.6500001 | CV30: LUCKY_FONE | CW30: 0 | CX30: 0 | CY30: 0 | CZ30: =RC[-3]-RC[-1]-RC[-2] -> 0.54999999999999982 | DA30: =R40C105*RC[-4] -> 875000000 | DB30: =RC[-1]*15% -> 131250000 | DC30: =R40C19*RC[-5] -> 1.8 | DD30: =RC[-3]-RC[-2]-RC[-1] -> 743749998.20000005 | DE30: =RC[-1]-RC[-5] -> 743749997.6500001 | DG30: LUCKY_FONE | DH30: 0 | DI30: 0 | DJ30: 0 | DK30: =RC[-3]-RC[-1]-RC[-2] -> 0.54999999999999982 | DL30: =R40C116*RC[-4] -> 807692307.69230771 | DM30: =RC[-1]*15% -> 121153846.15384614 | DN30: =R40C19*RC[-5] -> 1.8 | DO30: =RC[-3]-RC[-2]-RC[-1] -> 686538459.73846161 | DP30: =RC[-1]-RC[-5] -> 686538459.18846166 | DR30: LUCKY_FONE | DS30: 0 | DT30: 0 | DU30: 0 | DV30: =RC[-3]-RC[-1]-RC[-2] -> 0.54999999999999982 | DW30: =R40C127*RC[-4] -> 875000000 | DX30: =RC[-1]*15% -> 131250000 | DY30: =R40C19*RC[-5] -> 1.8 | DZ30: =RC[-3]-RC[-2]-RC[-1] -> 743749998.20000005 | EA30: =RC[-1]-RC[-5] -> 743749997.6500001 | EC30: LUCKY_FONE | ED30: =RC[-132]+RC[-121]+RC[-110]+RC[-99]+RC[-88]+RC[-77]+RC[-66]+RC[-55]+RC[-44]+RC[-33]+RC[-22]+RC[-11] ->  | EE30: =RC[-132]+RC[-121]+RC[-110]+RC[-99]+RC[-88]+RC[-77]+RC[-66]+RC[-55]+RC[-44]+RC[-33]+RC[-22]+RC[-11] ->  | EF30: =RC[-132]+RC[-121]+RC[-110]+RC[-99]+RC[-88]+RC[-77]+RC[-66]+RC[-55]+RC[-44]+RC[-33]+RC[-22]+RC[-11] ->  | EG30: =RC[-132]+RC[-121]+RC[-110]+RC[-99]+RC[-88]+RC[-77]+RC[-66]+RC[-55]+RC[-44]+RC[-33]+RC[-22]+RC[-11] ->  | EH30: =RC[-132]+RC[-121]+RC[-110]+RC[-99]+RC[-88]+RC[-77]+RC[-66]+RC[-55]+RC[-44]+RC[-33]+RC[-22]+RC[-11] ->  | EI30: =RC[-132]+RC[-121]+RC[-110]+RC[-99]+RC[-88]+RC[-77]+RC[-66]+RC[-55]+RC[-44]+RC[-33]+RC[-22]+RC[-11] ->  | EJ30: =RC[-132]+RC[-121]+RC[-110]+RC[-99]+RC[-88]+RC[-77]+RC[-66]+RC[-55]+RC[-44]+RC[-33]+RC[-22]+RC[-11] ->  | EK30: =RC[-132]+RC[-121]+RC[-110]+RC[-99]+RC[-88]+RC[-77]+RC[-66]+RC[-55]+RC[-44]+RC[-33]+RC[-22]+RC[-11] ->  | EL30: =RC[-132]+RC[-121]+RC[-110]+RC[-99]+RC[-88]+RC[-77]+RC[-66]+RC[-55]+RC[-44]+RC[-33]+RC[-22]+RC[-11] -> 
A31: TT PTKD | B31: 58646421 | C31: 208985 | D31: 0 | E31: =RC[-3]-RC[-1]-RC[-2] ->  | F31: =R40C6*RC[-4] ->  | G31: =RC[-1]*15% ->  | H31: =R40C8*RC[-5] ->  | I31: =RC[-3]-RC[-2]-RC[-1] ->  | J31: =RC[-1]-RC[-5] ->  | L31: TT PTKD | M31: 51224788 | N31: 287284 | O31: 0 | P31: =RC[-3]-RC[-1]-RC[-2] -> 2467006.9 | Q31: =R40C17*RC[-4] -> 3000383.6278659259 | R31: =RC[-1]*15% -> 450057.54417988885 | S31: =R40C19*RC[-5] -> 108517.5 | T31: =RC[-3]-RC[-2]-RC[-1] -> 2441808.583686037 | U31: =RC[-1]-RC[-5] -> -25198.316313962918 | W31: TT PTKD | X31: 66797347 | Y31: 1519832 | Z31: 0 | AA31: =RC[-3]-RC[-1]-RC[-2] -> 0 | AB31: =R40C28*RC[-4] -> 875000000 | AC31: =RC[-1]*15% -> 131250000 | AD31: =R40C19*RC[-5] -> 1.8 | AE31: =RC[-3]-RC[-2]-RC[-1] -> 743749998.20000005 | AF31: =RC[-1]-RC[-5] -> 743749998.20000005 | AH31: TT PTKD | AI31: 46524876 | AJ31: 1270039 | AK31: 0 | AL31: =RC[-3]-RC[-1]-RC[-2] -> 0.54999999999999982 | AM31: =R40C39*RC[-4] -> 875000000 | AN31: =RC[-1]*15% -> 131250000 | AO31: =R40C19*RC[-5] -> 1.8 | AP31: =RC[-3]-RC[-2]-RC[-1] -> 743749998.20000005 | AQ31: =RC[-1]-RC[-5] -> 743749997.6500001 | AS31: TT PTKD | AT31: 39227411 | AU31: 2267471 | AV31: 0 | AW31: =RC[-3]-RC[-1]-RC[-2] -> 0.54999999999999982 | AX31: =R40C50*RC[-4] -> 875000000 | AY31: =RC[-1]*15% -> 131250000 | AZ31: =R40C19*RC[-5] -> 1.8 | BA31: =RC[-3]-RC[-2]-RC[-1] -> 743749998.20000005 | BB31: =RC[-1]-RC[-5] -> 743749997.6500001 | BD31: TT PTKD | BE31: 27800490 | BF31: 420850 | BG31: 0 | BH31: =RC[-3]-RC[-1]-RC[-2] -> 0.54999999999999982 | BI31: =R40C61*RC[-4] -> 875000000 | BJ31: =RC[-1]*15% -> 131250000 | BK31: =R40C19*RC[-5] -> 1.8 | BL31: =RC[-3]-RC[-2]-RC[-1] -> 743749998.20000005 | BM31: =RC[-1]-RC[-5] -> 743749997.6500001 | BO31: TT PTKD | BP31: 0 | BQ31: 0 | BR31: 0 | BS31: =RC[-3]-RC[-1]-RC[-2] -> 0.54999999999999982 | BT31: =R40C72*RC[-4] -> 875000000 | BU31: =RC[-1]*15% -> 131250000 | BV31: =R40C8*RC[-5] -> 1.8 | BW31: =RC[-3]-RC[-2]-RC[-1] -> 743749998.20000005 | BX31: =RC[-1]-RC[-5] -> 743749997.6500001 | BZ31: TT PTKD | CA31: 0 | CB31: 0 | CC31: 0 | CD31: =RC[-3]-RC[-1]-RC[-2] -> 0.54999999999999982 | CE31: =R40C83*RC[-4] -> 875000000 | CF31: =RC[-1]*15% -> 131250000 | CG31: =R40C19*RC[-5] -> 1.8 | CH31: =RC[-3]-RC[-2]-RC[-1] -> 743749998.20000005 | CI31: =RC[-1]-RC[-5] -> 743749997.6500001 | CK31: TT PTKD | CL31: 0 | CM31: 0 | CN31: 0 | CO31: =RC[-3]-RC[-1]-RC[-2] -> 0.54999999999999982 | CP31: =R40C94*RC[-4] -> 875000000 | CQ31: =RC[-1]*15% -> 131250000 | CR31: =R40C19*RC[-5] -> 1.8 | CS31: =RC[-3]-RC[-2]-RC[-1] -> 743749998.20000005 | CT31: =RC[-1]-RC[-5] -> 743749997.6500001 | CV31: TT PTKD | CW31: 0 | CX31: 0 | CY31: 0 | CZ31: =RC[-3]-RC[-1]-RC[-2] -> 0.54999999999999982 | DA31: =R40C105*RC[-4] -> 875000000 | DB31: =RC[-1]*15% -> 131250000 | DC31: =R40C19*RC[-5] -> 1.8 | DD31: =RC[-3]-RC[-2]-RC[-1] -> 743749998.20000005 | DE31: =RC[-1]-RC[-5] -> 743749997.6500001 | DG31: TT PTKD | DH31: 0 | DI31: 0 | DJ31: 0 | DK31: =RC[-3]-RC[-1]-RC[-2] -> 0.54999999999999982 | DL31: =R40C116*RC[-4] -> 807692307.69230771 | DM31: =RC[-1]*15% -> 121153846.15384614 | DN31: =R40C19*RC[-5] -> 1.8 | DO31: =RC[-3]-RC[-2]-RC[-1] -> 686538459.73846161 | DP31: =RC[-1]-RC[-5] -> 686538459.18846166 | DR31: TT PTKD | DS31: 0 | DT31: 0 | DU31: 0 | DV31: =RC[-3]-RC[-1]-RC[-2] -> 0.54999999999999982 | DW31: =R40C127*RC[-4] -> 875000000 | DX31: =RC[-1]*15% -> 131250000 | DY31: =R40C19*RC[-5] -> 1.8 | DZ31: =RC[-3]-RC[-2]-RC[-1] -> 743749998.20000005 | EA31: =RC[-1]-RC[-5] -> 743749997.6500001 | EC31: TT PTKD | ED31: =RC[-132]+RC[-121]+RC[-110]+RC[-99]+RC[-88]+RC[-77]+RC[-66]+RC[-55]+RC[-44]+RC[-33]+RC[-22]+RC[-11] ->  | EE31: =RC[-132]+RC[-121]+RC[-110]+RC[-99]+RC[-88]+RC[-77]+RC[-66]+RC[-55]+RC[-44]+RC[-33]+RC[-22]+RC[-11] ->  | EF31: =RC[-132]+RC[-121]+RC[-110]+RC[-99]+RC[-88]+RC[-77]+RC[-66]+RC[-55]+RC[-44]+RC[-33]+RC[-22]+RC[-11] ->  | EG31: =RC[-132]+RC[-121]+RC[-110]+RC[-99]+RC[-88]+RC[-77]+RC[-66]+RC[-55]+RC[-44]+RC[-33]+RC[-22]+RC[-11] ->  | EH31: =RC[-132]+RC[-121]+RC[-110]+RC[-99]+RC[-88]+RC[-77]+RC[-66]+RC[-55]+RC[-44]+RC[-33]+RC[-22]+RC[-11] ->  | EI31: =RC[-132]+RC[-121]+RC[-110]+RC[-99]+RC[-88]+RC[-77]+RC[-66]+RC[-55]+RC[-44]+RC[-33]+RC[-22]+RC[-11] ->  | EJ31: =RC[-132]+RC[-121]+RC[-110]+RC[-99]+RC[-88]+RC[-77]+RC[-66]+RC[-55]+RC[-44]+RC[-33]+RC[-22]+RC[-11] ->  | EK31: =RC[-132]+RC[-121]+RC[-110]+RC[-99]+RC[-88]+RC[-77]+RC[-66]+RC[-55]+RC[-44]+RC[-33]+RC[-22]+RC[-11] ->  | EL31: =RC[-132]+RC[-121]+RC[-110]+RC[-99]+RC[-88]+RC[-77]+RC[-66]+RC[-55]+RC[-44]+RC[-33]+RC[-22]+RC[-11] -> 
A32: TT PTND | B32: 171423032 | C32: 6555993 | D32: 0 | E32: =RC[-3]-RC[-1]-RC[-2] ->  | F32: =R40C6*RC[-4] ->  | G32: =RC[-1]*15% ->  | H32: =R40C8*RC[-5] ->  | I32: =RC[-3]-RC[-2]-RC[-1] ->  | J32: =RC[-1]-RC[-5] ->  | L32: TT PTND | M32: 142997813 | N32: 5151537 | O32: 0 | P32: =RC[-3]-RC[-1]-RC[-2] -> 2467006.9 | Q32: =R40C17*RC[-4] -> 3000383.6278659259 | R32: =RC[-1]*15% -> 450057.54417988885 | S32: =R40C19*RC[-5] -> 108517.5 | T32: =RC[-3]-RC[-2]-RC[-1] -> 2441808.583686037 | U32: =RC[-1]-RC[-5] -> -25198.316313962918 | W32: TT PTND | X32: 145964710 | Y32: 7120530 | Z32: 0 | AA32: =RC[-3]-RC[-1]-RC[-2] -> 0 | AB32: =R40C28*RC[-4] -> 875000000 | AC32: =RC[-1]*15% -> 131250000 | AD32: =R40C19*RC[-5] -> 1.8 | AE32: =RC[-3]-RC[-2]-RC[-1] -> 743749998.20000005 | AF32: =RC[-1]-RC[-5] -> 743749998.20000005 | AH32: TT PTND | AI32: 142216754 | AJ32: 3851820 | AK32: 0 | AL32: =RC[-3]-RC[-1]-RC[-2] -> 0.54999999999999982 | AM32: =R40C39*RC[-4] -> 875000000 | AN32: =RC[-1]*15% -> 131250000 | AO32: =R40C19*RC[-5] -> 1.8 | AP32: =RC[-3]-RC[-2]-RC[-1] -> 743749998.20000005 | AQ32: =RC[-1]-RC[-5] -> 743749997.6500001 | AS32: TT PTND | AT32: 135691558 | AU32: 4639532 | AV32: 0 | AW32: =RC[-3]-RC[-1]-RC[-2] -> 0.54999999999999982 | AX32: =R40C50*RC[-4] -> 875000000 | AY32: =RC[-1]*15% -> 131250000 | AZ32: =R40C19*RC[-5] -> 1.8 | BA32: =RC[-3]-RC[-2]-RC[-1] -> 743749998.20000005 | BB32: =RC[-1]-RC[-5] -> 743749997.6500001 | BD32: TT PTND | BE32: 122358087 | BF32: 3705730 | BG32: 0 | BH32: =RC[-3]-RC[-1]-RC[-2] -> 0.54999999999999982 | BI32: =R40C61*RC[-4] -> 875000000 | BJ32: =RC[-1]*15% -> 131250000 | BK32: =R40C19*RC[-5] -> 1.8 | BL32: =RC[-3]-RC[-2]-RC[-1] -> 743749998.20000005 | BM32: =RC[-1]-RC[-5] -> 743749997.6500001 | BO32: TT PTND | BP32: 0 | BQ32: 0 | BR32: 0 | BS32: =RC[-3]-RC[-1]-RC[-2] -> 0.54999999999999982 | BT32: =R40C72*RC[-4] -> 875000000 | BU32: =RC[-1]*15% -> 131250000 | BV32: =R40C8*RC[-5] -> 1.8 | BW32: =RC[-3]-RC[-2]-RC[-1] -> 743749998.20000005 | BX32: =RC[-1]-RC[-5] -> 743749997.6500001 | BZ32: TT PTND | CA32: 0 | CB32: 0 | CC32: 0 | CD32: =RC[-3]-RC[-1]-RC[-2] -> 0.54999999999999982 | CE32: =R40C83*RC[-4] -> 875000000 | CF32: =RC[-1]*15% -> 131250000 | CG32: =R40C19*RC[-5] -> 1.8 | CH32: =RC[-3]-RC[-2]-RC[-1] -> 743749998.20000005 | CI32: =RC[-1]-RC[-5] -> 743749997.6500001 | CK32: TT PTND | CL32: 0 | CM32: 0 | CN32: 0 | CO32: =RC[-3]-RC[-1]-RC[-2] -> 0.54999999999999982 | CP32: =R40C94*RC[-4] -> 875000000 | CQ32: =RC[-1]*15% -> 131250000 | CR32: =R40C19*RC[-5] -> 1.8 | CS32: =RC[-3]-RC[-2]-RC[-1] -> 743749998.20000005 | CT32: =RC[-1]-RC[-5] -> 743749997.6500001 | CV32: TT PTND | CW32: 0 | CX32: 0 | CY32: 0 | CZ32: =RC[-3]-RC[-1]-RC[-2] -> 0.54999999999999982 | DA32: =R40C105*RC[-4] -> 875000000 | DB32: =RC[-1]*15% -> 131250000 | DC32: =R40C19*RC[-5] -> 1.8 | DD32: =RC[-3]-RC[-2]-RC[-1] -> 743749998.20000005 | DE32: =RC[-1]-RC[-5] -> 743749997.6500001 | DG32: TT PTND | DH32: 0 | DI32: 0 | DJ32: 0 | DK32: =RC[-3]-RC[-1]-RC[-2] -> 0.54999999999999982 | DL32: =R40C116*RC[-4] -> 807692307.69230771 | DM32: =RC[-1]*15% -> 121153846.15384614 | DN32: =R40C19*RC[-5] -> 1.8 | DO32: =RC[-3]-RC[-2]-RC[-1] -> 686538459.73846161 | DP32: =RC[-1]-RC[-5] -> 686538459.18846166 | DR32: TT PTND | DS32: 0 | DT32: 0 | DU32: 0 | DV32: =RC[-3]-RC[-1]-RC[-2] -> 0.54999999999999982 | DW32: =R40C127*RC[-4] -> 875000000 | DX32: =RC[-1]*15% -> 131250000 | DY32: =R40C19*RC[-5] -> 1.8 | DZ32: =RC[-3]-RC[-2]-RC[-1] -> 743749998.20000005 | EA32: =RC[-1]-RC[-5] -> 743749997.6500001 | EC32: TT PTND | ED32: =RC[-132]+RC[-121]+RC[-110]+RC[-99]+RC[-88]+RC[-77]+RC[-66]+RC[-55]+RC[-44]+RC[-33]+RC[-22]+RC[-11] ->  | EE32: =RC[-132]+RC[-121]+RC[-110]+RC[-99]+RC[-88]+RC[-77]+RC[-66]+RC[-55]+RC[-44]+RC[-33]+RC[-22]+RC[-11] ->  | EF32: =RC[-132]+RC[-121]+RC[-110]+RC[-99]+RC[-88]+RC[-77]+RC[-66]+RC[-55]+RC[-44]+RC[-33]+RC[-22]+RC[-11] ->  | EG32: =RC[-132]+RC[-121]+RC[-110]+RC[-99]+RC[-88]+RC[-77]+RC[-66]+RC[-55]+RC[-44]+RC[-33]+RC[-22]+RC[-11] ->  | EH32: =RC[-132]+RC[-121]+RC[-110]+RC[-99]+RC[-88]+RC[-77]+RC[-66]+RC[-55]+RC[-44]+RC[-33]+RC[-22]+RC[-11] ->  | EI32: =RC[-132]+RC[-121]+RC[-110]+RC[-99]+RC[-88]+RC[-77]+RC[-66]+RC[-55]+RC[-44]+RC[-33]+RC[-22]+RC[-11] ->  | EJ32: =RC[-132]+RC[-121]+RC[-110]+RC[-99]+RC[-88]+RC[-77]+RC[-66]+RC[-55]+RC[-44]+RC[-33]+RC[-22]+RC[-11] ->  | EK32: =RC[-132]+RC[-121]+RC[-110]+RC[-99]+RC[-88]+RC[-77]+RC[-66]+RC[-55]+RC[-44]+RC[-33]+RC[-22]+RC[-11] ->  | EL32: =RC[-132]+RC[-121]+RC[-110]+RC[-99]+RC[-88]+RC[-77]+RC[-66]+RC[-55]+RC[-44]+RC[-33]+RC[-22]+RC[-11] -> 
A33: HQ | B33: 16078029 | C33: 24177863 | D33: 0 | E33: =RC[-3]-RC[-1]-RC[-2] ->  | F33: =R40C6*RC[-4] ->  | G33: =RC[-1]*15% ->  | H33: =R40C8*RC[-5] ->  | I33: =RC[-3]-RC[-2]-RC[-1] ->  | J33: =RC[-1]-RC[-5] ->  | L33: HQ | M33: 13839029 | N33: 20733636 | O33: 0 | P33: =RC[-3]-RC[-1]-RC[-2] -> 2467006.9 | Q33: =R40C17*RC[-4] -> 3000383.6278659259 | R33: =RC[-1]*15% -> 450057.54417988885 | S33: =R40C19*RC[-5] -> 108517.5 | T33: =RC[-3]-RC[-2]-RC[-1] -> 2441808.583686037 | U33: =RC[-1]-RC[-5] -> -25198.316313962918 | W33: HQ | X33: 15598164 | Y33: 24460344 | Z33: 0 | AA33: =RC[-3]-RC[-1]-RC[-2] -> 0 | AB33: =R40C28*RC[-4] -> 875000000 | AC33: =RC[-1]*15% -> 131250000 | AD33: =R40C19*RC[-5] -> 1.8 | AE33: =RC[-3]-RC[-2]-RC[-1] -> 743749998.20000005 | AF33: =RC[-1]-RC[-5] -> 743749998.20000005 | AH33: HQ | AI33: 14752514 | AJ33: 22353510 | AK33: 0 | AL33: =RC[-3]-RC[-1]-RC[-2] -> 0.54999999999999982 | AM33: =R40C39*RC[-4] -> 875000000 | AN33: =RC[-1]*15% -> 131250000 | AO33: =R40C19*RC[-5] -> 1.8 | AP33: =RC[-3]-RC[-2]-RC[-1] -> 743749998.20000005 | AQ33: =RC[-1]-RC[-5] -> 743749997.6500001 | AS33: HQ | AT33: 14743860 | AU33: 21726264 | AV33: 0 | AW33: =RC[-3]-RC[-1]-RC[-2] -> 0.54999999999999982 | AX33: =R40C50*RC[-4] -> 875000000 | AY33: =RC[-1]*15% -> 131250000 | AZ33: =R40C19*RC[-5] -> 1.8 | BA33: =RC[-3]-RC[-2]-RC[-1] -> 743749998.20000005 | BB33: =RC[-1]-RC[-5] -> 743749997.6500001 | BD33: HQ | BE33: 13851673 | BF33: 20658458 | BG33: 0 | BH33: =RC[-3]-RC[-1]-RC[-2] -> 0.54999999999999982 | BI33: =R40C61*RC[-4] -> 875000000 | BJ33: =RC[-1]*15% -> 131250000 | BK33: =R40C19*RC[-5] -> 1.8 | BL33: =RC[-3]-RC[-2]-RC[-1] -> 743749998.20000005 | BM33: =RC[-1]-RC[-5] -> 743749997.6500001 | BO33: HQ | BP33: 0 | BQ33: 0 | BR33: 0 | BS33: =RC[-3]-RC[-1]-RC[-2] -> 0.54999999999999982 | BT33: =R40C72*RC[-4] -> 875000000 | BU33: =RC[-1]*15% -> 131250000 | BV33: =R40C8*RC[-5] -> 1.8 | BW33: =RC[-3]-RC[-2]-RC[-1] -> 743749998.20000005 | BX33: =RC[-1]-RC[-5] -> 743749997.6500001 | BZ33: HQ | CA33: 0 | CB33: 0 | CC33: 0 | CD33: =RC[-3]-RC[-1]-RC[-2] -> 0.54999999999999982 | CE33: =R40C83*RC[-4] -> 875000000 | CF33: =RC[-1]*15% -> 131250000 | CG33: =R40C19*RC[-5] -> 1.8 | CH33: =RC[-3]-RC[-2]-RC[-1] -> 743749998.20000005 | CI33: =RC[-1]-RC[-5] -> 743749997.6500001 | CK33: HQ | CL33: 0 | CM33: 0 | CN33: 0 | CO33: =RC[-3]-RC[-1]-RC[-2] -> 0.54999999999999982 | CP33: =R40C94*RC[-4] -> 875000000 | CQ33: =RC[-1]*15% -> 131250000 | CR33: =R40C19*RC[-5] -> 1.8 | CS33: =RC[-3]-RC[-2]-RC[-1] -> 743749998.20000005 | CT33: =RC[-1]-RC[-5] -> 743749997.6500001 | CV33: HQ | CW33: 0 | CX33: 0 | CY33: 0 | CZ33: =RC[-3]-RC[-1]-RC[-2] -> 0.54999999999999982 | DA33: =R40C105*RC[-4] -> 875000000 | DB33: =RC[-1]*15% -> 131250000 | DC33: =R40C19*RC[-5] -> 1.8 | DD33: =RC[-3]-RC[-2]-RC[-1] -> 743749998.20000005 | DE33: =RC[-1]-RC[-5] -> 743749997.6500001 | DG33: HQ | DH33: 0 | DI33: 0 | DJ33: 0 | DK33: =RC[-3]-RC[-1]-RC[-2] -> 0.54999999999999982 | DL33: =R40C116*RC[-4] -> 807692307.69230771 | DM33: =RC[-1]*15% -> 121153846.15384614 | DN33: =R40C19*RC[-5] -> 1.8 | DO33: =RC[-3]-RC[-2]-RC[-1] -> 686538459.73846161 | DP33: =RC[-1]-RC[-5] -> 686538459.18846166 | DR33: HQ | DS33: 0 | DT33: 0 | DU33: 0 | DV33: =RC[-3]-RC[-1]-RC[-2] -> 0.54999999999999982 | DW33: =R40C127*RC[-4] -> 875000000 | DX33: =RC[-1]*15% -> 131250000 | DY33: =R40C19*RC[-5] -> 1.8 | DZ33: =RC[-3]-RC[-2]-RC[-1] -> 743749998.20000005 | EA33: =RC[-1]-RC[-5] -> 743749997.6500001 | EC33: HQ | ED33: =RC[-132]+RC[-121]+RC[-110]+RC[-99]+RC[-88]+RC[-77]+RC[-66]+RC[-55]+RC[-44]+RC[-33]+RC[-22]+RC[-11] ->  | EE33: =RC[-132]+RC[-121]+RC[-110]+RC[-99]+RC[-88]+RC[-77]+RC[-66]+RC[-55]+RC[-44]+RC[-33]+RC[-22]+RC[-11] ->  | EF33: =RC[-132]+RC[-121]+RC[-110]+RC[-99]+RC[-88]+RC[-77]+RC[-66]+RC[-55]+RC[-44]+RC[-33]+RC[-22]+RC[-11] ->  | EG33: =RC[-132]+RC[-121]+RC[-110]+RC[-99]+RC[-88]+RC[-77]+RC[-66]+RC[-55]+RC[-44]+RC[-33]+RC[-22]+RC[-11] ->  | EH33: =RC[-132]+RC[-121]+RC[-110]+RC[-99]+RC[-88]+RC[-77]+RC[-66]+RC[-55]+RC[-44]+RC[-33]+RC[-22]+RC[-11] ->  | EI33: =RC[-132]+RC[-121]+RC[-110]+RC[-99]+RC[-88]+RC[-77]+RC[-66]+RC[-55]+RC[-44]+RC[-33]+RC[-22]+RC[-11] ->  | EJ33: =RC[-132]+RC[-121]+RC[-110]+RC[-99]+RC[-88]+RC[-77]+RC[-66]+RC[-55]+RC[-44]+RC[-33]+RC[-22]+RC[-11] ->  | EK33: =RC[-132]+RC[-121]+RC[-110]+RC[-99]+RC[-88]+RC[-77]+RC[-66]+RC[-55]+RC[-44]+RC[-33]+RC[-22]+RC[-11] ->  | EL33: =RC[-132]+RC[-121]+RC[-110]+RC[-99]+RC[-88]+RC[-77]+RC[-66]+RC[-55]+RC[-44]+RC[-33]+RC[-22]+RC[-11] -> 
A34: Tổng | B34: =SUM(R[-5]C:R[-1]C) -> 3551128896 | C34: =SUM(R[-5]C:R[-1]C) -> -619983 | D34: =SUM(R[-5]C:R[-1]C) -> 532669334.39999998 | E34: =SUM(R[-5]C:R[-1]C) -> 3019079544.5999999 | F34: =SUM(R[-5]C:R[-1]C) -> 3499999999.9999995 | G34: =SUM(R[-5]C:R[-1]C) -> 525000000 | H34: =SUM(R[-5]C:R[-1]C) -> -557984.69999999995 | I34: =SUM(R[-5]C:R[-1]C) -> 2975557984.6999998 | J34: =SUM(R[-5]C:R[-1]C) -> -43521559.899999849 | L34: Tổng | M34: =SUM(R[-5]C:R[-1]C) -> 3551128896 | N34: =SUM(R[-5]C:R[-1]C) -> -619983 | O34: =SUM(R[-5]C:R[-1]C) -> 532669334.39999998 | P34: =SUM(R[-5]C:R[-1]C) -> 3019079544.5999999 | Q34: =SUM(R[-5]C:R[-1]C) -> 3499999999.9999995 | R34: =SUM(R[-5]C:R[-1]C) -> 525000000 | S34: =SUM(R[-5]C:R[-1]C) -> -557984.69999999995 | T34: =SUM(R[-5]C:R[-1]C) -> 2975557984.6999998 | U34: =SUM(R[-5]C:R[-1]C) -> -43521559.899999849 | W34: Tổng | X34: =SUM(R[-5]C:R[-1]C) -> 12 | Y34: =SUM(R[-5]C:R[-1]C) -> 9 | Z34: =SUM(R[-5]C:R[-1]C) -> 2.35 | AA34: =SUM(R[-5]C:R[-1]C) -> 0.64999999999999991 | AB34: =SUM(R[-5]C:R[-1]C) -> 3500000000 | AC34: =SUM(R[-5]C:R[-1]C) -> 525000000 | AD34: =SUM(R[-5]C:R[-1]C) -> 8.1 | AE34: =SUM(R[-5]C:R[-1]C) -> 2974999991.9000006 | AF34: =SUM(R[-5]C:R[-1]C) -> 2974999991.2500005 | AH34: Tổng | AI34: =SUM(R[-5]C:R[-1]C) -> 12 | AJ34: =SUM(R[-5]C:R[-1]C) -> 9 | AK34: =SUM(R[-5]C:R[-1]C) -> 1.7999999999999998 | AL34: =SUM(R[-5]C:R[-1]C) -> 1.1999999999999997 | AM34: =SUM(R[-5]C:R[-1]C) -> 3500000000 | AN34: =SUM(R[-5]C:R[-1]C) -> 525000000 | AO34: =SUM(R[-5]C:R[-1]C) -> 8.1 | AP34: =SUM(R[-5]C:R[-1]C) -> 2974999991.9000006 | AQ34: =SUM(R[-5]C:R[-1]C) -> 2974999990.7000003 | AS34: Tổng | AT34: =SUM(R[-5]C:R[-1]C) -> 12 | AU34: =SUM(R[-5]C:R[-1]C) -> 9 | AV34: =SUM(R[-5]C:R[-1]C) -> 1.7999999999999998 | AW34: =SUM(R[-5]C:R[-1]C) -> 1.1999999999999997 | AX34: =SUM(R[-5]C:R[-1]C) -> 3500000000 | AY34: =SUM(R[-5]C:R[-1]C) -> 525000000 | AZ34: =SUM(R[-5]C:R[-1]C) -> 8.1 | BA34: =SUM(R[-5]C:R[-1]C) -> 2974999991.9000006 | BB34: =SUM(R[-5]C:R[-1]C) -> 2974999990.7000003 | BD34: Tổng | BE34: =SUM(R[-5]C:R[-1]C) -> 12 | BF34: =SUM(R[-5]C:R[-1]C) -> 9 | BG34: =SUM(R[-5]C:R[-1]C) -> 1.7999999999999998 | BH34: =SUM(R[-5]C:R[-1]C) -> 1.1999999999999997 | BI34: =SUM(R[-5]C:R[-1]C) -> 3500000000 | BJ34: =SUM(R[-5]C:R[-1]C) -> 525000000 | BK34: =SUM(R[-5]C:R[-1]C) -> 8.1 | BL34: =SUM(R[-5]C:R[-1]C) -> 2974999991.9000006 | BM34: =SUM(R[-5]C:R[-1]C) -> 2974999990.7000003 | BO34: Tổng | BP34: =SUM(R[-5]C:R[-1]C) -> 12 | BQ34: =SUM(R[-5]C:R[-1]C) -> 9 | BR34: =SUM(R[-5]C:R[-1]C) -> 1.7999999999999998 | BS34: =SUM(R[-5]C:R[-1]C) -> 1.1999999999999997 | BT34: =SUM(R[-5]C:R[-1]C) -> 3500000000 | BU34: =SUM(R[-5]C:R[-1]C) -> 525000000 | BV34: =SUM(R[-5]C:R[-1]C) -> 8.1 | BW34: =SUM(R[-5]C:R[-1]C) -> 2974999991.9000006 | BX34: =SUM(R[-5]C:R[-1]C) -> 2974999990.7000003 | BZ34: Tổng | CA34: =SUM(R[-5]C:R[-1]C) -> 12 | CB34: =SUM(R[-5]C:R[-1]C) -> 9 | CC34: =SUM(R[-5]C:R[-1]C) -> 1.7999999999999998 | CD34: =SUM(R[-5]C:R[-1]C) -> 1.1999999999999997 | CE34: =SUM(R[-5]C:R[-1]C) -> 3500000000 | CF34: =SUM(R[-5]C:R[-1]C) -> 525000000 | CG34: =SUM(R[-5]C:R[-1]C) -> 8.1 | CH34: =SUM(R[-5]C:R[-1]C) -> 2974999991.9000006 | CI34: =SUM(R[-5]C:R[-1]C) -> 2974999990.7000003 | CK34: Tổng | CL34: =SUM(R[-5]C:R[-1]C) -> 12 | CM34: =SUM(R[-5]C:R[-1]C) -> 9 | CN34: =SUM(R[-5]C:R[-1]C) -> 1.7999999999999998 | CO34: =SUM(R[-5]C:R[-1]C) -> 1.1999999999999997 | CP34: =SUM(R[-5]C:R[-1]C) -> 3500000000 | CQ34: =SUM(R[-5]C:R[-1]C) -> 525000000 | CR34: =SUM(R[-5]C:R[-1]C) -> 8.1 | CS34: =SUM(R[-5]C:R[-1]C) -> 2974999991.9000006 | CT34: =SUM(R[-5]C:R[-1]C) -> 2974999990.7000003 | CV34: Tổng | CW34: =SUM(R[-5]C:R[-1]C) -> 12 | CX34: =SUM(R[-5]C:R[-1]C) -> 9 | CY34: =SUM(R[-5]C:R[-1]C) -> 1.7999999999999998 | CZ34: =SUM(R[-5]C:R[-1]C) -> 1.1999999999999997 | DA34: =SUM(R[-5]C:R[-1]C) -> 3500000000 | DB34: =SUM(R[-5]C:R[-1]C) -> 525000000 | DC34: =SUM(R[-5]C:R[-1]C) -> 8.1 | DD34: =SUM(R[-5]C:R[-1]C) -> 2974999991.9000006 | DE34: =SUM(R[-5]C:R[-1]C) -> 2974999990.7000003 | DG34: Tổng | DH34: =SUM(R[-5]C:R[-1]C) -> 13 | DI34: =SUM(R[-5]C:R[-1]C) -> 9 | DJ34: =SUM(R[-5]C:R[-1]C) -> 1.9499999999999997 | DK34: =SUM(R[-5]C:R[-1]C) -> 2.0499999999999994 | DL34: =SUM(R[-5]C:R[-1]C) -> 3500000000 | DM34: =SUM(R[-5]C:R[-1]C) -> 525000000 | DN34: =SUM(R[-5]C:R[-1]C) -> 8.1 | DO34: =SUM(R[-5]C:R[-1]C) -> 2974999991.9000001 | DP34: =SUM(R[-5]C:R[-1]C) -> 2974999989.8500004 | DR34: Tổng | DS34: =SUM(R[-5]C:R[-1]C) -> 12 | DT34: =SUM(R[-5]C:R[-1]C) -> 9 | DU34: =SUM(R[-5]C:R[-1]C) -> 1.7999999999999998 | DV34: =SUM(R[-5]C:R[-1]C) -> 1.1999999999999997 | DW34: =SUM(R[-5]C:R[-1]C) -> 3500000000 | DX34: =SUM(R[-5]C:R[-1]C) -> 525000000 | DY34: =SUM(R[-5]C:R[-1]C) -> 8.1 | DZ34: =SUM(R[-5]C:R[-1]C) -> 2974999991.9000006 | EA34: =SUM(R[-5]C:R[-1]C) -> 2974999990.7000003 | EC34: Tổng | ED34: =SUM(R[-5]C:R[-1]C) -> 7102257913 | EE34: =SUM(R[-5]C:R[-1]C) -> -1239876 | EF34: =SUM(R[-5]C:R[-1]C) -> 1065338687.5000002 | EG34: =SUM(R[-5]C:R[-1]C) -> 6038159101.4999962 | EH34: =SUM(R[-5]C:R[-1]C) -> 42000000000 | EI34: =SUM(R[-5]C:R[-1]C) -> 6300000000 | EJ34: =SUM(R[-5]C:R[-1]C) -> -1115888.4000000006 | EK34: =SUM(R[-5]C:R[-1]C) -> 35701115888.400009 | EL34: =SUM(R[-5]C:R[-1]C) -> 29662956786.900002
E36: Số liệu theo biên bản đối soát thực tế với Viettel | P36: Số liệu theo biên bản đối soát thực tế với Viettel | AA36: Số liệu theo biên bản đối soát thực tế với Viettel | AL36: Số liệu theo biên bản đối soát thực tế với Viettel | AW36: Số liệu theo biên bản đối soát thực tế với Viettel | BH36: Số liệu theo biên bản đối soát thực tế với Viettel | BS36: Số liệu theo biên bản đối soát thực tế với Viettel | CD36: Số liệu theo biên bản đối soát thực tế với Viettel | CO36: Số liệu theo biên bản đối soát thực tế với Viettel | CZ36: Số liệu theo biên bản đối soát thực tế với Viettel | DK36: Số liệu theo biên bản đối soát thực tế với Viettel | DV36: Số liệu theo biên bản đối soát thực tế với Viettel
E37: Doanh thu | G37: MT vượt | P37: Doanh thu | R37: MT vượt | AA37: Doanh thu | AC37: MT vượt | AL37: Doanh thu | AN37: MT vượt | AW37: Doanh thu | AY37: MT vượt | BH37: Doanh thu | BJ37: MT vượt | BS37: Doanh thu | BU37: MT vượt | CD37: Doanh thu | CF37: MT vượt | CO37: Doanh thu | CQ37: MT vượt | CZ37: Doanh thu | DB37: MT vượt | DK37: Doanh thu | DM37: MT vượt | DV37: Doanh thu | DX37: MT vượt
E38: Doanh thu hệ thống | F38: =R[-4]C[-4] -> 3551128896 | G38: MT hệ thống | H38: 10 | P38: Doanh thu hệ thống | Q38: =R[-4]C[-4] -> 3551128896 | R38: MT hệ thống | S38: 10 | AA38: Doanh thu hệ thống | AB38: =R[-4]C[-4] -> 12 | AC38: MT hệ thống | AD38: 10 | AL38: Doanh thu hệ thống | AM38: =R[-4]C[-4] -> 12 | AN38: MT hệ thống | AO38: 10 | AW38: Doanh thu hệ thống | AX38: =R[-4]C[-4] -> 12 | AY38: MT hệ thống | AZ38: 10 | BH38: Doanh thu hệ thống | BI38: =R[-4]C[-4] -> 12 | BJ38: MT hệ thống | BK38: 10 | BS38: Doanh thu hệ thống | BT38: =R[-4]C[-4] -> 12 | BU38: MT hệ thống | BV38: 10 | CD38: Doanh thu hệ thống | CE38: =R[-4]C[-4] -> 12 | CF38: MT hệ thống | CG38: 10 | CO38: Doanh thu hệ thống | CP38: =R[-4]C[-4] -> 12 | CQ38: MT hệ thống | CR38: 10 | CZ38: Doanh thu hệ thống | DA38: =R[-4]C[-4] -> 12 | DB38: MT hệ thống | DC38: 10 | DK38: Doanh thu hệ thống | DL38: =R[-4]C[-4] -> 13 | DM38: MT hệ thống | DN38: 10 | DV38: Doanh thu hệ thống | DW38: =R[-4]C[-4] -> 12 | DX38: MT hệ thống | DY38: 10
E39: Doanh thu thực tế | F39: 3500000000 | G39: MT thực tế | H39: 9 | P39: Doanh thu thực tế | Q39: 3500000000 | R39: MT thực tế | S39: 9 | AA39: Doanh thu thực tế | AB39: 3500000000 | AC39: MT thực tế | AD39: 9 | AL39: Doanh thu thực tế | AM39: 3500000000 | AN39: MT thực tế | AO39: 9 | AW39: Doanh thu thực tế | AX39: 3500000000 | AY39: MT thực tế | AZ39: 9 | BH39: Doanh thu thực tế | BI39: 3500000000 | BJ39: MT thực tế | BK39: 9 | BS39: Doanh thu thực tế | BT39: 3500000000 | BU39: MT thực tế | BV39: 9 | CD39: Doanh thu thực tế | CE39: 3500000000 | CF39: MT thực tế | CG39: 9 | CO39: Doanh thu thực tế | CP39: 3500000000 | CQ39: MT thực tế | CR39: 9 | CZ39: Doanh thu thực tế | DA39: 3500000000 | DB39: MT thực tế | DC39: 9 | DK39: Doanh thu thực tế | DL39: 3500000000 | DM39: MT thực tế | DN39: 9 | DV39: Doanh thu thực tế | DW39: 3500000000 | DX39: MT thực tế | DY39: 9
E40: DT QT/DT HT | F40: =R[-1]C/R[-2]C -> 0.9856020726091943 | G40: MT QT/ HT | H40: =R[-1]C/R[-2]C -> 0.9 | P40: DT QT/DT HT | Q40: =R[-1]C/R[-2]C -> 0.9856020726091943 | R40: MT QT/ HT | S40: =R[-1]C/R[-2]C -> 0.9 | AA40: DT QT/DT HT | AB40: =R[-1]C/R[-2]C -> 291666666.66666669 | AC40: MT QT/ HT | AD40: =R[-1]C/R[-2]C -> 0.9 | AL40: DT QT/DT HT | AM40: =R[-1]C/R[-2]C -> 291666666.66666669 | AN40: MT QT/ HT | AO40: =R[-1]C/R[-2]C -> 0.9 | AW40: DT QT/DT HT | AX40: =R[-1]C/R[-2]C -> 291666666.66666669 | AY40: MT QT/ HT | AZ40: =R[-1]C/R[-2]C -> 0.9 | BH40: DT QT/DT HT | BI40: =R[-1]C/R[-2]C -> 291666666.66666669 | BJ40: MT QT/ HT | BK40: =R[-1]C/R[-2]C -> 0.9 | BS40: DT QT/DT HT | BT40: =R[-1]C/R[-2]C -> 291666666.66666669 | BU40: MT QT/ HT | BV40: =R[-1]C/R[-2]C -> 0.9 | CD40: DT QT/DT HT | CE40: =R[-1]C/R[-2]C -> 291666666.66666669 | CF40: MT QT/ HT | CG40: =R[-1]C/R[-2]C -> 0.9 | CO40: DT QT/DT HT | CP40: =R[-1]C/R[-2]C -> 291666666.66666669 | CQ40: MT QT/ HT | CR40: =R[-1]C/R[-2]C -> 0.9 | CZ40: DT QT/DT HT | DA40: =R[-1]C/R[-2]C -> 291666666.66666669 | DB40: MT QT/ HT | DC40: =R[-1]C/R[-2]C -> 0.9 | DK40: DT QT/DT HT | DL40: =R[-1]C/R[-2]C -> 269230769.23076922 | DM40: MT QT/ HT | DN40: =R[-1]C/R[-2]C -> 0.9 | DV40: DT QT/DT HT | DW40: =R[-1]C/R[-2]C -> 291666666.66666669 | DX40: MT QT/ HT | DY40: =R[-1]C/R[-2]C -> 0.9
E41: Tỷ lệ thất thoát | F41: =100%-R[-1]C -> 1.4397927390805698E-2 | G41: Tỷ lệ chênh lệch | H41: =100%-R[-1]C -> 9.9999999999999978E-2 | P41: Tỷ lệ thất thoát | Q41: =100%-R[-1]C -> 1.4397927390805698E-2 | R41: Tỷ lệ chênh lệch | S41: =100%-R[-1]C -> 9.9999999999999978E-2 | AA41: Tỷ lệ thất thoát | AB41: =100%-R[-1]C -> -291666665.66666669 | AC41: Tỷ lệ chênh lệch | AD41: =100%-R[-1]C -> 9.9999999999999978E-2 | AL41: Tỷ lệ thất thoát | AM41: =100%-R[-1]C -> -291666665.66666669 | AN41: Tỷ lệ chênh lệch | AO41: =100%-R[-1]C -> 9.9999999999999978E-2 | AW41: Tỷ lệ thất thoát | AX41: =100%-R[-1]C -> -291666665.66666669 | AY41: Tỷ lệ chênh lệch | AZ41: =100%-R[-1]C -> 9.9999999999999978E-2 | BH41: Tỷ lệ thất thoát | BI41: =100%-R[-1]C -> -291666665.66666669 | BJ41: Tỷ lệ chênh lệch | BK41: =100%-R[-1]C -> 9.9999999999999978E-2 | BS41: Tỷ lệ thất thoát | BT41: =100%-R[-1]C -> -291666665.66666669 | BU41: Tỷ lệ chênh lệch | BV41: =100%-R[-1]C -> 9.9999999999999978E-2 | CD41: Tỷ lệ thất thoát | CE41: =100%-R[-1]C -> -291666665.66666669 | CF41: Tỷ lệ chênh lệch | CG41: =100%-R[-1]C -> 9.9999999999999978E-2 | CO41: Tỷ lệ thất thoát | CP41: =100%-R[-1]C -> -291666665.66666669 | CQ41: Tỷ lệ chênh lệch | CR41: =100%-R[-1]C -> 9.9999999999999978E-2 | CZ41: Tỷ lệ thất thoát | DA41: =100%-R[-1]C -> -291666665.66666669 | DB41: Tỷ lệ chênh lệch | DC41: =100%-R[-1]C -> 9.9999999999999978E-2 | DK41: Tỷ lệ thất thoát | DL41: =100%-R[-1]C -> -269230768.23076922 | DM41: Tỷ lệ chênh lệch | DN41: =100%-R[-1]C -> 9.9999999999999978E-2 | DV41: Tỷ lệ thất thoát | DW41: =100%-R[-1]C -> -291666665.66666669 | DX41: Tỷ lệ chênh lệch | DY41: =100%-R[-1]C -> 9.9999999999999978E-2
E42: Doanh thu khuyến khích | P42: Doanh thu khuyến khích | AA42: Doanh thu khuyến khích | AL42: Doanh thu khuyến khích | AW42: Doanh thu khuyến khích | BH42: Doanh thu khuyến khích | BS42: Doanh thu khuyến khích | CD42: Doanh thu khuyến khích | CO42: Doanh thu khuyến khích | CZ42: Doanh thu khuyến khích | DK42: Doanh thu khuyến khích | DV42: Doanh thu khuyến khích
A47: 8x79/VNP/2015
A48: Tháng 1 | L48: Tháng 2 | W48: Tháng 3 | AH48: Tháng 4 | AS48: Tháng 5 | BD48: Tháng 6 | BO48: Tháng 7 | BZ48: Tháng 8 | CK48: Tháng 9 | CV48: Tháng 10 | DG48: Tháng 11 | DR48: Tháng 12 | EC48: Lũy kế đến tháng báo cáo
A49: Tên đối tác | B49: Số liệu hệ thống/tạm tính | F49: Số liệu quyết toán theo biên bản đối soát | J49: C/lệch Quyết toán - Tạm tính | L49: Tên đối tác | M49: Số liệu hệ thống/tạm tính | Q49: Số liệu quyết toán theo biên bản đối soát | U49: C/lệch Quyết toán - Tạm tính | W49: Tên đối tác | X49: Số liệu hệ thống/tạm tính | AB49: Số liệu quyết toán theo biên bản đối soát | AF49: C/lệch Quyết toán - Tạm tính | AH49: Tên đối tác | AI49: Số liệu hệ thống/tạm tính | AM49: Số liệu quyết toán theo biên bản đối soát | AQ49: C/lệch Quyết toán - Tạm tính | AS49: Tên đối tác | AT49: Số liệu hệ thống/tạm tính | AX49: Số liệu quyết toán theo biên bản đối soát | BB49: C/lệch Quyết toán - Tạm tính | BD49: Tên đối tác | BE49: Số liệu hệ thống/tạm tính | BI49: Số liệu quyết toán theo biên bản đối soát | BM49: C/lệch Quyết toán - Tạm tính | BO49: Tên đối tác | BP49: Số liệu hệ thống/tạm tính | BT49: Số liệu quyết toán theo biên bản đối soát | BX49: C/lệch Quyết toán - Tạm tính | BZ49: Tên đối tác | CA49: Số liệu hệ thống/tạm tính | CE49: Số liệu quyết toán theo biên bản đối soát | CI49: C/lệch Quyết toán - Tạm tính | CK49: Tên đối tác | CL49: Số liệu hệ thống/tạm tính | CP49: Số liệu quyết toán theo biên bản đối soát | CT49: C/lệch Quyết toán - Tạm tính | CV49: Tên đối tác | CW49: Số liệu hệ thống/tạm tính | DA49: Số liệu quyết toán theo biên bản đối soát | DE49: C/lệch Quyết toán - Tạm tính | DG49: Tên đối tác | DH49: Số liệu hệ thống/tạm tính | DL49: Số liệu quyết toán theo biên bản đối soát | DP49: C/lệch Quyết toán - Tạm tính | DR49: Tên đối tác | DS49: Số liệu hệ thống/tạm tính | DW49: Số liệu quyết toán theo biên bản đối soát | EA49: C/lệch Quyết toán - Tạm tính | EC49: Tên đối tác | ED49: Số liệu hệ thống/tạm tính | EH49: Số liệu quyết toán theo biên bản đối soát | EL49: C/lệch Quyết toán - Tạm tính
B50: Doanh thu | C50: MT vượt | D50: Trả đối tác | E50: DT về đơn vị | F50: Doanh thu | G50: Trả đối tác | H50: MT | I50: DT về đơn vị | M50: Doanh thu | N50: MT vượt | O50: Trả đối tác | P50: DT về đơn vị | Q50: Doanh thu | R50: Trả đối tác | S50: MT | T50: DT về đơn vị | X50: Doanh thu | Y50: MT vượt | Z50: Trả đối tác | AA50: DT về đơn vị | AB50: Doanh thu | AC50: Trả đối tác | AD50: MT | AE50: DT về đơn vị | AI50: Doanh thu | AJ50: MT vượt | AK50: Trả đối tác | AL50: DT về đơn vị | AM50: Doanh thu | AN50: Trả đối tác | AO50: MT | AP50: DT về đơn vị | AT50: Doanh thu | AU50: MT vượt | AV50: Trả đối tác | AW50: DT về đơn vị | AX50: Doanh thu | AY50: Trả đối tác | AZ50: MT | BA50: DT về đơn vị | BE50: Doanh thu | BF50: MT vượt | BG50: Trả đối tác | BH50: DT về đơn vị | BI50: Doanh thu | BJ50: Trả đối tác | BK50: MT | BL50: DT về đơn vị | BP50: Doanh thu | BQ50: MT vượt | BR50: Trả đối tác | BS50: DT về đơn vị | BT50: Doanh thu | BU50: Trả đối tác | BV50: MT | BW50: DT về đơn vị | CA50: Doanh thu | CB50: MT vượt | CC50: Trả đối tác | CD50: DT về đơn vị | CE50: Doanh thu | CF50: Trả đối tác | CG50: MT | CH50: DT về đơn vị | CL50: Doanh thu | CM50: MT vượt | CN50: Trả đối tác | CO50: DT về đơn vị | CP50: Doanh thu | CQ50: Trả đối tác | CR50: MT | CS50: DT về đơn vị | CW50: Doanh thu | CX50: MT vượt | CY50: Trả đối tác | CZ50: DT về đơn vị | DA50: Doanh thu | DB50: Trả đối tác | DC50: MT | DD50: DT về đơn vị | DH50: Doanh thu | DI50: MT vượt | DJ50: Trả đối tác | DK50: DT về đơn vị | DL50: Doanh thu | DM50: Trả đối tác | DN50: MT | DO50: DT về đơn vị | DS50: Doanh thu | DT50: MT vượt | DU50: Trả đối tác | DV50: DT về đơn vị | DW50: Doanh thu | DX50: Trả đối tác | DY50: MT | DZ50: DT về đơn vị | ED50: Doanh thu | EE50: MT vượt | EF50: Trả đối tác | EG50: DT về đơn vị | EH50: Doanh thu | EI50: Trả đối tác | EJ50: MT | EK50: DT về đơn vị
B51: (1) | C51: (2) | D51: (3) = (2) *x% | E51: (4) = (1) - (3) - (2) | F51: (5) | G51: (6) | H51: (7) | I51: (8) = (5) - (6) - (7) | J51: (9) = (4) - (8) | M51: (1) | N51: (2) = ( MO - MT) *91 | O51: (3) = (2) *15% | P51: (4) = (1) - (3) - (2) | Q51: (5) | R51: (6) | S51: (7) | T51: (8) = (5) - (6) - (7) | U51: (9) = (4) - (8) | X51: (1) | Y51: (2) = ( MO - MT) *91 | Z51: (3) = (2) *15% | AA51: (4) = (1) - (3) - (2) | AB51: (5) | AC51: (6) | AD51: (7) | AE51: (8) = (5) - (6) - (7) | AF51: (9) = (4) - (8) | AI51: (1) | AJ51: (2) = ( MO - MT) *91 | AK51: (3) = (2) *15% | AL51: (4) = (1) - (3) - (2) | AM51: (5) | AN51: (6) | AO51: (7) | AP51: (8) = (5) - (6) - (7) | AQ51: (9) = (4) - (8) | AT51: (1) | AU51: (2) = ( MO - MT) *91 | AV51: (3) = (2) *15% | AW51: (4) = (1) - (3) - (2) | AX51: (5) | AY51: (6) | AZ51: (7) | BA51: (8) = (5) - (6) - (7) | BB51: (9) = (4) - (8) | BE51: (1) | BF51: (2) = ( MO - MT) *91 | BG51: (3) = (2) *15% | BH51: (4) = (1) - (3) - (2) | BI51: (5) | BJ51: (6) | BK51: (7) | BL51: (8) = (5) - (6) - (7) | BM51: (9) = (4) - (8) | BP51: (1) | BQ51: (2) | BR51: (3) = (2) *15% | BS51: (4) = (1) - (3) - (2) | BT51: (5) | BU51: (6) | BV51: (7) | BW51: (8) = (5) - (6) - (7) | BX51: (9) = (4) - (8) | CA51: (1) | CB51: (2) = ( MO - MT) *91 | CC51: (3) = (2) *15% | CD51: (4) = (1) - (3) - (2) | CE51: (5) | CF51: (6) | CG51: (7) | CH51: (8) = (5) - (6) - (7) | CI51: (9) = (4) - (8) | CL51: (1) | CM51: (2) = ( MO - MT) *91 | CN51: (3) = (2) *15% | CO51: (4) = (1) - (3) - (2) | CP51: (5) | CQ51: (6) | CR51: (7) | CS51: (8) = (5) - (6) - (7) | CT51: (9) = (4) - (8) | CW51: (1) | CX51: (2) = ( MO - MT) *91 | CY51: (3) = (2) *15% | CZ51: (4) = (1) - (3) - (2) | DA51: (5) | DB51: (6) | DC51: (7) | DD51: (8) = (5) - (6) - (7) | DE51: (9) = (4) - (8) | DH51: (1) | DI51: (2) = ( MO - MT) *91 | DJ51: (3) = (2) *15% | DK51: (4) = (1) - (3) - (2) | DL51: (5) | DM51: (6) | DN51: (7) | DO51: (8) = (5) - (6) - (7) | DP51: (9) = (4) - (8) | DS51: (1) | DT51: (2) = ( MO - MT) *91 | DU51: (3) = (2) *15% | DV51: (4) = (1) - (3) - (2) | DW51: (5) | DX51: (6) | DY51: (7) | DZ51: (8) = (5) - (6) - (7) | EA51: (9) = (4) - (8) | ED51: (1) | EE51: (2) = ( MO - MT) *91 | EF51: (3) = (2) *15% | EG51: (4) = (1) - (3) - (2) | EH51: (5) | EI51: (6) | EJ51: (7) | EK51: (8) = (5) - (6) - (7) | EL51: (9) = (4) - (8)
A52: SUBCPS | B52: 27754265 | C52: 864499 | D52: 0 | E52: =RC[-3]-RC[-1]-RC[-2] ->  | F52: =R40C6*RC[-4] ->  | G52: =RC[-1]*15% ->  | H52: =R40C8*RC[-5] ->  | I52: =RC[-3]-RC[-2]-RC[-1] ->  | J52: =RC[-1]-RC[-5] ->  | L52: SUBCPS | M52: 34729079 | N52: 725976 | O52: 0 | P52: =RC[-3]-RC[-1]-RC[-2] -> 2467006.9 | Q52: =R40C17*RC[-4] -> 3000383.6278659259 | R52: =RC[-1]*15% -> 450057.54417988885 | S52: =R40C19*RC[-5] -> 108517.5 | T52: =RC[-3]-RC[-2]-RC[-1] -> 2441808.583686037 | U52: =RC[-1]-RC[-5] -> -25198.316313962918 | W52: SUBCPS | X52: 28589761 | Y52: 801073 | Z52: 0 | AA52: =RC[-3]-RC[-1]-RC[-2] -> 0 | AB52: =R40C28*RC[-4] -> 875000000 | AC52: =RC[-1]*15% -> 131250000 | AD52: =R40C19*RC[-5] -> 1.8 | AE52: =RC[-3]-RC[-2]-RC[-1] -> 743749998.20000005 | AF52: =RC[-1]-RC[-5] -> 743749998.20000005 | AH52: SUBCPS | AI52: 27689542 | AJ52: 168532 | AK52: 0 | AL52: =RC[-3]-RC[-1]-RC[-2] -> 0.54999999999999982 | AM52: =R40C39*RC[-4] -> 875000000 | AN52: =RC[-1]*15% -> 131250000 | AO52: =R40C19*RC[-5] -> 1.8 | AP52: =RC[-3]-RC[-2]-RC[-1] -> 743749998.20000005 | AQ52: =RC[-1]-RC[-5] -> 743749997.6500001 | AS52: SUBCPS | AT52: 34230108 | AU52: 172263 | AV52: 0 | AW52: =RC[-3]-RC[-1]-RC[-2] -> 0.54999999999999982 | AX52: =R40C50*RC[-4] -> 875000000 | AY52: =RC[-1]*15% -> 131250000 | AZ52: =R40C19*RC[-5] -> 1.8 | BA52: =RC[-3]-RC[-2]-RC[-1] -> 743749998.20000005 | BB52: =RC[-1]-RC[-5] -> 743749997.6500001 | BD52: SUBCPS | BE52: 34081392 | BF52: 140959 | BG52: 0 | BH52: =RC[-3]-RC[-1]-RC[-2] -> 0.54999999999999982 | BI52: =R40C61*RC[-4] -> 875000000 | BJ52: =RC[-1]*15% -> 131250000 | BK52: =R40C19*RC[-5] -> 1.8 | BL52: =RC[-3]-RC[-2]-RC[-1] -> 743749998.20000005 | BM52: =RC[-1]-RC[-5] -> 743749997.6500001 | BO52: SUBCPS | BP52: 0 | BQ52: 0 | BR52: 0 | BS52: =RC[-3]-RC[-1]-RC[-2] -> 0.54999999999999982 | BT52: =R40C72*RC[-4] -> 875000000 | BU52: =RC[-1]*15% -> 131250000 | BV52: =R40C8*RC[-5] -> 1.8 | BW52: =RC[-3]-RC[-2]-RC[-1] -> 743749998.20000005 | BX52: =RC[-1]-RC[-5] -> 743749997.6500001 | BZ52: SUBCPS | CA52: 0 | CB52: 0 | CC52: 0 | CD52: =RC[-3]-RC[-1]-RC[-2] -> 0.54999999999999982 | CE52: =R40C83*RC[-4] -> 875000000 | CF52: =RC[-1]*15% -> 131250000 | CG52: =R40C19*RC[-5] -> 1.8 | CH52: =RC[-3]-RC[-2]-RC[-1] -> 743749998.20000005 | CI52: =RC[-1]-RC[-5] -> 743749997.6500001 | CK52: SUBCPS | CL52: 0 | CM52: 0 | CN52: 0 | CO52: =RC[-3]-RC[-1]-RC[-2] -> 0.54999999999999982 | CP52: =R40C94*RC[-4] -> 875000000 | CQ52: =RC[-1]*15% -> 131250000 | CR52: =R40C19*RC[-5] -> 1.8 | CS52: =RC[-3]-RC[-2]-RC[-1] -> 743749998.20000005 | CT52: =RC[-1]-RC[-5] -> 743749997.6500001 | CV52: SUBCPS | CW52: 0 | CX52: 0 | CY52: 0 | CZ52: =RC[-3]-RC[-1]-RC[-2] -> 0.54999999999999982 | DA52: =R40C105*RC[-4] -> 875000000 | DB52: =RC[-1]*15% -> 131250000 | DC52: =R40C19*RC[-5] -> 1.8 | DD52: =RC[-3]-RC[-2]-RC[-1] -> 743749998.20000005 | DE52: =RC[-1]-RC[-5] -> 743749997.6500001 | DG52: SUBCPS | DH52: 0 | DI52: 0 | DJ52: 0 | DK52: =RC[-3]-RC[-1]-RC[-2] -> 0.54999999999999982 | DL52: =R40C116*RC[-4] -> 807692307.69230771 | DM52: =RC[-1]*15% -> 121153846.15384614 | DN52: =R40C19*RC[-5] -> 1.8 | DO52: =RC[-3]-RC[-2]-RC[-1] -> 686538459.73846161 | DP52: =RC[-1]-RC[-5] -> 686538459.18846166 | DR52: SUBCPS | DS52: 0 | DT52: 0 | DU52: 0 | DV52: =RC[-3]-RC[-1]-RC[-2] -> 0.54999999999999982 | DW52: =R40C127*RC[-4] -> 875000000 | DX52: =RC[-1]*15% -> 131250000 | DY52: =R40C19*RC[-5] -> 1.8 | DZ52: =RC[-3]-RC[-2]-RC[-1] -> 743749998.20000005 | EA52: =RC[-1]-RC[-5] -> 743749997.6500001 | EC52: SUBCPS | ED52: =RC[-132]+RC[-121]+RC[-110]+RC[-99]+RC[-88]+RC[-77]+RC[-66]+RC[-55]+RC[-44]+RC[-33]+RC[-22]+RC[-11] ->  | EE52: =RC[-132]+RC[-121]+RC[-110]+RC[-99]+RC[-88]+RC[-77]+RC[-66]+RC[-55]+RC[-44]+RC[-33]+RC[-22]+RC[-11] ->  | EF52: =RC[-132]+RC[-121]+RC[-110]+RC[-99]+RC[-88]+RC[-77]+RC[-66]+RC[-55]+RC[-44]+RC[-33]+RC[-22]+RC[-11] ->  | EG52: =RC[-132]+RC[-121]+RC[-110]+RC[-99]+RC[-88]+RC[-77]+RC[-66]+RC[-55]+RC[-44]+RC[-33]+RC[-22]+RC[-11] ->  | EH52: =RC[-132]+RC[-121]+RC[-110]+RC[-99]+RC[-88]+RC[-77]+RC[-66]+RC[-55]+RC[-44]+RC[-33]+RC[-22]+RC[-11] ->  | EI52: =RC[-132]+RC[-121]+RC[-110]+RC[-99]+RC[-88]+RC[-77]+RC[-66]+RC[-55]+RC[-44]+RC[-33]+RC[-22]+RC[-11] ->  | EJ52: =RC[-132]+RC[-121]+RC[-110]+RC[-99]+RC[-88]+RC[-77]+RC[-66]+RC[-55]+RC[-44]+RC[-33]+RC[-22]+RC[-11] ->  | EK52: =RC[-132]+RC[-121]+RC[-110]+RC[-99]+RC[-88]+RC[-77]+RC[-66]+RC[-55]+RC[-44]+RC[-33]+RC[-22]+RC[-11] ->  | EL52: =RC[-132]+RC[-121]+RC[-110]+RC[-99]+RC[-88]+RC[-77]+RC[-66]+RC[-55]+RC[-44]+RC[-33]+RC[-22]+RC[-11] -> 
A53: LUCKY_FONE | B53: 123078044 | C53: 10097261 | D53: 0 | E53: =RC[-3]-RC[-1]-RC[-2] ->  | F53: =R40C6*RC[-4] ->  | G53: =RC[-1]*15% ->  | H53: =R40C8*RC[-5] ->  | I53: =RC[-3]-RC[-2]-RC[-1] ->  | J53: =RC[-1]-RC[-5] ->  | L53: LUCKY_FONE | M53: 102929984 | N53: 7727686 | O53: 0 | P53: =RC[-3]-RC[-1]-RC[-2] -> 2467006.9 | Q53: =R40C17*RC[-4] -> 3000383.6278659259 | R53: =RC[-1]*15% -> 450057.54417988885 | S53: =R40C19*RC[-5] -> 108517.5 | T53: =RC[-3]-RC[-2]-RC[-1] -> 2441808.583686037 | U53: =RC[-1]-RC[-5] -> -25198.316313962918 | W53: LUCKY_FONE | X53: 113557413 | Y53: 9550630 | Z53: 0 | AA53: =RC[-3]-RC[-1]-RC[-2] -> 0 | AB53: =R40C28*RC[-4] -> 875000000 | AC53: =RC[-1]*15% -> 131250000 | AD53: =R40C19*RC[-5] -> 1.8 | AE53: =RC[-3]-RC[-2]-RC[-1] -> 743749998.20000005 | AF53: =RC[-1]-RC[-5] -> 743749998.20000005 | AH53: LUCKY_FONE | AI53: 108344108 | AJ53: 9168394 | AK53: 0 | AL53: =RC[-3]-RC[-1]-RC[-2] -> 0.54999999999999982 | AM53: =R40C39*RC[-4] -> 875000000 | AN53: =RC[-1]*15% -> 131250000 | AO53: =R40C19*RC[-5] -> 1.8 | AP53: =RC[-3]-RC[-2]-RC[-1] -> 743749998.20000005 | AQ53: =RC[-1]-RC[-5] -> 743749997.6500001 | AS53: LUCKY_FONE | AT53: 116684263 | AU53: 9812888 | AV53: 0 | AW53: =RC[-3]-RC[-1]-RC[-2] -> 0.54999999999999982 | AX53: =R40C50*RC[-4] -> 875000000 | AY53: =RC[-1]*15% -> 131250000 | AZ53: =R40C19*RC[-5] -> 1.8 | BA53: =RC[-3]-RC[-2]-RC[-1] -> 743749998.20000005 | BB53: =RC[-1]-RC[-5] -> 743749997.6500001 | BD53: LUCKY_FONE | BE53: 108360964 | BF53: 9442702 | BG53: 0 | BH53: =RC[-3]-RC[-1]-RC[-2] -> 0.54999999999999982 | BI53: =R40C61*RC[-4] -> 875000000 | BJ53: =RC[-1]*15% -> 131250000 | BK53: =R40C19*RC[-5] -> 1.8 | BL53: =RC[-3]-RC[-2]-RC[-1] -> 743749998.20000005 | BM53: =RC[-1]-RC[-5] -> 743749997.6500001 | BO53: LUCKY_FONE | BP53: 0 | BQ53: 0 | BR53: 0 | BS53: =RC[-3]-RC[-1]-RC[-2] -> 0.54999999999999982 | BT53: =R40C72*RC[-4] -> 875000000 | BU53: =RC[-1]*15% -> 131250000 | BV53: =R40C8*RC[-5] -> 1.8 | BW53: =RC[-3]-RC[-2]-RC[-1] -> 743749998.20000005 | BX53: =RC[-1]-RC[-5] -> 743749997.6500001 | BZ53: LUCKY_FONE | CA53: 0 | CB53: 0 | CC53: 0 | CD53: =RC[-3]-RC[-1]-RC[-2] -> 0.54999999999999982 | CE53: =R40C83*RC[-4] -> 875000000 | CF53: =RC[-1]*15% -> 131250000 | CG53: =R40C19*RC[-5] -> 1.8 | CH53: =RC[-3]-RC[-2]-RC[-1] -> 743749998.20000005 | CI53: =RC[-1]-RC[-5] -> 743749997.6500001 | CK53: LUCKY_FONE | CL53: 0 | CM53: 0 | CN53: 0 | CO53: =RC[-3]-RC[-1]-RC[-2] -> 0.54999999999999982 | CP53: =R40C94*RC[-4] -> 875000000 | CQ53: =RC[-1]*15% -> 131250000 | CR53: =R40C19*RC[-5] -> 1.8 | CS53: =RC[-3]-RC[-2]-RC[-1] -> 743749998.20000005 | CT53: =RC[-1]-RC[-5] -> 743749997.6500001 | CV53: LUCKY_FONE | CW53: 0 | CX53: 0 | CY53: 0 | CZ53: =RC[-3]-RC[-1]-RC[-2] -> 0.54999999999999982 | DA53: =R40C105*RC[-4] -> 875000000 | DB53: =RC[-1]*15% -> 131250000 | DC53: =R40C19*RC[-5] -> 1.8 | DD53: =RC[-3]-RC[-2]-RC[-1] -> 743749998.20000005 | DE53: =RC[-1]-RC[-5] -> 743749997.6500001 | DG53: LUCKY_FONE | DH53: 0 | DI53: 0 | DJ53: 0 | DK53: =RC[-3]-RC[-1]-RC[-2] -> 0.54999999999999982 | DL53: =R40C116*RC[-4] -> 807692307.69230771 | DM53: =RC[-1]*15% -> 121153846.15384614 | DN53: =R40C19*RC[-5] -> 1.8 | DO53: =RC[-3]-RC[-2]-RC[-1] -> 686538459.73846161 | DP53: =RC[-1]-RC[-5] -> 686538459.18846166 | DR53: LUCKY_FONE | DS53: 0 | DT53: 0 | DU53: 0 | DV53: =RC[-3]-RC[-1]-RC[-2] -> 0.54999999999999982 | DW53: =R40C127*RC[-4] -> 875000000 | DX53: =RC[-1]*15% -> 131250000 | DY53: =R40C19*RC[-5] -> 1.8 | DZ53: =RC[-3]-RC[-2]-RC[-1] -> 743749998.20000005 | EA53: =RC[-1]-RC[-5] -> 743749997.6500001 | EC53: LUCKY_FONE | ED53: =RC[-132]+RC[-121]+RC[-110]+RC[-99]+RC[-88]+RC[-77]+RC[-66]+RC[-55]+RC[-44]+RC[-33]+RC[-22]+RC[-11] ->  | EE53: =RC[-132]+RC[-121]+RC[-110]+RC[-99]+RC[-88]+RC[-77]+RC[-66]+RC[-55]+RC[-44]+RC[-33]+RC[-22]+RC[-11] ->  | EF53: =RC[-132]+RC[-121]+RC[-110]+RC[-99]+RC[-88]+RC[-77]+RC[-66]+RC[-55]+RC[-44]+RC[-33]+RC[-22]+RC[-11] ->  | EG53: =RC[-132]+RC[-121]+RC[-110]+RC[-99]+RC[-88]+RC[-77]+RC[-66]+RC[-55]+RC[-44]+RC[-33]+RC[-22]+RC[-11] ->  | EH53: =RC[-132]+RC[-121]+RC[-110]+RC[-99]+RC[-88]+RC[-77]+RC[-66]+RC[-55]+RC[-44]+RC[-33]+RC[-22]+RC[-11] ->  | EI53: =RC[-132]+RC[-121]+RC[-110]+RC[-99]+RC[-88]+RC[-77]+RC[-66]+RC[-55]+RC[-44]+RC[-33]+RC[-22]+RC[-11] ->  | EJ53: =RC[-132]+RC[-121]+RC[-110]+RC[-99]+RC[-88]+RC[-77]+RC[-66]+RC[-55]+RC[-44]+RC[-33]+RC[-22]+RC[-11] ->  | EK53: =RC[-132]+RC[-121]+RC[-110]+RC[-99]+RC[-88]+RC[-77]+RC[-66]+RC[-55]+RC[-44]+RC[-33]+RC[-22]+RC[-11] ->  | EL53: =RC[-132]+RC[-121]+RC[-110]+RC[-99]+RC[-88]+RC[-77]+RC[-66]+RC[-55]+RC[-44]+RC[-33]+RC[-22]+RC[-11] -> 
A54: TT PTKD | B54: 71040483 | C54: 2108925 | D54: 0 | E54: =RC[-3]-RC[-1]-RC[-2] ->  | F54: =R40C6*RC[-4] ->  | G54: =RC[-1]*15% ->  | H54: =R40C8*RC[-5] ->  | I54: =RC[-3]-RC[-2]-RC[-1] ->  | J54: =RC[-1]-RC[-5] ->  | L54: TT PTKD | M54: 58232288 | N54: 945296 | O54: 0 | P54: =RC[-3]-RC[-1]-RC[-2] -> 2467006.9 | Q54: =R40C17*RC[-4] -> 3000383.6278659259 | R54: =RC[-1]*15% -> 450057.54417988885 | S54: =R40C19*RC[-5] -> 108517.5 | T54: =RC[-3]-RC[-2]-RC[-1] -> 2441808.583686037 | U54: =RC[-1]-RC[-5] -> -25198.316313962918 | W54: TT PTKD | X54: 72696152 | Y54: 850559 | Z54: 0 | AA54: =RC[-3]-RC[-1]-RC[-2] -> 0 | AB54: =R40C28*RC[-4] -> 875000000 | AC54: =RC[-1]*15% -> 131250000 | AD54: =R40C19*RC[-5] -> 1.8 | AE54: =RC[-3]-RC[-2]-RC[-1] -> 743749998.20000005 | AF54: =RC[-1]-RC[-5] -> 743749998.20000005 | AH54: TT PTKD | AI54: 51045791 | AJ54: 68614 | AK54: 0 | AL54: =RC[-3]-RC[-1]-RC[-2] -> 0.54999999999999982 | AM54: =R40C39*RC[-4] -> 875000000 | AN54: =RC[-1]*15% -> 131250000 | AO54: =R40C19*RC[-5] -> 1.8 | AP54: =RC[-3]-RC[-2]-RC[-1] -> 743749998.20000005 | AQ54: =RC[-1]-RC[-5] -> 743749997.6500001 | AS54: TT PTKD | AT54: 45541183 | AU54: 821093 | AV54: 0 | AW54: =RC[-3]-RC[-1]-RC[-2] -> 0.54999999999999982 | AX54: =R40C50*RC[-4] -> 875000000 | AY54: =RC[-1]*15% -> 131250000 | AZ54: =R40C19*RC[-5] -> 1.8 | BA54: =RC[-3]-RC[-2]-RC[-1] -> 743749998.20000005 | BB54: =RC[-1]-RC[-5] -> 743749997.6500001 | BD54: TT PTKD | BE54: 34587439 | BF54: 1960413 | BG54: 0 | BH54: =RC[-3]-RC[-1]-RC[-2] -> 0.54999999999999982 | BI54: =R40C61*RC[-4] -> 875000000 | BJ54: =RC[-1]*15% -> 131250000 | BK54: =R40C19*RC[-5] -> 1.8 | BL54: =RC[-3]-RC[-2]-RC[-1] -> 743749998.20000005 | BM54: =RC[-1]-RC[-5] -> 743749997.6500001 | BO54: TT PTKD | BP54: 0 | BQ54: 0 | BR54: 0 | BS54: =RC[-3]-RC[-1]-RC[-2] -> 0.54999999999999982 | BT54: =R40C72*RC[-4] -> 875000000 | BU54: =RC[-1]*15% -> 131250000 | BV54: =R40C8*RC[-5] -> 1.8 | BW54: =RC[-3]-RC[-2]-RC[-1] -> 743749998.20000005 | BX54: =RC[-1]-RC[-5] -> 743749997.6500001 | BZ54: TT PTKD | CA54: 0 | CB54: 0 | CC54: 0 | CD54: =RC[-3]-RC[-1]-RC[-2] -> 0.54999999999999982 | CE54: =R40C83*RC[-4] -> 875000000 | CF54: =RC[-1]*15% -> 131250000 | CG54: =R40C19*RC[-5] -> 1.8 | CH54: =RC[-3]-RC[-2]-RC[-1] -> 743749998.20000005 | CI54: =RC[-1]-RC[-5] -> 743749997.6500001 | CK54: TT PTKD | CL54: 0 | CM54: 0 | CN54: 0 | CO54: =RC[-3]-RC[-1]-RC[-2] -> 0.54999999999999982 | CP54: =R40C94*RC[-4] -> 875000000 | CQ54: =RC[-1]*15% -> 131250000 | CR54: =R40C19*RC[-5] -> 1.8 | CS54: =RC[-3]-RC[-2]-RC[-1] -> 743749998.20000005 | CT54: =RC[-1]-RC[-5] -> 743749997.6500001 | CV54: TT PTKD | CW54: 0 | CX54: 0 | CY54: 0 | CZ54: =RC[-3]-RC[-1]-RC[-2] -> 0.54999999999999982 | DA54: =R40C105*RC[-4] -> 875000000 | DB54: =RC[-1]*15% -> 131250000 | DC54: =R40C19*RC[-5] -> 1.8 | DD54: =RC[-3]-RC[-2]-RC[-1] -> 743749998.20000005 | DE54: =RC[-1]-RC[-5] -> 743749997.6500001 | DG54: TT PTKD | DH54: 0 | DI54: 0 | DJ54: 0 | DK54: =RC[-3]-RC[-1]-RC[-2] -> 0.54999999999999982 | DL54: =R40C116*RC[-4] -> 807692307.69230771 | DM54: =RC[-1]*15% -> 121153846.15384614 | DN54: =R40C19*RC[-5] -> 1.8 | DO54: =RC[-3]-RC[-2]-RC[-1] -> 686538459.73846161 | DP54: =RC[-1]-RC[-5] -> 686538459.18846166 | DR54: TT PTKD | DS54: 0 | DT54: 0 | DU54: 0 | DV54: =RC[-3]-RC[-1]-RC[-2] -> 0.54999999999999982 | DW54: =R40C127*RC[-4] -> 875000000 | DX54: =RC[-1]*15% -> 131250000 | DY54: =R40C19*RC[-5] -> 1.8 | DZ54: =RC[-3]-RC[-2]-RC[-1] -> 743749998.20000005 | EA54: =RC[-1]-RC[-5] -> 743749997.6500001 | EC54: TT PTKD | ED54: =RC[-132]+RC[-121]+RC[-110]+RC[-99]+RC[-88]+RC[-77]+RC[-66]+RC[-55]+RC[-44]+RC[-33]+RC[-22]+RC[-11] ->  | EE54: =RC[-132]+RC[-121]+RC[-110]+RC[-99]+RC[-88]+RC[-77]+RC[-66]+RC[-55]+RC[-44]+RC[-33]+RC[-22]+RC[-11] ->  | EF54: =RC[-132]+RC[-121]+RC[-110]+RC[-99]+RC[-88]+RC[-77]+RC[-66]+RC[-55]+RC[-44]+RC[-33]+RC[-22]+RC[-11] ->  | EG54: =RC[-132]+RC[-121]+RC[-110]+RC[-99]+RC[-88]+RC[-77]+RC[-66]+RC[-55]+RC[-44]+RC[-33]+RC[-22]+RC[-11] ->  | EH54: =RC[-132]+RC[-121]+RC[-110]+RC[-99]+RC[-88]+RC[-77]+RC[-66]+RC[-55]+RC[-44]+RC[-33]+RC[-22]+RC[-11] ->  | EI54: =RC[-132]+RC[-121]+RC[-110]+RC[-99]+RC[-88]+RC[-77]+RC[-66]+RC[-55]+RC[-44]+RC[-33]+RC[-22]+RC[-11] ->  | EJ54: =RC[-132]+RC[-121]+RC[-110]+RC[-99]+RC[-88]+RC[-77]+RC[-66]+RC[-55]+RC[-44]+RC[-33]+RC[-22]+RC[-11] ->  | EK54: =RC[-132]+RC[-121]+RC[-110]+RC[-99]+RC[-88]+RC[-77]+RC[-66]+RC[-55]+RC[-44]+RC[-33]+RC[-22]+RC[-11] ->  | EL54: =RC[-132]+RC[-121]+RC[-110]+RC[-99]+RC[-88]+RC[-77]+RC[-66]+RC[-55]+RC[-44]+RC[-33]+RC[-22]+RC[-11] -> 
A55: TT PTND | B55: 153711296 | C55: 4283370 | D55: 0 | E55: =RC[-3]-RC[-1]-RC[-2] ->  | F55: =R40C6*RC[-4] ->  | G55: =RC[-1]*15% ->  | H55: =R40C8*RC[-5] ->  | I55: =RC[-3]-RC[-2]-RC[-1] ->  | J55: =RC[-1]-RC[-5] ->  | L55: TT PTND | M55: 126513266 | N55: 9241778 | O55: 0 | P55: =RC[-3]-RC[-1]-RC[-2] -> 2467006.9 | Q55: =R40C17*RC[-4] -> 3000383.6278659259 | R55: =RC[-1]*15% -> 450057.54417988885 | S55: =R40C19*RC[-5] -> 108517.5 | T55: =RC[-3]-RC[-2]-RC[-1] -> 2441808.583686037 | U55: =RC[-1]-RC[-5] -> -25198.316313962918 | W55: TT PTND | X55: 142006212 | Y55: 4855305 | Z55: 0 | AA55: =RC[-3]-RC[-1]-RC[-2] -> 0 | AB55: =R40C28*RC[-4] -> 875000000 | AC55: =RC[-1]*15% -> 131250000 | AD55: =R40C19*RC[-5] -> 1.8 | AE55: =RC[-3]-RC[-2]-RC[-1] -> 743749998.20000005 | AF55: =RC[-1]-RC[-5] -> 743749998.20000005 | AH55: TT PTND | AI55: 128498666 | AJ55: 2676947 | AK55: 0 | AL55: =RC[-3]-RC[-1]-RC[-2] -> 0.54999999999999982 | AM55: =R40C39*RC[-4] -> 875000000 | AN55: =RC[-1]*15% -> 131250000 | AO55: =R40C19*RC[-5] -> 1.8 | AP55: =RC[-3]-RC[-2]-RC[-1] -> 743749998.20000005 | AQ55: =RC[-1]-RC[-5] -> 743749997.6500001 | AS55: TT PTND | AT55: 120353077 | AU55: 2824367 | AV55: 0 | AW55: =RC[-3]-RC[-1]-RC[-2] -> 0.54999999999999982 | AX55: =R40C50*RC[-4] -> 875000000 | AY55: =RC[-1]*15% -> 131250000 | AZ55: =R40C19*RC[-5] -> 1.8 | BA55: =RC[-3]-RC[-2]-RC[-1] -> 743749998.20000005 | BB55: =RC[-1]-RC[-5] -> 743749997.6500001 | BD55: TT PTND | BE55: 103354969 | BF55: 2715258 | BG55: 0 | BH55: =RC[-3]-RC[-1]-RC[-2] -> 0.54999999999999982 | BI55: =R40C61*RC[-4] -> 875000000 | BJ55: =RC[-1]*15% -> 131250000 | BK55: =R40C19*RC[-5] -> 1.8 | BL55: =RC[-3]-RC[-2]-RC[-1] -> 743749998.20000005 | BM55: =RC[-1]-RC[-5] -> 743749997.6500001 | BO55: TT PTND | BP55: 0 | BQ55: 0 | BR55: 0 | BS55: =RC[-3]-RC[-1]-RC[-2] -> 0.54999999999999982 | BT55: =R40C72*RC[-4] -> 875000000 | BU55: =RC[-1]*15% -> 131250000 | BV55: =R40C8*RC[-5] -> 1.8 | BW55: =RC[-3]-RC[-2]-RC[-1] -> 743749998.20000005 | BX55: =RC[-1]-RC[-5] -> 743749997.6500001 | BZ55: TT PTND | CA55: 0 | CB55: 0 | CC55: 0 | CD55: =RC[-3]-RC[-1]-RC[-2] -> 0.54999999999999982 | CE55: =R40C83*RC[-4] -> 875000000 | CF55: =RC[-1]*15% -> 131250000 | CG55: =R40C19*RC[-5] -> 1.8 | CH55: =RC[-3]-RC[-2]-RC[-1] -> 743749998.20000005 | CI55: =RC[-1]-RC[-5] -> 743749997.6500001 | CK55: TT PTND | CL55: 0 | CM55: 0 | CN55: 0 | CO55: =RC[-3]-RC[-1]-RC[-2] -> 0.54999999999999982 | CP55: =R40C94*RC[-4] -> 875000000 | CQ55: =RC[-1]*15% -> 131250000 | CR55: =R40C19*RC[-5] -> 1.8 | CS55: =RC[-3]-RC[-2]-RC[-1] -> 743749998.20000005 | CT55: =RC[-1]-RC[-5] -> 743749997.6500001 | CV55: TT PTND | CW55: 0 | CX55: 0 | CY55: 0 | CZ55: =RC[-3]-RC[-1]-RC[-2] -> 0.54999999999999982 | DA55: =R40C105*RC[-4] -> 875000000 | DB55: =RC[-1]*15% -> 131250000 | DC55: =R40C19*RC[-5] -> 1.8 | DD55: =RC[-3]-RC[-2]-RC[-1] -> 743749998.20000005 | DE55: =RC[-1]-RC[-5] -> 743749997.6500001 | DG55: TT PTND | DH55: 0 | DI55: 0 | DJ55: 0 | DK55: =RC[-3]-RC[-1]-RC[-2] -> 0.54999999999999982 | DL55: =R40C116*RC[-4] -> 807692307.69230771 | DM55: =RC[-1]*15% -> 121153846.15384614 | DN55: =R40C19*RC[-5] -> 1.8 | DO55: =RC[-3]-RC[-2]-RC[-1] -> 686538459.73846161 | DP55: =RC[-1]-RC[-5] -> 686538459.18846166 | DR55: TT PTND | DS55: 0 | DT55: 0 | DU55: 0 | DV55: =RC[-3]-RC[-1]-RC[-2] -> 0.54999999999999982 | DW55: =R40C127*RC[-4] -> 875000000 | DX55: =RC[-1]*15% -> 131250000 | DY55: =R40C19*RC[-5] -> 1.8 | DZ55: =RC[-3]-RC[-2]-RC[-1] -> 743749998.20000005 | EA55: =RC[-1]-RC[-5] -> 743749997.6500001 | EC55: TT PTND | ED55: =RC[-132]+RC[-121]+RC[-110]+RC[-99]+RC[-88]+RC[-77]+RC[-66]+RC[-55]+RC[-44]+RC[-33]+RC[-22]+RC[-11] ->  | EE55: =RC[-132]+RC[-121]+RC[-110]+RC[-99]+RC[-88]+RC[-77]+RC[-66]+RC[-55]+RC[-44]+RC[-33]+RC[-22]+RC[-11] ->  | EF55: =RC[-132]+RC[-121]+RC[-110]+RC[-99]+RC[-88]+RC[-77]+RC[-66]+RC[-55]+RC[-44]+RC[-33]+RC[-22]+RC[-11] ->  | EG55: =RC[-132]+RC[-121]+RC[-110]+RC[-99]+RC[-88]+RC[-77]+RC[-66]+RC[-55]+RC[-44]+RC[-33]+RC[-22]+RC[-11] ->  | EH55: =RC[-132]+RC[-121]+RC[-110]+RC[-99]+RC[-88]+RC[-77]+RC[-66]+RC[-55]+RC[-44]+RC[-33]+RC[-22]+RC[-11] ->  | EI55: =RC[-132]+RC[-121]+RC[-110]+RC[-99]+RC[-88]+RC[-77]+RC[-66]+RC[-55]+RC[-44]+RC[-33]+RC[-22]+RC[-11] ->  | EJ55: =RC[-132]+RC[-121]+RC[-110]+RC[-99]+RC[-88]+RC[-77]+RC[-66]+RC[-55]+RC[-44]+RC[-33]+RC[-22]+RC[-11] ->  | EK55: =RC[-132]+RC[-121]+RC[-110]+RC[-99]+RC[-88]+RC[-77]+RC[-66]+RC[-55]+RC[-44]+RC[-33]+RC[-22]+RC[-11] ->  | EL55: =RC[-132]+RC[-121]+RC[-110]+RC[-99]+RC[-88]+RC[-77]+RC[-66]+RC[-55]+RC[-44]+RC[-33]+RC[-22]+RC[-11] -> 
A56: HQ | B56: 12476927 | C56: 18171881 | D56: 0 | E56: =RC[-3]-RC[-1]-RC[-2] ->  | F56: =R40C6*RC[-4] ->  | G56: =RC[-1]*15% ->  | H56: =R40C8*RC[-5] ->  | I56: =RC[-3]-RC[-2]-RC[-1] ->  | J56: =RC[-1]-RC[-5] ->  | L56: HQ | M56: 10176494 | N56: 14706419 | O56: 0 | P56: =RC[-3]-RC[-1]-RC[-2] -> 2467006.9 | Q56: =R40C17*RC[-4] -> 3000383.6278659259 | R56: =RC[-1]*15% -> 450057.54417988885 | S56: =R40C19*RC[-5] -> 108517.5 | T56: =RC[-3]-RC[-2]-RC[-1] -> 2441808.583686037 | U56: =RC[-1]-RC[-5] -> -25198.316313962918 | W56: HQ | X56: 12301669 | Y56: 17969497 | Z56: 0 | AA56: =RC[-3]-RC[-1]-RC[-2] -> 0 | AB56: =R40C28*RC[-4] -> 875000000 | AC56: =RC[-1]*15% -> 131250000 | AD56: =R40C19*RC[-5] -> 1.8 | AE56: =RC[-3]-RC[-2]-RC[-1] -> 743749998.20000005 | AF56: =RC[-1]-RC[-5] -> 743749998.20000005 | AH56: HQ | AI56: 12006051 | AJ56: 16912623 | AK56: 0 | AL56: =RC[-3]-RC[-1]-RC[-2] -> 0.54999999999999982 | AM56: =R40C39*RC[-4] -> 875000000 | AN56: =RC[-1]*15% -> 131250000 | AO56: =R40C19*RC[-5] -> 1.8 | AP56: =RC[-3]-RC[-2]-RC[-1] -> 743749998.20000005 | AQ56: =RC[-1]-RC[-5] -> 743749997.6500001 | AS56: HQ | AT56: 11939403 | AU56: 15641990 | AV56: 0 | AW56: =RC[-3]-RC[-1]-RC[-2] -> 0.54999999999999982 | AX56: =R40C50*RC[-4] -> 875000000 | AY56: =RC[-1]*15% -> 131250000 | AZ56: =R40C19*RC[-5] -> 1.8 | BA56: =RC[-3]-RC[-2]-RC[-1] -> 743749998.20000005 | BB56: =RC[-1]-RC[-5] -> 743749997.6500001 | BD56: HQ | BE56: 11471100 | BF56: 14644266 | BG56: 0 | BH56: =RC[-3]-RC[-1]-RC[-2] -> 0.54999999999999982 | BI56: =R40C61*RC[-4] -> 875000000 | BJ56: =RC[-1]*15% -> 131250000 | BK56: =R40C19*RC[-5] -> 1.8 | BL56: =RC[-3]-RC[-2]-RC[-1] -> 743749998.20000005 | BM56: =RC[-1]-RC[-5] -> 743749997.6500001 | BO56: HQ | BP56: 0 | BQ56: 0 | BR56: 0 | BS56: =RC[-3]-RC[-1]-RC[-2] -> 0.54999999999999982 | BT56: =R40C72*RC[-4] -> 875000000 | BU56: =RC[-1]*15% -> 131250000 | BV56: =R40C8*RC[-5] -> 1.8 | BW56: =RC[-3]-RC[-2]-RC[-1] -> 743749998.20000005 | BX56: =RC[-1]-RC[-5] -> 743749997.6500001 | BZ56: HQ | CA56: 0 | CB56: 0 | CC56: 0 | CD56: =RC[-3]-RC[-1]-RC[-2] -> 0.54999999999999982 | CE56: =R40C83*RC[-4] -> 875000000 | CF56: =RC[-1]*15% -> 131250000 | CG56: =R40C19*RC[-5] -> 1.8 | CH56: =RC[-3]-RC[-2]-RC[-1] -> 743749998.20000005 | CI56: =RC[-1]-RC[-5] -> 743749997.6500001 | CK56: HQ | CL56: 0 | CM56: 0 | CN56: 0 | CO56: =RC[-3]-RC[-1]-RC[-2] -> 0.54999999999999982 | CP56: =R40C94*RC[-4] -> 875000000 | CQ56: =RC[-1]*15% -> 131250000 | CR56: =R40C19*RC[-5] -> 1.8 | CS56: =RC[-3]-RC[-2]-RC[-1] -> 743749998.20000005 | CT56: =RC[-1]-RC[-5] -> 743749997.6500001 | CV56: HQ | CW56: 0 | CX56: 0 | CY56: 0 | CZ56: =RC[-3]-RC[-1]-RC[-2] -> 0.54999999999999982 | DA56: =R40C105*RC[-4] -> 875000000 | DB56: =RC[-1]*15% -> 131250000 | DC56: =R40C19*RC[-5] -> 1.8 | DD56: =RC[-3]-RC[-2]-RC[-1] -> 743749998.20000005 | DE56: =RC[-1]-RC[-5] -> 743749997.6500001 | DG56: HQ | DH56: 0 | DI56: 0 | DJ56: 0 | DK56: =RC[-3]-RC[-1]-RC[-2] -> 0.54999999999999982 | DL56: =R40C116*RC[-4] -> 807692307.69230771 | DM56: =RC[-1]*15% -> 121153846.15384614 | DN56: =R40C19*RC[-5] -> 1.8 | DO56: =RC[-3]-RC[-2]-RC[-1] -> 686538459.73846161 | DP56: =RC[-1]-RC[-5] -> 686538459.18846166 | DR56: HQ | DS56: 0 | DT56: 0 | DU56: 0 | DV56: =RC[-3]-RC[-1]-RC[-2] -> 0.54999999999999982 | DW56: =R40C127*RC[-4] -> 875000000 | DX56: =RC[-1]*15% -> 131250000 | DY56: =R40C19*RC[-5] -> 1.8 | DZ56: =RC[-3]-RC[-2]-RC[-1] -> 743749998.20000005 | EA56: =RC[-1]-RC[-5] -> 743749997.6500001 | EC56: HQ | ED56: =RC[-132]+RC[-121]+RC[-110]+RC[-99]+RC[-88]+RC[-77]+RC[-66]+RC[-55]+RC[-44]+RC[-33]+RC[-22]+RC[-11] ->  | EE56: =RC[-132]+RC[-121]+RC[-110]+RC[-99]+RC[-88]+RC[-77]+RC[-66]+RC[-55]+RC[-44]+RC[-33]+RC[-22]+RC[-11] ->  | EF56: =RC[-132]+RC[-121]+RC[-110]+RC[-99]+RC[-88]+RC[-77]+RC[-66]+RC[-55]+RC[-44]+RC[-33]+RC[-22]+RC[-11] ->  | EG56: =RC[-132]+RC[-121]+RC[-110]+RC[-99]+RC[-88]+RC[-77]+RC[-66]+RC[-55]+RC[-44]+RC[-33]+RC[-22]+RC[-11] ->  | EH56: =RC[-132]+RC[-121]+RC[-110]+RC[-99]+RC[-88]+RC[-77]+RC[-66]+RC[-55]+RC[-44]+RC[-33]+RC[-22]+RC[-11] ->  | EI56: =RC[-132]+RC[-121]+RC[-110]+RC[-99]+RC[-88]+RC[-77]+RC[-66]+RC[-55]+RC[-44]+RC[-33]+RC[-22]+RC[-11] ->  | EJ56: =RC[-132]+RC[-121]+RC[-110]+RC[-99]+RC[-88]+RC[-77]+RC[-66]+RC[-55]+RC[-44]+RC[-33]+RC[-22]+RC[-11] ->  | EK56: =RC[-132]+RC[-121]+RC[-110]+RC[-99]+RC[-88]+RC[-77]+RC[-66]+RC[-55]+RC[-44]+RC[-33]+RC[-22]+RC[-11] ->  | EL56: =RC[-132]+RC[-121]+RC[-110]+RC[-99]+RC[-88]+RC[-77]+RC[-66]+RC[-55]+RC[-44]+RC[-33]+RC[-22]+RC[-11] -> 
A57: Tổng | B57: =SUM(R[-5]C:R[-1]C) -> 3551128896 | C57: =SUM(R[-5]C:R[-1]C) -> -619983 | D57: =SUM(R[-5]C:R[-1]C) -> 532669334.39999998 | E57: =SUM(R[-5]C:R[-1]C) -> 3019079544.5999999 | F57: =SUM(R[-5]C:R[-1]C) -> 3499999999.9999995 | G57: =SUM(R[-5]C:R[-1]C) -> 525000000 | H57: =SUM(R[-5]C:R[-1]C) -> -557984.69999999995 | I57: =SUM(R[-5]C:R[-1]C) -> 2975557984.6999998 | J57: =SUM(R[-5]C:R[-1]C) -> -43521559.899999849 | L57: Tổng | M57: =SUM(R[-5]C:R[-1]C) -> 3551128896 | N57: =SUM(R[-5]C:R[-1]C) -> -619983 | O57: =SUM(R[-5]C:R[-1]C) -> 532669334.39999998 | P57: =SUM(R[-5]C:R[-1]C) -> 3019079544.5999999 | Q57: =SUM(R[-5]C:R[-1]C) -> 3499999999.9999995 | R57: =SUM(R[-5]C:R[-1]C) -> 525000000 | S57: =SUM(R[-5]C:R[-1]C) -> -557984.69999999995 | T57: =SUM(R[-5]C:R[-1]C) -> 2975557984.6999998 | U57: =SUM(R[-5]C:R[-1]C) -> -43521559.899999849 | W57: Tổng | X57: =SUM(R[-5]C:R[-1]C) -> 12 | Y57: =SUM(R[-5]C:R[-1]C) -> 9 | Z57: =SUM(R[-5]C:R[-1]C) -> 2.35 | AA57: =SUM(R[-5]C:R[-1]C) -> 0.64999999999999991 | AB57: =SUM(R[-5]C:R[-1]C) -> 3500000000 | AC57: =SUM(R[-5]C:R[-1]C) -> 525000000 | AD57: =SUM(R[-5]C:R[-1]C) -> 8.1 | AE57: =SUM(R[-5]C:R[-1]C) -> 2974999991.9000006 | AF57: =SUM(R[-5]C:R[-1]C) -> 2974999991.2500005 | AH57: Tổng | AI57: =SUM(R[-5]C:R[-1]C) -> 12 | AJ57: =SUM(R[-5]C:R[-1]C) -> 9 | AK57: =SUM(R[-5]C:R[-1]C) -> 1.7999999999999998 | AL57: =SUM(R[-5]C:R[-1]C) -> 1.1999999999999997 | AM57: =SUM(R[-5]C:R[-1]C) -> 3500000000 | AN57: =SUM(R[-5]C:R[-1]C) -> 525000000 | AO57: =SUM(R[-5]C:R[-1]C) -> 8.1 | AP57: =SUM(R[-5]C:R[-1]C) -> 2974999991.9000006 | AQ57: =SUM(R[-5]C:R[-1]C) -> 2974999990.7000003 | AS57: Tổng | AT57: =SUM(R[-5]C:R[-1]C) -> 12 | AU57: =SUM(R[-5]C:R[-1]C) -> 9 | AV57: =SUM(R[-5]C:R[-1]C) -> 1.7999999999999998 | AW57: =SUM(R[-5]C:R[-1]C) -> 1.1999999999999997 | AX57: =SUM(R[-5]C:R[-1]C) -> 3500000000 | AY57: =SUM(R[-5]C:R[-1]C) -> 525000000 | AZ57: =SUM(R[-5]C:R[-1]C) -> 8.1 | BA57: =SUM(R[-5]C:R[-1]C) -> 2974999991.9000006 | BB57: =SUM(R[-5]C:R[-1]C) -> 2974999990.7000003 | BD57: Tổng | BE57: =SUM(R[-5]C:R[-1]C) -> 12 | BF57: =SUM(R[-5]C:R[-1]C) -> 9 | BG57: =SUM(R[-5]C:R[-1]C) -> 1.7999999999999998 | BH57: =SUM(R[-5]C:R[-1]C) -> 1.1999999999999997 | BI57: =SUM(R[-5]C:R[-1]C) -> 3500000000 | BJ57: =SUM(R[-5]C:R[-1]C) -> 525000000 | BK57: =SUM(R[-5]C:R[-1]C) -> 8.1 | BL57: =SUM(R[-5]C:R[-1]C) -> 2974999991.9000006 | BM57: =SUM(R[-5]C:R[-1]C) -> 2974999990.7000003 | BO57: Tổng | BP57: =SUM(R[-5]C:R[-1]C) -> 12 | BQ57: =SUM(R[-5]C:R[-1]C) -> 9 | BR57: =SUM(R[-5]C:R[-1]C) -> 1.7999999999999998 | BS57: =SUM(R[-5]C:R[-1]C) -> 1.1999999999999997 | BT57: =SUM(R[-5]C:R[-1]C) -> 3500000000 | BU57: =SUM(R[-5]C:R[-1]C) -> 525000000 | BV57: =SUM(R[-5]C:R[-1]C) -> 8.1 | BW57: =SUM(R[-5]C:R[-1]C) -> 2974999991.9000006 | BX57: =SUM(R[-5]C:R[-1]C) -> 2974999990.7000003 | BZ57: Tổng | CA57: =SUM(R[-5]C:R[-1]C) -> 12 | CB57: =SUM(R[-5]C:R[-1]C) -> 9 | CC57: =SUM(R[-5]C:R[-1]C) -> 1.7999999999999998 | CD57: =SUM(R[-5]C:R[-1]C) -> 1.1999999999999997 | CE57: =SUM(R[-5]C:R[-1]C) -> 3500000000 | CF57: =SUM(R[-5]C:R[-1]C) -> 525000000 | CG57: =SUM(R[-5]C:R[-1]C) -> 8.1 | CH57: =SUM(R[-5]C:R[-1]C) -> 2974999991.9000006 | CI57: =SUM(R[-5]C:R[-1]C) -> 2974999990.7000003 | CK57: Tổng | CL57: =SUM(R[-5]C:R[-1]C) -> 12 | CM57: =SUM(R[-5]C:R[-1]C) -> 9 | CN57: =SUM(R[-5]C:R[-1]C) -> 1.7999999999999998 | CO57: =SUM(R[-5]C:R[-1]C) -> 1.1999999999999997 | CP57: =SUM(R[-5]C:R[-1]C) -> 3500000000 | CQ57: =SUM(R[-5]C:R[-1]C) -> 525000000 | CR57: =SUM(R[-5]C:R[-1]C) -> 8.1 | CS57: =SUM(R[-5]C:R[-1]C) -> 2974999991.9000006 | CT57: =SUM(R[-5]C:R[-1]C) -> 2974999990.7000003 | CV57: Tổng | CW57: =SUM(R[-5]C:R[-1]C) -> 12 | CX57: =SUM(R[-5]C:R[-1]C) -> 9 | CY57: =SUM(R[-5]C:R[-1]C) -> 1.7999999999999998 | CZ57: =SUM(R[-5]C:R[-1]C) -> 1.1999999999999997 | DA57: =SUM(R[-5]C:R[-1]C) -> 3500000000 | DB57: =SUM(R[-5]C:R[-1]C) -> 525000000 | DC57: =SUM(R[-5]C:R[-1]C) -> 8.1 | DD57: =SUM(R[-5]C:R[-1]C) -> 2974999991.9000006 | DE57: =SUM(R[-5]C:R[-1]C) -> 2974999990.7000003 | DG57: Tổng | DH57: =SUM(R[-5]C:R[-1]C) -> 13 | DI57: =SUM(R[-5]C:R[-1]C) -> 9 | DJ57: =SUM(R[-5]C:R[-1]C) -> 1.9499999999999997 | DK57: =SUM(R[-5]C:R[-1]C) -> 2.0499999999999994 | DL57: =SUM(R[-5]C:R[-1]C) -> 3500000000 | DM57: =SUM(R[-5]C:R[-1]C) -> 525000000 | DN57: =SUM(R[-5]C:R[-1]C) -> 8.1 | DO57: =SUM(R[-5]C:R[-1]C) -> 2974999991.9000001 | DP57: =SUM(R[-5]C:R[-1]C) -> 2974999989.8500004 | DR57: Tổng | DS57: =SUM(R[-5]C:R[-1]C) -> 12 | DT57: =SUM(R[-5]C:R[-1]C) -> 9 | DU57: =SUM(R[-5]C:R[-1]C) -> 1.7999999999999998 | DV57: =SUM(R[-5]C:R[-1]C) -> 1.1999999999999997 | DW57: =SUM(R[-5]C:R[-1]C) -> 3500000000 | DX57: =SUM(R[-5]C:R[-1]C) -> 525000000 | DY57: =SUM(R[-5]C:R[-1]C) -> 8.1 | DZ57: =SUM(R[-5]C:R[-1]C) -> 2974999991.9000006 | EA57: =SUM(R[-5]C:R[-1]C) -> 2974999990.7000003 | EC57: Tổng | ED57: =SUM(R[-5]C:R[-1]C) -> 7102257913 | EE57: =SUM(R[-5]C:R[-1]C) -> -1239876 | EF57: =SUM(R[-5]C:R[-1]C) -> 1065338687.5000002 | EG57: =SUM(R[-5]C:R[-1]C) -> 6038159101.4999962 | EH57: =SUM(R[-5]C:R[-1]C) -> 42000000000 | EI57: =SUM(R[-5]C:R[-1]C) -> 6300000000 | EJ57: =SUM(R[-5]C:R[-1]C) -> -1115888.4000000006 | EK57: =SUM(R[-5]C:R[-1]C) -> 35701115888.400009 | EL57: =SUM(R[-5]C:R[-1]C) -> 29662956786.900002
E59: Số liệu theo biên bản đối soát thực tế với Viettel | P59: Số liệu theo biên bản đối soát thực tế với Viettel | AA59: Số liệu theo biên bản đối soát thực tế với Viettel | AL59: Số liệu theo biên bản đối soát thực tế với Viettel | AW59: Số liệu theo biên bản đối soát thực tế với Viettel | BH59: Số liệu theo biên bản đối soát thực tế với Viettel | BS59: Số liệu theo biên bản đối soát thực tế với Viettel | CD59: Số liệu theo biên bản đối soát thực tế với Viettel | CO59: Số liệu theo biên bản đối soát thực tế với Viettel | CZ59: Số liệu theo biên bản đối soát thực tế với Viettel | DK59: Số liệu theo biên bản đối soát thực tế với Viettel | DV59: Số liệu theo biên bản đối soát thực tế với Viettel
E60: Doanh thu | G60: MT vượt | P60: Doanh thu | R60: MT vượt | AA60: Doanh thu | AC60: MT vượt | AL60: Doanh thu | AN60: MT vượt | AW60: Doanh thu | AY60: MT vượt | BH60: Doanh thu | BJ60: MT vượt | BS60: Doanh thu | BU60: MT vượt | CD60: Doanh thu | CF60: MT vượt | CO60: Doanh thu | CQ60: MT vượt | CZ60: Doanh thu | DB60: MT vượt | DK60: Doanh thu | DM60: MT vượt | DV60: Doanh thu | DX60: MT vượt
E61: Doanh thu hệ thống | F61: =R[-4]C[-4] -> 3551128896 | G61: MT hệ thống | H61: 10 | P61: Doanh thu hệ thống | Q61: =R[-4]C[-4] -> 3551128896 | R61: MT hệ thống | S61: 10 | AA61: Doanh thu hệ thống | AB61: =R[-4]C[-4] -> 12 | AC61: MT hệ thống | AD61: 10 | AL61: Doanh thu hệ thống | AM61: =R[-4]C[-4] -> 12 | AN61: MT hệ thống | AO61: 10 | AW61: Doanh thu hệ thống | AX61: =R[-4]C[-4] -> 12 | AY61: MT hệ thống | AZ61: 10 | BH61: Doanh thu hệ thống | BI61: =R[-4]C[-4] -> 12 | BJ61: MT hệ thống | BK61: 10 | BS61: Doanh thu hệ thống | BT61: =R[-4]C[-4] -> 12 | BU61: MT hệ thống | BV61: 10 | CD61: Doanh thu hệ thống | CE61: =R[-4]C[-4] -> 12 | CF61: MT hệ thống | CG61: 10 | CO61: Doanh thu hệ thống | CP61: =R[-4]C[-4] -> 12 | CQ61: MT hệ thống | CR61: 10 | CZ61: Doanh thu hệ thống | DA61: =R[-4]C[-4] -> 12 | DB61: MT hệ thống | DC61: 10 | DK61: Doanh thu hệ thống | DL61: =R[-4]C[-4] -> 13 | DM61: MT hệ thống | DN61: 10 | DV61: Doanh thu hệ thống | DW61: =R[-4]C[-4] -> 12 | DX61: MT hệ thống | DY61: 10
E62: Doanh thu thực tế | F62: 3500000000 | G62: MT thực tế | H62: 9 | P62: Doanh thu thực tế | Q62: 3500000000 | R62: MT thực tế | S62: 9 | AA62: Doanh thu thực tế | AB62: 3500000000 | AC62: MT thực tế | AD62: 9 | AL62: Doanh thu thực tế | AM62: 3500000000 | AN62: MT thực tế | AO62: 9 | AW62: Doanh thu thực tế | AX62: 3500000000 | AY62: MT thực tế | AZ62: 9 | BH62: Doanh thu thực tế | BI62: 3500000000 | BJ62: MT thực tế | BK62: 9 | BS62: Doanh thu thực tế | BT62: 3500000000 | BU62: MT thực tế | BV62: 9 | CD62: Doanh thu thực tế | CE62: 3500000000 | CF62: MT thực tế | CG62: 9 | CO62: Doanh thu thực tế | CP62: 3500000000 | CQ62: MT thực tế | CR62: 9 | CZ62: Doanh thu thực tế | DA62: 3500000000 | DB62: MT thực tế | DC62: 9 | DK62: Doanh thu thực tế | DL62: 3500000000 | DM62: MT thực tế | DN62: 9 | DV62: Doanh thu thực tế | DW62: 3500000000 | DX62: MT thực tế | DY62: 9
E63: DT QT/DT HT | F63: =R[-1]C/R[-2]C -> 0.9856020726091943 | G63: MT QT/ HT | H63: =R[-1]C/R[-2]C -> 0.9 | P63: DT QT/DT HT | Q63: =R[-1]C/R[-2]C -> 0.9856020726091943 | R63: MT QT/ HT | S63: =R[-1]C/R[-2]C -> 0.9 | AA63: DT QT/DT HT | AB63: =R[-1]C/R[-2]C -> 291666666.66666669 | AC63: MT QT/ HT | AD63: =R[-1]C/R[-2]C -> 0.9 | AL63: DT QT/DT HT | AM63: =R[-1]C/R[-2]C -> 291666666.66666669 | AN63: MT QT/ HT | AO63: =R[-1]C/R[-2]C -> 0.9 | AW63: DT QT/DT HT | AX63: =R[-1]C/R[-2]C -> 291666666.66666669 | AY63: MT QT/ HT | AZ63: =R[-1]C/R[-2]C -> 0.9 | BH63: DT QT/DT HT | BI63: =R[-1]C/R[-2]C -> 291666666.66666669 | BJ63: MT QT/ HT | BK63: =R[-1]C/R[-2]C -> 0.9 | BS63: DT QT/DT HT | BT63: =R[-1]C/R[-2]C -> 291666666.66666669 | BU63: MT QT/ HT | BV63: =R[-1]C/R[-2]C -> 0.9 | CD63: DT QT/DT HT | CE63: =R[-1]C/R[-2]C -> 291666666.66666669 | CF63: MT QT/ HT | CG63: =R[-1]C/R[-2]C -> 0.9 | CO63: DT QT/DT HT | CP63: =R[-1]C/R[-2]C -> 291666666.66666669 | CQ63: MT QT/ HT | CR63: =R[-1]C/R[-2]C -> 0.9 | CZ63: DT QT/DT HT | DA63: =R[-1]C/R[-2]C -> 291666666.66666669 | DB63: MT QT/ HT | DC63: =R[-1]C/R[-2]C -> 0.9 | DK63: DT QT/DT HT | DL63: =R[-1]C/R[-2]C -> 269230769.23076922 | DM63: MT QT/ HT | DN63: =R[-1]C/R[-2]C -> 0.9 | DV63: DT QT/DT HT | DW63: =R[-1]C/R[-2]C -> 291666666.66666669 | DX63: MT QT/ HT | DY63: =R[-1]C/R[-2]C -> 0.9
E64: Tỷ lệ thất thoát | F64: =100%-R[-1]C -> 1.4397927390805698E-2 | G64: Tỷ lệ chênh lệch | H64: =100%-R[-1]C -> 9.9999999999999978E-2 | P64: Tỷ lệ thất thoát | Q64: =100%-R[-1]C -> 1.4397927390805698E-2 | R64: Tỷ lệ chênh lệch | S64: =100%-R[-1]C -> 9.9999999999999978E-2 | AA64: Tỷ lệ thất thoát | AB64: =100%-R[-1]C -> -291666665.66666669 | AC64: Tỷ lệ chênh lệch | AD64: =100%-R[-1]C -> 9.9999999999999978E-2 | AL64: Tỷ lệ thất thoát | AM64: =100%-R[-1]C -> -291666665.66666669 | AN64: Tỷ lệ chênh lệch | AO64: =100%-R[-1]C -> 9.9999999999999978E-2 | AW64: Tỷ lệ thất thoát | AX64: =100%-R[-1]C -> -291666665.66666669 | AY64: Tỷ lệ chênh lệch | AZ64: =100%-R[-1]C -> 9.9999999999999978E-2 | BH64: Tỷ lệ thất thoát | BI64: =100%-R[-1]C -> -291666665.66666669 | BJ64: Tỷ lệ chênh lệch | BK64: =100%-R[-1]C -> 9.9999999999999978E-2 | BS64: Tỷ lệ thất thoát | BT64: =100%-R[-1]C -> -291666665.66666669 | BU64: Tỷ lệ chênh lệch | BV64: =100%-R[-1]C -> 9.9999999999999978E-2 | CD64: Tỷ lệ thất thoát | CE64: =100%-R[-1]C -> -291666665.66666669 | CF64: Tỷ lệ chênh lệch | CG64: =100%-R[-1]C -> 9.9999999999999978E-2 | CO64: Tỷ lệ thất thoát | CP64: =100%-R[-1]C -> -291666665.66666669 | CQ64: Tỷ lệ chênh lệch | CR64: =100%-R[-1]C -> 9.9999999999999978E-2 | CZ64: Tỷ lệ thất thoát | DA64: =100%-R[-1]C -> -291666665.66666669 | DB64: Tỷ lệ chênh lệch | DC64: =100%-R[-1]C -> 9.9999999999999978E-2 | DK64: Tỷ lệ thất thoát | DL64: =100%-R[-1]C -> -269230768.23076922 | DM64: Tỷ lệ chênh lệch | DN64: =100%-R[-1]C -> 9.9999999999999978E-2 | DV64: Tỷ lệ thất thoát | DW64: =100%-R[-1]C -> -291666665.66666669 | DX64: Tỷ lệ chênh lệch | DY64: =100%-R[-1]C -> 9.9999999999999978E-2
E65: Doanh thu khuyến khích | P65: Doanh thu khuyến khích | AA65: Doanh thu khuyến khích | AL65: Doanh thu khuyến khích | AW65: Doanh thu khuyến khích | BH65: Doanh thu khuyến khích | BS65: Doanh thu khuyến khích | CD65: Doanh thu khuyến khích | CO65: Doanh thu khuyến khích | CZ65: Doanh thu khuyến khích | DK65: Doanh thu khuyến khích | DV65: Doanh thu khuyến khích