Sheet: Sheet1
A1: 6x66/VIETTEL/2015
A2: Tháng 1 | L2: Tháng 2 | W2: Tháng 3 | AH2: Tháng 4 | AS2: Tháng 5 | BD2: Tháng 6 | BO2: Tháng 7 | BZ2: Tháng 8 | CK2: Tháng 9 | CV2: Tháng 10 | DG2: Tháng 11 | DR2: Tháng 12 | EC2: Lũy kế đến tháng báo cáo
A3: Tên đối tác | B3: Số liệu hệ thống/tạm tính | F3: Số liệu quyết toán theo biên bản đối soát | J3: C/lệch Quyết toán - Tạm tính | L3: Tên đối tác | M3: Số liệu hệ thống/tạm tính | Q3: Số liệu quyết toán theo biên bản đối soát | U3: C/lệch Quyết toán - Tạm tính | W3: Tên đối tác | X3: Số liệu hệ thống/tạm tính | AB3: Số liệu quyết toán theo biên bản đối soát | AF3: C/lệch Quyết toán - Tạm tính | AH3: Tên đối tác | AI3: Số liệu hệ thống/tạm tính | AM3: Số liệu quyết toán theo biên bản đối soát | AQ3: C/lệch Quyết toán - Tạm tính | AS3: Tên đối tác | AT3: Số liệu hệ thống/tạm tính | AX3: Số liệu quyết toán theo biên bản đối soát | BB3: C/lệch Quyết toán - Tạm tính | BD3: Tên đối tác | BE3: Số liệu hệ thống/tạm tính | BI3: Số liệu quyết toán theo biên bản đối soát | BM3: C/lệch Quyết toán - Tạm tính | BO3: Tên đối tác | BP3: Số liệu hệ thống/tạm tính | BT3: Số liệu quyết toán theo biên bản đối soát | BX3: C/lệch Quyết toán - Tạm tính | BZ3: Tên đối tác | CA3: Số liệu hệ thống/tạm tính | CE3: Số liệu quyết toán theo biên bản đối soát | CI3: C/lệch Quyết toán - Tạm tính | CK3: Tên đối tác | CL3: Số liệu hệ thống/tạm tính | CP3: Số liệu quyết toán theo biên bản đối soát | CT3: C/lệch Quyết toán - Tạm tính | CV3: Tên đối tác | CW3: Số liệu hệ thống/tạm tính | DA3: Số liệu quyết toán theo biên bản đối soát | DE3: C/lệch Quyết toán - Tạm tính | DG3: Tên đối tác | DH3: Số liệu hệ thống/tạm tính | DL3: Số liệu quyết toán theo biên bản đối soát | DP3: C/lệch Quyết toán - Tạm tính | DR3: Tên đối tác | DS3: Số liệu hệ thống/tạm tính | DW3: Số liệu quyết toán theo biên bản đối soát | EA3: C/lệch Quyết toán - Tạm tính | EC3: Tên đối tác | ED3: Số liệu hệ thống/tạm tính | EH3: Số liệu quyết toán theo biên bản đối soát | EL3: C/lệch Quyết toán - Tạm tính
B4: Doanh thu | C4: MT vượt | D4: Trả đối tác | E4: DT về đơn vị | F4: Doanh thu | G4: Trả đối tác | H4: MT | I4: DT về đơn vị | M4: Doanh thu | N4: MT vượt | O4: Trả đối tác | P4: DT về đơn vị | Q4: Doanh thu | R4: Trả đối tác | S4: MT | T4: DT về đơn vị | X4: Doanh thu | Y4: MT vượt | Z4: Trả đối tác | AA4: DT về đơn vị | AB4: Doanh thu | AC4: Trả đối tác | AD4: MT | AE4: DT về đơn vị | AI4: Doanh thu | AJ4: MT vượt | AK4: Trả đối tác | AL4: DT về đơn vị | AM4: Doanh thu | AN4: Trả đối tác | AO4: MT | AP4: DT về đơn vị | AT4: Doanh thu | AU4: MT vượt | AV4: Trả đối tác | AW4: DT về đơn vị | AX4: Doanh thu | AY4: Trả đối tác | AZ4: MT | BA4: DT về đơn vị | BE4: Doanh thu | BF4: MT vượt | BG4: Trả đối tác | BH4: DT về đơn vị | BI4: Doanh thu | BJ4: Trả đối tác | BK4: MT | BL4: DT về đơn vị | BP4: Doanh thu | BQ4: MT vượt | BR4: Trả đối tác | BS4: DT về đơn vị | BT4: Doanh thu | BU4: Trả đối tác | BV4: MT | BW4: DT về đơn vị | CA4: Doanh thu | CB4: MT vượt | CC4: Trả đối tác | CD4: DT về đơn vị | CE4: Doanh thu | CF4: Trả đối tác | CG4: MT | CH4: DT về đơn vị | CL4: Doanh thu | CM4: MT vượt | CN4: Trả đối tác | CO4: DT về đơn vị | CP4: Doanh thu | CQ4: Trả đối tác | CR4: MT | CS4: DT về đơn vị | CW4: Doanh thu | CX4: MT vượt | CY4: Trả đối tác | CZ4: DT về đơn vị | DA4: Doanh thu | DB4: Trả đối tác | DC4: MT | DD4: DT về đơn vị | DH4: Doanh thu | DI4: MT vượt | DJ4: Trả đối tác | DK4: DT về đơn vị | DL4: Doanh thu | DM4: Trả đối tác | DN4: MT | DO4: DT về đơn vị | DS4: Doanh thu | DT4: MT vượt | DU4: Trả đối tác | DV4: DT về đơn vị | DW4: Doanh thu | DX4: Trả đối tác | DY4: MT | DZ4: DT về đơn vị | ED4: Doanh thu | EE4: MT vượt | EF4: Trả đối tác | EG4: DT về đơn vị | EH4: Doanh thu | EI4: Trả đối tác | EJ4: MT | EK4: DT về đơn vị
B5: (1) | C5: (2) | D5: (3) = (1) *15% | E5: (4) = (1) - (3) - (2) | F5: (5) | G5: (6) | H5: (7) | I5: (8) = (5) - (6) - (7) | J5: (9) = (4) - (8) | M5: (1) | N5: (2) = ( MO - MT) *91 | O5: (3) = (1) *15% | P5: (4) = (1) - (3) - (2) | Q5: (5) | R5: (6) | S5: (7) | T5: (8) = (5) - (6) - (7) | U5: (9) = (4) - (8) | X5: (1) | Y5: (2) = ( MO - MT) *91 | Z5: (3) = (1) *15% | AA5: (4) = (1) - (3) - (2) | AB5: (5) | AC5: (6) | AD5: (7) | AE5: (8) = (5) - (6) - (7) | AF5: (9) = (4) - (8) | AI5: (1) | AJ5: (2) = ( MO - MT) *91 | AK5: (3) = (1) *15% | AL5: (4) = (1) - (3) - (2) | AM5: (5) | AN5: (6) | AO5: (7) | AP5: (8) = (5) - (6) - (7) | AQ5: (9) = (4) - (8) | AT5: (1) | AU5: (2) = ( MO - MT) *91 | AV5: (3) = (1) *15% | AW5: (4) = (1) - (3) - (2) | AX5: (5) | AY5: (6) | AZ5: (7) | BA5: (8) = (5) - (6) - (7) | BB5: (9) = (4) - (8) | BE5: (1) | BF5: (2) = ( MO - MT) *91 | BG5: (3) = (1) *15% | BH5: (4) = (1) - (3) - (2) | BI5: (5) | BJ5: (6) | BK5: (7) | BL5: (8) = (5) - (6) - (7) | BM5: (9) = (4) - (8) | BP5: (1) | BQ5: (2) | BR5: (3) = (1) *15% | BS5: (4) = (1) - (3) - (2) | BT5: (5) | BU5: (6) | BV5: (7) | BW5: (8) = (5) - (6) - (7) | BX5: (9) = (4) - (8) | CA5: (1) | CB5: (2) = ( MO - MT) *91 | CC5: (3) = (1) *15% | CD5: (4) = (1) - (3) - (2) | CE5: (5) | CF5: (6) | CG5: (7) | CH5: (8) = (5) - (6) - (7) | CI5: (9) = (4) - (8) | CL5: (1) | CM5: (2) = ( MO - MT) *91 | CN5: (3) = (1) *15% | CO5: (4) = (1) - (3) - (2) | CP5: (5) | CQ5: (6) | CR5: (7) | CS5: (8) = (5) - (6) - (7) | CT5: (9) = (4) - (8) | CW5: (1) | CX5: (2) = ( MO - MT) *91 | CY5: (3) = (1) *15% | CZ5: (4) = (1) - (3) - (2) | DA5: (5) | DB5: (6) | DC5: (7) | DD5: (8) = (5) - (6) - (7) | DE5: (9) = (4) - (8) | DH5: (1) | DI5: (2) = ( MO - MT) *91 | DJ5: (3) = (1) *15% | DK5: (4) = (1) - (3) - (2) | DL5: (5) | DM5: (6) | DN5: (7) | DO5: (8) = (5) - (6) - (7) | DP5: (9) = (4) - (8) | DS5: (1) | DT5: (2) = ( MO - MT) *91 | DU5: (3) = (1) *15% | DV5: (4) = (1) - (3) - (2) | DW5: (5) | DX5: (6) | DY5: (7) | DZ5: (8) = (5) - (6) - (7) | EA5: (9) = (4) - (8) | ED5: (1) | EE5: (2) = ( MO - MT) *91 | EF5: (3) = (1) *15% | EG5: (4) = (1) - (3) - (2) | EH5: (5) | EI5: (6) | EJ5: (7) | EK5: (8) = (5) - (6) - (7) | EL5: (9) = (4) - (8)
A6: SUBCPS | B6: 9769857 | C6: 324051 | D6: 488493 | E6: =RC[-3]-RC[-1]-RC[-2] ->  | F6: =R17C6*RC[-4] ->  | G6: =RC[-1]*5% ->  | H6: =R17C8*RC[-5] ->  | I6: =RC[-3]-RC[-2]-RC[-1] ->  | J6: =RC[-1]-RC[-5] ->  | L6: SUBCPS | M6: 6736634 | N6: 215670 | O6: 336832 | P6: =RC[-3]-RC[-1]-RC[-2] -> 2467006.9 | Q6: =R17C17*RC[-4] -> 3000383.6278659259 | R6: =RC[-1]*5% -> 450057.54417988885 | S6: =R17C19*RC[-5] -> 108517.5 | T6: =RC[-3]-RC[-2]-RC[-1] -> 2441808.583686037 | U6: =RC[-1]-RC[-5] -> -25198.316313962918 | W6: SUBCPS | X6: 7801597 | Y6: 273182 | Z6: 390080 | AA6: =RC[-3]-RC[-1]-RC[-2] -> 0 | AB6: =R17C28*RC[-4] -> 875000000 | AC6: =RC[-1]*5% -> 131250000 | AD6: =R17C19*RC[-5] -> 1.8 | AE6: =RC[-3]-RC[-2]-RC[-1] -> 743749998.20000005 | AF6: =RC[-1]-RC[-5] -> 743749998.20000005 | AH6: SUBCPS | AI6: 8127966 | AJ6: 268814 | AK6: 406398 | AL6: =RC[-3]-RC[-1]-RC[-2] -> 0.54999999999999982 | AM6: =R17C39*RC[-4] -> 875000000 | AN6: =RC[-1]*5% -> 131250000 | AO6: =R17C19*RC[-5] -> 1.8 | AP6: =RC[-3]-RC[-2]-RC[-1] -> 743749998.20000005 | AQ6: =RC[-1]-RC[-5] -> 743749997.6500001 | AS6: SUBCPS | AT6: 8689133 | AU6: 281827 | AV6: 434457 | AW6: =RC[-3]-RC[-1]-RC[-2] -> 0.54999999999999982 | AX6: =R17C50*RC[-4] -> 875000000 | AY6: =RC[-1]*5% -> 131250000 | AZ6: =R17C19*RC[-5] -> 1.8 | BA6: =RC[-3]-RC[-2]-RC[-1] -> 743749998.20000005 | BB6: =RC[-1]-RC[-5] -> 743749997.6500001 | BD6: SUBCPS | BE6: 8215398 | BF6: 244972 | BG6: 410770 | BH6: =RC[-3]-RC[-1]-RC[-2] -> 0.54999999999999982 | BI6: =R17C61*RC[-4] -> 875000000 | BJ6: =RC[-1]*5% -> 131250000 | BK6: =R17C19*RC[-5] -> 1.8 | BL6: =RC[-3]-RC[-2]-RC[-1] -> 743749998.20000005 | BM6: =RC[-1]-RC[-5] -> 743749997.6500001 | BO6: SUBCPS | BP6: 0 | BQ6: 0 | BR6: 0 | BS6: =RC[-3]-RC[-1]-RC[-2] -> 0.54999999999999982 | BT6: =R17C72*RC[-4] -> 875000000 | BU6: =RC[-1]*5% -> 131250000 | BV6: =R17C8*RC[-5] -> 1.8 | BW6: =RC[-3]-RC[-2]-RC[-1] -> 743749998.20000005 | BX6: =RC[-1]-RC[-5] -> 743749997.6500001 | BZ6: SUBCPS | CA6: 0 | CB6: 0 | CC6: 0 | CD6: =RC[-3]-RC[-1]-RC[-2] -> 0.54999999999999982 | CE6: =R17C83*RC[-4] -> 875000000 | CF6: =RC[-1]*5% -> 131250000 | CG6: =R17C19*RC[-5] -> 1.8 | CH6: =RC[-3]-RC[-2]-RC[-1] -> 743749998.20000005 | CI6: =RC[-1]-RC[-5] -> 743749997.6500001 | CK6: SUBCPS | CL6: 0 | CM6: 0 | CN6: 0 | CO6: =RC[-3]-RC[-1]-RC[-2] -> 0.54999999999999982 | CP6: =R17C94*RC[-4] -> 875000000 | CQ6: =RC[-1]*5% -> 131250000 | CR6: =R17C19*RC[-5] -> 1.8 | CS6: =RC[-3]-RC[-2]-RC[-1] -> 743749998.20000005 | CT6: =RC[-1]-RC[-5] -> 743749997.6500001 | CV6: SUBCPS | CW6: 0 | CX6: 0 | CY6: 0 | CZ6: =RC[-3]-RC[-1]-RC[-2] -> 0.54999999999999982 | DA6: =R17C105*RC[-4] -> 875000000 | DB6: =RC[-1]*5% -> 131250000 | DC6: =R17C19*RC[-5] -> 1.8 | DD6: =RC[-3]-RC[-2]-RC[-1] -> 743749998.20000005 | DE6: =RC[-1]-RC[-5] -> 743749997.6500001 | DG6: SUBCPS | DH6: 0 | DI6: 0 | DJ6: 0 | DK6: =RC[-3]-RC[-1]-RC[-2] -> 0.54999999999999982 | DL6: =R17C116*RC[-4] -> 807692307.69230771 | DM6: =RC[-1]*5% -> 121153846.15384614 | DN6: =R17C19*RC[-5] -> 1.8 | DO6: =RC[-3]-RC[-2]-RC[-1] -> 686538459.73846161 | DP6: =RC[-1]-RC[-5] -> 686538459.18846166 | DR6: SUBCPS | DS6: 0 | DT6: 0 | DU6: 0 | DV6: =RC[-3]-RC[-1]-RC[-2] -> 0.54999999999999982 | DW6: =R17C127*RC[-4] -> 875000000 | DX6: =RC[-1]*5% -> 131250000 | DY6: =R17C19*RC[-5] -> 1.8 | DZ6: =RC[-3]-RC[-2]-RC[-1] -> 743749998.20000005 | EA6: =RC[-1]-RC[-5] -> 743749997.6500001 | EC6: SUBCPS | ED6: =RC[-132]+RC[-121]+RC[-110]+RC[-99]+RC[-88]+RC[-77]+RC[-66]+RC[-55]+RC[-44]+RC[-33]+RC[-22]+RC[-11] ->  | EE6: =RC[-132]+RC[-121]+RC[-110]+RC[-99]+RC[-88]+RC[-77]+RC[-66]+RC[-55]+RC[-44]+RC[-33]+RC[-22]+RC[-11] ->  | EF6: =RC[-132]+RC[-121]+RC[-110]+RC[-99]+RC[-88]+RC[-77]+RC[-66]+RC[-55]+RC[-44]+RC[-33]+RC[-22]+RC[-11] ->  | EG6: =RC[-132]+RC[-121]+RC[-110]+RC[-99]+RC[-88]+RC[-77]+RC[-66]+RC[-55]+RC[-44]+RC[-33]+RC[-22]+RC[-11] ->  | EH6: =RC[-132]+RC[-121]+RC[-110]+RC[-99]+RC[-88]+RC[-77]+RC[-66]+RC[-55]+RC[-44]+RC[-33]+RC[-22]+RC[-11] ->  | EI6: =RC[-132]+RC[-121]+RC[-110]+RC[-99]+RC[-88]+RC[-77]+RC[-66]+RC[-55]+RC[-44]+RC[-33]+RC[-22]+RC[-11] ->  | EJ6: =RC[-132]+RC[-121]+RC[-110]+RC[-99]+RC[-88]+RC[-77]+RC[-66]+RC[-55]+RC[-44]+RC[-33]+RC[-22]+RC[-11] ->  | EK6: =RC[-132]+RC[-121]+RC[-110]+RC[-99]+RC[-88]+RC[-77]+RC[-66]+RC[-55]+RC[-44]+RC[-33]+RC[-22]+RC[-11] ->  | EL6: =RC[-132]+RC[-121]+RC[-110]+RC[-99]+RC[-88]+RC[-77]+RC[-66]+RC[-55]+RC[-44]+RC[-33]+RC[-22]+RC[-11] -> 
A7: LUCKY_FONE | B7: 9308634 | C7: 1220769 | D7: 465432 | E7: =RC[-3]-RC[-1]-RC[-2] ->  | F7: =R17C6*RC[-4] ->  | G7: =RC[-1]*5% ->  | H7: =R17C8*RC[-5] ->  | I7: =RC[-3]-RC[-2]-RC[-1] ->  | J7: =RC[-1]-RC[-5] ->  | L7: LUCKY_FONE | M7: 6999052 | N7: 736099 | O7: 349953 | P7: =RC[-3]-RC[-1]-RC[-2] -> 2467006.9 | Q7: =R17C17*RC[-4] -> 3000383.6278659259 | R7: =RC[-1]*5% -> 450057.54417988885 | S7: =R17C19*RC[-5] -> 108517.5 | T7: =RC[-3]-RC[-2]-RC[-1] -> 2441808.583686037 | U7: =RC[-1]-RC[-5] -> -25198.316313962918 | W7: LUCKY_FONE | X7: 7903624 | Y7: 946578 | Z7: 395181 | AA7: =RC[-3]-RC[-1]-RC[-2] -> 0 | AB7: =R17C28*RC[-4] -> 875000000 | AC7: =RC[-1]*5% -> 131250000 | AD7: =R17C19*RC[-5] -> 1.8 | AE7: =RC[-3]-RC[-2]-RC[-1] -> 743749998.20000005 | AF7: =RC[-1]-RC[-5] -> 743749998.20000005 | AH7: LUCKY_FONE | AI7: 7852934 | AJ7: 977232 | AK7: 392647 | AL7: =RC[-3]-RC[-1]-RC[-2] -> 0.54999999999999982 | AM7: =R17C39*RC[-4] -> 875000000 | AN7: =RC[-1]*5% -> 131250000 | AO7: =R17C19*RC[-5] -> 1.8 | AP7: =RC[-3]-RC[-2]-RC[-1] -> 743749998.20000005 | AQ7: =RC[-1]-RC[-5] -> 743749997.6500001 | AS7: LUCKY_FONE | AT7: 8136567 | AU7: 995449 | AV7: 406828 | AW7: =RC[-3]-RC[-1]-RC[-2] -> 0.54999999999999982 | AX7: =R17C50*RC[-4] -> 875000000 | AY7: =RC[-1]*5% -> 131250000 | AZ7: =R17C19*RC[-5] -> 1.8 | BA7: =RC[-3]-RC[-2]-RC[-1] -> 743749998.20000005 | BB7: =RC[-1]-RC[-5] -> 743749997.6500001 | BD7: LUCKY_FONE | BE7: 7699645 | BF7: 913367 | BG7: 384982 | BH7: =RC[-3]-RC[-1]-RC[-2] -> 0.54999999999999982 | BI7: =R17C61*RC[-4] -> 875000000 | BJ7: =RC[-1]*5% -> 131250000 | BK7: =R17C19*RC[-5] -> 1.8 | BL7: =RC[-3]-RC[-2]-RC[-1] -> 743749998.20000005 | BM7: =RC[-1]-RC[-5] -> 743749997.6500001 | BO7: LUCKY_FONE | BP7: 0 | BQ7: 0 | BR7: 0 | BS7: =RC[-3]-RC[-1]-RC[-2] -> 0.54999999999999982 | BT7: =R17C72*RC[-4] -> 875000000 | BU7: =RC[-1]*5% -> 131250000 | BV7: =R17C8*RC[-5] -> 1.8 | BW7: =RC[-3]-RC[-2]-RC[-1] -> 743749998.20000005 | BX7: =RC[-1]-RC[-5] -> 743749997.6500001 | BZ7: LUCKY_FONE | CA7: 0 | CB7: 0 | CC7: 0 | CD7: =RC[-3]-RC[-1]-RC[-2] -> 0.54999999999999982 | CE7: =R17C83*RC[-4] -> 875000000 | CF7: =RC[-1]*5% -> 131250000 | CG7: =R17C19*RC[-5] -> 1.8 | CH7: =RC[-3]-RC[-2]-RC[-1] -> 743749998.20000005 | CI7: =RC[-1]-RC[-5] -> 743749997.6500001 | CK7: LUCKY_FONE | CL7: 0 | CM7: 0 | CN7: 0 | CO7: =RC[-3]-RC[-1]-RC[-2] -> 0.54999999999999982 | CP7: =R17C94*RC[-4] -> 875000000 | CQ7: =RC[-1]*5% -> 131250000 | CR7: =R17C19*RC[-5] -> 1.8 | CS7: =RC[-3]-RC[-2]-RC[-1] -> 743749998.20000005 | CT7: =RC[-1]-RC[-5] -> 743749997.6500001 | CV7: LUCKY_FONE | CW7: 0 | CX7: 0 | CY7: 0 | CZ7: =RC[-3]-RC[-1]-RC[-2] -> 0.54999999999999982 | DA7: =R17C105*RC[-4] -> 875000000 | DB7: =RC[-1]*5% -> 131250000 | DC7: =R17C19*RC[-5] -> 1.8 | DD7: =RC[-3]-RC[-2]-RC[-1] -> 743749998.20000005 | DE7: =RC[-1]-RC[-5] -> 743749997.6500001 | DG7: LUCKY_FONE | DH7: 0 | DI7: 0 | DJ7: 0 | DK7: =RC[-3]-RC[-1]-RC[-2] -> 0.54999999999999982 | DL7: =R17C116*RC[-4] -> 807692307.69230771 | DM7: =RC[-1]*5% -> 121153846.15384614 | DN7: =R17C19*RC[-5] -> 1.8 | DO7: =RC[-3]-RC[-2]-RC[-1] -> 686538459.73846161 | DP7: =RC[-1]-RC[-5] -> 686538459.18846166 | DR7: LUCKY_FONE | DS7: 0 | DT7: 0 | DU7: 0 | DV7: =RC[-3]-RC[-1]-RC[-2] -> 0.54999999999999982 | DW7: =R17C127*RC[-4] -> 875000000 | DX7: =RC[-1]*5% -> 131250000 | DY7: =R17C19*RC[-5] -> 1.8 | DZ7: =RC[-3]-RC[-2]-RC[-1] -> 743749998.20000005 | EA7: =RC[-1]-RC[-5] -> 743749997.6500001 | EC7: LUCKY_FONE | ED7: =RC[-132]+RC[-121]+RC[-110]+RC[-99]+RC[-88]+RC[-77]+RC[-66]+RC[-55]+RC[-44]+RC[-33]+RC[-22]+RC[-11] ->  | EE7: =RC[-132]+RC[-121]+RC[-110]+RC[-99]+RC[-88]+RC[-77]+RC[-66]+RC[-55]+RC[-44]+RC[-33]+RC[-22]+RC[-11] ->  | EF7: =RC[-132]+RC[-121]+RC[-110]+RC[-99]+RC[-88]+RC[-77]+RC[-66]+RC[-55]+RC[-44]+RC[-33]+RC[-22]+RC[-11] ->  | EG7: =RC[-132]+RC[-121]+RC[-110]+RC[-99]+RC[-88]+RC[-77]+RC[-66]+RC[-55]+RC[-44]+RC[-33]+RC[-22]+RC[-11] ->  | EH7: =RC[-132]+RC[-121]+RC[-110]+RC[-99]+RC[-88]+RC[-77]+RC[-66]+RC[-55]+RC[-44]+RC[-33]+RC[-22]+RC[-11] ->  | EI7: =RC[-132]+RC[-121]+RC[-110]+RC[-99]+RC[-88]+RC[-77]+RC[-66]+RC[-55]+RC[-44]+RC[-33]+RC[-22]+RC[-11] ->  | EJ7: =RC[-132]+RC[-121]+RC[-110]+RC[-99]+RC[-88]+RC[-77]+RC[-66]+RC[-55]+RC[-44]+RC[-33]+RC[-22]+RC[-11] ->  | EK7: =RC[-132]+RC[-121]+RC[-110]+RC[-99]+RC[-88]+RC[-77]+RC[-66]+RC[-55]+RC[-44]+RC[-33]+RC[-22]+RC[-11] ->  | EL7: =RC[-132]+RC[-121]+RC[-110]+RC[-99]+RC[-88]+RC[-77]+RC[-66]+RC[-55]+RC[-44]+RC[-33]+RC[-22]+RC[-11] -> 
A8: TT PTKD | B8: 2812677 | C8: 296162 | D8: 140634 | E8: =RC[-3]-RC[-1]-RC[-2] ->  | F8: =R17C6*RC[-4] ->  | G8: =RC[-1]*5% ->  | H8: =R17C8*RC[-5] ->  | I8: =RC[-3]-RC[-2]-RC[-1] ->  | J8: =RC[-1]-RC[-5] ->  | L8: TT PTKD | M8: 2640494 | N8: 605345 | O8: 132025 | P8: =RC[-3]-RC[-1]-RC[-2] -> 2467006.9 | Q8: =R17C17*RC[-4] -> 3000383.6278659259 | R8: =RC[-1]*5% -> 450057.54417988885 | S8: =R17C19*RC[-5] -> 108517.5 | T8: =RC[-3]-RC[-2]-RC[-1] -> 2441808.583686037 | U8: =RC[-1]-RC[-5] -> -25198.316313962918 | W8: TT PTKD | X8: 2361587 | Y8: 193686 | Z8: 118079 | AA8: =RC[-3]-RC[-1]-RC[-2] -> 0 | AB8: =R17C28*RC[-4] -> 875000000 | AC8: =RC[-1]*5% -> 131250000 | AD8: =R17C19*RC[-5] -> 1.8 | AE8: =RC[-3]-RC[-2]-RC[-1] -> 743749998.20000005 | AF8: =RC[-1]-RC[-5] -> 743749998.20000005 | AH8: TT PTKD | AI8: 2374817 | AJ8: 312497 | AK8: 118741 | AL8: =RC[-3]-RC[-1]-RC[-2] -> 0.54999999999999982 | AM8: =R17C39*RC[-4] -> 875000000 | AN8: =RC[-1]*5% -> 131250000 | AO8: =R17C19*RC[-5] -> 1.8 | AP8: =RC[-3]-RC[-2]-RC[-1] -> 743749998.20000005 | AQ8: =RC[-1]-RC[-5] -> 743749997.6500001 | AS8: TT PTKD | AT8: 2714460 | AU8: 163082 | AV8: 135723 | AW8: =RC[-3]-RC[-1]-RC[-2] -> 0.54999999999999982 | AX8: =R17C50*RC[-4] -> 875000000 | AY8: =RC[-1]*5% -> 131250000 | AZ8: =R17C19*RC[-5] -> 1.8 | BA8: =RC[-3]-RC[-2]-RC[-1] -> 743749998.20000005 | BB8: =RC[-1]-RC[-5] -> 743749997.6500001 | BD8: TT PTKD | BE8: 2059579 | BF8: 195496 | BG8: 102979 | BH8: =RC[-3]-RC[-1]-RC[-2] -> 0.54999999999999982 | BI8: =R17C61*RC[-4] -> 875000000 | BJ8: =RC[-1]*5% -> 131250000 | BK8: =R17C19*RC[-5] -> 1.8 | BL8: =RC[-3]-RC[-2]-RC[-1] -> 743749998.20000005 | BM8: =RC[-1]-RC[-5] -> 743749997.6500001 | BO8: TT PTKD | BP8: 0 | BQ8: 0 | BR8: 0 | BS8: =RC[-3]-RC[-1]-RC[-2] -> 0.54999999999999982 | BT8: =R17C72*RC[-4] -> 875000000 | BU8: =RC[-1]*5% -> 131250000 | BV8: =R17C8*RC[-5] -> 1.8 | BW8: =RC[-3]-RC[-2]-RC[-1] -> 743749998.20000005 | BX8: =RC[-1]-RC[-5] -> 743749997.6500001 | BZ8: TT PTKD | CA8: 0 | CB8: 0 | CC8: 0 | CD8: =RC[-3]-RC[-1]-RC[-2] -> 0.54999999999999982 | CE8: =R17C83*RC[-4] -> 875000000 | CF8: =RC[-1]*5% -> 131250000 | CG8: =R17C19*RC[-5] -> 1.8 | CH8: =RC[-3]-RC[-2]-RC[-1] -> 743749998.20000005 | CI8: =RC[-1]-RC[-5] -> 743749997.6500001 | CK8: TT PTKD | CL8: 0 | CM8: 0 | CN8: 0 | CO8: =RC[-3]-RC[-1]-RC[-2] -> 0.54999999999999982 | CP8: =R17C94*RC[-4] -> 875000000 | CQ8: =RC[-1]*5% -> 131250000 | CR8: =R17C19*RC[-5] -> 1.8 | CS8: =RC[-3]-RC[-2]-RC[-1] -> 743749998.20000005 | CT8: =RC[-1]-RC[-5] -> 743749997.6500001 | CV8: TT PTKD | CW8: 0 | CX8: 0 | CY8: 0 | CZ8: =RC[-3]-RC[-1]-RC[-2] -> 0.54999999999999982 | DA8: =R17C105*RC[-4] -> 875000000 | DB8: =RC[-1]*5% -> 131250000 | DC8: =R17C19*RC[-5] -> 1.8 | DD8: =RC[-3]-RC[-2]-RC[-1] -> 743749998.20000005 | DE8: =RC[-1]-RC[-5] -> 743749997.6500001 | DG8: TT PTKD | DH8: 0 | DI8: 0 | DJ8: 0 | DK8: =RC[-3]-RC[-1]-RC[-2] -> 0.54999999999999982 | DL8: =R17C116*RC[-4] -> 807692307.69230771 | DM8: =RC[-1]*5% -> 121153846.15384614 | DN8: =R17C19*RC[-5] -> 1.8 | DO8: =RC[-3]-RC[-2]-RC[-1] -> 686538459.73846161 | DP8: =RC[-1]-RC[-5] -> 686538459.18846166 | DR8: TT PTKD | DS8: 0 | DT8: 0 | DU8: 0 | DV8: =RC[-3]-RC[-1]-RC[-2] -> 0.54999999999999982 | DW8: =R17C127*RC[-4] -> 875000000 | DX8: =RC[-1]*5% -> 131250000 | DY8: =R17C19*RC[-5] -> 1.8 | DZ8: =RC[-3]-RC[-2]-RC[-1] -> 743749998.20000005 | EA8: =RC[-1]-RC[-5] -> 743749997.6500001 | EC8: TT PTKD | ED8: =RC[-132]+RC[-121]+RC[-110]+RC[-99]+RC[-88]+RC[-77]+RC[-66]+RC[-55]+RC[-44]+RC[-33]+RC[-22]+RC[-11] ->  | EE8: =RC[-132]+RC[-121]+RC[-110]+RC[-99]+RC[-88]+RC[-77]+RC[-66]+RC[-55]+RC[-44]+RC[-33]+RC[-22]+RC[-11] ->  | EF8: =RC[-132]+RC[-121]+RC[-110]+RC[-99]+RC[-88]+RC[-77]+RC[-66]+RC[-55]+RC[-44]+RC[-33]+RC[-22]+RC[-11] ->  | EG8: =RC[-132]+RC[-121]+RC[-110]+RC[-99]+RC[-88]+RC[-77]+RC[-66]+RC[-55]+RC[-44]+RC[-33]+RC[-22]+RC[-11] ->  | EH8: =RC[-132]+RC[-121]+RC[-110]+RC[-99]+RC[-88]+RC[-77]+RC[-66]+RC[-55]+RC[-44]+RC[-33]+RC[-22]+RC[-11] ->  | EI8: =RC[-132]+RC[-121]+RC[-110]+RC[-99]+RC[-88]+RC[-77]+RC[-66]+RC[-55]+RC[-44]+RC[-33]+RC[-22]+RC[-11] ->  | EJ8: =RC[-132]+RC[-121]+RC[-110]+RC[-99]+RC[-88]+RC[-77]+RC[-66]+RC[-55]+RC[-44]+RC[-33]+RC[-22]+RC[-11] ->  | EK8: =RC[-132]+RC[-121]+RC[-110]+RC[-99]+RC[-88]+RC[-77]+RC[-66]+RC[-55]+RC[-44]+RC[-33]+RC[-22]+RC[-11] ->  | EL8: =RC[-132]+RC[-121]+RC[-110]+RC[-99]+RC[-88]+RC[-77]+RC[-66]+RC[-55]+RC[-44]+RC[-33]+RC[-22]+RC[-11] -> 
A9: TT PTND | B9: 213676019 | C9: 4619969 | D9: 10683801 | E9: =RC[-3]-RC[-1]-RC[-2] ->  | F9: =R17C6*RC[-4] ->  | G9: =RC[-1]*5% ->  | H9: =R17C8*RC[-5] ->  | I9: =RC[-3]-RC[-2]-RC[-1] ->  | J9: =RC[-1]-RC[-5] ->  | L9: TT PTND | M9: 178824378 | N9: 1466656 | O9: 8941219 | P9: =RC[-3]-RC[-1]-RC[-2] -> 2467006.9 | Q9: =R17C17*RC[-4] -> 3000383.6278659259 | R9: =RC[-1]*5% -> 450057.54417988885 | S9: =R17C19*RC[-5] -> 108517.5 | T9: =RC[-3]-RC[-2]-RC[-1] -> 2441808.583686037 | U9: =RC[-1]-RC[-5] -> -25198.316313962918 | W9: TT PTND | X9: 207102901 | Y9: 4854695 | Z9: 10355145 | AA9: =RC[-3]-RC[-1]-RC[-2] -> 0 | AB9: =R17C28*RC[-4] -> 875000000 | AC9: =RC[-1]*5% -> 131250000 | AD9: =R17C19*RC[-5] -> 1.8 | AE9: =RC[-3]-RC[-2]-RC[-1] -> 743749998.20000005 | AF9: =RC[-1]-RC[-5] -> 743749998.20000005 | AH9: TT PTND | AI9: 193368826 | AJ9: 4391628 | AK9: 9668441 | AL9: =RC[-3]-RC[-1]-RC[-2] -> 0.54999999999999982 | AM9: =R17C39*RC[-4] -> 875000000 | AN9: =RC[-1]*5% -> 131250000 | AO9: =R17C19*RC[-5] -> 1.8 | AP9: =RC[-3]-RC[-2]-RC[-1] -> 743749998.20000005 | AQ9: =RC[-1]-RC[-5] -> 743749997.6500001 | AS9: TT PTND | AT9: 226079623 | AU9: 5245239 | AV9: 11303981 | AW9: =RC[-3]-RC[-1]-RC[-2] -> 0.54999999999999982 | AX9: =R17C50*RC[-4] -> 875000000 | AY9: =RC[-1]*5% -> 131250000 | AZ9: =R17C19*RC[-5] -> 1.8 | BA9: =RC[-3]-RC[-2]-RC[-1] -> 743749998.20000005 | BB9: =RC[-1]-RC[-5] -> 743749997.6500001 | BD9: TT PTND | BE9: 326937533 | BF9: 6244912 | BG9: 16346877 | BH9: =RC[-3]-RC[-1]-RC[-2] -> 0.54999999999999982 | BI9: =R17C61*RC[-4] -> 875000000 | BJ9: =RC[-1]*5% -> 131250000 | BK9: =R17C19*RC[-5] -> 1.8 | BL9: =RC[-3]-RC[-2]-RC[-1] -> 743749998.20000005 | BM9: =RC[-1]-RC[-5] -> 743749997.6500001 | BO9: TT PTND | BP9: 0 | BQ9: 0 | BR9: 0 | BS9: =RC[-3]-RC[-1]-RC[-2] -> 0.54999999999999982 | BT9: =R17C72*RC[-4] -> 875000000 | BU9: =RC[-1]*5% -> 131250000 | BV9: =R17C8*RC[-5] -> 1.8 | BW9: =RC[-3]-RC[-2]-RC[-1] -> 743749998.20000005 | BX9: =RC[-1]-RC[-5] -> 743749997.6500001 | BZ9: TT PTND | CA9: 0 | CB9: 0 | CC9: 0 | CD9: =RC[-3]-RC[-1]-RC[-2] -> 0.54999999999999982 | CE9: =R17C83*RC[-4] -> 875000000 | CF9: =RC[-1]*5% -> 131250000 | CG9: =R17C19*RC[-5] -> 1.8 | CH9: =RC[-3]-RC[-2]-RC[-1] -> 743749998.20000005 | CI9: =RC[-1]-RC[-5] -> 743749997.6500001 | CK9: TT PTND | CL9: 0 | CM9: 0 | CN9: 0 | CO9: =RC[-3]-RC[-1]-RC[-2] -> 0.54999999999999982 | CP9: =R17C94*RC[-4] -> 875000000 | CQ9: =RC[-1]*5% -> 131250000 | CR9: =R17C19*RC[-5] -> 1.8 | CS9: =RC[-3]-RC[-2]-RC[-1] -> 743749998.20000005 | CT9: =RC[-1]-RC[-5] -> 743749997.6500001 | CV9: TT PTND | CW9: 0 | CX9: 0 | CY9: 0 | CZ9: =RC[-3]-RC[-1]-RC[-2] -> 0.54999999999999982 | DA9: =R17C105*RC[-4] -> 875000000 | DB9: =RC[-1]*5% -> 131250000 | DC9: =R17C19*RC[-5] -> 1.8 | DD9: =RC[-3]-RC[-2]-RC[-1] -> 743749998.20000005 | DE9: =RC[-1]-RC[-5] -> 743749997.6500001 | DG9: TT PTND | DH9: 0 | DI9: 0 | DJ9: 0 | DK9: =RC[-3]-RC[-1]-RC[-2] -> 0.54999999999999982 | DL9: =R17C116*RC[-4] -> 807692307.69230771 | DM9: =RC[-1]*5% -> 121153846.15384614 | DN9: =R17C19*RC[-5] -> 1.8 | DO9: =RC[-3]-RC[-2]-RC[-1] -> 686538459.73846161 | DP9: =RC[-1]-RC[-5] -> 686538459.18846166 | DR9: TT PTND | DS9: 0 | DT9: 0 | DU9: 0 | DV9: =RC[-3]-RC[-1]-RC[-2] -> 0.54999999999999982 | DW9: =R17C127*RC[-4] -> 875000000 | DX9: =RC[-1]*5% -> 131250000 | DY9: =R17C19*RC[-5] -> 1.8 | DZ9: =RC[-3]-RC[-2]-RC[-1] -> 743749998.20000005 | EA9: =RC[-1]-RC[-5] -> 743749997.6500001 | EC9: TT PTND | ED9: =RC[-132]+RC[-121]+RC[-110]+RC[-99]+RC[-88]+RC[-77]+RC[-66]+RC[-55]+RC[-44]+RC[-33]+RC[-22]+RC[-11] ->  | EE9: =RC[-132]+RC[-121]+RC[-110]+RC[-99]+RC[-88]+RC[-77]+RC[-66]+RC[-55]+RC[-44]+RC[-33]+RC[-22]+RC[-11] ->  | EF9: =RC[-132]+RC[-121]+RC[-110]+RC[-99]+RC[-88]+RC[-77]+RC[-66]+RC[-55]+RC[-44]+RC[-33]+RC[-22]+RC[-11] ->  | EG9: =RC[-132]+RC[-121]+RC[-110]+RC[-99]+RC[-88]+RC[-77]+RC[-66]+RC[-55]+RC[-44]+RC[-33]+RC[-22]+RC[-11] ->  | EH9: =RC[-132]+RC[-121]+RC[-110]+RC[-99]+RC[-88]+RC[-77]+RC[-66]+RC[-55]+RC[-44]+RC[-33]+RC[-22]+RC[-11] ->  | EI9: =RC[-132]+RC[-121]+RC[-110]+RC[-99]+RC[-88]+RC[-77]+RC[-66]+RC[-55]+RC[-44]+RC[-33]+RC[-22]+RC[-11] ->  | EJ9: =RC[-132]+RC[-121]+RC[-110]+RC[-99]+RC[-88]+RC[-77]+RC[-66]+RC[-55]+RC[-44]+RC[-33]+RC[-22]+RC[-11] ->  | EK9: =RC[-132]+RC[-121]+RC[-110]+RC[-99]+RC[-88]+RC[-77]+RC[-66]+RC[-55]+RC[-44]+RC[-33]+RC[-22]+RC[-11] ->  | EL9: =RC[-132]+RC[-121]+RC[-110]+RC[-99]+RC[-88]+RC[-77]+RC[-66]+RC[-55]+RC[-44]+RC[-33]+RC[-22]+RC[-11] -> 
A10: HQ | B10: 952997 | C10: 11448815 | D10: 47650 | E10: =RC[-3]-RC[-1]-RC[-2] ->  | F10: =R17C6*RC[-4] ->  | G10: =RC[-1]*5% ->  | H10: =R17C8*RC[-5] ->  | I10: =RC[-3]-RC[-2]-RC[-1] ->  | J10: =RC[-1]-RC[-5] ->  | L10: HQ | M10: 843442 | N10: 10159345 | O10: 42172 | P10: =RC[-3]-RC[-1]-RC[-2] -> 2467006.9 | Q10: =R17C17*RC[-4] -> 3000383.6278659259 | R10: =RC[-1]*5% -> 450057.54417988885 | S10: =R17C19*RC[-5] -> 108517.5 | T10: =RC[-3]-RC[-2]-RC[-1] -> 2441808.583686037 | U10: =RC[-1]-RC[-5] -> -25198.316313962918 | W10: HQ | X10: 903174 | Y10: 10982840 | Z10: 45159 | AA10: =RC[-3]-RC[-1]-RC[-2] -> 0 | AB10: =R17C28*RC[-4] -> 875000000 | AC10: =RC[-1]*5% -> 131250000 | AD10: =R17C19*RC[-5] -> 1.8 | AE10: =RC[-3]-RC[-2]-RC[-1] -> 743749998.20000005 | AF10: =RC[-1]-RC[-5] -> 743749998.20000005 | AH10: HQ | AI10: 926038 | AJ10: 10419487 | AK10: 46302 | AL10: =RC[-3]-RC[-1]-RC[-2] -> 0.54999999999999982 | AM10: =R17C39*RC[-4] -> 875000000 | AN10: =RC[-1]*5% -> 131250000 | AO10: =R17C19*RC[-5] -> 1.8 | AP10: =RC[-3]-RC[-2]-RC[-1] -> 743749998.20000005 | AQ10: =RC[-1]-RC[-5] -> 743749997.6500001 | AS10: HQ | AT10: 835120 | AU10: 12883614 | AV10: 41756 | AW10: =RC[-3]-RC[-1]-RC[-2] -> 0.54999999999999982 | AX10: =R17C50*RC[-4] -> 875000000 | AY10: =RC[-1]*5% -> 131250000 | AZ10: =R17C19*RC[-5] -> 1.8 | BA10: =RC[-3]-RC[-2]-RC[-1] -> 743749998.20000005 | BB10: =RC[-1]-RC[-5] -> 743749997.6500001 | BD10: HQ | BE10: 780768 | BF10: 13706205 | BG10: 39038 | BH10: =RC[-3]-RC[-1]-RC[-2] -> 0.54999999999999982 | BI10: =R17C61*RC[-4] -> 875000000 | BJ10: =RC[-1]*5% -> 131250000 | BK10: =R17C19*RC[-5] -> 1.8 | BL10: =RC[-3]-RC[-2]-RC[-1] -> 743749998.20000005 | BM10: =RC[-1]-RC[-5] -> 743749997.6500001 | BO10: HQ | BP10: 0 | BQ10: 0 | BR10: 0 | BS10: =RC[-3]-RC[-1]-RC[-2] -> 0.54999999999999982 | BT10: =R17C72*RC[-4] -> 875000000 | BU10: =RC[-1]*5% -> 131250000 | BV10: =R17C8*RC[-5] -> 1.8 | BW10: =RC[-3]-RC[-2]-RC[-1] -> 743749998.20000005 | BX10: =RC[-1]-RC[-5] -> 743749997.6500001 | BZ10: HQ | CA10: 0 | CB10: 0 | CC10: 0 | CD10: =RC[-3]-RC[-1]-RC[-2] -> 0.54999999999999982 | CE10: =R17C83*RC[-4] -> 875000000 | CF10: =RC[-1]*5% -> 131250000 | CG10: =R17C19*RC[-5] -> 1.8 | CH10: =RC[-3]-RC[-2]-RC[-1] -> 743749998.20000005 | CI10: =RC[-1]-RC[-5] -> 743749997.6500001 | CK10: HQ | CL10: 0 | CM10: 0 | CN10: 0 | CO10: =RC[-3]-RC[-1]-RC[-2] -> 0.54999999999999982 | CP10: =R17C94*RC[-4] -> 875000000 | CQ10: =RC[-1]*5% -> 131250000 | CR10: =R17C19*RC[-5] -> 1.8 | CS10: =RC[-3]-RC[-2]-RC[-1] -> 743749998.20000005 | CT10: =RC[-1]-RC[-5] -> 743749997.6500001 | CV10: HQ | CW10: 0 | CX10: 0 | CY10: 0 | CZ10: =RC[-3]-RC[-1]-RC[-2] -> 0.54999999999999982 | DA10: =R17C105*RC[-4] -> 875000000 | DB10: =RC[-1]*5% -> 131250000 | DC10: =R17C19*RC[-5] -> 1.8 | DD10: =RC[-3]-RC[-2]-RC[-1] -> 743749998.20000005 | DE10: =RC[-1]-RC[-5] -> 743749997.6500001 | DG10: HQ | DH10: 0 | DI10: 0 | DJ10: 0 | DK10: =RC[-3]-RC[-1]-RC[-2] -> 0.54999999999999982 | DL10: =R17C116*RC[-4] -> 807692307.69230771 | DM10: =RC[-1]*5% -> 121153846.15384614 | DN10: =R17C19*RC[-5] -> 1.8 | DO10: =RC[-3]-RC[-2]-RC[-1] -> 686538459.73846161 | DP10: =RC[-1]-RC[-5] -> 686538459.18846166 | DR10: HQ | DS10: 0 | DT10: 0 | DU10: 0 | DV10: =RC[-3]-RC[-1]-RC[-2] -> 0.54999999999999982 | DW10: =R17C127*RC[-4] -> 875000000 | DX10: =RC[-1]*5% -> 131250000 | DY10: =R17C19*RC[-5] -> 1.8 | DZ10: =RC[-3]-RC[-2]-RC[-1] -> 743749998.20000005 | EA10: =RC[-1]-RC[-5] -> 743749997.6500001 | EC10: HQ | ED10: =RC[-132]+RC[-121]+RC[-110]+RC[-99]+RC[-88]+RC[-77]+RC[-66]+RC[-55]+RC[-44]+RC[-33]+RC[-22]+RC[-11] ->  | EE10: =RC[-132]+RC[-121]+RC[-110]+RC[-99]+RC[-88]+RC[-77]+RC[-66]+RC[-55]+RC[-44]+RC[-33]+RC[-22]+RC[-11] ->  | EF10: =RC[-132]+RC[-121]+RC[-110]+RC[-99]+RC[-88]+RC[-77]+RC[-66]+RC[-55]+RC[-44]+RC[-33]+RC[-22]+RC[-11] ->  | EG10: =RC[-132]+RC[-121]+RC[-110]+RC[-99]+RC[-88]+RC[-77]+RC[-66]+RC[-55]+RC[-44]+RC[-33]+RC[-22]+RC[-11] ->  | EH10: =RC[-132]+RC[-121]+RC[-110]+RC[-99]+RC[-88]+RC[-77]+RC[-66]+RC[-55]+RC[-44]+RC[-33]+RC[-22]+RC[-11] ->  | EI10: =RC[-132]+RC[-121]+RC[-110]+RC[-99]+RC[-88]+RC[-77]+RC[-66]+RC[-55]+RC[-44]+RC[-33]+RC[-22]+RC[-11] ->  | EJ10: =RC[-132]+RC[-121]+RC[-110]+RC[-99]+RC[-88]+RC[-77]+RC[-66]+RC[-55]+RC[-44]+RC[-33]+RC[-22]+RC[-11] ->  | EK10: =RC[-132]+RC[-121]+RC[-110]+RC[-99]+RC[-88]+RC[-77]+RC[-66]+RC[-55]+RC[-44]+RC[-33]+RC[-22]+RC[-11] ->  | EL10: =RC[-132]+RC[-121]+RC[-110]+RC[-99]+RC[-88]+RC[-77]+RC[-66]+RC[-55]+RC[-44]+RC[-33]+RC[-22]+RC[-11] -> 
A11: Tổng | B11: =SUM(R[-5]C:R[-1]C) -> 3551128896 | C11: =SUM(R[-5]C:R[-1]C) -> -619983 | D11: =SUM(R[-5]C:R[-1]C) -> 532669334.39999998 | E11: =SUM(R[-5]C:R[-1]C) -> 3019079544.5999999 | F11: =SUM(R[-5]C:R[-1]C) -> 3499999999.9999995 | G11: =SUM(R[-5]C:R[-1]C) -> 525000000 | H11: =SUM(R[-5]C:R[-1]C) -> -557984.69999999995 | I11: =SUM(R[-5]C:R[-1]C) -> 2975557984.6999998 | J11: =SUM(R[-5]C:R[-1]C) -> -43521559.899999849 | L11: Tổng | M11: =SUM(R[-5]C:R[-1]C) -> 3551128896 | N11: =SUM(R[-5]C:R[-1]C) -> -619983 | O11: =SUM(R[-5]C:R[-1]C) -> 532669334.39999998 | P11: =SUM(R[-5]C:R[-1]C) -> 3019079544.5999999 | Q11: =SUM(R[-5]C:R[-1]C) -> 3499999999.9999995 | R11: =SUM(R[-5]C:R[-1]C) -> 525000000 | S11: =SUM(R[-5]C:R[-1]C) -> -557984.69999999995 | T11: =SUM(R[-5]C:R[-1]C) -> 2975557984.6999998 | U11: =SUM(R[-5]C:R[-1]C) -> -43521559.899999849 | W11: Tổng | X11: =SUM(R[-5]C:R[-1]C) -> 12 | Y11: =SUM(R[-5]C:R[-1]C) -> 9 | Z11: =SUM(R[-5]C:R[-1]C) -> 2.35 | AA11: =SUM(R[-5]C:R[-1]C) -> 0.64999999999999991 | AB11: =SUM(R[-5]C:R[-1]C) -> 3500000000 | AC11: =SUM(R[-5]C:R[-1]C) -> 525000000 | AD11: =SUM(R[-5]C:R[-1]C) -> 8.1 | AE11: =SUM(R[-5]C:R[-1]C) -> 2974999991.9000006 | AF11: =SUM(R[-5]C:R[-1]C) -> 2974999991.2500005 | AH11: Tổng | AI11: =SUM(R[-5]C:R[-1]C) -> 12 | AJ11: =SUM(R[-5]C:R[-1]C) -> 9 | AK11: =SUM(R[-5]C:R[-1]C) -> 1.7999999999999998 | AL11: =SUM(R[-5]C:R[-1]C) -> 1.1999999999999997 | AM11: =SUM(R[-5]C:R[-1]C) -> 3500000000 | AN11: =SUM(R[-5]C:R[-1]C) -> 525000000 | AO11: =SUM(R[-5]C:R[-1]C) -> 8.1 | AP11: =SUM(R[-5]C:R[-1]C) -> 2974999991.9000006 | AQ11: =SUM(R[-5]C:R[-1]C) -> 2974999990.7000003 | AS11: Tổng | AT11: =SUM(R[-5]C:R[-1]C) -> 12 | AU11: =SUM(R[-5]C:R[-1]C) -> 9 | AV11: =SUM(R[-5]C:R[-1]C) -> 1.7999999999999998 | AW11: =SUM(R[-5]C:R[-1]C) -> 1.1999999999999997 | AX11: =SUM(R[-5]C:R[-1]C) -> 3500000000 | AY11: =SUM(R[-5]C:R[-1]C) -> 525000000 | AZ11: =SUM(R[-5]C:R[-1]C) -> 8.1 | BA11: =SUM(R[-5]C:R[-1]C) -> 2974999991.9000006 | BB11: =SUM(R[-5]C:R[-1]C) -> 2974999990.7000003 | BD11: Tổng | BE11: =SUM(R[-5]C:R[-1]C) -> 12 | BF11: =SUM(R[-5]C:R[-1]C) -> 9 | BG11: =SUM(R[-5]C:R[-1]C) -> 1.7999999999999998 | BH11: =SUM(R[-5]C:R[-1]C) -> 1.1999999999999997 | BI11: =SUM(R[-5]C:R[-1]C) -> 3500000000 | BJ11: =SUM(R[-5]C:R[-1]C) -> 525000000 | BK11: =SUM(R[-5]C:R[-1]C) -> 8.1 | BL11: =SUM(R[-5]C:R[-1]C) -> 2974999991.9000006 | BM11: =SUM(R[-5]C:R[-1]C) -> 2974999990.7000003 | BO11: Tổng | BP11: =SUM(R[-5]C:R[-1]C) -> 12 | BQ11: =SUM(R[-5]C:R[-1]C) -> 9 | BR11: =SUM(R[-5]C:R[-1]C) -> 1.7999999999999998 | BS11: =SUM(R[-5]C:R[-1]C) -> 1.1999999999999997 | BT11: =SUM(R[-5]C:R[-1]C) -> 3500000000 | BU11: =SUM(R[-5]C:R[-1]C) -> 525000000 | BV11: =SUM(R[-5]C:R[-1]C) -> 8.1 | BW11: =SUM(R[-5]C:R[-1]C) -> 2974999991.9000006 | BX11: =SUM(R[-5]C:R[-1]C) -> 2974999990.7000003 | BZ11: Tổng | CA11: =SUM(R[-5]C:R[-1]C) -> 12 | CB11: =SUM(R[-5]C:R[-1]C) -> 9 | CC11: =SUM(R[-5]C:R[-1]C) -> 1.7999999999999998 | CD11: =SUM(R[-5]C:R[-1]C) -> 1.1999999999999997 | CE11: =SUM(R[-5]C:R[-1]C) -> 3500000000 | CF11: =SUM(R[-5]C:R[-1]C) -> 525000000 | CG11: =SUM(R[-5]C:R[-1]C) -> 8.1 | CH11: =SUM(R[-5]C:R[-1]C) -> 2974999991.9000006 | CI11: =SUM(R[-5]C:R[-1]C) -> 2974999990.7000003 | CK11: Tổng | CL11: =SUM(R[-5]C:R[-1]C) -> 12 | CM11: =SUM(R[-5]C:R[-1]C) -> 9 | CN11: =SUM(R[-5]C:R[-1]C) -> 1.7999999999999998 | CO11: =SUM(R[-5]C:R[-1]C) -> 1.1999999999999997 | CP11: =SUM(R[-5]C:R[-1]C) -> 3500000000 | CQ11: =SUM(R[-5]C:R[-1]C) -> 525000000 | CR11: =SUM(R[-5]C:R[-1]C) -> 8.1 | CS11: =SUM(R[-5]C:R[-1]C) -> 2974999991.9000006 | CT11: =SUM(R[-5]C:R[-1]C) -> 2974999990.7000003 | CV11: Tổng | CW11: =SUM(R[-5]C:R[-1]C) -> 12 | CX11: =SUM(R[-5]C:R[-1]C) -> 9 | CY11: =SUM(R[-5]C:R[-1]C) -> 1.7999999999999998 | CZ11: =SUM(R[-5]C:R[-1]C) -> 1.1999999999999997 | DA11: =SUM(R[-5]C:R[-1]C) -> 3500000000 | DB11: =SUM(R[-5]C:R[-1]C) -> 525000000 | DC11: =SUM(R[-5]C:R[-1]C) -> 8.1 | DD11: =SUM(R[-5]C:R[-1]C) -> 2974999991.9000006 | DE11: =SUM(R[-5]C:R[-1]C) -> 2974999990.7000003 | DG11: Tổng | DH11: =SUM(R[-5]C:R[-1]C) -> 13 | DI11: =SUM(R[-5]C:R[-1]C) -> 9 | DJ11: =SUM(R[-5]C:R[-1]C) -> 1.9499999999999997 | DK11: =SUM(R[-5]C:R[-1]C) -> 2.0499999999999994 | DL11: =SUM(R[-5]C:R[-1]C) -> 3500000000 | DM11: =SUM(R[-5]C:R[-1]C) -> 525000000 | DN11: =SUM(R[-5]C:R[-1]C) -> 8.1 | DO11: =SUM(R[-5]C:R[-1]C) -> 2974999991.9000001 | DP11: =SUM(R[-5]C:R[-1]C) -> 2974999989.8500004 | DR11: Tổng | DS11: =SUM(R[-5]C:R[-1]C) -> 12 | DT11: =SUM(R[-5]C:R[-1]C) -> 9 | DU11: =SUM(R[-5]C:R[-1]C) -> 1.7999999999999998 | DV11: =SUM(R[-5]C:R[-1]C) -> 1.1999999999999997 | DW11: =SUM(R[-5]C:R[-1]C) -> 3500000000 | DX11: =SUM(R[-5]C:R[-1]C) -> 525000000 | DY11: =SUM(R[-5]C:R[-1]C) -> 8.1 | DZ11: =SUM(R[-5]C:R[-1]C) -> 2974999991.9000006 | EA11: =SUM(R[-5]C:R[-1]C) -> 2974999990.7000003 | EC11: Tổng | ED11: =SUM(R[-5]C:R[-1]C) -> 7102257913 | EE11: =SUM(R[-5]C:R[-1]C) -> -1239876 | EF11: =SUM(R[-5]C:R[-1]C) -> 1065338687.5000002 | EG11: =SUM(R[-5]C:R[-1]C) -> 6038159101.4999962 | EH11: =SUM(R[-5]C:R[-1]C) -> 42000000000 | EI11: =SUM(R[-5]C:R[-1]C) -> 6300000000 | EJ11: =SUM(R[-5]C:R[-1]C) -> -1115888.4000000006 | EK11: =SUM(R[-5]C:R[-1]C) -> 35701115888.400009 | EL11: =SUM(R[-5]C:R[-1]C) -> 29662956786.900002
E13: Số liệu theo biên bản đối soát thực tế với Viettel | P13: Số liệu theo biên bản đối soát thực tế với Viettel | AA13: Số liệu theo biên bản đối soát thực tế với Viettel | AL13: Số liệu theo biên bản đối soát thực tế với Viettel | AW13: Số liệu theo biên bản đối soát thực tế với Viettel | BH13: Số liệu theo biên bản đối soát thực tế với Viettel | BS13: Số liệu theo biên bản đối soát thực tế với Viettel | CD13: Số liệu theo biên bản đối soát thực tế với Viettel | CO13: Số liệu theo biên bản đối soát thực tế với Viettel | CZ13: Số liệu theo biên bản đối soát thực tế với Viettel | DK13: Số liệu theo biên bản đối soát thực tế với Viettel | DV13: Số liệu theo biên bản đối soát thực tế với Viettel
E14: Doanh thu | G14: MT vượt | P14: Doanh thu | R14: MT vượt | AA14: Doanh thu | AC14: MT vượt | AL14: Doanh thu | AN14: MT vượt | AW14: Doanh thu | AY14: MT vượt | BH14: Doanh thu | BJ14: MT vượt | BS14: Doanh thu | BU14: MT vượt | CD14: Doanh thu | CF14: MT vượt | CO14: Doanh thu | CQ14: MT vượt | CZ14: Doanh thu | DB14: MT vượt | DK14: Doanh thu | DM14: MT vượt | DV14: Doanh thu | DX14: MT vượt
E15: Doanh thu hệ thống | F15: =R[-4]C[-4] -> 3551128896 | G15: MT hệ thống | H15: =R[-4]C[-5] -> 10 | P15: Doanh thu hệ thống | Q15: =R[-4]C[-4] -> 3551128896 | R15: MT hệ thống | S15: =R[-4]C[-5] -> 10 | AA15: Doanh thu hệ thống | AB15: =R[-4]C[-4] -> 12 | AC15: MT hệ thống | AD15: =R[-4]C[-5] -> 10 | AL15: Doanh thu hệ thống | AM15: =R[-4]C[-4] -> 12 | AN15: MT hệ thống | AO15: =R[-4]C[-5] -> 10 | AW15: Doanh thu hệ thống | AX15: =R[-4]C[-4] -> 12 | AY15: MT hệ thống | AZ15: =R[-4]C[-5] -> 10 | BH15: Doanh thu hệ thống | BI15: =R[-4]C[-4] -> 12 | BJ15: MT hệ thống | BK15: =R[-4]C[-5] -> 10 | BS15: Doanh thu hệ thống | BT15: =R[-4]C[-4] -> 12 | BU15: MT hệ thống | BV15: =R[-4]C[-5] -> 10 | CD15: Doanh thu hệ thống | CE15: =R[-4]C[-4] -> 12 | CF15: MT hệ thống | CG15: =R[-4]C[-5] -> 10 | CO15: Doanh thu hệ thống | CP15: =R[-4]C[-4] -> 12 | CQ15: MT hệ thống | CR15: =R[-4]C[-5] -> 10 | CZ15: Doanh thu hệ thống | DA15: =R[-4]C[-4] -> 12 | DB15: MT hệ thống | DC15: =R[-4]C[-5] -> 10 | DK15: Doanh thu hệ thống | DL15: =R[-4]C[-4] -> 13 | DM15: MT hệ thống | DN15: =R[-4]C[-5] -> 10 | DV15: Doanh thu hệ thống | DW15: =R[-4]C[-4] -> 12 | DX15: MT hệ thống | DY15: =R[-4]C[-5] -> 10
E16: Doanh thu thực tế | F16: 3500000000 | G16: MT thực tế | H16: 9 | P16: Doanh thu thực tế | Q16: 3500000000 | R16: MT thực tế | S16: 9 | AA16: Doanh thu thực tế | AB16: 3500000000 | AC16: MT thực tế | AD16: 9 | AL16: Doanh thu thực tế | AM16: 3500000000 | AN16: MT thực tế | AO16: 9 | AW16: Doanh thu thực tế | AX16: 3500000000 | AY16: MT thực tế | AZ16: 9 | BH16: Doanh thu thực tế | BI16: 3500000000 | BJ16: MT thực tế | BK16: 9 | BS16: Doanh thu thực tế | BT16: 3500000000 | BU16: MT thực tế | BV16: 9 | CD16: Doanh thu thực tế | CE16: 3500000000 | CF16: MT thực tế | CG16: 9 | CO16: Doanh thu thực tế | CP16: 3500000000 | CQ16: MT thực tế | CR16: 9 | CZ16: Doanh thu thực tế | DA16: 3500000000 | DB16: MT thực tế | DC16: 9 | DK16: Doanh thu thực tế | DL16: 3500000000 | DM16: MT thực tế | DN16: 9 | DV16: Doanh thu thực tế | DW16: 3500000000 | DX16: MT thực tế | DY16: 9
E17: DT QT/DT HT | F17: =R[-1]C/R[-2]C -> 0.9856020726091943 | G17: MT QT/ HT | H17: =R[-1]C/R[-2]C -> 0.9 | P17: DT QT/DT HT | Q17: =R[-1]C/R[-2]C -> 0.9856020726091943 | R17: MT QT/ HT | S17: =R[-1]C/R[-2]C -> 0.9 | AA17: DT QT/DT HT | AB17: =R[-1]C/R[-2]C -> 291666666.66666669 | AC17: MT QT/ HT | AD17: =R[-1]C/R[-2]C -> 0.9 | AL17: DT QT/DT HT | AM17: =R[-1]C/R[-2]C -> 291666666.66666669 | AN17: MT QT/ HT | AO17: =R[-1]C/R[-2]C -> 0.9 | AW17: DT QT/DT HT | AX17: =R[-1]C/R[-2]C -> 291666666.66666669 | AY17: MT QT/ HT | AZ17: =R[-1]C/R[-2]C -> 0.9 | BH17: DT QT/DT HT | BI17: =R[-1]C/R[-2]C -> 291666666.66666669 | BJ17: MT QT/ HT | BK17: =R[-1]C/R[-2]C -> 0.9 | BS17: DT QT/DT HT | BT17: =R[-1]C/R[-2]C -> 291666666.66666669 | BU17: MT QT/ HT | BV17: =R[-1]C/R[-2]C -> 0.9 | CD17: DT QT/DT HT | CE17: =R[-1]C/R[-2]C -> 291666666.66666669 | CF17: MT QT/ HT | CG17: =R[-1]C/R[-2]C -> 0.9 | CO17: DT QT/DT HT | CP17: =R[-1]C/R[-2]C -> 291666666.66666669 | CQ17: MT QT/ HT | CR17: =R[-1]C/R[-2]C -> 0.9 | CZ17: DT QT/DT HT | DA17: =R[-1]C/R[-2]C -> 291666666.66666669 | DB17: MT QT/ HT | DC17: =R[-1]C/R[-2]C -> 0.9 | DK17: DT QT/DT HT | DL17: =R[-1]C/R[-2]C -> 269230769.23076922 | DM17: MT QT/ HT | DN17: =R[-1]C/R[-2]C -> 0.9 | DV17: DT QT/DT HT | DW17: =R[-1]C/R[-2]C -> 291666666.66666669 | DX17: MT QT/ HT | DY17: =R[-1]C/R[-2]C -> 0.9
E18: Tỷ lệ thất thoát | F18: =100%-R[-1]C -> 1.4397927390805698E-2 | G18: Tỷ lệ chênh lệch | H18: =100%-R[-1]C -> 9.9999999999999978E-2 | P18: Tỷ lệ thất thoát | Q18: =100%-R[-1]C -> 1.4397927390805698E-2 | R18: Tỷ lệ chênh lệch | S18: =100%-R[-1]C -> 9.9999999999999978E-2 | AA18: Tỷ lệ thất thoát | AB18: =100%-R[-1]C -> -291666665.66666669 | AC18: Tỷ lệ chênh lệch | AD18: =100%-R[-1]C -> 9.9999999999999978E-2 | AL18: Tỷ lệ thất thoát | AM18: =100%-R[-1]C -> -291666665.66666669 | AN18: Tỷ lệ chênh lệch | AO18: =100%-R[-1]C -> 9.9999999999999978E-2 | AW18: Tỷ lệ thất thoát | AX18: =100%-R[-1]C -> -291666665.66666669 | AY18: Tỷ lệ chênh lệch | AZ18: =100%-R[-1]C -> 9.9999999999999978E-2 | BH18: Tỷ lệ thất thoát | BI18: =100%-R[-1]C -> -291666665.66666669 | BJ18: Tỷ lệ chênh lệch | BK18: =100%-R[-1]C -> 9.9999999999999978E-2 | BS18: Tỷ lệ thất thoát | BT18: =100%-R[-1]C -> -291666665.66666669 | BU18: Tỷ lệ chênh lệch | BV18: =100%-R[-1]C -> 9.9999999999999978E-2 | CD18: Tỷ lệ thất thoát | CE18: =100%-R[-1]C -> -291666665.66666669 | CF18: Tỷ lệ chênh lệch | CG18: =100%-R[-1]C -> 9.9999999999999978E-2 | CO18: Tỷ lệ thất thoát | CP18: =100%-R[-1]C -> -291666665.66666669 | CQ18: Tỷ lệ chênh lệch | CR18: =100%-R[-1]C -> 9.9999999999999978E-2 | CZ18: Tỷ lệ thất thoát | DA18: =100%-R[-1]C -> -291666665.66666669 | DB18: Tỷ lệ chênh lệch | DC18: =100%-R[-1]C -> 9.9999999999999978E-2 | DK18: Tỷ lệ thất thoát | DL18: =100%-R[-1]C -> -269230768.23076922 | DM18: Tỷ lệ chênh lệch | DN18: =100%-R[-1]C -> 9.9999999999999978E-2 | DV18: Tỷ lệ thất thoát | DW18: =100%-R[-1]C -> -291666665.66666669 | DX18: Tỷ lệ chênh lệch | DY18: =100%-R[-1]C -> 9.9999999999999978E-2
E19: Doanh thu khuyến khích | P19: Doanh thu khuyến khích | AA19: Doanh thu khuyến khích | AL19: Doanh thu khuyến khích | AW19: Doanh thu khuyến khích | BH19: Doanh thu khuyến khích | BS19: Doanh thu khuyến khích | CD19: Doanh thu khuyến khích | CO19: Doanh thu khuyến khích | CZ19: Doanh thu khuyến khích | DK19: Doanh thu khuyến khích | DV19: Doanh thu khuyến khích
A24: 6x66/VMS/2015
A25: Tháng 1 | L25: Tháng 2 | W25: Tháng 3 | AH25: Tháng 4 | AS25: Tháng 5 | BD25: Tháng 6 | BO25: Tháng 7 | BZ25: Tháng 8 | CK25: Tháng 9 | CV25: Tháng 10 | DG25: Tháng 11 | DR25: Tháng 12 | EC25: Lũy kế đến tháng báo cáo
A26: Tên đối tác | B26: Số liệu hệ thống/tạm tính | F26: Số liệu quyết toán theo biên bản đối soát | J26: C/lệch Quyết toán - Tạm tính | L26: Tên đối tác | M26: Số liệu hệ thống/tạm tính | Q26: Số liệu quyết toán theo biên bản đối soát | U26: C/lệch Quyết toán - Tạm tính | W26: Tên đối tác | X26: Số liệu hệ thống/tạm tính | AB26: Số liệu quyết toán theo biên bản đối soát | AF26: C/lệch Quyết toán - Tạm tính | AH26: Tên đối tác | AI26: Số liệu hệ thống/tạm tính | AM26: Số liệu quyết toán theo biên bản đối soát | AQ26: C/lệch Quyết toán - Tạm tính | AS26: Tên đối tác | AT26: Số liệu hệ thống/tạm tính | AX26: Số liệu quyết toán theo biên bản đối soát | BB26: C/lệch Quyết toán - Tạm tính | BD26: Tên đối tác | BE26: Số liệu hệ thống/tạm tính | BI26: Số liệu quyết toán theo biên bản đối soát | BM26: C/lệch Quyết toán - Tạm tính | BO26: Tên đối tác | BP26: Số liệu hệ thống/tạm tính | BT26: Số liệu quyết toán theo biên bản đối soát | BX26: C/lệch Quyết toán - Tạm tính | BZ26: Tên đối tác | CA26: Số liệu hệ thống/tạm tính | CE26: Số liệu quyết toán theo biên bản đối soát | CI26: C/lệch Quyết toán - Tạm tính | CK26: Tên đối tác | CL26: Số liệu hệ thống/tạm tính | CP26: Số liệu quyết toán theo biên bản đối soát | CT26: C/lệch Quyết toán - Tạm tính | CV26: Tên đối tác | CW26: Số liệu hệ thống/tạm tính | DA26: Số liệu quyết toán theo biên bản đối soát | DE26: C/lệch Quyết toán - Tạm tính | DG26: Tên đối tác | DH26: Số liệu hệ thống/tạm tính | DL26: Số liệu quyết toán theo biên bản đối soát | DP26: C/lệch Quyết toán - Tạm tính | DR26: Tên đối tác | DS26: Số liệu hệ thống/tạm tính | DW26: Số liệu quyết toán theo biên bản đối soát | EA26: C/lệch Quyết toán - Tạm tính | EC26: Tên đối tác | ED26: Số liệu hệ thống/tạm tính | EH26: Số liệu quyết toán theo biên bản đối soát | EL26: C/lệch Quyết toán - Tạm tính
B27: Doanh thu | C27: MT vượt | D27: Trả đối tác | E27: DT về đơn vị | F27: Doanh thu | G27: Trả đối tác | H27: MT | I27: DT về đơn vị | M27: Doanh thu | N27: MT vượt | O27: Trả đối tác | P27: DT về đơn vị | Q27: Doanh thu | R27: Trả đối tác | S27: MT | T27: DT về đơn vị | X27: Doanh thu | Y27: MT vượt | Z27: Trả đối tác | AA27: DT về đơn vị | AB27: Doanh thu | AC27: Trả đối tác | AD27: MT | AE27: DT về đơn vị | AI27: Doanh thu | AJ27: MT vượt | AK27: Trả đối tác | AL27: DT về đơn vị | AM27: Doanh thu | AN27: Trả đối tác | AO27: MT | AP27: DT về đơn vị | AT27: Doanh thu | AU27: MT vượt | AV27: Trả đối tác | AW27: DT về đơn vị | AX27: Doanh thu | AY27: Trả đối tác | AZ27: MT | BA27: DT về đơn vị | BE27: Doanh thu | BF27: MT vượt | BG27: Trả đối tác | BH27: DT về đơn vị | BI27: Doanh thu | BJ27: Trả đối tác | BK27: MT | BL27: DT về đơn vị | BP27: Doanh thu | BQ27: MT vượt | BR27: Trả đối tác | BS27: DT về đơn vị | BT27: Doanh thu | BU27: Trả đối tác | BV27: MT | BW27: DT về đơn vị | CA27: Doanh thu | CB27: MT vượt | CC27: Trả đối tác | CD27: DT về đơn vị | CE27: Doanh thu | CF27: Trả đối tác | CG27: MT | CH27: DT về đơn vị | CL27: Doanh thu | CM27: MT vượt | CN27: Trả đối tác | CO27: DT về đơn vị | CP27: Doanh thu | CQ27: Trả đối tác | CR27: MT | CS27: DT về đơn vị | CW27: Doanh thu | CX27: MT vượt | CY27: Trả đối tác | CZ27: DT về đơn vị | DA27: Doanh thu | DB27: Trả đối tác | DC27: MT | DD27: DT về đơn vị | DH27: Doanh thu | DI27: MT vượt | DJ27: Trả đối tác | DK27: DT về đơn vị | DL27: Doanh thu | DM27: Trả đối tác | DN27: MT | DO27: DT về đơn vị | DS27: Doanh thu | DT27: MT vượt | DU27: Trả đối tác | DV27: DT về đơn vị | DW27: Doanh thu | DX27: Trả đối tác | DY27: MT | DZ27: DT về đơn vị | ED27: Doanh thu | EE27: MT vượt | EF27: Trả đối tác | EG27: DT về đơn vị | EH27: Doanh thu | EI27: Trả đối tác | EJ27: MT | EK27: DT về đơn vị
B28: (1) | C28: (2) | D28: (3) = (1) *15% | E28: (4) = (1) - (3) - (2) | F28: (5) | G28: (6) | H28: (7) | I28: (8) = (5) - (6) - (7) | J28: (9) = (4) - (8) | M28: (1) | N28: (2) = ( MO - MT) *91 | O28: (3) = (1) *15% | P28: (4) = (1) - (3) - (2) | Q28: (5) | R28: (6) | S28: (7) | T28: (8) = (5) - (6) - (7) | U28: (9) = (4) - (8) | X28: (1) | Y28: (2) = ( MO - MT) *91 | Z28: (3) = (1) *15% | AA28: (4) = (1) - (3) - (2) | AB28: (5) | AC28: (6) | AD28: (7) | AE28: (8) = (5) - (6) - (7) | AF28: (9) = (4) - (8) | AI28: (1) | AJ28: (2) = ( MO - MT) *91 | AK28: (3) = (1) *15% | AL28: (4) = (1) - (3) - (2) | AM28: (5) | AN28: (6) | AO28: (7) | AP28: (8) = (5) - (6) - (7) | AQ28: (9) = (4) - (8) | AT28: (1) | AU28: (2) = ( MO - MT) *91 | AV28: (3) = (1) *15% | AW28: (4) = (1) - (3) - (2) | AX28: (5) | AY28: (6) | AZ28: (7) | BA28: (8) = (5) - (6) - (7) | BB28: (9) = (4) - (8) | BE28: (1) | BF28: (2) = ( MO - MT) *91 | BG28: (3) = (1) *15% | BH28: (4) = (1) - (3) - (2) | BI28: (5) | BJ28: (6) | BK28: (7) | BL28: (8) = (5) - (6) - (7) | BM28: (9) = (4) - (8) | BP28: (1) | BQ28: (2) | BR28: (3) = (1) *15% | BS28: (4) = (1) - (3) - (2) | BT28: (5) | BU28: (6) | BV28: (7) | BW28: (8) = (5) - (6) - (7) | BX28: (9) = (4) - (8) | CA28: (1) | CB28: (2) = ( MO - MT) *91 | CC28: (3) = (1) *15% | CD28: (4) = (1) - (3) - (2) | CE28: (5) | CF28: (6) | CG28: (7) | CH28: (8) = (5) - (6) - (7) | CI28: (9) = (4) - (8) | CL28: (1) | CM28: (2) = ( MO - MT) *91 | CN28: (3) = (1) *15% | CO28: (4) = (1) - (3) - (2) | CP28: (5) | CQ28: (6) | CR28: (7) | CS28: (8) = (5) - (6) - (7) | CT28: (9) = (4) - (8) | CW28: (1) | CX28: (2) = ( MO - MT) *91 | CY28: (3) = (1) *15% | CZ28: (4) = (1) - (3) - (2) | DA28: (5) | DB28: (6) | DC28: (7) | DD28: (8) = (5) - (6) - (7) | DE28: (9) = (4) - (8) | DH28: (1) | DI28: (2) = ( MO - MT) *91 | DJ28: (3) = (1) *15% | DK28: (4) = (1) - (3) - (2) | DL28: (5) | DM28: (6) | DN28: (7) | DO28: (8) = (5) - (6) - (7) | DP28: (9) = (4) - (8) | DS28: (1) | DT28: (2) = ( MO - MT) *91 | DU28: (3) = (1) *15% | DV28: (4) = (1) - (3) - (2) | DW28: (5) | DX28: (6) | DY28: (7) | DZ28: (8) = (5) - (6) - (7) | EA28: (9) = (4) - (8) | ED28: (1) | EE28: (2) = ( MO - MT) *91 | EF28: (3) = (1) *15% | EG28: (4) = (1) - (3) - (2) | EH28: (5) | EI28: (6) | EJ28: (7) | EK28: (8) = (5) - (6) - (7) | EL28: (9) = (4) - (8)
A29: SUBCPS | B29: 13282027 | C29: 426334 | D29: 664101 | E29: =RC[-3]-RC[-1]-RC[-2] ->  | F29: =R40C6*RC[-4] ->  | G29: =RC[-1]*5% ->  | H29: =R40C8*RC[-5] ->  | I29: =RC[-3]-RC[-2]-RC[-1] ->  | J29: =RC[-1]-RC[-5] ->  | L29: SUBCPS | M29: 10426616 | N29: 1244151 | O29: 521331 | P29: =RC[-3]-RC[-1]-RC[-2] -> 2467006.9 | Q29: =R40C17*RC[-4] -> 3000383.6278659259 | R29: =RC[-1]*5% -> 450057.54417988885 | S29: =R40C19*RC[-5] -> 108517.5 | T29: =RC[-3]-RC[-2]-RC[-1] -> 2441808.583686037 | U29: =RC[-1]-RC[-5] -> -25198.316313962918 | W29: SUBCPS | X29: 12623156 | Y29: 316770 | Z29: 631158 | AA29: =RC[-3]-RC[-1]-RC[-2] -> 0 | AB29: =R40C28*RC[-4] -> 875000000 | AC29: =RC[-1]*5% -> 131250000 | AD29: =R40C19*RC[-5] -> 1.8 | AE29: =RC[-3]-RC[-2]-RC[-1] -> 743749998.20000005 | AF29: =RC[-1]-RC[-5] -> 743749998.20000005 | AH29: SUBCPS | AI29: 11215410 | AJ29: 279096 | AK29: 560770 | AL29: =RC[-3]-RC[-1]-RC[-2] -> 0.54999999999999982 | AM29: =R40C39*RC[-4] -> 875000000 | AN29: =RC[-1]*5% -> 131250000 | AO29: =R40C19*RC[-5] -> 1.8 | AP29: =RC[-3]-RC[-2]-RC[-1] -> 743749998.20000005 | AQ29: =RC[-1]-RC[-5] -> 743749997.6500001 | AS29: SUBCPS | AT29: 11524910 | AU29: 289198 | AV29: 576246 | AW29: =RC[-3]-RC[-1]-RC[-2] -> 0.54999999999999982 | AX29: =R40C50*RC[-4] -> 875000000 | AY29: =RC[-1]*5% -> 131250000 | AZ29: =R40C19*RC[-5] -> 1.8 | BA29: =RC[-3]-RC[-2]-RC[-1] -> 743749998.20000005 | BB29: =RC[-1]-RC[-5] -> 743749997.6500001 | BD29: SUBCPS | BE29: 11615099 | BF29: 297388 | BG29: 580755 | BH29: =RC[-3]-RC[-1]-RC[-2] -> 0.54999999999999982 | BI29: =R40C61*RC[-4] -> 875000000 | BJ29: =RC[-1]*5% -> 131250000 | BK29: =R40C19*RC[-5] -> 1.8 | BL29: =RC[-3]-RC[-2]-RC[-1] -> 743749998.20000005 | BM29: =RC[-1]-RC[-5] -> 743749997.6500001 | BO29: SUBCPS | BP29: 0 | BQ29: 0 | BR29: 0 | BS29: =RC[-3]-RC[-1]-RC[-2] -> 0.54999999999999982 | BT29: =R40C72*RC[-4] -> 875000000 | BU29: =RC[-1]*5% -> 131250000 | BV29: =R40C8*RC[-5] -> 1.8 | BW29: =RC[-3]-RC[-2]-RC[-1] -> 743749998.20000005 | BX29: =RC[-1]-RC[-5] -> 743749997.6500001 | BZ29: SUBCPS | CA29: 0 | CB29: 0 | CC29: 0 | CD29: =RC[-3]-RC[-1]-RC[-2] -> 0.54999999999999982 | CE29: =R40C83*RC[-4] -> 875000000 | CF29: =RC[-1]*5% -> 131250000 | CG29: =R40C19*RC[-5] -> 1.8 | CH29: =RC[-3]-RC[-2]-RC[-1] -> 743749998.20000005 | CI29: =RC[-1]-RC[-5] -> 743749997.6500001 | CK29: SUBCPS | CL29: 0 | CM29: 0 | CN29: 0 | CO29: =RC[-3]-RC[-1]-RC[-2] -> 0.54999999999999982 | CP29: =R40C94*RC[-4] -> 875000000 | CQ29: =RC[-1]*5% -> 131250000 | CR29: =R40C19*RC[-5] -> 1.8 | CS29: =RC[-3]-RC[-2]-RC[-1] -> 743749998.20000005 | CT29: =RC[-1]-RC[-5] -> 743749997.6500001 | CV29: SUBCPS | CW29: 0 | CX29: 0 | CY29: 0 | CZ29: =RC[-3]-RC[-1]-RC[-2] -> 0.54999999999999982 | DA29: =R40C105*RC[-4] -> 875000000 | DB29: =RC[-1]*5% -> 131250000 | DC29: =R40C19*RC[-5] -> 1.8 | DD29: =RC[-3]-RC[-2]-RC[-1] -> 743749998.20000005 | DE29: =RC[-1]-RC[-5] -> 743749997.6500001 | DG29: SUBCPS | DH29: 0 | DI29: 0 | DJ29: 0 | DK29: =RC[-3]-RC[-1]-RC[-2] -> 0.54999999999999982 | DL29: =R40C116*RC[-4] -> 807692307.69230771 | DM29: =RC[-1]*5% -> 121153846.15384614 | DN29: =R40C19*RC[-5] -> 1.8 | DO29: =RC[-3]-RC[-2]-RC[-1] -> 686538459.73846161 | DP29: =RC[-1]-RC[-5] -> 686538459.18846166 | DR29: SUBCPS | DS29: 0 | DT29: 0 | DU29: 0 | DV29: =RC[-3]-RC[-1]-RC[-2] -> 0.54999999999999982 | DW29: =R40C127*RC[-4] -> 875000000 | DX29: =RC[-1]*5% -> 131250000 | DY29: =R40C19*RC[-5] -> 1.8 | DZ29: =RC[-3]-RC[-2]-RC[-1] -> 743749998.20000005 | EA29: =RC[-1]-RC[-5] -> 743749997.6500001 | EC29: SUBCPS | ED29: =RC[-132]+RC[-121]+RC[-110]+RC[-99]+RC[-88]+RC[-77]+RC[-66]+RC[-55]+RC[-44]+RC[-33]+RC[-22]+RC[-11] ->  | EE29: =RC[-132]+RC[-121]+RC[-110]+RC[-99]+RC[-88]+RC[-77]+RC[-66]+RC[-55]+RC[-44]+RC[-33]+RC[-22]+RC[-11] ->  | EF29: =RC[-132]+RC[-121]+RC[-110]+RC[-99]+RC[-88]+RC[-77]+RC[-66]+RC[-55]+RC[-44]+RC[-33]+RC[-22]+RC[-11] ->  | EG29: =RC[-132]+RC[-121]+RC[-110]+RC[-99]+RC[-88]+RC[-77]+RC[-66]+RC[-55]+RC[-44]+RC[-33]+RC[-22]+RC[-11] ->  | EH29: =RC[-132]+RC[-121]+RC[-110]+RC[-99]+RC[-88]+RC[-77]+RC[-66]+RC[-55]+RC[-44]+RC[-33]+RC[-22]+RC[-11] ->  | EI29: =RC[-132]+RC[-121]+RC[-110]+RC[-99]+RC[-88]+RC[-77]+RC[-66]+RC[-55]+RC[-44]+RC[-33]+RC[-22]+RC[-11] ->  | EJ29: =RC[-132]+RC[-121]+RC[-110]+RC[-99]+RC[-88]+RC[-77]+RC[-66]+RC[-55]+RC[-44]+RC[-33]+RC[-22]+RC[-11] ->  | EK29: =RC[-132]+RC[-121]+RC[-110]+RC[-99]+RC[-88]+RC[-77]+RC[-66]+RC[-55]+RC[-44]+RC[-33]+RC[-22]+RC[-11] ->  | EL29: =RC[-132]+RC[-121]+RC[-110]+RC[-99]+RC[-88]+RC[-77]+RC[-66]+RC[-55]+RC[-44]+RC[-33]+RC[-22]+RC[-11] -> 
A30: LUCKY_FONE | B30: 12099201 | C30: 1594568 | D30: 604960 | E30: =RC[-3]-RC[-1]-RC[-2] ->  | F30: =R40C6*RC[-4] ->  | G30: =RC[-1]*5% ->  | H30: =R40C8*RC[-5] ->  | I30: =RC[-3]-RC[-2]-RC[-1] ->  | J30: =RC[-1]-RC[-5] ->  | L30: LUCKY_FONE | M30: 9384416 | N30: 1086813 | O30: 469221 | P30: =RC[-3]-RC[-1]-RC[-2] -> 2467006.9 | Q30: =R40C17*RC[-4] -> 3000383.6278659259 | R30: =RC[-1]*5% -> 450057.54417988885 | S30: =R40C19*RC[-5] -> 108517.5 | T30: =RC[-3]-RC[-2]-RC[-1] -> 2441808.583686037 | U30: =RC[-1]-RC[-5] -> -25198.316313962918 | W30: LUCKY_FONE | X30: 10501025 | Y30: 1253343 | Z30: 525051 | AA30: =RC[-3]-RC[-1]-RC[-2] -> 0 | AB30: =R40C28*RC[-4] -> 875000000 | AC30: =RC[-1]*5% -> 131250000 | AD30: =R40C19*RC[-5] -> 1.8 | AE30: =RC[-3]-RC[-2]-RC[-1] -> 743749998.20000005 | AF30: =RC[-1]-RC[-5] -> 743749998.20000005 | AH30: LUCKY_FONE | AI30: 9884200 | AJ30: 1168804 | AK30: 494210 | AL30: =RC[-3]-RC[-1]-RC[-2] -> 0.54999999999999982 | AM30: =R40C39*RC[-4] -> 875000000 | AN30: =RC[-1]*5% -> 131250000 | AO30: =R40C19*RC[-5] -> 1.8 | AP30: =RC[-3]-RC[-2]-RC[-1] -> 743749998.20000005 | AQ30: =RC[-1]-RC[-5] -> 743749997.6500001 | AS30: LUCKY_FONE | AT30: 10242272 | AU30: 1184638 | AV30: 512114 | AW30: =RC[-3]-RC[-1]-RC[-2] -> 0.54999999999999982 | AX30: =R40C50*RC[-4] -> 875000000 | AY30: =RC[-1]*5% -> 131250000 | AZ30: =R40C19*RC[-5] -> 1.8 | BA30: =RC[-3]-RC[-2]-RC[-1] -> 743749998.20000005 | BB30: =RC[-1]-RC[-5] -> 743749997.6500001 | BD30: LUCKY_FONE | BE30: 9125365 | BF30: 1143779 | BG30: 456268 | BH30: =RC[-3]-RC[-1]-RC[-2] -> 0.54999999999999982 | BI30: =R40C61*RC[-4] -> 875000000 | BJ30: =RC[-1]*5% -> 131250000 | BK30: =R40C19*RC[-5] -> 1.8 | BL30: =RC[-3]-RC[-2]-RC[-1] -> 743749998.20000005 | BM30: =RC[-1]-RC[-5] -> 743749997.6500001 | BO30: LUCKY_FONE | BP30: 0 | BQ30: 0 | BR30: 0 | BS30: =RC[-3]-RC[-1]-RC[-2] -> 0.54999999999999982 | BT30: =R40C72*RC[-4] -> 875000000 | BU30: =RC[-1]*5% -> 131250000 | BV30: =R40C8*RC[-5] -> 1.8 | BW30: =RC[-3]-RC[-2]-RC[-1] -> 743749998.20000005 | BX30: =RC[-1]-RC[-5] -> 743749997.6500001 | BZ30: LUCKY_FONE | CA30: 0 | CB30: 0 | CC30: 0 | CD30: =RC[-3]-RC[-1]-RC[-2] -> 0.54999999999999982 | CE30: =R40C83*RC[-4] -> 875000000 | CF30: =RC[-1]*5% -> 131250000 | CG30: =R40C19*RC[-5] -> 1.8 | CH30: =RC[-3]-RC[-2]-RC[-1] -> 743749998.20000005 | CI30: =RC[-1]-RC[-5] -> 743749997.6500001 | CK30: LUCKY_FONE | CL30: 0 | CM30: 0 | CN30: 0 | CO30: =RC[-3]-RC[-1]-RC[-2] -> 0.54999999999999982 | CP30: =R40C94*RC[-4] -> 875000000 | CQ30: =RC[-1]*5% -> 131250000 | CR30: =R40C19*RC[-5] -> 1.8 | CS30: =RC[-3]-RC[-2]-RC[-1] -> 743749998.20000005 | CT30: =RC[-1]-RC[-5] -> 743749997.6500001 | CV30: LUCKY_FONE | CW30: 0 | CX30: 0 | CY30: 0 | CZ30: =RC[-3]-RC[-1]-RC[-2] -> 0.54999999999999982 | DA30: =R40C105*RC[-4] -> 875000000 | DB30: =RC[-1]*5% -> 131250000 | DC30: =R40C19*RC[-5] -> 1.8 | DD30: =RC[-3]-RC[-2]-RC[-1] -> 743749998.20000005 | DE30: =RC[-1]-RC[-5] -> 743749997.6500001 | DG30: LUCKY_FONE | DH30: 0 | DI30: 0 | DJ30: 0 | DK30: =RC[-3]-RC[-1]-RC[-2] -> 0.54999999999999982 | DL30: =R40C116*RC[-4] -> 807692307.69230771 | DM30: =RC[-1]*5% -> 121153846.15384614 | DN30: =R40C19*RC[-5] -> 1.8 | DO30: =RC[-3]-RC[-2]-RC[-1] -> 686538459.73846161 | DP30: =RC[-1]-RC[-5] -> 686538459.18846166 | DR30: LUCKY_FONE | DS30: 0 | DT30: 0 | DU30: 0 | DV30: =RC[-3]-RC[-1]-RC[-2] -> 0.54999999999999982 | DW30: =R40C127*RC[-4] -> 875000000 | DX30: =RC[-1]*5% -> 131250000 | DY30: =R40C19*RC[-5] -> 1.8 | DZ30: =RC[-3]-RC[-2]-RC[-1] -> 743749998.20000005 | EA30: =RC[-1]-RC[-5] -> 743749997.6500001 | EC30: LUCKY_FONE | ED30: =RC[-132]+RC[-121]+RC[-110]+RC[-99]+RC[-88]+RC[-77]+RC[-66]+RC[-55]+RC[-44]+RC[-33]+RC[-22]+RC[-11] ->  | EE30: =RC[-132]+RC[-121]+RC[-110]+RC[-99]+RC[-88]+RC[-77]+RC[-66]+RC[-55]+RC[-44]+RC[-33]+RC[-22]+RC[-11] ->  | EF30: =RC[-132]+RC[-121]+RC[-110]+RC[-99]+RC[-88]+RC[-77]+RC[-66]+RC[-55]+RC[-44]+RC[-33]+RC[-22]+RC[-11] ->  | EG30: =RC[-132]+RC[-121]+RC[-110]+RC[-99]+RC[-88]+RC[-77]+RC[-66]+RC[-55]+RC[-44]+RC[-33]+RC[-22]+RC[-11] ->  | EH30: =RC[-132]+RC[-121]+RC[-110]+RC[-99]+RC[-88]+RC[-77]+RC[-66]+RC[-55]+RC[-44]+RC[-33]+RC[-22]+RC[-11] ->  | EI30: =RC[-132]+RC[-121]+RC[-110]+RC[-99]+RC[-88]+RC[-77]+RC[-66]+RC[-55]+RC[-44]+RC[-33]+RC[-22]+RC[-11] ->  | EJ30: =RC[-132]+RC[-121]+RC[-110]+RC[-99]+RC[-88]+RC[-77]+RC[-66]+RC[-55]+RC[-44]+RC[-33]+RC[-22]+RC[-11] ->  | EK30: =RC[-132]+RC[-121]+RC[-110]+RC[-99]+RC[-88]+RC[-77]+RC[-66]+RC[-55]+RC[-44]+RC[-33]+RC[-22]+RC[-11] ->  | EL30: =RC[-132]+RC[-121]+RC[-110]+RC[-99]+RC[-88]+RC[-77]+RC[-66]+RC[-55]+RC[-44]+RC[-33]+RC[-22]+RC[-11] -> 
A31: TT PTKD | B31: 1276925 | C31: 8288339 | D31: 63846 | E31: =RC[-3]-RC[-1]-RC[-2] ->  | F31: =R40C6*RC[-4] ->  | G31: =RC[-1]*5% ->  | H31: =R40C8*RC[-5] ->  | I31: =RC[-3]-RC[-2]-RC[-1] ->  | J31: =RC[-1]-RC[-5] ->  | L31: TT PTKD | M31: 1607052 | N31: 9445804 | O31: 80353 | P31: =RC[-3]-RC[-1]-RC[-2] -> 2467006.9 | Q31: =R40C17*RC[-4] -> 3000383.6278659259 | R31: =RC[-1]*5% -> 450057.54417988885 | S31: =R40C19*RC[-5] -> 108517.5 | T31: =RC[-3]-RC[-2]-RC[-1] -> 2441808.583686037 | U31: =RC[-1]-RC[-5] -> -25198.316313962918 | W31: TT PTKD | X31: 1290928 | Y31: 9893980 | Z31: 64546 | AA31: =RC[-3]-RC[-1]-RC[-2] -> 0 | AB31: =R40C28*RC[-4] -> 875000000 | AC31: =RC[-1]*5% -> 131250000 | AD31: =R40C19*RC[-5] -> 1.8 | AE31: =RC[-3]-RC[-2]-RC[-1] -> 743749998.20000005 | AF31: =RC[-1]-RC[-5] -> 743749998.20000005 | AH31: TT PTKD | AI31: 1068758 | AJ31: 8313638 | AK31: 53438 | AL31: =RC[-3]-RC[-1]-RC[-2] -> 0.54999999999999982 | AM31: =R40C39*RC[-4] -> 875000000 | AN31: =RC[-1]*5% -> 131250000 | AO31: =R40C19*RC[-5] -> 1.8 | AP31: =RC[-3]-RC[-2]-RC[-1] -> 743749998.20000005 | AQ31: =RC[-1]-RC[-5] -> 743749997.6500001 | AS31: TT PTKD | AT31: 725657 | AU31: 8887887 | AV31: 36283 | AW31: =RC[-3]-RC[-1]-RC[-2] -> 0.54999999999999982 | AX31: =R40C50*RC[-4] -> 875000000 | AY31: =RC[-1]*5% -> 131250000 | AZ31: =R40C19*RC[-5] -> 1.8 | BA31: =RC[-3]-RC[-2]-RC[-1] -> 743749998.20000005 | BB31: =RC[-1]-RC[-5] -> 743749997.6500001 | BD31: TT PTKD | BE31: 576817 | BF31: 8928647 | BG31: 28841 | BH31: =RC[-3]-RC[-1]-RC[-2] -> 0.54999999999999982 | BI31: =R40C61*RC[-4] -> 875000000 | BJ31: =RC[-1]*5% -> 131250000 | BK31: =R40C19*RC[-5] -> 1.8 | BL31: =RC[-3]-RC[-2]-RC[-1] -> 743749998.20000005 | BM31: =RC[-1]-RC[-5] -> 743749997.6500001 | BO31: TT PTKD | BP31: 0 | BQ31: 0 | BR31: 0 | BS31: =RC[-3]-RC[-1]-RC[-2] -> 0.54999999999999982 | BT31: =R40C72*RC[-4] -> 875000000 | BU31: =RC[-1]*5% -> 131250000 | BV31: =R40C8*RC[-5] -> 1.8 | BW31: =RC[-3]-RC[-2]-RC[-1] -> 743749998.20000005 | BX31: =RC[-1]-RC[-5] -> 743749997.6500001 | BZ31: TT PTKD | CA31: 0 | CB31: 0 | CC31: 0 | CD31: =RC[-3]-RC[-1]-RC[-2] -> 0.54999999999999982 | CE31: =R40C83*RC[-4] -> 875000000 | CF31: =RC[-1]*5% -> 131250000 | CG31: =R40C19*RC[-5] -> 1.8 | CH31: =RC[-3]-RC[-2]-RC[-1] -> 743749998.20000005 | CI31: =RC[-1]-RC[-5] -> 743749997.6500001 | CK31: TT PTKD | CL31: 0 | CM31: 0 | CN31: 0 | CO31: =RC[-3]-RC[-1]-RC[-2] -> 0.54999999999999982 | CP31: =R40C94*RC[-4] -> 875000000 | CQ31: =RC[-1]*5% -> 131250000 | CR31: =R40C19*RC[-5] -> 1.8 | CS31: =RC[-3]-RC[-2]-RC[-1] -> 743749998.20000005 | CT31: =RC[-1]-RC[-5] -> 743749997.6500001 | CV31: TT PTKD | CW31: 0 | CX31: 0 | CY31: 0 | CZ31: =RC[-3]-RC[-1]-RC[-2] -> 0.54999999999999982 | DA31: =R40C105*RC[-4] -> 875000000 | DB31: =RC[-1]*5% -> 131250000 | DC31: =R40C19*RC[-5] -> 1.8 | DD31: =RC[-3]-RC[-2]-RC[-1] -> 743749998.20000005 | DE31: =RC[-1]-RC[-5] -> 743749997.6500001 | DG31: TT PTKD | DH31: 0 | DI31: 0 | DJ31: 0 | DK31: =RC[-3]-RC[-1]-RC[-2] -> 0.54999999999999982 | DL31: =R40C116*RC[-4] -> 807692307.69230771 | DM31: =RC[-1]*5% -> 121153846.15384614 | DN31: =R40C19*RC[-5] -> 1.8 | DO31: =RC[-3]-RC[-2]-RC[-1] -> 686538459.73846161 | DP31: =RC[-1]-RC[-5] -> 686538459.18846166 | DR31: TT PTKD | DS31: 0 | DT31: 0 | DU31: 0 | DV31: =RC[-3]-RC[-1]-RC[-2] -> 0.54999999999999982 | DW31: =R40C127*RC[-4] -> 875000000 | DX31: =RC[-1]*5% -> 131250000 | DY31: =R40C19*RC[-5] -> 1.8 | DZ31: =RC[-3]-RC[-2]-RC[-1] -> 743749998.20000005 | EA31: =RC[-1]-RC[-5] -> 743749997.6500001 | EC31: TT PTKD | ED31: =RC[-132]+RC[-121]+RC[-110]+RC[-99]+RC[-88]+RC[-77]+RC[-66]+RC[-55]+RC[-44]+RC[-33]+RC[-22]+RC[-11] ->  | EE31: =RC[-132]+RC[-121]+RC[-110]+RC[-99]+RC[-88]+RC[-77]+RC[-66]+RC[-55]+RC[-44]+RC[-33]+RC[-22]+RC[-11] ->  | EF31: =RC[-132]+RC[-121]+RC[-110]+RC[-99]+RC[-88]+RC[-77]+RC[-66]+RC[-55]+RC[-44]+RC[-33]+RC[-22]+RC[-11] ->  | EG31: =RC[-132]+RC[-121]+RC[-110]+RC[-99]+RC[-88]+RC[-77]+RC[-66]+RC[-55]+RC[-44]+RC[-33]+RC[-22]+RC[-11] ->  | EH31: =RC[-132]+RC[-121]+RC[-110]+RC[-99]+RC[-88]+RC[-77]+RC[-66]+RC[-55]+RC[-44]+RC[-33]+RC[-22]+RC[-11] ->  | EI31: =RC[-132]+RC[-121]+RC[-110]+RC[-99]+RC[-88]+RC[-77]+RC[-66]+RC[-55]+RC[-44]+RC[-33]+RC[-22]+RC[-11] ->  | EJ31: =RC[-132]+RC[-121]+RC[-110]+RC[-99]+RC[-88]+RC[-77]+RC[-66]+RC[-55]+RC[-44]+RC[-33]+RC[-22]+RC[-11] ->  | EK31: =RC[-132]+RC[-121]+RC[-110]+RC[-99]+RC[-88]+RC[-77]+RC[-66]+RC[-55]+RC[-44]+RC[-33]+RC[-22]+RC[-11] ->  | EL31: =RC[-132]+RC[-121]+RC[-110]+RC[-99]+RC[-88]+RC[-77]+RC[-66]+RC[-55]+RC[-44]+RC[-33]+RC[-22]+RC[-11] -> 
A32: TT PTND | B32: 142144719 | C32: 9560688 | D32: 7107236 | E32: =RC[-3]-RC[-1]-RC[-2] ->  | F32: =R40C6*RC[-4] ->  | G32: =RC[-1]*5% ->  | H32: =R40C8*RC[-5] ->  | I32: =RC[-3]-RC[-2]-RC[-1] ->  | J32: =RC[-1]-RC[-5] ->  | L32: TT PTND | M32: 117223634 | N32: 8092360 | O32: 5861182 | P32: =RC[-3]-RC[-1]-RC[-2] -> 2467006.9 | Q32: =R40C17*RC[-4] -> 3000383.6278659259 | R32: =RC[-1]*5% -> 450057.54417988885 | S32: =R40C19*RC[-5] -> 108517.5 | T32: =RC[-3]-RC[-2]-RC[-1] -> 2441808.583686037 | U32: =RC[-1]-RC[-5] -> -25198.316313962918 | W32: TT PTND | X32: 138385646 | Y32: 10275834 | Z32: 6919282 | AA32: =RC[-3]-RC[-1]-RC[-2] -> 0 | AB32: =R40C28*RC[-4] -> 875000000 | AC32: =RC[-1]*5% -> 131250000 | AD32: =R40C19*RC[-5] -> 1.8 | AE32: =RC[-3]-RC[-2]-RC[-1] -> 743749998.20000005 | AF32: =RC[-1]-RC[-5] -> 743749998.20000005 | AH32: TT PTND | AI32: 125874692 | AJ32: 8517888 | AK32: 6293735 | AL32: =RC[-3]-RC[-1]-RC[-2] -> 0.54999999999999982 | AM32: =R40C39*RC[-4] -> 875000000 | AN32: =RC[-1]*5% -> 131250000 | AO32: =R40C19*RC[-5] -> 1.8 | AP32: =RC[-3]-RC[-2]-RC[-1] -> 743749998.20000005 | AQ32: =RC[-1]-RC[-5] -> 743749997.6500001 | AS32: TT PTND | AT32: 132984574 | AU32: 9144481 | AV32: 6649229 | AW32: =RC[-3]-RC[-1]-RC[-2] -> 0.54999999999999982 | AX32: =R40C50*RC[-4] -> 875000000 | AY32: =RC[-1]*5% -> 131250000 | AZ32: =R40C19*RC[-5] -> 1.8 | BA32: =RC[-3]-RC[-2]-RC[-1] -> 743749998.20000005 | BB32: =RC[-1]-RC[-5] -> 743749997.6500001 | BD32: TT PTND | BE32: 161505509 | BF32: 10040016 | BG32: 8075275 | BH32: =RC[-3]-RC[-1]-RC[-2] -> 0.54999999999999982 | BI32: =R40C61*RC[-4] -> 875000000 | BJ32: =RC[-1]*5% -> 131250000 | BK32: =R40C19*RC[-5] -> 1.8 | BL32: =RC[-3]-RC[-2]-RC[-1] -> 743749998.20000005 | BM32: =RC[-1]-RC[-5] -> 743749997.6500001 | BO32: TT PTND | BP32: 0 | BQ32: 0 | BR32: 0 | BS32: =RC[-3]-RC[-1]-RC[-2] -> 0.54999999999999982 | BT32: =R40C72*RC[-4] -> 875000000 | BU32: =RC[-1]*5% -> 131250000 | BV32: =R40C8*RC[-5] -> 1.8 | BW32: =RC[-3]-RC[-2]-RC[-1] -> 743749998.20000005 | BX32: =RC[-1]-RC[-5] -> 743749997.6500001 | BZ32: TT PTND | CA32: 0 | CB32: 0 | CC32: 0 | CD32: =RC[-3]-RC[-1]-RC[-2] -> 0.54999999999999982 | CE32: =R40C83*RC[-4] -> 875000000 | CF32: =RC[-1]*5% -> 131250000 | CG32: =R40C19*RC[-5] -> 1.8 | CH32: =RC[-3]-RC[-2]-RC[-1] -> 743749998.20000005 | CI32: =RC[-1]-RC[-5] -> 743749997.6500001 | CK32: TT PTND | CL32: 0 | CM32: 0 | CN32: 0 | CO32: =RC[-3]-RC[-1]-RC[-2] -> 0.54999999999999982 | CP32: =R40C94*RC[-4] -> 875000000 | CQ32: =RC[-1]*5% -> 131250000 | CR32: =R40C19*RC[-5] -> 1.8 | CS32: =RC[-3]-RC[-2]-RC[-1] -> 743749998.20000005 | CT32: =RC[-1]-RC[-5] -> 743749997.6500001 | CV32: TT PTND | CW32: 0 | CX32: 0 | CY32: 0 | CZ32: =RC[-3]-RC[-1]-RC[-2] -> 0.54999999999999982 | DA32: =R40C105*RC[-4] -> 875000000 | DB32: =RC[-1]*5% -> 131250000 | DC32: =R40C19*RC[-5] -> 1.8 | DD32: =RC[-3]-RC[-2]-RC[-1] -> 743749998.20000005 | DE32: =RC[-1]-RC[-5] -> 743749997.6500001 | DG32: TT PTND | DH32: 0 | DI32: 0 | DJ32: 0 | DK32: =RC[-3]-RC[-1]-RC[-2] -> 0.54999999999999982 | DL32: =R40C116*RC[-4] -> 807692307.69230771 | DM32: =RC[-1]*5% -> 121153846.15384614 | DN32: =R40C19*RC[-5] -> 1.8 | DO32: =RC[-3]-RC[-2]-RC[-1] -> 686538459.73846161 | DP32: =RC[-1]-RC[-5] -> 686538459.18846166 | DR32: TT PTND | DS32: 0 | DT32: 0 | DU32: 0 | DV32: =RC[-3]-RC[-1]-RC[-2] -> 0.54999999999999982 | DW32: =R40C127*RC[-4] -> 875000000 | DX32: =RC[-1]*5% -> 131250000 | DY32: =R40C19*RC[-5] -> 1.8 | DZ32: =RC[-3]-RC[-2]-RC[-1] -> 743749998.20000005 | EA32: =RC[-1]-RC[-5] -> 743749997.6500001 | EC32: TT PTND | ED32: =RC[-132]+RC[-121]+RC[-110]+RC[-99]+RC[-88]+RC[-77]+RC[-66]+RC[-55]+RC[-44]+RC[-33]+RC[-22]+RC[-11] ->  | EE32: =RC[-132]+RC[-121]+RC[-110]+RC[-99]+RC[-88]+RC[-77]+RC[-66]+RC[-55]+RC[-44]+RC[-33]+RC[-22]+RC[-11] ->  | EF32: =RC[-132]+RC[-121]+RC[-110]+RC[-99]+RC[-88]+RC[-77]+RC[-66]+RC[-55]+RC[-44]+RC[-33]+RC[-22]+RC[-11] ->  | EG32: =RC[-132]+RC[-121]+RC[-110]+RC[-99]+RC[-88]+RC[-77]+RC[-66]+RC[-55]+RC[-44]+RC[-33]+RC[-22]+RC[-11] ->  | EH32: =RC[-132]+RC[-121]+RC[-110]+RC[-99]+RC[-88]+RC[-77]+RC[-66]+RC[-55]+RC[-44]+RC[-33]+RC[-22]+RC[-11] ->  | EI32: =RC[-132]+RC[-121]+RC[-110]+RC[-99]+RC[-88]+RC[-77]+RC[-66]+RC[-55]+RC[-44]+RC[-33]+RC[-22]+RC[-11] ->  | EJ32: =RC[-132]+RC[-121]+RC[-110]+RC[-99]+RC[-88]+RC[-77]+RC[-66]+RC[-55]+RC[-44]+RC[-33]+RC[-22]+RC[-11] ->  | EK32: =RC[-132]+RC[-121]+RC[-110]+RC[-99]+RC[-88]+RC[-77]+RC[-66]+RC[-55]+RC[-44]+RC[-33]+RC[-22]+RC[-11] ->  | EL32: =RC[-132]+RC[-121]+RC[-110]+RC[-99]+RC[-88]+RC[-77]+RC[-66]+RC[-55]+RC[-44]+RC[-33]+RC[-22]+RC[-11] -> 
A33: HQ | B33: 2221153 | C33: 5579308 | D33: 111058 | E33: =RC[-3]-RC[-1]-RC[-2] ->  | F33: =R40C6*RC[-4] ->  | G33: =RC[-1]*5% ->  | H33: =R40C8*RC[-5] ->  | I33: =RC[-3]-RC[-2]-RC[-1] ->  | J33: =RC[-1]-RC[-5] ->  | L33: HQ | M33: 1768930 | N33: 4914641 | O33: 88446 | P33: =RC[-3]-RC[-1]-RC[-2] -> 2467006.9 | Q33: =R40C17*RC[-4] -> 3000383.6278659259 | R33: =RC[-1]*5% -> 450057.54417988885 | S33: =R40C19*RC[-5] -> 108517.5 | T33: =RC[-3]-RC[-2]-RC[-1] -> 2441808.583686037 | U33: =RC[-1]-RC[-5] -> -25198.316313962918 | W33: HQ | X33: 1552017 | Y33: 5077362 | Z33: 77601 | AA33: =RC[-3]-RC[-1]-RC[-2] -> 0 | AB33: =R40C28*RC[-4] -> 875000000 | AC33: =RC[-1]*5% -> 131250000 | AD33: =R40C19*RC[-5] -> 1.8 | AE33: =RC[-3]-RC[-2]-RC[-1] -> 743749998.20000005 | AF33: =RC[-1]-RC[-5] -> 743749998.20000005 | AH33: HQ | AI33: 1376413 | AJ33: 4738852 | AK33: 68821 | AL33: =RC[-3]-RC[-1]-RC[-2] -> 0.54999999999999982 | AM33: =R40C39*RC[-4] -> 875000000 | AN33: =RC[-1]*5% -> 131250000 | AO33: =R40C19*RC[-5] -> 1.8 | AP33: =RC[-3]-RC[-2]-RC[-1] -> 743749998.20000005 | AQ33: =RC[-1]-RC[-5] -> 743749997.6500001 | AS33: HQ | AT33: 1760017 | AU33: 5001718 | AV33: 88001 | AW33: =RC[-3]-RC[-1]-RC[-2] -> 0.54999999999999982 | AX33: =R40C50*RC[-4] -> 875000000 | AY33: =RC[-1]*5% -> 131250000 | AZ33: =R40C19*RC[-5] -> 1.8 | BA33: =RC[-3]-RC[-2]-RC[-1] -> 743749998.20000005 | BB33: =RC[-1]-RC[-5] -> 743749997.6500001 | BD33: HQ | BE33: 1339996 | BF33: 4651323 | BG33: 67000 | BH33: =RC[-3]-RC[-1]-RC[-2] -> 0.54999999999999982 | BI33: =R40C61*RC[-4] -> 875000000 | BJ33: =RC[-1]*5% -> 131250000 | BK33: =R40C19*RC[-5] -> 1.8 | BL33: =RC[-3]-RC[-2]-RC[-1] -> 743749998.20000005 | BM33: =RC[-1]-RC[-5] -> 743749997.6500001 | BO33: HQ | BP33: 0 | BQ33: 0 | BR33: 0 | BS33: =RC[-3]-RC[-1]-RC[-2] -> 0.54999999999999982 | BT33: =R40C72*RC[-4] -> 875000000 | BU33: =RC[-1]*5% -> 131250000 | BV33: =R40C8*RC[-5] -> 1.8 | BW33: =RC[-3]-RC[-2]-RC[-1] -> 743749998.20000005 | BX33: =RC[-1]-RC[-5] -> 743749997.6500001 | BZ33: HQ | CA33: 0 | CB33: 0 | CC33: 0 | CD33: =RC[-3]-RC[-1]-RC[-2] -> 0.54999999999999982 | CE33: =R40C83*RC[-4] -> 875000000 | CF33: =RC[-1]*5% -> 131250000 | CG33: =R40C19*RC[-5] -> 1.8 | CH33: =RC[-3]-RC[-2]-RC[-1] -> 743749998.20000005 | CI33: =RC[-1]-RC[-5] -> 743749997.6500001 | CK33: HQ | CL33: 0 | CM33: 0 | CN33: 0 | CO33: =RC[-3]-RC[-1]-RC[-2] -> 0.54999999999999982 | CP33: =R40C94*RC[-4] -> 875000000 | CQ33: =RC[-1]*5% -> 131250000 | CR33: =R40C19*RC[-5] -> 1.8 | CS33: =RC[-3]-RC[-2]-RC[-1] -> 743749998.20000005 | CT33: =RC[-1]-RC[-5] -> 743749997.6500001 | CV33: HQ | CW33: 0 | CX33: 0 | CY33: 0 | CZ33: =RC[-3]-RC[-1]-RC[-2] -> 0.54999999999999982 | DA33: =R40C105*RC[-4] -> 875000000 | DB33: =RC[-1]*5% -> 131250000 | DC33: =R40C19*RC[-5] -> 1.8 | DD33: =RC[-3]-RC[-2]-RC[-1] -> 743749998.20000005 | DE33: =RC[-1]-RC[-5] -> 743749997.6500001 | DG33: HQ | DH33: 0 | DI33: 0 | DJ33: 0 | DK33: =RC[-3]-RC[-1]-RC[-2] -> 0.54999999999999982 | DL33: =R40C116*RC[-4] -> 807692307.69230771 | DM33: =RC[-1]*5% -> 121153846.15384614 | DN33: =R40C19*RC[-5] -> 1.8 | DO33: =RC[-3]-RC[-2]-RC[-1] -> 686538459.73846161 | DP33: =RC[-1]-RC[-5] -> 686538459.18846166 | DR33: HQ | DS33: 0 | DT33: 0 | DU33: 0 | DV33: =RC[-3]-RC[-1]-RC[-2] -> 0.54999999999999982 | DW33: =R40C127*RC[-4] -> 875000000 | DX33: =RC[-1]*5% -> 131250000 | DY33: =R40C19*RC[-5] -> 1.8 | DZ33: =RC[-3]-RC[-2]-RC[-1] -> 743749998.20000005 | EA33: =RC[-1]-RC[-5] -> 743749997.6500001 | EC33: HQ | ED33: =RC[-132]+RC[-121]+RC[-110]+RC[-99]+RC[-88]+RC[-77]+RC[-66]+RC[-55]+RC[-44]+RC[-33]+RC[-22]+RC[-11] ->  | EE33: =RC[-132]+RC[-121]+RC[-110]+RC[-99]+RC[-88]+RC[-77]+RC[-66]+RC[-55]+RC[-44]+RC[-33]+RC[-22]+RC[-11] ->  | EF33: =RC[-132]+RC[-121]+RC[-110]+RC[-99]+RC[-88]+RC[-77]+RC[-66]+RC[-55]+RC[-44]+RC[-33]+RC[-22]+RC[-11] ->  | EG33: =RC[-132]+RC[-121]+RC[-110]+RC[-99]+RC[-88]+RC[-77]+RC[-66]+RC[-55]+RC[-44]+RC[-33]+RC[-22]+RC[-11] ->  | EH33: =RC[-132]+RC[-121]+RC[-110]+RC[-99]+RC[-88]+RC[-77]+RC[-66]+RC[-55]+RC[-44]+RC[-33]+RC[-22]+RC[-11] ->  | EI33: =RC[-132]+RC[-121]+RC[-110]+RC[-99]+RC[-88]+RC[-77]+RC[-66]+RC[-55]+RC[-44]+RC[-33]+RC[-22]+RC[-11] ->  | EJ33: =RC[-132]+RC[-121]+RC[-110]+RC[-99]+RC[-88]+RC[-77]+RC[-66]+RC[-55]+RC[-44]+RC[-33]+RC[-22]+RC[-11] ->  | EK33: =RC[-132]+RC[-121]+RC[-110]+RC[-99]+RC[-88]+RC[-77]+RC[-66]+RC[-55]+RC[-44]+RC[-33]+RC[-22]+RC[-11] ->  | EL33: =RC[-132]+RC[-121]+RC[-110]+RC[-99]+RC[-88]+RC[-77]+RC[-66]+RC[-55]+RC[-44]+RC[-33]+RC[-22]+RC[-11] -> 
A34: Tổng | B34: =SUM(R[-5]C:R[-1]C) -> 3551128896 | C34: =SUM(R[-5]C:R[-1]C) -> -619983 | D34: =SUM(R[-5]C:R[-1]C) -> 532669334.39999998 | E34: =SUM(R[-5]C:R[-1]C) -> 3019079544.5999999 | F34: =SUM(R[-5]C:R[-1]C) -> 3499999999.9999995 | G34: =SUM(R[-5]C:R[-1]C) -> 525000000 | H34: =SUM(R[-5]C:R[-1]C) -> -557984.69999999995 | I34: =SUM(R[-5]C:R[-1]C) -> 2975557984.6999998 | J34: =SUM(R[-5]C:R[-1]C) -> -43521559.899999849 | L34: Tổng | M34: =SUM(R[-5]C:R[-1]C) -> 3551128896 | N34: =SUM(R[-5]C:R[-1]C) -> -619983 | O34: =SUM(R[-5]C:R[-1]C) -> 532669334.39999998 | P34: =SUM(R[-5]C:R[-1]C) -> 3019079544.5999999 | Q34: =SUM(R[-5]C:R[-1]C) -> 3499999999.9999995 | R34: =SUM(R[-5]C:R[-1]C) -> 525000000 | S34: =SUM(R[-5]C:R[-1]C) -> -557984.69999999995 | T34: =SUM(R[-5]C:R[-1]C) -> 2975557984.6999998 | U34: =SUM(R[-5]C:R[-1]C) -> -43521559.899999849 | W34: Tổng | X34: =SUM(R[-5]C:R[-1]C) -> 12 | Y34: =SUM(R[-5]C:R[-1]C) -> 9 | Z34: =SUM(R[-5]C:R[-1]C) -> 2.35 | AA34: =SUM(R[-5]C:R[-1]C) -> 0.64999999999999991 | AB34: =SUM(R[-5]C:R[-1]C) -> 3500000000 | AC34: =SUM(R[-5]C:R[-1]C) -> 525000000 | AD34: =SUM(R[-5]C:R[-1]C) -> 8.1 | AE34: =SUM(R[-5]C:R[-1]C) -> 2974999991.9000006 | AF34: =SUM(R[-5]C:R[-1]C) -> 2974999991.2500005 | AH34: Tổng | AI34: =SUM(R[-5]C:R[-1]C) -> 12 | AJ34: =SUM(R[-5]C:R[-1]C) -> 9 | AK34: =SUM(R[-5]C:R[-1]C) -> 1.7999999999999998 | AL34: =SUM(R[-5]C:R[-1]C) -> 1.1999999999999997 | AM34: =SUM(R[-5]C:R[-1]C) -> 3500000000 | AN34: =SUM(R[-5]C:R[-1]C) -> 525000000 | AO34: =SUM(R[-5]C:R[-1]C) -> 8.1 | AP34: =SUM(R[-5]C:R[-1]C) -> 2974999991.9000006 | AQ34: =SUM(R[-5]C:R[-1]C) -> 2974999990.7000003 | AS34: Tổng | AT34: =SUM(R[-5]C:R[-1]C) -> 12 | AU34: =SUM(R[-5]C:R[-1]C) -> 9 | AV34: =SUM(R[-5]C:R[-1]C) -> 1.7999999999999998 | AW34: =SUM(R[-5]C:R[-1]C) -> 1.1999999999999997 | AX34: =SUM(R[-5]C:R[-1]C) -> 3500000000 | AY34: =SUM(R[-5]C:R[-1]C) -> 525000000 | AZ34: =SUM(R[-5]C:R[-1]C) -> 8.1 | BA34: =SUM(R[-5]C:R[-1]C) -> 2974999991.9000006 | BB34: =SUM(R[-5]C:R[-1]C) -> 2974999990.7000003 | BD34: Tổng | BE34: =SUM(R[-5]C:R[-1]C) -> 12 | BF34: =SUM(R[-5]C:R[-1]C) -> 9 | BG34: =SUM(R[-5]C:R[-1]C) -> 1.7999999999999998 | BH34: =SUM(R[-5]C:R[-1]C) -> 1.1999999999999997 | BI34: =SUM(R[-5]C:R[-1]C) -> 3500000000 | BJ34: =SUM(R[-5]C:R[-1]C) -> 525000000 | BK34: =SUM(R[-5]C:R[-1]C) -> 8.1 | BL34: =SUM(R[-5]C:R[-1]C) -> 2974999991.9000006 | BM34: =SUM(R[-5]C:R[-1]C) -> 2974999990.7000003 | BO34: Tổng | BP34: =SUM(R[-5]C:R[-1]C) -> 12 | BQ34: =SUM(R[-5]C:R[-1]C) -> 9 | BR34: =SUM(R[-5]C:R[-1]C) -> 1.7999999999999998 | BS34: =SUM(R[-5]C:R[-1]C) -> 1.1999999999999997 | BT34: =SUM(R[-5]C:R[-1]C) -> 3500000000 | BU34: =SUM(R[-5]C:R[-1]C) -> 525000000 | BV34: =SUM(R[-5]C:R[-1]C) -> 8.1 | BW34: =SUM(R[-5]C:R[-1]C) -> 2974999991.9000006 | BX34: =SUM(R[-5]C:R[-1]C) -> 2974999990.7000003 | BZ34: Tổng | CA34: =SUM(R[-5]C:R[-1]C) -> 12 | CB34: =SUM(R[-5]C:R[-1]C) -> 9 | CC34: =SUM(R[-5]C:R[-1]C) -> 1.7999999999999998 | CD34: =SUM(R[-5]C:R[-1]C) -> 1.1999999999999997 | CE34: =SUM(R[-5]C:R[-1]C) -> 3500000000 | CF34: =SUM(R[-5]C:R[-1]C) -> 525000000 | CG34: =SUM(R[-5]C:R[-1]C) -> 8.1 | CH34: =SUM(R[-5]C:R[-1]C) -> 2974999991.9000006 | CI34: =SUM(R[-5]C:R[-1]C) -> 2974999990.7000003 | CK34: Tổng | CL34: =SUM(R[-5]C:R[-1]C) -> 12 | CM34: =SUM(R[-5]C:R[-1]C) -> 9 | CN34: =SUM(R[-5]C:R[-1]C) -> 1.7999999999999998 | CO34: =SUM(R[-5]C:R[-1]C) -> 1.1999999999999997 | CP34: =SUM(R[-5]C:R[-1]C) -> 3500000000 | CQ34: =SUM(R[-5]C:R[-1]C) -> 525000000 | CR34: =SUM(R[-5]C:R[-1]C) -> 8.1 | CS34: =SUM(R[-5]C:R[-1]C) -> 2974999991.9000006 | CT34: =SUM(R[-5]C:R[-1]C) -> 2974999990.7000003 | CV34: Tổng | CW34: =SUM(R[-5]C:R[-1]C) -> 12 | CX34: =SUM(R[-5]C:R[-1]C) -> 9 | CY34: =SUM(R[-5]C:R[-1]C) -> 1.7999999999999998 | CZ34: =SUM(R[-5]C:R[-1]C) -> 1.1999999999999997 | DA34: =SUM(R[-5]C:R[-1]C) -> 3500000000 | DB34: =SUM(R[-5]C:R[-1]C) -> 525000000 | DC34: =SUM(R[-5]C:R[-1]C) -> 8.1 | DD34: =SUM(R[-5]C:R[-1]C) -> 2974999991.9000006 | DE34: =SUM(R[-5]C:R[-1]C) -> 2974999990.7000003 | DG34: Tổng | DH34: =SUM(R[-5]C:R[-1]C) -> 13 | DI34: =SUM(R[-5]C:R[-1]C) -> 9 | DJ34: =SUM(R[-5]C:R[-1]C) -> 1.9499999999999997 | DK34: =SUM(R[-5]C:R[-1]C) -> 2.0499999999999994 | DL34: =SUM(R[-5]C:R[-1]C) -> 3500000000 | DM34: =SUM(R[-5]C:R[-1]C) -> 525000000 | DN34: =SUM(R[-5]C:R[-1]C) -> 8.1 | DO34: =SUM(R[-5]C:R[-1]C) -> 2974999991.9000001 | DP34: =SUM(R[-5]C:R[-1]C) -> 2974999989.8500004 | DR34: Tổng | DS34: =SUM(R[-5]C:R[-1]C) -> 12 | DT34: =SUM(R[-5]C:R[-1]C) -> 9 | DU34: =SUM(R[-5]C:R[-1]C) -> 1.7999999999999998 | DV34: =SUM(R[-5]C:R[-1]C) -> 1.1999999999999997 | DW34: =SUM(R[-5]C:R[-1]C) -> 3500000000 | DX34: =SUM(R[-5]C:R[-1]C) -> 525000000 | DY34: =SUM(R[-5]C:R[-1]C) -> 8.1 | DZ34: =SUM(R[-5]C:R[-1]C) -> 2974999991.9000006 | EA34: =SUM(R[-5]C:R[-1]C) -> 2974999990.7000003 | EC34: Tổng | ED34: =SUM(R[-5]C:R[-1]C) -> 7102257913 | EE34: =SUM(R[-5]C:R[-1]C) -> -1239876 | EF34: =SUM(R[-5]C:R[-1]C) -> 1065338687.5000002 | EG34: =SUM(R[-5]C:R[-1]C) -> 6038159101.4999962 | EH34: =SUM(R[-5]C:R[-1]C) -> 42000000000 | EI34: =SUM(R[-5]C:R[-1]C) -> 6300000000 | EJ34: =SUM(R[-5]C:R[-1]C) -> -1115888.4000000006 | EK34: =SUM(R[-5]C:R[-1]C) -> 35701115888.400009 | EL34: =SUM(R[-5]C:R[-1]C) -> 29662956786.900002
E36: Số liệu theo biên bản đối soát thực tế với Viettel | P36: Số liệu theo biên bản đối soát thực tế với Viettel | AA36: Số liệu theo biên bản đối soát thực tế với Viettel | AL36: Số liệu theo biên bản đối soát thực tế với Viettel | AW36: Số liệu theo biên bản đối soát thực tế với Viettel | BH36: Số liệu theo biên bản đối soát thực tế với Viettel | BS36: Số liệu theo biên bản đối soát thực tế với Viettel | CD36: Số liệu theo biên bản đối soát thực tế với Viettel | CO36: Số liệu theo biên bản đối soát thực tế với Viettel | CZ36: Số liệu theo biên bản đối soát thực tế với Viettel | DK36: Số liệu theo biên bản đối soát thực tế với Viettel | DV36: Số liệu theo biên bản đối soát thực tế với Viettel
E37: Doanh thu | G37: MT vượt | P37: Doanh thu | R37: MT vượt | AA37: Doanh thu | AC37: MT vượt | AL37: Doanh thu | AN37: MT vượt | AW37: Doanh thu | AY37: MT vượt | BH37: Doanh thu | BJ37: MT vượt | BS37: Doanh thu | BU37: MT vượt | CD37: Doanh thu | CF37: MT vượt | CO37: Doanh thu | CQ37: MT vượt | CZ37: Doanh thu | DB37: MT vượt | DK37: Doanh thu | DM37: MT vượt | DV37: Doanh thu | DX37: MT vượt
E38: Doanh thu hệ thống | F38: =R[-4]C[-4] -> 3551128896 | G38: MT hệ thống | H38: =R[-4]C[-5] -> 10 | P38: Doanh thu hệ thống | Q38: =R[-4]C[-4] -> 3551128896 | R38: MT hệ thống | S38: =R[-4]C[-5] -> 10 | AA38: Doanh thu hệ thống | AB38: =R[-4]C[-4] -> 12 | AC38: MT hệ thống | AD38: =R[-4]C[-5] -> 10 | AL38: Doanh thu hệ thống | AM38: =R[-4]C[-4] -> 12 | AN38: MT hệ thống | AO38: =R[-4]C[-5] -> 10 | AW38: Doanh thu hệ thống | AX38: =R[-4]C[-4] -> 12 | AY38: MT hệ thống | AZ38: =R[-4]C[-5] -> 10 | BH38: Doanh thu hệ thống | BI38: =R[-4]C[-4] -> 12 | BJ38: MT hệ thống | BK38: =R[-4]C[-5] -> 10 | BS38: Doanh thu hệ thống | BT38: =R[-4]C[-4] -> 12 | BU38: MT hệ thống | BV38: =R[-4]C[-5] -> 10 | CD38: Doanh thu hệ thống | CE38: =R[-4]C[-4] -> 12 | CF38: MT hệ thống | CG38: =R[-4]C[-5] -> 10 | CO38: Doanh thu hệ thống | CP38: =R[-4]C[-4] -> 12 | CQ38: MT hệ thống | CR38: =R[-4]C[-5] -> 10 | CZ38: Doanh thu hệ thống | DA38: =R[-4]C[-4] -> 12 | DB38: MT hệ thống | DC38: =R[-4]C[-5] -> 10 | DK38: Doanh thu hệ thống | DL38: =R[-4]C[-4] -> 13 | DM38: MT hệ thống | DN38: =R[-4]C[-5] -> 10 | DV38: Doanh thu hệ thống | DW38: =R[-4]C[-4] -> 12 | DX38: MT hệ thống | DY38: =R[-4]C[-5] -> 10
E39: Doanh thu thực tế | F39: 3500000000 | G39: MT thực tế | H39: 9 | P39: Doanh thu thực tế | Q39: 3500000000 | R39: MT thực tế | S39: 9 | AA39: Doanh thu thực tế | AB39: 3500000000 | AC39: MT thực tế | AD39: 9 | AL39: Doanh thu thực tế | AM39: 3500000000 | AN39: MT thực tế | AO39: 9 | AW39: Doanh thu thực tế | AX39: 3500000000 | AY39: MT thực tế | AZ39: 9 | BH39: Doanh thu thực tế | BI39: 3500000000 | BJ39: MT thực tế | BK39: 9 | BS39: Doanh thu thực tế | BT39: 3500000000 | BU39: MT thực tế | BV39: 9 | CD39: Doanh thu thực tế | CE39: 3500000000 | CF39: MT thực tế | CG39: 9 | CO39: Doanh thu thực tế | CP39: 3500000000 | CQ39: MT thực tế | CR39: 9 | CZ39: Doanh thu thực tế | DA39: 3500000000 | DB39: MT thực tế | DC39: 9 | DK39: Doanh thu thực tế | DL39: 3500000000 | DM39: MT thực tế | DN39: 9 | DV39: Doanh thu thực tế | DW39: 3500000000 | DX39: MT thực tế | DY39: 9
E40: DT QT/DT HT | F40: =R[-1]C/R[-2]C -> 0.9856020726091943 | G40: MT QT/ HT | H40: =R[-1]C/R[-2]C -> 0.9 | P40: DT QT/DT HT | Q40: =R[-1]C/R[-2]C -> 0.9856020726091943 | R40: MT QT/ HT | S40: =R[-1]C/R[-2]C -> 0.9 | AA40: DT QT/DT HT | AB40: =R[-1]C/R[-2]C -> 291666666.66666669 | AC40: MT QT/ HT | AD40: =R[-1]C/R[-2]C -> 0.9 | AL40: DT QT/DT HT | AM40: =R[-1]C/R[-2]C -> 291666666.66666669 | AN40: MT QT/ HT | AO40: =R[-1]C/R[-2]C -> 0.9 | AW40: DT QT/DT HT | AX40: =R[-1]C/R[-2]C -> 291666666.66666669 | AY40: MT QT/ HT | AZ40: =R[-1]C/R[-2]C -> 0.9 | BH40: DT QT/DT HT | BI40: =R[-1]C/R[-2]C -> 291666666.66666669 | BJ40: MT QT/ HT | BK40: =R[-1]C/R[-2]C -> 0.9 | BS40: DT QT/DT HT | BT40: =R[-1]C/R[-2]C -> 291666666.66666669 | BU40: MT QT/ HT | BV40: =R[-1]C/R[-2]C -> 0.9 | CD40: DT QT/DT HT | CE40: =R[-1]C/R[-2]C -> 291666666.66666669 | CF40: MT QT/ HT | CG40: =R[-1]C/R[-2]C -> 0.9 | CO40: DT QT/DT HT | CP40: =R[-1]C/R[-2]C -> 291666666.66666669 | CQ40: MT QT/ HT | CR40: =R[-1]C/R[-2]C -> 0.9 | CZ40: DT QT/DT HT | DA40: =R[-1]C/R[-2]C -> 291666666.66666669 | DB40: MT QT/ HT | DC40: =R[-1]C/R[-2]C -> 0.9 | DK40: DT QT/DT HT | DL40: =R[-1]C/R[-2]C -> 269230769.23076922 | DM40: MT QT/ HT | DN40: =R[-1]C/R[-2]C -> 0.9 | DV40: DT QT/DT HT | DW40: =R[-1]C/R[-2]C -> 291666666.66666669 | DX40: MT QT/ HT | DY40: =R[-1]C/R[-2]C -> 0.9
E41: Tỷ lệ thất thoát | F41: =100%-R[-1]C -> 1.4397927390805698E-2 | G41: Tỷ lệ chênh lệch | H41: =100%-R[-1]C -> 9.9999999999999978E-2 | P41: Tỷ lệ thất thoát | Q41: =100%-R[-1]C -> 1.4397927390805698E-2 | R41: Tỷ lệ chênh lệch | S41: =100%-R[-1]C -> 9.9999999999999978E-2 | AA41: Tỷ lệ thất thoát | AB41: =100%-R[-1]C -> -291666665.66666669 | AC41: Tỷ lệ chênh lệch | AD41: =100%-R[-1]C -> 9.9999999999999978E-2 | AL41: Tỷ lệ thất thoát | AM41: =100%-R[-1]C -> -291666665.66666669 | AN41: Tỷ lệ chênh lệch | AO41: =100%-R[-1]C -> 9.9999999999999978E-2 | AW41: Tỷ lệ thất thoát | AX41: =100%-R[-1]C -> -291666665.66666669 | AY41: Tỷ lệ chênh lệch | AZ41: =100%-R[-1]C -> 9.9999999999999978E-2 | BH41: Tỷ lệ thất thoát | BI41: =100%-R[-1]C -> -291666665.66666669 | BJ41: Tỷ lệ chênh lệch | BK41: =100%-R[-1]C -> 9.9999999999999978E-2 | BS41: Tỷ lệ thất thoát | BT41: =100%-R[-1]C -> -291666665.66666669 | BU41: Tỷ lệ chênh lệch | BV41: =100%-R[-1]C -> 9.9999999999999978E-2 | CD41: Tỷ lệ thất thoát | CE41: =100%-R[-1]C -> -291666665.66666669 | CF41: Tỷ lệ chênh lệch | CG41: =100%-R[-1]C -> 9.9999999999999978E-2 | CO41: Tỷ lệ thất thoát | CP41: =100%-R[-1]C -> -291666665.66666669 | CQ41: Tỷ lệ chênh lệch | CR41: =100%-R[-1]C -> 9.9999999999999978E-2 | CZ41: Tỷ lệ thất thoát | DA41: =100%-R[-1]C -> -291666665.66666669 | DB41: Tỷ lệ chênh lệch | DC41: =100%-R[-1]C -> 9.9999999999999978E-2 | DK41: Tỷ lệ thất thoát | DL41: =100%-R[-1]C -> -269230768.23076922 | DM41: Tỷ lệ chênh lệch | DN41: =100%-R[-1]C -> 9.9999999999999978E-2 | DV41: Tỷ lệ thất thoát | DW41: =100%-R[-1]C -> -291666665.66666669 | DX41: Tỷ lệ chênh lệch | DY41: =100%-R[-1]C -> 9.9999999999999978E-2
E42: Doanh thu khuyến khích | P42: Doanh thu khuyến khích | AA42: Doanh thu khuyến khích | AL42: Doanh thu khuyến khích | AW42: Doanh thu khuyến khích | BH42: Doanh thu khuyến khích | BS42: Doanh thu khuyến khích | CD42: Doanh thu khuyến khích | CO42: Doanh thu khuyến khích | CZ42: Doanh thu khuyến khích | DK42: Doanh thu khuyến khích | DV42: Doanh thu khuyến khích
A47: 6x66/VNP/2015
A48: Tháng 1 | L48: Tháng 2 | W48: Tháng 3 | AH48: Tháng 4 | AS48: Tháng 5 | BD48: Tháng 6 | BO48: Tháng 7 | BZ48: Tháng 8 | CK48: Tháng 9 | CV48: Tháng 10 | DG48: Tháng 11 | DR48: Tháng 12 | EC48: Lũy kế đến tháng báo cáo
A49: Tên đối tác | B49: Số liệu hệ thống/tạm tính | F49: Số liệu quyết toán theo biên bản đối soát | J49: C/lệch Quyết toán - Tạm tính | L49: Tên đối tác | M49: Số liệu hệ thống/tạm tính | Q49: Số liệu quyết toán theo biên bản đối soát | U49: C/lệch Quyết toán - Tạm tính | W49: Tên đối tác | X49: Số liệu hệ thống/tạm tính | AB49: Số liệu quyết toán theo biên bản đối soát | AF49: C/lệch Quyết toán - Tạm tính | AH49: Tên đối tác | AI49: Số liệu hệ thống/tạm tính | AM49: Số liệu quyết toán theo biên bản đối soát | AQ49: C/lệch Quyết toán - Tạm tính | AS49: Tên đối tác | AT49: Số liệu hệ thống/tạm tính | AX49: Số liệu quyết toán theo biên bản đối soát | BB49: C/lệch Quyết toán - Tạm tính | BD49: Tên đối tác | BE49: Số liệu hệ thống/tạm tính | BI49: Số liệu quyết toán theo biên bản đối soát | BM49: C/lệch Quyết toán - Tạm tính | BO49: Tên đối tác | BP49: Số liệu hệ thống/tạm tính | BT49: Số liệu quyết toán theo biên bản đối soát | BX49: C/lệch Quyết toán - Tạm tính | BZ49: Tên đối tác | CA49: Số liệu hệ thống/tạm tính | CE49: Số liệu quyết toán theo biên bản đối soát | CI49: C/lệch Quyết toán - Tạm tính | CK49: Tên đối tác | CL49: Số liệu hệ thống/tạm tính | CP49: Số liệu quyết toán theo biên bản đối soát | CT49: C/lệch Quyết toán - Tạm tính | CV49: Tên đối tác | CW49: Số liệu hệ thống/tạm tính | DA49: Số liệu quyết toán theo biên bản đối soát | DE49: C/lệch Quyết toán - Tạm tính | DG49: Tên đối tác | DH49: Số liệu hệ thống/tạm tính | DL49: Số liệu quyết toán theo biên bản đối soát | DP49: C/lệch Quyết toán - Tạm tính | DR49: Tên đối tác | DS49: Số liệu hệ thống/tạm tính | DW49: Số liệu quyết toán theo biên bản đối soát | EA49: C/lệch Quyết toán - Tạm tính | EC49: Tên đối tác | ED49: Số liệu hệ thống/tạm tính | EH49: Số liệu quyết toán theo biên bản đối soát | EL49: C/lệch Quyết toán - Tạm tính
B50: Doanh thu | C50: MT vượt | D50: Trả đối tác | E50: DT về đơn vị | F50: Doanh thu | G50: Trả đối tác | H50: MT | I50: DT về đơn vị | M50: Doanh thu | N50: MT vượt | O50: Trả đối tác | P50: DT về đơn vị | Q50: Doanh thu | R50: Trả đối tác | S50: MT | T50: DT về đơn vị | X50: Doanh thu | Y50: MT vượt | Z50: Trả đối tác | AA50: DT về đơn vị | AB50: Doanh thu | AC50: Trả đối tác | AD50: MT | AE50: DT về đơn vị | AI50: Doanh thu | AJ50: MT vượt | AK50: Trả đối tác | AL50: DT về đơn vị | AM50: Doanh thu | AN50: Trả đối tác | AO50: MT | AP50: DT về đơn vị | AT50: Doanh thu | AU50: MT vượt | AV50: Trả đối tác | AW50: DT về đơn vị | AX50: Doanh thu | AY50: Trả đối tác | AZ50: MT | BA50: DT về đơn vị | BE50: Doanh thu | BF50: MT vượt | BG50: Trả đối tác | BH50: DT về đơn vị | BI50: Doanh thu | BJ50: Trả đối tác | BK50: MT | BL50: DT về đơn vị | BP50: Doanh thu | BQ50: MT vượt | BR50: Trả đối tác | BS50: DT về đơn vị | BT50: Doanh thu | BU50: Trả đối tác | BV50: MT | BW50: DT về đơn vị | CA50: Doanh thu | CB50: MT vượt | CC50: Trả đối tác | CD50: DT về đơn vị | CE50: Doanh thu | CF50: Trả đối tác | CG50: MT | CH50: DT về đơn vị | CL50: Doanh thu | CM50: MT vượt | CN50: Trả đối tác | CO50: DT về đơn vị | CP50: Doanh thu | CQ50: Trả đối tác | CR50: MT | CS50: DT về đơn vị | CW50: Doanh thu | CX50: MT vượt | CY50: Trả đối tác | CZ50: DT về đơn vị | DA50: Doanh thu | DB50: Trả đối tác | DC50: MT | DD50: DT về đơn vị | DH50: Doanh thu | DI50: MT vượt | DJ50: Trả đối tác | DK50: DT về đơn vị | DL50: Doanh thu | DM50: Trả đối tác | DN50: MT | DO50: DT về đơn vị | DS50: Doanh thu | DT50: MT vượt | DU50: Trả đối tác | DV50: DT về đơn vị | DW50: Doanh thu | DX50: Trả đối tác | DY50: MT | DZ50: DT về đơn vị | ED50: Doanh thu | EE50: MT vượt | EF50: Trả đối tác | EG50: DT về đơn vị | EH50: Doanh thu | EI50: Trả đối tác | EJ50: MT | EK50: DT về đơn vị
B51: (1) | C51: (2) | D51: (3) = (1) *15% | E51: (4) = (1) - (3) - (2) | F51: (5) | G51: (6) | H51: (7) | I51: (8) = (5) - (6) - (7) | J51: (9) = (4) - (8) | M51: (1) | N51: (2) = ( MO - MT) *91 | O51: (3) = (1) *15% | P51: (4) = (1) - (3) - (2) | Q51: (5) | R51: (6) | S51: (7) | T51: (8) = (5) - (6) - (7) | U51: (9) = (4) - (8) | X51: (1) | Y51: (2) = ( MO - MT) *91 | Z51: (3) = (1) *15% | AA51: (4) = (1) - (3) - (2) | AB51: (5) | AC51: (6) | AD51: (7) | AE51: (8) = (5) - (6) - (7) | AF51: (9) = (4) - (8) | AI51: (1) | AJ51: (2) = ( MO - MT) *91 | AK51: (3) = (1) *15% | AL51: (4) = (1) - (3) - (2) | AM51: (5) | AN51: (6) | AO51: (7) | AP51: (8) = (5) - (6) - (7) | AQ51: (9) = (4) - (8) | AT51: (1) | AU51: (2) = ( MO - MT) *91 | AV51: (3) = (1) *15% | AW51: (4) = (1) - (3) - (2) | AX51: (5) | AY51: (6) | AZ51: (7) | BA51: (8) = (5) - (6) - (7) | BB51: (9) = (4) - (8) | BE51: (1) | BF51: (2) = ( MO - MT) *91 | BG51: (3) = (1) *15% | BH51: (4) = (1) - (3) - (2) | BI51: (5) | BJ51: (6) | BK51: (7) | BL51: (8) = (5) - (6) - (7) | BM51: (9) = (4) - (8) | BP51: (1) | BQ51: (2) | BR51: (3) = (1) *15% | BS51: (4) = (1) - (3) - (2) | BT51: (5) | BU51: (6) | BV51: (7) | BW51: (8) = (5) - (6) - (7) | BX51: (9) = (4) - (8) | CA51: (1) | CB51: (2) = ( MO - MT) *91 | CC51: (3) = (1) *15% | CD51: (4) = (1) - (3) - (2) | CE51: (5) | CF51: (6) | CG51: (7) | CH51: (8) = (5) - (6) - (7) | CI51: (9) = (4) - (8) | CL51: (1) | CM51: (2) = ( MO - MT) *91 | CN51: (3) = (1) *15% | CO51: (4) = (1) - (3) - (2) | CP51: (5) | CQ51: (6) | CR51: (7) | CS51: (8) = (5) - (6) - (7) | CT51: (9) = (4) - (8) | CW51: (1) | CX51: (2) = ( MO - MT) *91 | CY51: (3) = (1) *15% | CZ51: (4) = (1) - (3) - (2) | DA51: (5) | DB51: (6) | DC51: (7) | DD51: (8) = (5) - (6) - (7) | DE51: (9) = (4) - (8) | DH51: (1) | DI51: (2) = ( MO - MT) *91 | DJ51: (3) = (1) *15% | DK51: (4) = (1) - (3) - (2) | DL51: (5) | DM51: (6) | DN51: (7) | DO51: (8) = (5) - (6) - (7) | DP51: (9) = (4) - (8) | DS51: (1) | DT51: (2) = ( MO - MT) *91 | DU51: (3) = (1) *15% | DV51: (4) = (1) - (3) - (2) | DW51: (5) | DX51: (6) | DY51: (7) | DZ51: (8) = (5) - (6) - (7) | EA51: (9) = (4) - (8) | ED51: (1) | EE51: (2) = ( MO - MT) *91 | EF51: (3) = (1) *15% | EG51: (4) = (1) - (3) - (2) | EH51: (5) | EI51: (6) | EJ51: (7) | EK51: (8) = (5) - (6) - (7) | EL51: (9) = (4) - (8)
A52: SUBCPS | B52: 3525064 | C52: 140686 | D52: 176253 | E52: =RC[-3]-RC[-1]-RC[-2] ->  | F52: =R63C6*RC[-4] ->  | G52: =RC[-1]*5% ->  | H52: =R63C8*RC[-5] ->  | I52: =RC[-3]-RC[-2]-RC[-1] ->  | J52: =RC[-1]-RC[-5] ->  | L52: SUBCPS | M52: 2268173 | N52: 164646 | O52: 113409 | P52: =RC[-3]-RC[-1]-RC[-2] -> 2467006.9 | Q52: =R63C17*RC[-4] -> 3000383.6278659259 | R52: =RC[-1]*5% -> 450057.54417988885 | S52: =R63C19*RC[-5] -> 108517.5 | T52: =RC[-3]-RC[-2]-RC[-1] -> 2441808.583686037 | U52: =RC[-1]-RC[-5] -> -25198.316313962918 | W52: SUBCPS | X52: 2382266 | Y52: 72527 | Z52: 119113 | AA52: =RC[-3]-RC[-1]-RC[-2] -> 0 | AB52: =R63C28*RC[-4] -> 875000000 | AC52: =RC[-1]*5% -> 131250000 | AD52: =R63C19*RC[-5] -> 1.8 | AE52: =RC[-3]-RC[-2]-RC[-1] -> 743749998.20000005 | AF52: =RC[-1]-RC[-5] -> 743749998.20000005 | AH52: SUBCPS | AI52: 3325871 | AJ52: 89089 | AK52: 166294 | AL52: =RC[-3]-RC[-1]-RC[-2] -> 0.54999999999999982 | AM52: =R63C39*RC[-4] -> 875000000 | AN52: =RC[-1]*5% -> 131250000 | AO52: =R63C19*RC[-5] -> 1.8 | AP52: =RC[-3]-RC[-2]-RC[-1] -> 743749998.20000005 | AQ52: =RC[-1]-RC[-5] -> 743749997.6500001 | AS52: SUBCPS | AT52: 2953678 | AU52: 85904 | AV52: 147684 | AW52: =RC[-3]-RC[-1]-RC[-2] -> 0.54999999999999982 | AX52: =R63C50*RC[-4] -> 875000000 | AY52: =RC[-1]*5% -> 131250000 | AZ52: =R63C19*RC[-5] -> 1.8 | BA52: =RC[-3]-RC[-2]-RC[-1] -> 743749998.20000005 | BB52: =RC[-1]-RC[-5] -> 743749997.6500001 | BD52: SUBCPS | BE52: 3254091 | BF52: 99463 | BG52: 162705 | BH52: =RC[-3]-RC[-1]-RC[-2] -> 0.54999999999999982 | BI52: =R63C61*RC[-4] -> 875000000 | BJ52: =RC[-1]*5% -> 131250000 | BK52: =R63C19*RC[-5] -> 1.8 | BL52: =RC[-3]-RC[-2]-RC[-1] -> 743749998.20000005 | BM52: =RC[-1]-RC[-5] -> 743749997.6500001 | BO52: SUBCPS | BP52: 0 | BQ52: 0 | BR52: 0 | BS52: =RC[-3]-RC[-1]-RC[-2] -> 0.54999999999999982 | BT52: =R63C72*RC[-4] -> 875000000 | BU52: =RC[-1]*5% -> 131250000 | BV52: =R63C8*RC[-5] -> 1.8 | BW52: =RC[-3]-RC[-2]-RC[-1] -> 743749998.20000005 | BX52: =RC[-1]-RC[-5] -> 743749997.6500001 | BZ52: SUBCPS | CA52: 0 | CB52: 0 | CC52: 0 | CD52: =RC[-3]-RC[-1]-RC[-2] -> 0.54999999999999982 | CE52: =R63C83*RC[-4] -> 875000000 | CF52: =RC[-1]*5% -> 131250000 | CG52: =R63C19*RC[-5] -> 1.8 | CH52: =RC[-3]-RC[-2]-RC[-1] -> 743749998.20000005 | CI52: =RC[-1]-RC[-5] -> 743749997.6500001 | CK52: SUBCPS | CL52: 0 | CM52: 0 | CN52: 0 | CO52: =RC[-3]-RC[-1]-RC[-2] -> 0.54999999999999982 | CP52: =R63C94*RC[-4] -> 875000000 | CQ52: =RC[-1]*5% -> 131250000 | CR52: =R63C19*RC[-5] -> 1.8 | CS52: =RC[-3]-RC[-2]-RC[-1] -> 743749998.20000005 | CT52: =RC[-1]-RC[-5] -> 743749997.6500001 | CV52: SUBCPS | CW52: 0 | CX52: 0 | CY52: 0 | CZ52: =RC[-3]-RC[-1]-RC[-2] -> 0.54999999999999982 | DA52: =R63C105*RC[-4] -> 875000000 | DB52: =RC[-1]*5% -> 131250000 | DC52: =R63C19*RC[-5] -> 1.8 | DD52: =RC[-3]-RC[-2]-RC[-1] -> 743749998.20000005 | DE52: =RC[-1]-RC[-5] -> 743749997.6500001 | DG52: SUBCPS | DH52: 0 | DI52: 0 | DJ52: 0 | DK52: =RC[-3]-RC[-1]-RC[-2] -> 0.54999999999999982 | DL52: =R63C116*RC[-4] -> 807692307.69230771 | DM52: =RC[-1]*5% -> 121153846.15384614 | DN52: =R63C19*RC[-5] -> 1.8 | DO52: =RC[-3]-RC[-2]-RC[-1] -> 686538459.73846161 | DP52: =RC[-1]-RC[-5] -> 686538459.18846166 | DR52: SUBCPS | DS52: 0 | DT52: 0 | DU52: 0 | DV52: =RC[-3]-RC[-1]-RC[-2] -> 0.54999999999999982 | DW52: =R63C127*RC[-4] -> 875000000 | DX52: =RC[-1]*5% -> 131250000 | DY52: =R63C19*RC[-5] -> 1.8 | DZ52: =RC[-3]-RC[-2]-RC[-1] -> 743749998.20000005 | EA52: =RC[-1]-RC[-5] -> 743749997.6500001 | EC52: SUBCPS | ED52: =RC[-132]+RC[-121]+RC[-110]+RC[-99]+RC[-88]+RC[-77]+RC[-66]+RC[-55]+RC[-44]+RC[-33]+RC[-22]+RC[-11] ->  | EE52: =RC[-132]+RC[-121]+RC[-110]+RC[-99]+RC[-88]+RC[-77]+RC[-66]+RC[-55]+RC[-44]+RC[-33]+RC[-22]+RC[-11] ->  | EF52: =RC[-132]+RC[-121]+RC[-110]+RC[-99]+RC[-88]+RC[-77]+RC[-66]+RC[-55]+RC[-44]+RC[-33]+RC[-22]+RC[-11] ->  | EG52: =RC[-132]+RC[-121]+RC[-110]+RC[-99]+RC[-88]+RC[-77]+RC[-66]+RC[-55]+RC[-44]+RC[-33]+RC[-22]+RC[-11] ->  | EH52: =RC[-132]+RC[-121]+RC[-110]+RC[-99]+RC[-88]+RC[-77]+RC[-66]+RC[-55]+RC[-44]+RC[-33]+RC[-22]+RC[-11] ->  | EI52: =RC[-132]+RC[-121]+RC[-110]+RC[-99]+RC[-88]+RC[-77]+RC[-66]+RC[-55]+RC[-44]+RC[-33]+RC[-22]+RC[-11] ->  | EJ52: =RC[-132]+RC[-121]+RC[-110]+RC[-99]+RC[-88]+RC[-77]+RC[-66]+RC[-55]+RC[-44]+RC[-33]+RC[-22]+RC[-11] ->  | EK52: =RC[-132]+RC[-121]+RC[-110]+RC[-99]+RC[-88]+RC[-77]+RC[-66]+RC[-55]+RC[-44]+RC[-33]+RC[-22]+RC[-11] ->  | EL52: =RC[-132]+RC[-121]+RC[-110]+RC[-99]+RC[-88]+RC[-77]+RC[-66]+RC[-55]+RC[-44]+RC[-33]+RC[-22]+RC[-11] -> 
A53: LUCKY_FONE | B53: 9935971 | C53: 1615978 | D53: 496799 | E53: =RC[-3]-RC[-1]-RC[-2] ->  | F53: =R63C6*RC[-4] ->  | G53: =RC[-1]*5% ->  | H53: =R63C8*RC[-5] ->  | I53: =RC[-3]-RC[-2]-RC[-1] ->  | J53: =RC[-1]-RC[-5] ->  | L53: LUCKY_FONE | M53: 7089347 | N53: 1167985 | O53: 354467 | P53: =RC[-3]-RC[-1]-RC[-2] -> 2467006.9 | Q53: =R63C17*RC[-4] -> 3000383.6278659259 | R53: =RC[-1]*5% -> 450057.54417988885 | S53: =R63C19*RC[-5] -> 108517.5 | T53: =RC[-3]-RC[-2]-RC[-1] -> 2441808.583686037 | U53: =RC[-1]-RC[-5] -> -25198.316313962918 | W53: LUCKY_FONE | X53: 8186880 | Y53: 1400217 | Z53: 409344 | AA53: =RC[-3]-RC[-1]-RC[-2] -> 0 | AB53: =R63C28*RC[-4] -> 875000000 | AC53: =RC[-1]*5% -> 131250000 | AD53: =R63C19*RC[-5] -> 1.8 | AE53: =RC[-3]-RC[-2]-RC[-1] -> 743749998.20000005 | AF53: =RC[-1]-RC[-5] -> 743749998.20000005 | AH53: LUCKY_FONE | AI53: 7550402 | AJ53: 1336335 | AK53: 377520 | AL53: =RC[-3]-RC[-1]-RC[-2] -> 0.54999999999999982 | AM53: =R63C39*RC[-4] -> 875000000 | AN53: =RC[-1]*5% -> 131250000 | AO53: =R63C19*RC[-5] -> 1.8 | AP53: =RC[-3]-RC[-2]-RC[-1] -> 743749998.20000005 | AQ53: =RC[-1]-RC[-5] -> 743749997.6500001 | AS53: LUCKY_FONE | AT53: 8212664 | AU53: 2044042 | AV53: 410633 | AW53: =RC[-3]-RC[-1]-RC[-2] -> 0.54999999999999982 | AX53: =R63C50*RC[-4] -> 875000000 | AY53: =RC[-1]*5% -> 131250000 | AZ53: =R63C19*RC[-5] -> 1.8 | BA53: =RC[-3]-RC[-2]-RC[-1] -> 743749998.20000005 | BB53: =RC[-1]-RC[-5] -> 743749997.6500001 | BD53: LUCKY_FONE | BE53: 7411524 | BF53: 1254981 | BG53: 370576 | BH53: =RC[-3]-RC[-1]-RC[-2] -> 0.54999999999999982 | BI53: =R63C61*RC[-4] -> 875000000 | BJ53: =RC[-1]*5% -> 131250000 | BK53: =R63C19*RC[-5] -> 1.8 | BL53: =RC[-3]-RC[-2]-RC[-1] -> 743749998.20000005 | BM53: =RC[-1]-RC[-5] -> 743749997.6500001 | BO53: LUCKY_FONE | BP53: 0 | BQ53: 0 | BR53: 0 | BS53: =RC[-3]-RC[-1]-RC[-2] -> 0.54999999999999982 | BT53: =R63C72*RC[-4] -> 875000000 | BU53: =RC[-1]*5% -> 131250000 | BV53: =R63C8*RC[-5] -> 1.8 | BW53: =RC[-3]-RC[-2]-RC[-1] -> 743749998.20000005 | BX53: =RC[-1]-RC[-5] -> 743749997.6500001 | BZ53: LUCKY_FONE | CA53: 0 | CB53: 0 | CC53: 0 | CD53: =RC[-3]-RC[-1]-RC[-2] -> 0.54999999999999982 | CE53: =R63C83*RC[-4] -> 875000000 | CF53: =RC[-1]*5% -> 131250000 | CG53: =R63C19*RC[-5] -> 1.8 | CH53: =RC[-3]-RC[-2]-RC[-1] -> 743749998.20000005 | CI53: =RC[-1]-RC[-5] -> 743749997.6500001 | CK53: LUCKY_FONE | CL53: 0 | CM53: 0 | CN53: 0 | CO53: =RC[-3]-RC[-1]-RC[-2] -> 0.54999999999999982 | CP53: =R63C94*RC[-4] -> 875000000 | CQ53: =RC[-1]*5% -> 131250000 | CR53: =R63C19*RC[-5] -> 1.8 | CS53: =RC[-3]-RC[-2]-RC[-1] -> 743749998.20000005 | CT53: =RC[-1]-RC[-5] -> 743749997.6500001 | CV53: LUCKY_FONE | CW53: 0 | CX53: 0 | CY53: 0 | CZ53: =RC[-3]-RC[-1]-RC[-2] -> 0.54999999999999982 | DA53: =R63C105*RC[-4] -> 875000000 | DB53: =RC[-1]*5% -> 131250000 | DC53: =R63C19*RC[-5] -> 1.8 | DD53: =RC[-3]-RC[-2]-RC[-1] -> 743749998.20000005 | DE53: =RC[-1]-RC[-5] -> 743749997.6500001 | DG53: LUCKY_FONE | DH53: 0 | DI53: 0 | DJ53: 0 | DK53: =RC[-3]-RC[-1]-RC[-2] -> 0.54999999999999982 | DL53: =R63C116*RC[-4] -> 807692307.69230771 | DM53: =RC[-1]*5% -> 121153846.15384614 | DN53: =R63C19*RC[-5] -> 1.8 | DO53: =RC[-3]-RC[-2]-RC[-1] -> 686538459.73846161 | DP53: =RC[-1]-RC[-5] -> 686538459.18846166 | DR53: LUCKY_FONE | DS53: 0 | DT53: 0 | DU53: 0 | DV53: =RC[-3]-RC[-1]-RC[-2] -> 0.54999999999999982 | DW53: =R63C127*RC[-4] -> 875000000 | DX53: =RC[-1]*5% -> 131250000 | DY53: =R63C19*RC[-5] -> 1.8 | DZ53: =RC[-3]-RC[-2]-RC[-1] -> 743749998.20000005 | EA53: =RC[-1]-RC[-5] -> 743749997.6500001 | EC53: LUCKY_FONE | ED53: =RC[-132]+RC[-121]+RC[-110]+RC[-99]+RC[-88]+RC[-77]+RC[-66]+RC[-55]+RC[-44]+RC[-33]+RC[-22]+RC[-11] ->  | EE53: =RC[-132]+RC[-121]+RC[-110]+RC[-99]+RC[-88]+RC[-77]+RC[-66]+RC[-55]+RC[-44]+RC[-33]+RC[-22]+RC[-11] ->  | EF53: =RC[-132]+RC[-121]+RC[-110]+RC[-99]+RC[-88]+RC[-77]+RC[-66]+RC[-55]+RC[-44]+RC[-33]+RC[-22]+RC[-11] ->  | EG53: =RC[-132]+RC[-121]+RC[-110]+RC[-99]+RC[-88]+RC[-77]+RC[-66]+RC[-55]+RC[-44]+RC[-33]+RC[-22]+RC[-11] ->  | EH53: =RC[-132]+RC[-121]+RC[-110]+RC[-99]+RC[-88]+RC[-77]+RC[-66]+RC[-55]+RC[-44]+RC[-33]+RC[-22]+RC[-11] ->  | EI53: =RC[-132]+RC[-121]+RC[-110]+RC[-99]+RC[-88]+RC[-77]+RC[-66]+RC[-55]+RC[-44]+RC[-33]+RC[-22]+RC[-11] ->  | EJ53: =RC[-132]+RC[-121]+RC[-110]+RC[-99]+RC[-88]+RC[-77]+RC[-66]+RC[-55]+RC[-44]+RC[-33]+RC[-22]+RC[-11] ->  | EK53: =RC[-132]+RC[-121]+RC[-110]+RC[-99]+RC[-88]+RC[-77]+RC[-66]+RC[-55]+RC[-44]+RC[-33]+RC[-22]+RC[-11] ->  | EL53: =RC[-132]+RC[-121]+RC[-110]+RC[-99]+RC[-88]+RC[-77]+RC[-66]+RC[-55]+RC[-44]+RC[-33]+RC[-22]+RC[-11] -> 
A54: TT PTKD | B54: 1660109 | C54: 1911897 | D54: 83005 | E54: =RC[-3]-RC[-1]-RC[-2] ->  | F54: =R63C6*RC[-4] ->  | G54: =RC[-1]*5% ->  | H54: =R63C8*RC[-5] ->  | I54: =RC[-3]-RC[-2]-RC[-1] ->  | J54: =RC[-1]-RC[-5] ->  | L54: TT PTKD | M54: 1449895 | N54: 49835626 | O54: 72495 | P54: =RC[-3]-RC[-1]-RC[-2] -> 2467006.9 | Q54: =R63C17*RC[-4] -> 3000383.6278659259 | R54: =RC[-1]*5% -> 450057.54417988885 | S54: =R63C19*RC[-5] -> 108517.5 | T54: =RC[-3]-RC[-2]-RC[-1] -> 2441808.583686037 | U54: =RC[-1]-RC[-5] -> -25198.316313962918 | W54: TT PTKD | X54: 1143021 | Y54: 2578116 | Z54: 57151 | AA54: =RC[-3]-RC[-1]-RC[-2] -> 0 | AB54: =R63C28*RC[-4] -> 875000000 | AC54: =RC[-1]*5% -> 131250000 | AD54: =R63C19*RC[-5] -> 1.8 | AE54: =RC[-3]-RC[-2]-RC[-1] -> 743749998.20000005 | AF54: =RC[-1]-RC[-5] -> 743749998.20000005 | AH54: TT PTKD | AI54: 787435 | AJ54: 20240226 | AK54: 39372 | AL54: =RC[-3]-RC[-1]-RC[-2] -> 0.54999999999999982 | AM54: =R63C39*RC[-4] -> 875000000 | AN54: =RC[-1]*5% -> 131250000 | AO54: =R63C19*RC[-5] -> 1.8 | AP54: =RC[-3]-RC[-2]-RC[-1] -> 743749998.20000005 | AQ54: =RC[-1]-RC[-5] -> 743749997.6500001 | AS54: TT PTKD | AT54: 710382 | AU54: 23008390 | AV54: 35519 | AW54: =RC[-3]-RC[-1]-RC[-2] -> 0.54999999999999982 | AX54: =R63C50*RC[-4] -> 875000000 | AY54: =RC[-1]*5% -> 131250000 | AZ54: =R63C19*RC[-5] -> 1.8 | BA54: =RC[-3]-RC[-2]-RC[-1] -> 743749998.20000005 | BB54: =RC[-1]-RC[-5] -> 743749997.6500001 | BD54: TT PTKD | BE54: 1385456 | BF54: 22372487 | BG54: 69273 | BH54: =RC[-3]-RC[-1]-RC[-2] -> 0.54999999999999982 | BI54: =R63C61*RC[-4] -> 875000000 | BJ54: =RC[-1]*5% -> 131250000 | BK54: =R63C19*RC[-5] -> 1.8 | BL54: =RC[-3]-RC[-2]-RC[-1] -> 743749998.20000005 | BM54: =RC[-1]-RC[-5] -> 743749997.6500001 | BO54: TT PTKD | BP54: 0 | BQ54: 0 | BR54: 0 | BS54: =RC[-3]-RC[-1]-RC[-2] -> 0.54999999999999982 | BT54: =R63C72*RC[-4] -> 875000000 | BU54: =RC[-1]*5% -> 131250000 | BV54: =R63C8*RC[-5] -> 1.8 | BW54: =RC[-3]-RC[-2]-RC[-1] -> 743749998.20000005 | BX54: =RC[-1]-RC[-5] -> 743749997.6500001 | BZ54: TT PTKD | CA54: 0 | CB54: 0 | CC54: 0 | CD54: =RC[-3]-RC[-1]-RC[-2] -> 0.54999999999999982 | CE54: =R63C83*RC[-4] -> 875000000 | CF54: =RC[-1]*5% -> 131250000 | CG54: =R63C19*RC[-5] -> 1.8 | CH54: =RC[-3]-RC[-2]-RC[-1] -> 743749998.20000005 | CI54: =RC[-1]-RC[-5] -> 743749997.6500001 | CK54: TT PTKD | CL54: 0 | CM54: 0 | CN54: 0 | CO54: =RC[-3]-RC[-1]-RC[-2] -> 0.54999999999999982 | CP54: =R63C94*RC[-4] -> 875000000 | CQ54: =RC[-1]*5% -> 131250000 | CR54: =R63C19*RC[-5] -> 1.8 | CS54: =RC[-3]-RC[-2]-RC[-1] -> 743749998.20000005 | CT54: =RC[-1]-RC[-5] -> 743749997.6500001 | CV54: TT PTKD | CW54: 0 | CX54: 0 | CY54: 0 | CZ54: =RC[-3]-RC[-1]-RC[-2] -> 0.54999999999999982 | DA54: =R63C105*RC[-4] -> 875000000 | DB54: =RC[-1]*5% -> 131250000 | DC54: =R63C19*RC[-5] -> 1.8 | DD54: =RC[-3]-RC[-2]-RC[-1] -> 743749998.20000005 | DE54: =RC[-1]-RC[-5] -> 743749997.6500001 | DG54: TT PTKD | DH54: 0 | DI54: 0 | DJ54: 0 | DK54: =RC[-3]-RC[-1]-RC[-2] -> 0.54999999999999982 | DL54: =R63C116*RC[-4] -> 807692307.69230771 | DM54: =RC[-1]*5% -> 121153846.15384614 | DN54: =R63C19*RC[-5] -> 1.8 | DO54: =RC[-3]-RC[-2]-RC[-1] -> 686538459.73846161 | DP54: =RC[-1]-RC[-5] -> 686538459.18846166 | DR54: TT PTKD | DS54: 0 | DT54: 0 | DU54: 0 | DV54: =RC[-3]-RC[-1]-RC[-2] -> 0.54999999999999982 | DW54: =R63C127*RC[-4] -> 875000000 | DX54: =RC[-1]*5% -> 131250000 | DY54: =R63C19*RC[-5] -> 1.8 | DZ54: =RC[-3]-RC[-2]-RC[-1] -> 743749998.20000005 | EA54: =RC[-1]-RC[-5] -> 743749997.6500001 | EC54: TT PTKD | ED54: =RC[-132]+RC[-121]+RC[-110]+RC[-99]+RC[-88]+RC[-77]+RC[-66]+RC[-55]+RC[-44]+RC[-33]+RC[-22]+RC[-11] ->  | EE54: =RC[-132]+RC[-121]+RC[-110]+RC[-99]+RC[-88]+RC[-77]+RC[-66]+RC[-55]+RC[-44]+RC[-33]+RC[-22]+RC[-11] ->  | EF54: =RC[-132]+RC[-121]+RC[-110]+RC[-99]+RC[-88]+RC[-77]+RC[-66]+RC[-55]+RC[-44]+RC[-33]+RC[-22]+RC[-11] ->  | EG54: =RC[-132]+RC[-121]+RC[-110]+RC[-99]+RC[-88]+RC[-77]+RC[-66]+RC[-55]+RC[-44]+RC[-33]+RC[-22]+RC[-11] ->  | EH54: =RC[-132]+RC[-121]+RC[-110]+RC[-99]+RC[-88]+RC[-77]+RC[-66]+RC[-55]+RC[-44]+RC[-33]+RC[-22]+RC[-11] ->  | EI54: =RC[-132]+RC[-121]+RC[-110]+RC[-99]+RC[-88]+RC[-77]+RC[-66]+RC[-55]+RC[-44]+RC[-33]+RC[-22]+RC[-11] ->  | EJ54: =RC[-132]+RC[-121]+RC[-110]+RC[-99]+RC[-88]+RC[-77]+RC[-66]+RC[-55]+RC[-44]+RC[-33]+RC[-22]+RC[-11] ->  | EK54: =RC[-132]+RC[-121]+RC[-110]+RC[-99]+RC[-88]+RC[-77]+RC[-66]+RC[-55]+RC[-44]+RC[-33]+RC[-22]+RC[-11] ->  | EL54: =RC[-132]+RC[-121]+RC[-110]+RC[-99]+RC[-88]+RC[-77]+RC[-66]+RC[-55]+RC[-44]+RC[-33]+RC[-22]+RC[-11] -> 
A55: TT PTND | B55: 98089789 | C55: 1609335 | D55: 4904489 | E55: =RC[-3]-RC[-1]-RC[-2] ->  | F55: =R63C6*RC[-4] ->  | G55: =RC[-1]*5% ->  | H55: =R63C8*RC[-5] ->  | I55: =RC[-3]-RC[-2]-RC[-1] ->  | J55: =RC[-1]-RC[-5] ->  | L55: TT PTND | M55: 80278750 | N55: 1172444 | O55: 4013938 | P55: =RC[-3]-RC[-1]-RC[-2] -> 2467006.9 | Q55: =R63C17*RC[-4] -> 3000383.6278659259 | R55: =RC[-1]*5% -> 450057.54417988885 | S55: =R63C19*RC[-5] -> 108517.5 | T55: =RC[-3]-RC[-2]-RC[-1] -> 2441808.583686037 | U55: =RC[-1]-RC[-5] -> -25198.316313962918 | W55: TT PTND | X55: 93936505 | Y55: 1422421 | Z55: 4696825 | AA55: =RC[-3]-RC[-1]-RC[-2] -> 0 | AB55: =R63C28*RC[-4] -> 875000000 | AC55: =RC[-1]*5% -> 131250000 | AD55: =R63C19*RC[-5] -> 1.8 | AE55: =RC[-3]-RC[-2]-RC[-1] -> 743749998.20000005 | AF55: =RC[-1]-RC[-5] -> 743749998.20000005 | AH55: TT PTND | AI55: 89173612 | AJ55: 1341613 | AK55: 4458681 | AL55: =RC[-3]-RC[-1]-RC[-2] -> 0.54999999999999982 | AM55: =R63C39*RC[-4] -> 875000000 | AN55: =RC[-1]*5% -> 131250000 | AO55: =R63C19*RC[-5] -> 1.8 | AP55: =RC[-3]-RC[-2]-RC[-1] -> 743749998.20000005 | AQ55: =RC[-1]-RC[-5] -> 743749997.6500001 | AS55: TT PTND | AT55: 95939705 | AU55: 1441622 | AV55: 4796985 | AW55: =RC[-3]-RC[-1]-RC[-2] -> 0.54999999999999982 | AX55: =R63C50*RC[-4] -> 875000000 | AY55: =RC[-1]*5% -> 131250000 | AZ55: =R63C19*RC[-5] -> 1.8 | BA55: =RC[-3]-RC[-2]-RC[-1] -> 743749998.20000005 | BB55: =RC[-1]-RC[-5] -> 743749997.6500001 | BD55: TT PTND | BE55: 140112977 | BF55: 1573026 | BG55: 7005649 | BH55: =RC[-3]-RC[-1]-RC[-2] -> 0.54999999999999982 | BI55: =R63C61*RC[-4] -> 875000000 | BJ55: =RC[-1]*5% -> 131250000 | BK55: =R63C19*RC[-5] -> 1.8 | BL55: =RC[-3]-RC[-2]-RC[-1] -> 743749998.20000005 | BM55: =RC[-1]-RC[-5] -> 743749997.6500001 | BO55: TT PTND | BP55: 0 | BQ55: 0 | BR55: 0 | BS55: =RC[-3]-RC[-1]-RC[-2] -> 0.54999999999999982 | BT55: =R63C72*RC[-4] -> 875000000 | BU55: =RC[-1]*5% -> 131250000 | BV55: =R63C8*RC[-5] -> 1.8 | BW55: =RC[-3]-RC[-2]-RC[-1] -> 743749998.20000005 | BX55: =RC[-1]-RC[-5] -> 743749997.6500001 | BZ55: TT PTND | CA55: 0 | CB55: 0 | CC55: 0 | CD55: =RC[-3]-RC[-1]-RC[-2] -> 0.54999999999999982 | CE55: =R63C83*RC[-4] -> 875000000 | CF55: =RC[-1]*5% -> 131250000 | CG55: =R63C19*RC[-5] -> 1.8 | CH55: =RC[-3]-RC[-2]-RC[-1] -> 743749998.20000005 | CI55: =RC[-1]-RC[-5] -> 743749997.6500001 | CK55: TT PTND | CL55: 0 | CM55: 0 | CN55: 0 | CO55: =RC[-3]-RC[-1]-RC[-2] -> 0.54999999999999982 | CP55: =R63C94*RC[-4] -> 875000000 | CQ55: =RC[-1]*5% -> 131250000 | CR55: =R63C19*RC[-5] -> 1.8 | CS55: =RC[-3]-RC[-2]-RC[-1] -> 743749998.20000005 | CT55: =RC[-1]-RC[-5] -> 743749997.6500001 | CV55: TT PTND | CW55: 0 | CX55: 0 | CY55: 0 | CZ55: =RC[-3]-RC[-1]-RC[-2] -> 0.54999999999999982 | DA55: =R63C105*RC[-4] -> 875000000 | DB55: =RC[-1]*5% -> 131250000 | DC55: =R63C19*RC[-5] -> 1.8 | DD55: =RC[-3]-RC[-2]-RC[-1] -> 743749998.20000005 | DE55: =RC[-1]-RC[-5] -> 743749997.6500001 | DG55: TT PTND | DH55: 0 | DI55: 0 | DJ55: 0 | DK55: =RC[-3]-RC[-1]-RC[-2] -> 0.54999999999999982 | DL55: =R63C116*RC[-4] -> 807692307.69230771 | DM55: =RC[-1]*5% -> 121153846.15384614 | DN55: =R63C19*RC[-5] -> 1.8 | DO55: =RC[-3]-RC[-2]-RC[-1] -> 686538459.73846161 | DP55: =RC[-1]-RC[-5] -> 686538459.18846166 | DR55: TT PTND | DS55: 0 | DT55: 0 | DU55: 0 | DV55: =RC[-3]-RC[-1]-RC[-2] -> 0.54999999999999982 | DW55: =R63C127*RC[-4] -> 875000000 | DX55: =RC[-1]*5% -> 131250000 | DY55: =R63C19*RC[-5] -> 1.8 | DZ55: =RC[-3]-RC[-2]-RC[-1] -> 743749998.20000005 | EA55: =RC[-1]-RC[-5] -> 743749997.6500001 | EC55: TT PTND | ED55: =RC[-132]+RC[-121]+RC[-110]+RC[-99]+RC[-88]+RC[-77]+RC[-66]+RC[-55]+RC[-44]+RC[-33]+RC[-22]+RC[-11] ->  | EE55: =RC[-132]+RC[-121]+RC[-110]+RC[-99]+RC[-88]+RC[-77]+RC[-66]+RC[-55]+RC[-44]+RC[-33]+RC[-22]+RC[-11] ->  | EF55: =RC[-132]+RC[-121]+RC[-110]+RC[-99]+RC[-88]+RC[-77]+RC[-66]+RC[-55]+RC[-44]+RC[-33]+RC[-22]+RC[-11] ->  | EG55: =RC[-132]+RC[-121]+RC[-110]+RC[-99]+RC[-88]+RC[-77]+RC[-66]+RC[-55]+RC[-44]+RC[-33]+RC[-22]+RC[-11] ->  | EH55: =RC[-132]+RC[-121]+RC[-110]+RC[-99]+RC[-88]+RC[-77]+RC[-66]+RC[-55]+RC[-44]+RC[-33]+RC[-22]+RC[-11] ->  | EI55: =RC[-132]+RC[-121]+RC[-110]+RC[-99]+RC[-88]+RC[-77]+RC[-66]+RC[-55]+RC[-44]+RC[-33]+RC[-22]+RC[-11] ->  | EJ55: =RC[-132]+RC[-121]+RC[-110]+RC[-99]+RC[-88]+RC[-77]+RC[-66]+RC[-55]+RC[-44]+RC[-33]+RC[-22]+RC[-11] ->  | EK55: =RC[-132]+RC[-121]+RC[-110]+RC[-99]+RC[-88]+RC[-77]+RC[-66]+RC[-55]+RC[-44]+RC[-33]+RC[-22]+RC[-11] ->  | EL55: =RC[-132]+RC[-121]+RC[-110]+RC[-99]+RC[-88]+RC[-77]+RC[-66]+RC[-55]+RC[-44]+RC[-33]+RC[-22]+RC[-11] -> 
A56: HQ | B56: 690233 | C56: 4718805 | D56: 34512 | E56: =RC[-3]-RC[-1]-RC[-2] ->  | F56: =R63C6*RC[-4] ->  | G56: =RC[-1]*5% ->  | H56: =R63C8*RC[-5] ->  | I56: =RC[-3]-RC[-2]-RC[-1] ->  | J56: =RC[-1]-RC[-5] ->  | L56: HQ | M56: 716607 | N56: 4526795 | O56: 35830 | P56: =RC[-3]-RC[-1]-RC[-2] -> 2467006.9 | Q56: =R63C17*RC[-4] -> 3000383.6278659259 | R56: =RC[-1]*5% -> 450057.54417988885 | S56: =R63C19*RC[-5] -> 108517.5 | T56: =RC[-3]-RC[-2]-RC[-1] -> 2441808.583686037 | U56: =RC[-1]-RC[-5] -> -25198.316313962918 | W56: HQ | X56: 710348 | Y56: 4609969 | Z56: 35517 | AA56: =RC[-3]-RC[-1]-RC[-2] -> 0 | AB56: =R63C28*RC[-4] -> 875000000 | AC56: =RC[-1]*5% -> 131250000 | AD56: =R63C19*RC[-5] -> 1.8 | AE56: =RC[-3]-RC[-2]-RC[-1] -> 743749998.20000005 | AF56: =RC[-1]-RC[-5] -> 743749998.20000005 | AH56: HQ | AI56: 798519 | AJ56: 4873505 | AK56: 39926 | AL56: =RC[-3]-RC[-1]-RC[-2] -> 0.54999999999999982 | AM56: =R63C39*RC[-4] -> 875000000 | AN56: =RC[-1]*5% -> 131250000 | AO56: =R63C19*RC[-5] -> 1.8 | AP56: =RC[-3]-RC[-2]-RC[-1] -> 743749998.20000005 | AQ56: =RC[-1]-RC[-5] -> 743749997.6500001 | AS56: HQ | AT56: 663421 | AU56: 4600050 | AV56: 33171 | AW56: =RC[-3]-RC[-1]-RC[-2] -> 0.54999999999999982 | AX56: =R63C50*RC[-4] -> 875000000 | AY56: =RC[-1]*5% -> 131250000 | AZ56: =R63C19*RC[-5] -> 1.8 | BA56: =RC[-3]-RC[-2]-RC[-1] -> 743749998.20000005 | BB56: =RC[-1]-RC[-5] -> 743749997.6500001 | BD56: HQ | BE56: 659717 | BF56: 4494945 | BG56: 32986 | BH56: =RC[-3]-RC[-1]-RC[-2] -> 0.54999999999999982 | BI56: =R63C61*RC[-4] -> 875000000 | BJ56: =RC[-1]*5% -> 131250000 | BK56: =R63C19*RC[-5] -> 1.8 | BL56: =RC[-3]-RC[-2]-RC[-1] -> 743749998.20000005 | BM56: =RC[-1]-RC[-5] -> 743749997.6500001 | BO56: HQ | BP56: 0 | BQ56: 0 | BR56: 0 | BS56: =RC[-3]-RC[-1]-RC[-2] -> 0.54999999999999982 | BT56: =R63C72*RC[-4] -> 875000000 | BU56: =RC[-1]*5% -> 131250000 | BV56: =R63C8*RC[-5] -> 1.8 | BW56: =RC[-3]-RC[-2]-RC[-1] -> 743749998.20000005 | BX56: =RC[-1]-RC[-5] -> 743749997.6500001 | BZ56: HQ | CA56: 0 | CB56: 0 | CC56: 0 | CD56: =RC[-3]-RC[-1]-RC[-2] -> 0.54999999999999982 | CE56: =R63C83*RC[-4] -> 875000000 | CF56: =RC[-1]*5% -> 131250000 | CG56: =R63C19*RC[-5] -> 1.8 | CH56: =RC[-3]-RC[-2]-RC[-1] -> 743749998.20000005 | CI56: =RC[-1]-RC[-5] -> 743749997.6500001 | CK56: HQ | CL56: 0 | CM56: 0 | CN56: 0 | CO56: =RC[-3]-RC[-1]-RC[-2] -> 0.54999999999999982 | CP56: =R63C94*RC[-4] -> 875000000 | CQ56: =RC[-1]*5% -> 131250000 | CR56: =R63C19*RC[-5] -> 1.8 | CS56: =RC[-3]-RC[-2]-RC[-1] -> 743749998.20000005 | CT56: =RC[-1]-RC[-5] -> 743749997.6500001 | CV56: HQ | CW56: 0 | CX56: 0 | CY56: 0 | CZ56: =RC[-3]-RC[-1]-RC[-2] -> 0.54999999999999982 | DA56: =R63C105*RC[-4] -> 875000000 | DB56: =RC[-1]*5% -> 131250000 | DC56: =R63C19*RC[-5] -> 1.8 | DD56: =RC[-3]-RC[-2]-RC[-1] -> 743749998.20000005 | DE56: =RC[-1]-RC[-5] -> 743749997.6500001 | DG56: HQ | DH56: 0 | DI56: 0 | DJ56: 0 | DK56: =RC[-3]-RC[-1]-RC[-2] -> 0.54999999999999982 | DL56: =R63C116*RC[-4] -> 807692307.69230771 | DM56: =RC[-1]*5% -> 121153846.15384614 | DN56: =R63C19*RC[-5] -> 1.8 | DO56: =RC[-3]-RC[-2]-RC[-1] -> 686538459.73846161 | DP56: =RC[-1]-RC[-5] -> 686538459.18846166 | DR56: HQ | DS56: 0 | DT56: 0 | DU56: 0 | DV56: =RC[-3]-RC[-1]-RC[-2] -> 0.54999999999999982 | DW56: =R63C127*RC[-4] -> 875000000 | DX56: =RC[-1]*5% -> 131250000 | DY56: =R63C19*RC[-5] -> 1.8 | DZ56: =RC[-3]-RC[-2]-RC[-1] -> 743749998.20000005 | EA56: =RC[-1]-RC[-5] -> 743749997.6500001 | EC56: HQ | ED56: =RC[-132]+RC[-121]+RC[-110]+RC[-99]+RC[-88]+RC[-77]+RC[-66]+RC[-55]+RC[-44]+RC[-33]+RC[-22]+RC[-11] ->  | EE56: =RC[-132]+RC[-121]+RC[-110]+RC[-99]+RC[-88]+RC[-77]+RC[-66]+RC[-55]+RC[-44]+RC[-33]+RC[-22]+RC[-11] ->  | EF56: =RC[-132]+RC[-121]+RC[-110]+RC[-99]+RC[-88]+RC[-77]+RC[-66]+RC[-55]+RC[-44]+RC[-33]+RC[-22]+RC[-11] ->  | EG56: =RC[-132]+RC[-121]+RC[-110]+RC[-99]+RC[-88]+RC[-77]+RC[-66]+RC[-55]+RC[-44]+RC[-33]+RC[-22]+RC[-11] ->  | EH56: =RC[-132]+RC[-121]+RC[-110]+RC[-99]+RC[-88]+RC[-77]+RC[-66]+RC[-55]+RC[-44]+RC[-33]+RC[-22]+RC[-11] ->  | EI56: =RC[-132]+RC[-121]+RC[-110]+RC[-99]+RC[-88]+RC[-77]+RC[-66]+RC[-55]+RC[-44]+RC[-33]+RC[-22]+RC[-11] ->  | EJ56: =RC[-132]+RC[-121]+RC[-110]+RC[-99]+RC[-88]+RC[-77]+RC[-66]+RC[-55]+RC[-44]+RC[-33]+RC[-22]+RC[-11] ->  | EK56: =RC[-132]+RC[-121]+RC[-110]+RC[-99]+RC[-88]+RC[-77]+RC[-66]+RC[-55]+RC[-44]+RC[-33]+RC[-22]+RC[-11] ->  | EL56: =RC[-132]+RC[-121]+RC[-110]+RC[-99]+RC[-88]+RC[-77]+RC[-66]+RC[-55]+RC[-44]+RC[-33]+RC[-22]+RC[-11] -> 
A57: Tổng | B57: =SUM(R[-5]C:R[-1]C) -> 3551128896 | C57: =SUM(R[-5]C:R[-1]C) -> -619983 | D57: =SUM(R[-5]C:R[-1]C) -> 532669334.39999998 | E57: =SUM(R[-5]C:R[-1]C) -> 3019079544.5999999 | F57: =SUM(R[-5]C:R[-1]C) -> 3499999999.9999995 | G57: =SUM(R[-5]C:R[-1]C) -> 525000000 | H57: =SUM(R[-5]C:R[-1]C) -> -557984.69999999995 | I57: =SUM(R[-5]C:R[-1]C) -> 2975557984.6999998 | J57: =SUM(R[-5]C:R[-1]C) -> -43521559.899999849 | L57: Tổng | M57: =SUM(R[-5]C:R[-1]C) -> 3551128896 | N57: =SUM(R[-5]C:R[-1]C) -> -619983 | O57: =SUM(R[-5]C:R[-1]C) -> 532669334.39999998 | P57: =SUM(R[-5]C:R[-1]C) -> 3019079544.5999999 | Q57: =SUM(R[-5]C:R[-1]C) -> 3499999999.9999995 | R57: =SUM(R[-5]C:R[-1]C) -> 525000000 | S57: =SUM(R[-5]C:R[-1]C) -> -557984.69999999995 | T57: =SUM(R[-5]C:R[-1]C) -> 2975557984.6999998 | U57: =SUM(R[-5]C:R[-1]C) -> -43521559.899999849 | W57: Tổng | X57: =SUM(R[-5]C:R[-1]C) -> 12 | Y57: =SUM(R[-5]C:R[-1]C) -> 9 | Z57: =SUM(R[-5]C:R[-1]C) -> 2.35 | AA57: =SUM(R[-5]C:R[-1]C) -> 0.64999999999999991 | AB57: =SUM(R[-5]C:R[-1]C) -> 3500000000 | AC57: =SUM(R[-5]C:R[-1]C) -> 525000000 | AD57: =SUM(R[-5]C:R[-1]C) -> 8.1 | AE57: =SUM(R[-5]C:R[-1]C) -> 2974999991.9000006 | AF57: =SUM(R[-5]C:R[-1]C) -> 2974999991.2500005 | AH57: Tổng | AI57: =SUM(R[-5]C:R[-1]C) -> 12 | AJ57: =SUM(R[-5]C:R[-1]C) -> 9 | AK57: =SUM(R[-5]C:R[-1]C) -> 1.7999999999999998 | AL57: =SUM(R[-5]C:R[-1]C) -> 1.1999999999999997 | AM57: =SUM(R[-5]C:R[-1]C) -> 3500000000 | AN57: =SUM(R[-5]C:R[-1]C) -> 525000000 | AO57: =SUM(R[-5]C:R[-1]C) -> 8.1 | AP57: =SUM(R[-5]C:R[-1]C) -> 2974999991.9000006 | AQ57: =SUM(R[-5]C:R[-1]C) -> 2974999990.7000003 | AS57: Tổng | AT57: =SUM(R[-5]C:R[-1]C) -> 12 | AU57: =SUM(R[-5]C:R[-1]C) -> 9 | AV57: =SUM(R[-5]C:R[-1]C) -> 1.7999999999999998 | AW57: =SUM(R[-5]C:R[-1]C) -> 1.1999999999999997 | AX57: =SUM(R[-5]C:R[-1]C) -> 3500000000 | AY57: =SUM(R[-5]C:R[-1]C) -> 525000000 | AZ57: =SUM(R[-5]C:R[-1]C) -> 8.1 | BA57: =SUM(R[-5]C:R[-1]C) -> 2974999991.9000006 | BB57: =SUM(R[-5]C:R[-1]C) -> 2974999990.7000003 | BD57: Tổng | BE57: =SUM(R[-5]C:R[-1]C) -> 12 | BF57: =SUM(R[-5]C:R[-1]C) -> 9 | BG57: =SUM(R[-5]C:R[-1]C) -> 1.7999999999999998 | BH57: =SUM(R[-5]C:R[-1]C) -> 1.1999999999999997 | BI57: =SUM(R[-5]C:R[-1]C) -> 3500000000 | BJ57: =SUM(R[-5]C:R[-1]C) -> 525000000 | BK57: =SUM(R[-5]C:R[-1]C) -> 8.1 | BL57: =SUM(R[-5]C:R[-1]C) -> 2974999991.9000006 | BM57: =SUM(R[-5]C:R[-1]C) -> 2974999990.7000003 | BO57: Tổng | BP57: =SUM(R[-5]C:R[-1]C) -> 12 | BQ57: =SUM(R[-5]C:R[-1]C) -> 9 | BR57: =SUM(R[-5]C:R[-1]C) -> 1.7999999999999998 | BS57: =SUM(R[-5]C:R[-1]C) -> 1.1999999999999997 | BT57: =SUM(R[-5]C:R[-1]C) -> 3500000000 | BU57: =SUM(R[-5]C:R[-1]C) -> 525000000 | BV57: =SUM(R[-5]C:R[-1]C) -> 8.1 | BW57: =SUM(R[-5]C:R[-1]C) -> 2974999991.9000006 | BX57: =SUM(R[-5]C:R[-1]C) -> 2974999990.7000003 | BZ57: Tổng | CA57: =SUM(R[-5]C:R[-1]C) -> 12 | CB57: =SUM(R[-5]C:R[-1]C) -> 9 | CC57: =SUM(R[-5]C:R[-1]C) -> 1.7999999999999998 | CD57: =SUM(R[-5]C:R[-1]C) -> 1.1999999999999997 | CE57: =SUM(R[-5]C:R[-1]C) -> 3500000000 | CF57: =SUM(R[-5]C:R[-1]C) -> 525000000 | CG57: =SUM(R[-5]C:R[-1]C) -> 8.1 | CH57: =SUM(R[-5]C:R[-1]C) -> 2974999991.9000006 | CI57: =SUM(R[-5]C:R[-1]C) -> 2974999990.7000003 | CK57: Tổng | CL57: =SUM(R[-5]C:R[-1]C) -> 12 | CM57: =SUM(R[-5]C:R[-1]C) -> 9 | CN57: =SUM(R[-5]C:R[-1]C) -> 1.7999999999999998 | CO57: =SUM(R[-5]C:R[-1]C) -> 1.1999999999999997 | CP57: =SUM(R[-5]C:R[-1]C) -> 3500000000 | CQ57: =SUM(R[-5]C:R[-1]C) -> 525000000 | CR57: =SUM(R[-5]C:R[-1]C) -> 8.1 | CS57: =SUM(R[-5]C:R[-1]C) -> 2974999991.9000006 | CT57: =SUM(R[-5]C:R[-1]C) -> 2974999990.7000003 | CV57: Tổng | CW57: =SUM(R[-5]C:R[-1]C) -> 12 | CX57: =SUM(R[-5]C:R[-1]C) -> 9 | CY57: =SUM(R[-5]C:R[-1]C) -> 1.7999999999999998 | CZ57: =SUM(R[-5]C:R[-1]C) -> 1.1999999999999997 | DA57: =SUM(R[-5]C:R[-1]C) -> 3500000000 | DB57: =SUM(R[-5]C:R[-1]C) -> 525000000 | DC57: =SUM(R[-5]C:R[-1]C) -> 8.1 | DD57: =SUM(R[-5]C:R[-1]C) -> 2974999991.9000006 | DE57: =SUM(R[-5]C:R[-1]C) -> 2974999990.7000003 | DG57: Tổng | DH57: =SUM(R[-5]C:R[-1]C) -> 13 | DI57: =SUM(R[-5]C:R[-1]C) -> 9 | DJ57: =SUM(R[-5]C:R[-1]C) -> 1.9499999999999997 | DK57: =SUM(R[-5]C:R[-1]C) -> 2.0499999999999994 | DL57: =SUM(R[-5]C:R[-1]C) -> 3500000000 | DM57: =SUM(R[-5]C:R[-1]C) -> 525000000 | DN57: =SUM(R[-5]C:R[-1]C) -> 8.1 | DO57: =SUM(R[-5]C:R[-1]C) -> 2974999991.9000001 | DP57: =SUM(R[-5]C:R[-1]C) -> 2974999989.8500004 | DR57: Tổng | DS57: =SUM(R[-5]C:R[-1]C) -> 12 | DT57: =SUM(R[-5]C:R[-1]C) -> 9 | DU57: =SUM(R[-5]C:R[-1]C) -> 1.7999999999999998 | DV57: =SUM(R[-5]C:R[-1]C) -> 1.1999999999999997 | DW57: =SUM(R[-5]C:R[-1]C) -> 3500000000 | DX57: =SUM(R[-5]C:R[-1]C) -> 525000000 | DY57: =SUM(R[-5]C:R[-1]C) -> 8.1 | DZ57: =SUM(R[-5]C:R[-1]C) -> 2974999991.9000006 | EA57: =SUM(R[-5]C:R[-1]C) -> 2974999990.7000003 | EC57: Tổng | ED57: =SUM(R[-5]C:R[-1]C) -> 7102257913 | EE57: =SUM(R[-5]C:R[-1]C) -> -1239876 | EF57: =SUM(R[-5]C:R[-1]C) -> 1065338687.5000002 | EG57: =SUM(R[-5]C:R[-1]C) -> 6038159101.4999962 | EH57: =SUM(R[-5]C:R[-1]C) -> 42000000000 | EI57: =SUM(R[-5]C:R[-1]C) -> 6300000000 | EJ57: =SUM(R[-5]C:R[-1]C) -> -1115888.4000000006 | EK57: =SUM(R[-5]C:R[-1]C) -> 35701115888.400009 | EL57: =SUM(R[-5]C:R[-1]C) -> 29662956786.900002
E59: Số liệu theo biên bản đối soát thực tế với Viettel | P59: Số liệu theo biên bản đối soát thực tế với Viettel | AA59: Số liệu theo biên bản đối soát thực tế với Viettel | AL59: Số liệu theo biên bản đối soát thực tế với Viettel | AW59: Số liệu theo biên bản đối soát thực tế với Viettel | BH59: Số liệu theo biên bản đối soát thực tế với Viettel | BS59: Số liệu theo biên bản đối soát thực tế với Viettel | CD59: Số liệu theo biên bản đối soát thực tế với Viettel | CO59: Số liệu theo biên bản đối soát thực tế với Viettel | CZ59: Số liệu theo biên bản đối soát thực tế với Viettel | DK59: Số liệu theo biên bản đối soát thực tế với Viettel | DV59: Số liệu theo biên bản đối soát thực tế với Viettel
E60: Doanh thu | G60: MT vượt | P60: Doanh thu | R60: MT vượt | AA60: Doanh thu | AC60: MT vượt | AL60: Doanh thu | AN60: MT vượt | AW60: Doanh thu | AY60: MT vượt | BH60: Doanh thu | BJ60: MT vượt | BS60: Doanh thu | BU60: MT vượt | CD60: Doanh thu | CF60: MT vượt | CO60: Doanh thu | CQ60: MT vượt | CZ60: Doanh thu | DB60: MT vượt | DK60: Doanh thu | DM60: MT vượt | DV60: Doanh thu | DX60: MT vượt
E61: Doanh thu hệ thống | F61: =R[-4]C[-4] -> 3551128896 | G61: MT hệ thống | H61: =R[-4]C[-5] -> 10 | P61: Doanh thu hệ thống | Q61: =R[-4]C[-4] -> 3551128896 | R61: MT hệ thống | S61: =R[-4]C[-5] -> 10 | AA61: Doanh thu hệ thống | AB61: =R[-4]C[-4] -> 12 | AC61: MT hệ thống | AD61: =R[-4]C[-5] -> 10 | AL61: Doanh thu hệ thống | AM61: =R[-4]C[-4] -> 12 | AN61: MT hệ thống | AO61: =R[-4]C[-5] -> 10 | AW61: Doanh thu hệ thống | AX61: =R[-4]C[-4] -> 12 | AY61: MT hệ thống | AZ61: =R[-4]C[-5] -> 10 | BH61: Doanh thu hệ thống | BI61: =R[-4]C[-4] -> 12 | BJ61: MT hệ thống | BK61: =R[-4]C[-5] -> 10 | BS61: Doanh thu hệ thống | BT61: =R[-4]C[-4] -> 12 | BU61: MT hệ thống | BV61: =R[-4]C[-5] -> 10 | CD61: Doanh thu hệ thống | CE61: =R[-4]C[-4] -> 12 | CF61: MT hệ thống | CG61: =R[-4]C[-5] -> 10 | CO61: Doanh thu hệ thống | CP61: =R[-4]C[-4] -> 12 | CQ61: MT hệ thống | CR61: =R[-4]C[-5] -> 10 | CZ61: Doanh thu hệ thống | DA61: =R[-4]C[-4] -> 12 | DB61: MT hệ thống | DC61: =R[-4]C[-5] -> 10 | DK61: Doanh thu hệ thống | DL61: =R[-4]C[-4] -> 13 | DM61: MT hệ thống | DN61: =R[-4]C[-5] -> 10 | DV61: Doanh thu hệ thống | DW61: =R[-4]C[-4] -> 12 | DX61: MT hệ thống | DY61: =R[-4]C[-5] -> 10
E62: Doanh thu thực tế | F62: 3500000000 | G62: MT thực tế | H62: 9 | P62: Doanh thu thực tế | Q62: 3500000000 | R62: MT thực tế | S62: 9 | AA62: Doanh thu thực tế | AB62: 3500000000 | AC62: MT thực tế | AD62: 9 | AL62: Doanh thu thực tế | AM62: 3500000000 | AN62: MT thực tế | AO62: 9 | AW62: Doanh thu thực tế | AX62: 3500000000 | AY62: MT thực tế | AZ62: 9 | BH62: Doanh thu thực tế | BI62: 3500000000 | BJ62: MT thực tế | BK62: 9 | BS62: Doanh thu thực tế | BT62: 3500000000 | BU62: MT thực tế | BV62: 9 | CD62: Doanh thu thực tế | CE62: 3500000000 | CF62: MT thực tế | CG62: 9 | CO62: Doanh thu thực tế | CP62: 3500000000 | CQ62: MT thực tế | CR62: 9 | CZ62: Doanh thu thực tế | DA62: 3500000000 | DB62: MT thực tế | DC62: 9 | DK62: Doanh thu thực tế | DL62: 3500000000 | DM62: MT thực tế | DN62: 9 | DV62: Doanh thu thực tế | DW62: 3500000000 | DX62: MT thực tế | DY62: 9
E63: DT QT/DT HT | F63: =R[-1]C/R[-2]C -> 0.9856020726091943 | G63: MT QT/ HT | H63: =R[-1]C/R[-2]C -> 0.9 | P63: DT QT/DT HT | Q63: =R[-1]C/R[-2]C -> 0.9856020726091943 | R63: MT QT/ HT | S63: =R[-1]C/R[-2]C -> 0.9 | AA63: DT QT/DT HT | AB63: =R[-1]C/R[-2]C -> 291666666.66666669 | AC63: MT QT/ HT | AD63: =R[-1]C/R[-2]C -> 0.9 | AL63: DT QT/DT HT | AM63: =R[-1]C/R[-2]C -> 291666666.66666669 | AN63: MT QT/ HT | AO63: =R[-1]C/R[-2]C -> 0.9 | AW63: DT QT/DT HT | AX63: =R[-1]C/R[-2]C -> 291666666.66666669 | AY63: MT QT/ HT | AZ63: =R[-1]C/R[-2]C -> 0.9 | BH63: DT QT/DT HT | BI63: =R[-1]C/R[-2]C -> 291666666.66666669 | BJ63: MT QT/ HT | BK63: =R[-1]C/R[-2]C -> 0.9 | BS63: DT QT/DT HT | BT63: =R[-1]C/R[-2]C -> 291666666.66666669 | BU63: MT QT/ HT | BV63: =R[-1]C/R[-2]C -> 0.9 | CD63: DT QT/DT HT | CE63: =R[-1]C/R[-2]C -> 291666666.66666669 | CF63: MT QT/ HT | CG63: =R[-1]C/R[-2]C -> 0.9 | CO63: DT QT/DT HT | CP63: =R[-1]C/R[-2]C -> 291666666.66666669 | CQ63: MT QT/ HT | CR63: =R[-1]C/R[-2]C -> 0.9 | CZ63: DT QT/DT HT | DA63: =R[-1]C/R[-2]C -> 291666666.66666669 | DB63: MT QT/ HT | DC63: =R[-1]C/R[-2]C -> 0.9 | DK63: DT QT/DT HT | DL63: =R[-1]C/R[-2]C -> 269230769.23076922 | DM63: MT QT/ HT | DN63: =R[-1]C/R[-2]C -> 0.9 | DV63: DT QT/DT HT | DW63: =R[-1]C/R[-2]C -> 291666666.66666669 | DX63: MT QT/ HT | DY63: =R[-1]C/R[-2]C -> 0.9
E64: Tỷ lệ thất thoát | F64: =100%-R[-1]C -> 1.4397927390805698E-2 | G64: Tỷ lệ chênh lệch | H64: =100%-R[-1]C -> 9.9999999999999978E-2 | P64: Tỷ lệ thất thoát | Q64: =100%-R[-1]C -> 1.4397927390805698E-2 | R64: Tỷ lệ chênh lệch | S64: =100%-R[-1]C -> 9.9999999999999978E-2 | AA64: Tỷ lệ thất thoát | AB64: =100%-R[-1]C -> -291666665.66666669 | AC64: Tỷ lệ chênh lệch | AD64: =100%-R[-1]C -> 9.9999999999999978E-2 | AL64: Tỷ lệ thất thoát | AM64: =100%-R[-1]C -> -291666665.66666669 | AN64: Tỷ lệ chênh lệch | AO64: =100%-R[-1]C -> 9.9999999999999978E-2 | AW64: Tỷ lệ thất thoát | AX64: =100%-R[-1]C -> -291666665.66666669 | AY64: Tỷ lệ chênh lệch | AZ64: =100%-R[-1]C -> 9.9999999999999978E-2 | BH64: Tỷ lệ thất thoát | BI64: =100%-R[-1]C -> -291666665.66666669 | BJ64: Tỷ lệ chênh lệch | BK64: =100%-R[-1]C -> 9.9999999999999978E-2 | BS64: Tỷ lệ thất thoát | BT64: =100%-R[-1]C -> -291666665.66666669 | BU64: Tỷ lệ chênh lệch | BV64: =100%-R[-1]C -> 9.9999999999999978E-2 | CD64: Tỷ lệ thất thoát | CE64: =100%-R[-1]C -> -291666665.66666669 | CF64: Tỷ lệ chênh lệch | CG64: =100%-R[-1]C -> 9.9999999999999978E-2 | CO64: Tỷ lệ thất thoát | CP64: =100%-R[-1]C -> -291666665.66666669 | CQ64: Tỷ lệ chênh lệch | CR64: =100%-R[-1]C -> 9.9999999999999978E-2 | CZ64: Tỷ lệ thất thoát | DA64: =100%-R[-1]C -> -291666665.66666669 | DB64: Tỷ lệ chênh lệch | DC64: =100%-R[-1]C -> 9.9999999999999978E-2 | DK64: Tỷ lệ thất thoát | DL64: =100%-R[-1]C -> -269230768.23076922 | DM64: Tỷ lệ chênh lệch | DN64: =100%-R[-1]C -> 9.9999999999999978E-2 | DV64: Tỷ lệ thất thoát | DW64: =100%-R[-1]C -> -291666665.66666669 | DX64: Tỷ lệ chênh lệch | DY64: =100%-R[-1]C -> 9.9999999999999978E-2
E65: Doanh thu khuyến khích | P65: Doanh thu khuyến khích | AA65: Doanh thu khuyến khích | AL65: Doanh thu khuyến khích | AW65: Doanh thu khuyến khích | BH65: Doanh thu khuyến khích | BS65: Doanh thu khuyến khích | CD65: Doanh thu khuyến khích | CO65: Doanh thu khuyến khích | CZ65: Doanh thu khuyến khích | DK65: Doanh thu khuyến khích | DV65: Doanh thu khuyến khích
A70: 6x66/VNM/2015
A71: Tháng 1 | L71: Tháng 2 | W71: Tháng 3 | AH71: Tháng 4 | AS71: Tháng 5 | BD71: Tháng 6 | BO71: Tháng 7 | BZ71: Tháng 8 | CK71: Tháng 9 | CV71: Tháng 10 | DG71: Tháng 11 | DR71: Tháng 12 | EC71: Lũy kế đến tháng báo cáo
A72: Tên đối tác | B72: Số liệu hệ thống/tạm tính | F72: Số liệu quyết toán theo biên bản đối soát | J72: C/lệch Quyết toán - Tạm tính | L72: Tên đối tác | M72: Số liệu hệ thống/tạm tính | Q72: Số liệu quyết toán theo biên bản đối soát | U72: C/lệch Quyết toán - Tạm tính | W72: Tên đối tác | X72: Số liệu hệ thống/tạm tính | AB72: Số liệu quyết toán theo biên bản đối soát | AF72: C/lệch Quyết toán - Tạm tính | AH72: Tên đối tác | AI72: Số liệu hệ thống/tạm tính | AM72: Số liệu quyết toán theo biên bản đối soát | AQ72: C/lệch Quyết toán - Tạm tính | AS72: Tên đối tác | AT72: Số liệu hệ thống/tạm tính | AX72: Số liệu quyết toán theo biên bản đối soát | BB72: C/lệch Quyết toán - Tạm tính | BD72: Tên đối tác | BE72: Số liệu hệ thống/tạm tính | BI72: Số liệu quyết toán theo biên bản đối soát | BM72: C/lệch Quyết toán - Tạm tính | BO72: Tên đối tác | BP72: Số liệu hệ thống/tạm tính | BT72: Số liệu quyết toán theo biên bản đối soát | BX72: C/lệch Quyết toán - Tạm tính | BZ72: Tên đối tác | CA72: Số liệu hệ thống/tạm tính | CE72: Số liệu quyết toán theo biên bản đối soát | CI72: C/lệch Quyết toán - Tạm tính | CK72: Tên đối tác | CL72: Số liệu hệ thống/tạm tính | CP72: Số liệu quyết toán theo biên bản đối soát | CT72: C/lệch Quyết toán - Tạm tính | CV72: Tên đối tác | CW72: Số liệu hệ thống/tạm tính | DA72: Số liệu quyết toán theo biên bản đối soát | DE72: C/lệch Quyết toán - Tạm tính | DG72: Tên đối tác | DH72: Số liệu hệ thống/tạm tính | DL72: Số liệu quyết toán theo biên bản đối soát | DP72: C/lệch Quyết toán - Tạm tính | DR72: Tên đối tác | DS72: Số liệu hệ thống/tạm tính | DW72: Số liệu quyết toán theo biên bản đối soát | EA72: C/lệch Quyết toán - Tạm tính | EC72: Tên đối tác | ED72: Số liệu hệ thống/tạm tính | EH72: Số liệu quyết toán theo biên bản đối soát | EL72: C/lệch Quyết toán - Tạm tính
B73: Doanh thu | C73: MT vượt | D73: Trả đối tác | E73: DT về đơn vị | F73: Doanh thu | G73: Trả đối tác | H73: MT | I73: DT về đơn vị | M73: Doanh thu | N73: MT vượt | O73: Trả đối tác | P73: DT về đơn vị | Q73: Doanh thu | R73: Trả đối tác | S73: MT | T73: DT về đơn vị | X73: Doanh thu | Y73: MT vượt | Z73: Trả đối tác | AA73: DT về đơn vị | AB73: Doanh thu | AC73: Trả đối tác | AD73: MT | AE73: DT về đơn vị | AI73: Doanh thu | AJ73: MT vượt | AK73: Trả đối tác | AL73: DT về đơn vị | AM73: Doanh thu | AN73: Trả đối tác | AO73: MT | AP73: DT về đơn vị | AT73: Doanh thu | AU73: MT vượt | AV73: Trả đối tác | AW73: DT về đơn vị | AX73: Doanh thu | AY73: Trả đối tác | AZ73: MT | BA73: DT về đơn vị | BE73: Doanh thu | BF73: MT vượt | BG73: Trả đối tác | BH73: DT về đơn vị | BI73: Doanh thu | BJ73: Trả đối tác | BK73: MT | BL73: DT về đơn vị | BP73: Doanh thu | BQ73: MT vượt | BR73: Trả đối tác | BS73: DT về đơn vị | BT73: Doanh thu | BU73: Trả đối tác | BV73: MT | BW73: DT về đơn vị | CA73: Doanh thu | CB73: MT vượt | CC73: Trả đối tác | CD73: DT về đơn vị | CE73: Doanh thu | CF73: Trả đối tác | CG73: MT | CH73: DT về đơn vị | CL73: Doanh thu | CM73: MT vượt | CN73: Trả đối tác | CO73: DT về đơn vị | CP73: Doanh thu | CQ73: Trả đối tác | CR73: MT | CS73: DT về đơn vị | CW73: Doanh thu | CX73: MT vượt | CY73: Trả đối tác | CZ73: DT về đơn vị | DA73: Doanh thu | DB73: Trả đối tác | DC73: MT | DD73: DT về đơn vị | DH73: Doanh thu | DI73: MT vượt | DJ73: Trả đối tác | DK73: DT về đơn vị | DL73: Doanh thu | DM73: Trả đối tác | DN73: MT | DO73: DT về đơn vị | DS73: Doanh thu | DT73: MT vượt | DU73: Trả đối tác | DV73: DT về đơn vị | DW73: Doanh thu | DX73: Trả đối tác | DY73: MT | DZ73: DT về đơn vị | ED73: Doanh thu | EE73: MT vượt | EF73: Trả đối tác | EG73: DT về đơn vị | EH73: Doanh thu | EI73: Trả đối tác | EJ73: MT | EK73: DT về đơn vị
B74: (1) | C74: (2) | D74: (3) = (1) *15% | E74: (4) = (1) - (3) - (2) | F74: (5) | G74: (6) | H74: (7) | I74: (8) = (5) - (6) - (7) | J74: (9) = (4) - (8) | M74: (1) | N74: (2) = ( MO - MT) *91 | O74: (3) = (1) *15% | P74: (4) = (1) - (3) - (2) | Q74: (5) | R74: (6) | S74: (7) | T74: (8) = (5) - (6) - (7) | U74: (9) = (4) - (8) | X74: (1) | Y74: (2) = ( MO - MT) *91 | Z74: (3) = (1) *15% | AA74: (4) = (1) - (3) - (2) | AB74: (5) | AC74: (6) | AD74: (7) | AE74: (8) = (5) - (6) - (7) | AF74: (9) = (4) - (8) | AI74: (1) | AJ74: (2) = ( MO - MT) *91 | AK74: (3) = (1) *15% | AL74: (4) = (1) - (3) - (2) | AM74: (5) | AN74: (6) | AO74: (7) | AP74: (8) = (5) - (6) - (7) | AQ74: (9) = (4) - (8) | AT74: (1) | AU74: (2) = ( MO - MT) *91 | AV74: (3) = (1) *15% | AW74: (4) = (1) - (3) - (2) | AX74: (5) | AY74: (6) | AZ74: (7) | BA74: (8) = (5) - (6) - (7) | BB74: (9) = (4) - (8) | BE74: (1) | BF74: (2) = ( MO - MT) *91 | BG74: (3) = (1) *15% | BH74: (4) = (1) - (3) - (2) | BI74: (5) | BJ74: (6) | BK74: (7) | BL74: (8) = (5) - (6) - (7) | BM74: (9) = (4) - (8) | BP74: (1) | BQ74: (2) | BR74: (3) = (1) *15% | BS74: (4) = (1) - (3) - (2) | BT74: (5) | BU74: (6) | BV74: (7) | BW74: (8) = (5) - (6) - (7) | BX74: (9) = (4) - (8) | CA74: (1) | CB74: (2) = ( MO - MT) *91 | CC74: (3) = (1) *15% | CD74: (4) = (1) - (3) - (2) | CE74: (5) | CF74: (6) | CG74: (7) | CH74: (8) = (5) - (6) - (7) | CI74: (9) = (4) - (8) | CL74: (1) | CM74: (2) = ( MO - MT) *91 | CN74: (3) = (1) *15% | CO74: (4) = (1) - (3) - (2) | CP74: (5) | CQ74: (6) | CR74: (7) | CS74: (8) = (5) - (6) - (7) | CT74: (9) = (4) - (8) | CW74: (1) | CX74: (2) = ( MO - MT) *91 | CY74: (3) = (1) *15% | CZ74: (4) = (1) - (3) - (2) | DA74: (5) | DB74: (6) | DC74: (7) | DD74: (8) = (5) - (6) - (7) | DE74: (9) = (4) - (8) | DH74: (1) | DI74: (2) = ( MO - MT) *91 | DJ74: (3) = (1) *15% | DK74: (4) = (1) - (3) - (2) | DL74: (5) | DM74: (6) | DN74: (7) | DO74: (8) = (5) - (6) - (7) | DP74: (9) = (4) - (8) | DS74: (1) | DT74: (2) = ( MO - MT) *91 | DU74: (3) = (1) *15% | DV74: (4) = (1) - (3) - (2) | DW74: (5) | DX74: (6) | DY74: (7) | DZ74: (8) = (5) - (6) - (7) | EA74: (9) = (4) - (8) | ED74: (1) | EE74: (2) = ( MO - MT) *91 | EF74: (3) = (1) *15% | EG74: (4) = (1) - (3) - (2) | EH74: (5) | EI74: (6) | EJ74: (7) | EK74: (8) = (5) - (6) - (7) | EL74: (9) = (4) - (8)
A75: SUBCPS | B75: 702278 | C75: 24570 | D75: 35114 | E75: =RC[-3]-RC[-1]-RC[-2] ->  | F75: =R86C6*RC[-4] ->  | G75: =RC[-1]*5% ->  | H75: =R86C8*RC[-5] ->  | I75: =RC[-3]-RC[-2]-RC[-1] ->  | J75: =RC[-1]-RC[-5] ->  | L75: SUBCPS | M75: 649700 | N75: 22386 | O75: 32485 | P75: =RC[-3]-RC[-1]-RC[-2] -> 2467006.9 | Q75: =R86C17*RC[-4] -> 3000383.6278659259 | R75: =RC[-1]*5% -> 450057.54417988885 | S75: =R86C19*RC[-5] -> 108517.5 | T75: =RC[-3]-RC[-2]-RC[-1] -> 2441808.583686037 | U75: =RC[-1]-RC[-5] -> -25198.316313962918 | W75: SUBCPS | X75: 770128 | Y75: 26572 | Z75: 38506 | AA75: =RC[-3]-RC[-1]-RC[-2] -> 0 | AB75: =R86C28*RC[-4] -> 875000000 | AC75: =RC[-1]*5% -> 131250000 | AD75: =R86C19*RC[-5] -> 1.8 | AE75: =RC[-3]-RC[-2]-RC[-1] -> 743749998.20000005 | AF75: =RC[-1]-RC[-5] -> 743749998.20000005 | AH75: SUBCPS | AI75: 596904 | AJ75: 20384 | AK75: 29845 | AL75: =RC[-3]-RC[-1]-RC[-2] -> 0.54999999999999982 | AM75: =R86C39*RC[-4] -> 875000000 | AN75: =RC[-1]*5% -> 131250000 | AO75: =R86C19*RC[-5] -> 1.8 | AP75: =RC[-3]-RC[-2]-RC[-1] -> 743749998.20000005 | AQ75: =RC[-1]-RC[-5] -> 743749997.6500001 | AS75: SUBCPS | AT75: 913026 | AU75: 32214 | AV75: 45651 | AW75: =RC[-3]-RC[-1]-RC[-2] -> 0.54999999999999982 | AX75: =R86C50*RC[-4] -> 875000000 | AY75: =RC[-1]*5% -> 131250000 | AZ75: =R86C19*RC[-5] -> 1.8 | BA75: =RC[-3]-RC[-2]-RC[-1] -> 743749998.20000005 | BB75: =RC[-1]-RC[-5] -> 743749997.6500001 | BD75: SUBCPS | BE75: 699879 | BF75: 24843 | BG75: 34994 | BH75: =RC[-3]-RC[-1]-RC[-2] -> 0.54999999999999982 | BI75: =R86C61*RC[-4] -> 875000000 | BJ75: =RC[-1]*5% -> 131250000 | BK75: =R86C19*RC[-5] -> 1.8 | BL75: =RC[-3]-RC[-2]-RC[-1] -> 743749998.20000005 | BM75: =RC[-1]-RC[-5] -> 743749997.6500001 | BO75: SUBCPS | BP75: 0 | BQ75: 0 | BR75: 0 | BS75: =RC[-3]-RC[-1]-RC[-2] -> 0.54999999999999982 | BT75: =R86C72*RC[-4] -> 875000000 | BU75: =RC[-1]*5% -> 131250000 | BV75: =R86C8*RC[-5] -> 1.8 | BW75: =RC[-3]-RC[-2]-RC[-1] -> 743749998.20000005 | BX75: =RC[-1]-RC[-5] -> 743749997.6500001 | BZ75: SUBCPS | CA75: 0 | CB75: 0 | CC75: 0 | CD75: =RC[-3]-RC[-1]-RC[-2] -> 0.54999999999999982 | CE75: =R86C83*RC[-4] -> 875000000 | CF75: =RC[-1]*5% -> 131250000 | CG75: =R86C19*RC[-5] -> 1.8 | CH75: =RC[-3]-RC[-2]-RC[-1] -> 743749998.20000005 | CI75: =RC[-1]-RC[-5] -> 743749997.6500001 | CK75: SUBCPS | CL75: 0 | CM75: 0 | CN75: 0 | CO75: =RC[-3]-RC[-1]-RC[-2] -> 0.54999999999999982 | CP75: =R86C94*RC[-4] -> 875000000 | CQ75: =RC[-1]*5% -> 131250000 | CR75: =R86C19*RC[-5] -> 1.8 | CS75: =RC[-3]-RC[-2]-RC[-1] -> 743749998.20000005 | CT75: =RC[-1]-RC[-5] -> 743749997.6500001 | CV75: SUBCPS | CW75: 0 | CX75: 0 | CY75: 0 | CZ75: =RC[-3]-RC[-1]-RC[-2] -> 0.54999999999999982 | DA75: =R86C105*RC[-4] -> 875000000 | DB75: =RC[-1]*5% -> 131250000 | DC75: =R86C19*RC[-5] -> 1.8 | DD75: =RC[-3]-RC[-2]-RC[-1] -> 743749998.20000005 | DE75: =RC[-1]-RC[-5] -> 743749997.6500001 | DG75: SUBCPS | DH75: 0 | DI75: 0 | DJ75: 0 | DK75: =RC[-3]-RC[-1]-RC[-2] -> 0.54999999999999982 | DL75: =R86C116*RC[-4] -> 807692307.69230771 | DM75: =RC[-1]*5% -> 121153846.15384614 | DN75: =R86C19*RC[-5] -> 1.8 | DO75: =RC[-3]-RC[-2]-RC[-1] -> 686538459.73846161 | DP75: =RC[-1]-RC[-5] -> 686538459.18846166 | DR75: SUBCPS | DS75: 0 | DT75: 0 | DU75: 0 | DV75: =RC[-3]-RC[-1]-RC[-2] -> 0.54999999999999982 | DW75: =R86C127*RC[-4] -> 875000000 | DX75: =RC[-1]*5% -> 131250000 | DY75: =R86C19*RC[-5] -> 1.8 | DZ75: =RC[-3]-RC[-2]-RC[-1] -> 743749998.20000005 | EA75: =RC[-1]-RC[-5] -> 743749997.6500001 | EC75: SUBCPS | ED75: =RC[-132]+RC[-121]+RC[-110]+RC[-99]+RC[-88]+RC[-77]+RC[-66]+RC[-55]+RC[-44]+RC[-33]+RC[-22]+RC[-11] ->  | EE75: =RC[-132]+RC[-121]+RC[-110]+RC[-99]+RC[-88]+RC[-77]+RC[-66]+RC[-55]+RC[-44]+RC[-33]+RC[-22]+RC[-11] ->  | EF75: =RC[-132]+RC[-121]+RC[-110]+RC[-99]+RC[-88]+RC[-77]+RC[-66]+RC[-55]+RC[-44]+RC[-33]+RC[-22]+RC[-11] ->  | EG75: =RC[-132]+RC[-121]+RC[-110]+RC[-99]+RC[-88]+RC[-77]+RC[-66]+RC[-55]+RC[-44]+RC[-33]+RC[-22]+RC[-11] ->  | EH75: =RC[-132]+RC[-121]+RC[-110]+RC[-99]+RC[-88]+RC[-77]+RC[-66]+RC[-55]+RC[-44]+RC[-33]+RC[-22]+RC[-11] ->  | EI75: =RC[-132]+RC[-121]+RC[-110]+RC[-99]+RC[-88]+RC[-77]+RC[-66]+RC[-55]+RC[-44]+RC[-33]+RC[-22]+RC[-11] ->  | EJ75: =RC[-132]+RC[-121]+RC[-110]+RC[-99]+RC[-88]+RC[-77]+RC[-66]+RC[-55]+RC[-44]+RC[-33]+RC[-22]+RC[-11] ->  | EK75: =RC[-132]+RC[-121]+RC[-110]+RC[-99]+RC[-88]+RC[-77]+RC[-66]+RC[-55]+RC[-44]+RC[-33]+RC[-22]+RC[-11] ->  | EL75: =RC[-132]+RC[-121]+RC[-110]+RC[-99]+RC[-88]+RC[-77]+RC[-66]+RC[-55]+RC[-44]+RC[-33]+RC[-22]+RC[-11] -> 
A76: LUCKY_FONE | B76: 588161 | C76: 160342 | D76: 29408 | E76: =RC[-3]-RC[-1]-RC[-2] ->  | F76: =R86C6*RC[-4] ->  | G76: =RC[-1]*5% ->  | H76: =R86C8*RC[-5] ->  | I76: =RC[-3]-RC[-2]-RC[-1] ->  | J76: =RC[-1]-RC[-5] ->  | L76: LUCKY_FONE | M76: 415433 | N76: 136318 | O76: 20772 | P76: =RC[-3]-RC[-1]-RC[-2] -> 2467006.9 | Q76: =R86C17*RC[-4] -> 3000383.6278659259 | R76: =RC[-1]*5% -> 450057.54417988885 | S76: =R86C19*RC[-5] -> 108517.5 | T76: =RC[-3]-RC[-2]-RC[-1] -> 2441808.583686037 | U76: =RC[-1]-RC[-5] -> -25198.316313962918 | W76: LUCKY_FONE | X76: 456949 | Y76: 163982 | Z76: 22847 | AA76: =RC[-3]-RC[-1]-RC[-2] -> 0 | AB76: =R86C28*RC[-4] -> 875000000 | AC76: =RC[-1]*5% -> 131250000 | AD76: =R86C19*RC[-5] -> 1.8 | AE76: =RC[-3]-RC[-2]-RC[-1] -> 743749998.20000005 | AF76: =RC[-1]-RC[-5] -> 743749998.20000005 | AH76: LUCKY_FONE | AI76: 416710 | AJ76: 136682 | AK76: 20836 | AL76: =RC[-3]-RC[-1]-RC[-2] -> 0.54999999999999982 | AM76: =R86C39*RC[-4] -> 875000000 | AN76: =RC[-1]*5% -> 131250000 | AO76: =R86C19*RC[-5] -> 1.8 | AP76: =RC[-3]-RC[-2]-RC[-1] -> 743749998.20000005 | AQ76: =RC[-1]-RC[-5] -> 743749997.6500001 | AS76: LUCKY_FONE | AT76: 356707 | AU76: 131222 | AV76: 17835 | AW76: =RC[-3]-RC[-1]-RC[-2] -> 0.54999999999999982 | AX76: =R86C50*RC[-4] -> 875000000 | AY76: =RC[-1]*5% -> 131250000 | AZ76: =R86C19*RC[-5] -> 1.8 | BA76: =RC[-3]-RC[-2]-RC[-1] -> 743749998.20000005 | BB76: =RC[-1]-RC[-5] -> 743749997.6500001 | BD76: LUCKY_FONE | BE76: 301956 | BF76: 94276 | BG76: 15098 | BH76: =RC[-3]-RC[-1]-RC[-2] -> 0.54999999999999982 | BI76: =R86C61*RC[-4] -> 875000000 | BJ76: =RC[-1]*5% -> 131250000 | BK76: =R86C19*RC[-5] -> 1.8 | BL76: =RC[-3]-RC[-2]-RC[-1] -> 743749998.20000005 | BM76: =RC[-1]-RC[-5] -> 743749997.6500001 | BO76: LUCKY_FONE | BP76: 0 | BQ76: 0 | BR76: 0 | BS76: =RC[-3]-RC[-1]-RC[-2] -> 0.54999999999999982 | BT76: =R86C72*RC[-4] -> 875000000 | BU76: =RC[-1]*5% -> 131250000 | BV76: =R86C8*RC[-5] -> 1.8 | BW76: =RC[-3]-RC[-2]-RC[-1] -> 743749998.20000005 | BX76: =RC[-1]-RC[-5] -> 743749997.6500001 | BZ76: LUCKY_FONE | CA76: 0 | CB76: 0 | CC76: 0 | CD76: =RC[-3]-RC[-1]-RC[-2] -> 0.54999999999999982 | CE76: =R86C83*RC[-4] -> 875000000 | CF76: =RC[-1]*5% -> 131250000 | CG76: =R86C19*RC[-5] -> 1.8 | CH76: =RC[-3]-RC[-2]-RC[-1] -> 743749998.20000005 | CI76: =RC[-1]-RC[-5] -> 743749997.6500001 | CK76: LUCKY_FONE | CL76: 0 | CM76: 0 | CN76: 0 | CO76: =RC[-3]-RC[-1]-RC[-2] -> 0.54999999999999982 | CP76: =R86C94*RC[-4] -> 875000000 | CQ76: =RC[-1]*5% -> 131250000 | CR76: =R86C19*RC[-5] -> 1.8 | CS76: =RC[-3]-RC[-2]-RC[-1] -> 743749998.20000005 | CT76: =RC[-1]-RC[-5] -> 743749997.6500001 | CV76: LUCKY_FONE | CW76: 0 | CX76: 0 | CY76: 0 | CZ76: =RC[-3]-RC[-1]-RC[-2] -> 0.54999999999999982 | DA76: =R86C105*RC[-4] -> 875000000 | DB76: =RC[-1]*5% -> 131250000 | DC76: =R86C19*RC[-5] -> 1.8 | DD76: =RC[-3]-RC[-2]-RC[-1] -> 743749998.20000005 | DE76: =RC[-1]-RC[-5] -> 743749997.6500001 | DG76: LUCKY_FONE | DH76: 0 | DI76: 0 | DJ76: 0 | DK76: =RC[-3]-RC[-1]-RC[-2] -> 0.54999999999999982 | DL76: =R86C116*RC[-4] -> 807692307.69230771 | DM76: =RC[-1]*5% -> 121153846.15384614 | DN76: =R86C19*RC[-5] -> 1.8 | DO76: =RC[-3]-RC[-2]-RC[-1] -> 686538459.73846161 | DP76: =RC[-1]-RC[-5] -> 686538459.18846166 | DR76: LUCKY_FONE | DS76: 0 | DT76: 0 | DU76: 0 | DV76: =RC[-3]-RC[-1]-RC[-2] -> 0.54999999999999982 | DW76: =R86C127*RC[-4] -> 875000000 | DX76: =RC[-1]*5% -> 131250000 | DY76: =R86C19*RC[-5] -> 1.8 | DZ76: =RC[-3]-RC[-2]-RC[-1] -> 743749998.20000005 | EA76: =RC[-1]-RC[-5] -> 743749997.6500001 | EC76: LUCKY_FONE | ED76: =RC[-132]+RC[-121]+RC[-110]+RC[-99]+RC[-88]+RC[-77]+RC[-66]+RC[-55]+RC[-44]+RC[-33]+RC[-22]+RC[-11] ->  | EE76: =RC[-132]+RC[-121]+RC[-110]+RC[-99]+RC[-88]+RC[-77]+RC[-66]+RC[-55]+RC[-44]+RC[-33]+RC[-22]+RC[-11] ->  | EF76: =RC[-132]+RC[-121]+RC[-110]+RC[-99]+RC[-88]+RC[-77]+RC[-66]+RC[-55]+RC[-44]+RC[-33]+RC[-22]+RC[-11] ->  | EG76: =RC[-132]+RC[-121]+RC[-110]+RC[-99]+RC[-88]+RC[-77]+RC[-66]+RC[-55]+RC[-44]+RC[-33]+RC[-22]+RC[-11] ->  | EH76: =RC[-132]+RC[-121]+RC[-110]+RC[-99]+RC[-88]+RC[-77]+RC[-66]+RC[-55]+RC[-44]+RC[-33]+RC[-22]+RC[-11] ->  | EI76: =RC[-132]+RC[-121]+RC[-110]+RC[-99]+RC[-88]+RC[-77]+RC[-66]+RC[-55]+RC[-44]+RC[-33]+RC[-22]+RC[-11] ->  | EJ76: =RC[-132]+RC[-121]+RC[-110]+RC[-99]+RC[-88]+RC[-77]+RC[-66]+RC[-55]+RC[-44]+RC[-33]+RC[-22]+RC[-11] ->  | EK76: =RC[-132]+RC[-121]+RC[-110]+RC[-99]+RC[-88]+RC[-77]+RC[-66]+RC[-55]+RC[-44]+RC[-33]+RC[-22]+RC[-11] ->  | EL76: =RC[-132]+RC[-121]+RC[-110]+RC[-99]+RC[-88]+RC[-77]+RC[-66]+RC[-55]+RC[-44]+RC[-33]+RC[-22]+RC[-11] -> 
A77: TT PTKD | B77: 85757 | C77: 51961 | D77: 4288 | E77: =RC[-3]-RC[-1]-RC[-2] ->  | F77: =R86C6*RC[-4] ->  | G77: =RC[-1]*5% ->  | H77: =R86C8*RC[-5] ->  | I77: =RC[-3]-RC[-2]-RC[-1] ->  | J77: =RC[-1]-RC[-5] ->  | L77: TT PTKD | M77: 29305 | N77: 26208 | O77: 1465 | P77: =RC[-3]-RC[-1]-RC[-2] -> 2467006.9 | Q77: =R86C17*RC[-4] -> 3000383.6278659259 | R77: =RC[-1]*5% -> 450057.54417988885 | S77: =R86C19*RC[-5] -> 108517.5 | T77: =RC[-3]-RC[-2]-RC[-1] -> 2441808.583686037 | U77: =RC[-1]-RC[-5] -> -25198.316313962918 | W77: TT PTKD | X77: 50649 | Y77: 27482 | Z77: 2532 | AA77: =RC[-3]-RC[-1]-RC[-2] -> 0 | AB77: =R86C28*RC[-4] -> 875000000 | AC77: =RC[-1]*5% -> 131250000 | AD77: =R86C19*RC[-5] -> 1.8 | AE77: =RC[-3]-RC[-2]-RC[-1] -> 743749998.20000005 | AF77: =RC[-1]-RC[-5] -> 743749998.20000005 | AH77: TT PTKD | AI77: 103553 | AJ77: 2456 | AK77: 5178 | AL77: =RC[-3]-RC[-1]-RC[-2] -> 0.54999999999999982 | AM77: =R86C39*RC[-4] -> 875000000 | AN77: =RC[-1]*5% -> 131250000 | AO77: =R86C19*RC[-5] -> 1.8 | AP77: =RC[-3]-RC[-2]-RC[-1] -> 743749998.20000005 | AQ77: =RC[-1]-RC[-5] -> 743749997.6500001 | AS77: TT PTKD | AT77: 55285 | AU77: 67364 | AV77: 2764 | AW77: =RC[-3]-RC[-1]-RC[-2] -> 0.54999999999999982 | AX77: =R86C50*RC[-4] -> 875000000 | AY77: =RC[-1]*5% -> 131250000 | AZ77: =R86C19*RC[-5] -> 1.8 | BA77: =RC[-3]-RC[-2]-RC[-1] -> 743749998.20000005 | BB77: =RC[-1]-RC[-5] -> 743749997.6500001 | BD77: TT PTKD | BE77: 15998 | BF77: 74136 | BG77: 800 | BH77: =RC[-3]-RC[-1]-RC[-2] -> 0.54999999999999982 | BI77: =R86C61*RC[-4] -> 875000000 | BJ77: =RC[-1]*5% -> 131250000 | BK77: =R86C19*RC[-5] -> 1.8 | BL77: =RC[-3]-RC[-2]-RC[-1] -> 743749998.20000005 | BM77: =RC[-1]-RC[-5] -> 743749997.6500001 | BO77: TT PTKD | BP77: 0 | BQ77: 0 | BR77: 0 | BS77: =RC[-3]-RC[-1]-RC[-2] -> 0.54999999999999982 | BT77: =R86C72*RC[-4] -> 875000000 | BU77: =RC[-1]*5% -> 131250000 | BV77: =R86C8*RC[-5] -> 1.8 | BW77: =RC[-3]-RC[-2]-RC[-1] -> 743749998.20000005 | BX77: =RC[-1]-RC[-5] -> 743749997.6500001 | BZ77: TT PTKD | CA77: 0 | CB77: 0 | CC77: 0 | CD77: =RC[-3]-RC[-1]-RC[-2] -> 0.54999999999999982 | CE77: =R86C83*RC[-4] -> 875000000 | CF77: =RC[-1]*5% -> 131250000 | CG77: =R86C19*RC[-5] -> 1.8 | CH77: =RC[-3]-RC[-2]-RC[-1] -> 743749998.20000005 | CI77: =RC[-1]-RC[-5] -> 743749997.6500001 | CK77: TT PTKD | CL77: 0 | CM77: 0 | CN77: 0 | CO77: =RC[-3]-RC[-1]-RC[-2] -> 0.54999999999999982 | CP77: =R86C94*RC[-4] -> 875000000 | CQ77: =RC[-1]*5% -> 131250000 | CR77: =R86C19*RC[-5] -> 1.8 | CS77: =RC[-3]-RC[-2]-RC[-1] -> 743749998.20000005 | CT77: =RC[-1]-RC[-5] -> 743749997.6500001 | CV77: TT PTKD | CW77: 0 | CX77: 0 | CY77: 0 | CZ77: =RC[-3]-RC[-1]-RC[-2] -> 0.54999999999999982 | DA77: =R86C105*RC[-4] -> 875000000 | DB77: =RC[-1]*5% -> 131250000 | DC77: =R86C19*RC[-5] -> 1.8 | DD77: =RC[-3]-RC[-2]-RC[-1] -> 743749998.20000005 | DE77: =RC[-1]-RC[-5] -> 743749997.6500001 | DG77: TT PTKD | DH77: 0 | DI77: 0 | DJ77: 0 | DK77: =RC[-3]-RC[-1]-RC[-2] -> 0.54999999999999982 | DL77: =R86C116*RC[-4] -> 807692307.69230771 | DM77: =RC[-1]*5% -> 121153846.15384614 | DN77: =R86C19*RC[-5] -> 1.8 | DO77: =RC[-3]-RC[-2]-RC[-1] -> 686538459.73846161 | DP77: =RC[-1]-RC[-5] -> 686538459.18846166 | DR77: TT PTKD | DS77: 0 | DT77: 0 | DU77: 0 | DV77: =RC[-3]-RC[-1]-RC[-2] -> 0.54999999999999982 | DW77: =R86C127*RC[-4] -> 875000000 | DX77: =RC[-1]*5% -> 131250000 | DY77: =R86C19*RC[-5] -> 1.8 | DZ77: =RC[-3]-RC[-2]-RC[-1] -> 743749998.20000005 | EA77: =RC[-1]-RC[-5] -> 743749997.6500001 | EC77: TT PTKD | ED77: =RC[-132]+RC[-121]+RC[-110]+RC[-99]+RC[-88]+RC[-77]+RC[-66]+RC[-55]+RC[-44]+RC[-33]+RC[-22]+RC[-11] ->  | EE77: =RC[-132]+RC[-121]+RC[-110]+RC[-99]+RC[-88]+RC[-77]+RC[-66]+RC[-55]+RC[-44]+RC[-33]+RC[-22]+RC[-11] ->  | EF77: =RC[-132]+RC[-121]+RC[-110]+RC[-99]+RC[-88]+RC[-77]+RC[-66]+RC[-55]+RC[-44]+RC[-33]+RC[-22]+RC[-11] ->  | EG77: =RC[-132]+RC[-121]+RC[-110]+RC[-99]+RC[-88]+RC[-77]+RC[-66]+RC[-55]+RC[-44]+RC[-33]+RC[-22]+RC[-11] ->  | EH77: =RC[-132]+RC[-121]+RC[-110]+RC[-99]+RC[-88]+RC[-77]+RC[-66]+RC[-55]+RC[-44]+RC[-33]+RC[-22]+RC[-11] ->  | EI77: =RC[-132]+RC[-121]+RC[-110]+RC[-99]+RC[-88]+RC[-77]+RC[-66]+RC[-55]+RC[-44]+RC[-33]+RC[-22]+RC[-11] ->  | EJ77: =RC[-132]+RC[-121]+RC[-110]+RC[-99]+RC[-88]+RC[-77]+RC[-66]+RC[-55]+RC[-44]+RC[-33]+RC[-22]+RC[-11] ->  | EK77: =RC[-132]+RC[-121]+RC[-110]+RC[-99]+RC[-88]+RC[-77]+RC[-66]+RC[-55]+RC[-44]+RC[-33]+RC[-22]+RC[-11] ->  | EL77: =RC[-132]+RC[-121]+RC[-110]+RC[-99]+RC[-88]+RC[-77]+RC[-66]+RC[-55]+RC[-44]+RC[-33]+RC[-22]+RC[-11] -> 
A78: TT PTND | B78: 8117571 | C78: 397670 | D78: 405879 | E78: =RC[-3]-RC[-1]-RC[-2] ->  | F78: =R86C6*RC[-4] ->  | G78: =RC[-1]*5% ->  | H78: =R86C8*RC[-5] ->  | I78: =RC[-3]-RC[-2]-RC[-1] ->  | J78: =RC[-1]-RC[-5] ->  | L78: TT PTND | M78: 6632253 | N78: 288652 | O78: 331613 | P78: =RC[-3]-RC[-1]-RC[-2] -> 2467006.9 | Q78: =R86C17*RC[-4] -> 3000383.6278659259 | R78: =RC[-1]*5% -> 450057.54417988885 | S78: =R86C19*RC[-5] -> 108517.5 | T78: =RC[-3]-RC[-2]-RC[-1] -> 2441808.583686037 | U78: =RC[-1]-RC[-5] -> -25198.316313962918 | W78: TT PTND | X78: 7559345 | Y78: 431340 | Z78: 377967 | AA78: =RC[-3]-RC[-1]-RC[-2] -> 0 | AB78: =R86C28*RC[-4] -> 875000000 | AC78: =RC[-1]*5% -> 131250000 | AD78: =R86C19*RC[-5] -> 1.8 | AE78: =RC[-3]-RC[-2]-RC[-1] -> 743749998.20000005 | AF78: =RC[-1]-RC[-5] -> 743749998.20000005 | AH78: TT PTND | AI78: 6259247 | AJ78: 370552 | AK78: 312962 | AL78: =RC[-3]-RC[-1]-RC[-2] -> 0.54999999999999982 | AM78: =R86C39*RC[-4] -> 875000000 | AN78: =RC[-1]*5% -> 131250000 | AO78: =R86C19*RC[-5] -> 1.8 | AP78: =RC[-3]-RC[-2]-RC[-1] -> 743749998.20000005 | AQ78: =RC[-1]-RC[-5] -> 743749997.6500001 | AS78: TT PTND | AT78: 7039653 | AU78: 362544 | AV78: 351983 | AW78: =RC[-3]-RC[-1]-RC[-2] -> 0.54999999999999982 | AX78: =R86C50*RC[-4] -> 875000000 | AY78: =RC[-1]*5% -> 131250000 | AZ78: =R86C19*RC[-5] -> 1.8 | BA78: =RC[-3]-RC[-2]-RC[-1] -> 743749998.20000005 | BB78: =RC[-1]-RC[-5] -> 743749997.6500001 | BD78: TT PTND | BE78: 38786158 | BF78: 649975 | BG78: 1939308 | BH78: =RC[-3]-RC[-1]-RC[-2] -> 0.54999999999999982 | BI78: =R86C61*RC[-4] -> 875000000 | BJ78: =RC[-1]*5% -> 131250000 | BK78: =R86C19*RC[-5] -> 1.8 | BL78: =RC[-3]-RC[-2]-RC[-1] -> 743749998.20000005 | BM78: =RC[-1]-RC[-5] -> 743749997.6500001 | BO78: TT PTND | BP78: 0 | BQ78: 0 | BR78: 0 | BS78: =RC[-3]-RC[-1]-RC[-2] -> 0.54999999999999982 | BT78: =R86C72*RC[-4] -> 875000000 | BU78: =RC[-1]*5% -> 131250000 | BV78: =R86C8*RC[-5] -> 1.8 | BW78: =RC[-3]-RC[-2]-RC[-1] -> 743749998.20000005 | BX78: =RC[-1]-RC[-5] -> 743749997.6500001 | BZ78: TT PTND | CA78: 0 | CB78: 0 | CC78: 0 | CD78: =RC[-3]-RC[-1]-RC[-2] -> 0.54999999999999982 | CE78: =R86C83*RC[-4] -> 875000000 | CF78: =RC[-1]*5% -> 131250000 | CG78: =R86C19*RC[-5] -> 1.8 | CH78: =RC[-3]-RC[-2]-RC[-1] -> 743749998.20000005 | CI78: =RC[-1]-RC[-5] -> 743749997.6500001 | CK78: TT PTND | CL78: 0 | CM78: 0 | CN78: 0 | CO78: =RC[-3]-RC[-1]-RC[-2] -> 0.54999999999999982 | CP78: =R86C94*RC[-4] -> 875000000 | CQ78: =RC[-1]*5% -> 131250000 | CR78: =R86C19*RC[-5] -> 1.8 | CS78: =RC[-3]-RC[-2]-RC[-1] -> 743749998.20000005 | CT78: =RC[-1]-RC[-5] -> 743749997.6500001 | CV78: TT PTND | CW78: 0 | CX78: 0 | CY78: 0 | CZ78: =RC[-3]-RC[-1]-RC[-2] -> 0.54999999999999982 | DA78: =R86C105*RC[-4] -> 875000000 | DB78: =RC[-1]*5% -> 131250000 | DC78: =R86C19*RC[-5] -> 1.8 | DD78: =RC[-3]-RC[-2]-RC[-1] -> 743749998.20000005 | DE78: =RC[-1]-RC[-5] -> 743749997.6500001 | DG78: TT PTND | DH78: 0 | DI78: 0 | DJ78: 0 | DK78: =RC[-3]-RC[-1]-RC[-2] -> 0.54999999999999982 | DL78: =R86C116*RC[-4] -> 807692307.69230771 | DM78: =RC[-1]*5% -> 121153846.15384614 | DN78: =R86C19*RC[-5] -> 1.8 | DO78: =RC[-3]-RC[-2]-RC[-1] -> 686538459.73846161 | DP78: =RC[-1]-RC[-5] -> 686538459.18846166 | DR78: TT PTND | DS78: 0 | DT78: 0 | DU78: 0 | DV78: =RC[-3]-RC[-1]-RC[-2] -> 0.54999999999999982 | DW78: =R86C127*RC[-4] -> 875000000 | DX78: =RC[-1]*5% -> 131250000 | DY78: =R86C19*RC[-5] -> 1.8 | DZ78: =RC[-3]-RC[-2]-RC[-1] -> 743749998.20000005 | EA78: =RC[-1]-RC[-5] -> 743749997.6500001 | EC78: TT PTND | ED78: =RC[-132]+RC[-121]+RC[-110]+RC[-99]+RC[-88]+RC[-77]+RC[-66]+RC[-55]+RC[-44]+RC[-33]+RC[-22]+RC[-11] ->  | EE78: =RC[-132]+RC[-121]+RC[-110]+RC[-99]+RC[-88]+RC[-77]+RC[-66]+RC[-55]+RC[-44]+RC[-33]+RC[-22]+RC[-11] ->  | EF78: =RC[-132]+RC[-121]+RC[-110]+RC[-99]+RC[-88]+RC[-77]+RC[-66]+RC[-55]+RC[-44]+RC[-33]+RC[-22]+RC[-11] ->  | EG78: =RC[-132]+RC[-121]+RC[-110]+RC[-99]+RC[-88]+RC[-77]+RC[-66]+RC[-55]+RC[-44]+RC[-33]+RC[-22]+RC[-11] ->  | EH78: =RC[-132]+RC[-121]+RC[-110]+RC[-99]+RC[-88]+RC[-77]+RC[-66]+RC[-55]+RC[-44]+RC[-33]+RC[-22]+RC[-11] ->  | EI78: =RC[-132]+RC[-121]+RC[-110]+RC[-99]+RC[-88]+RC[-77]+RC[-66]+RC[-55]+RC[-44]+RC[-33]+RC[-22]+RC[-11] ->  | EJ78: =RC[-132]+RC[-121]+RC[-110]+RC[-99]+RC[-88]+RC[-77]+RC[-66]+RC[-55]+RC[-44]+RC[-33]+RC[-22]+RC[-11] ->  | EK78: =RC[-132]+RC[-121]+RC[-110]+RC[-99]+RC[-88]+RC[-77]+RC[-66]+RC[-55]+RC[-44]+RC[-33]+RC[-22]+RC[-11] ->  | EL78: =RC[-132]+RC[-121]+RC[-110]+RC[-99]+RC[-88]+RC[-77]+RC[-66]+RC[-55]+RC[-44]+RC[-33]+RC[-22]+RC[-11] -> 
A79: HQ | B79: 272063 | C79: 256620 | D79: 13603 | E79: =RC[-3]-RC[-1]-RC[-2] ->  | F79: =R86C6*RC[-4] ->  | G79: =RC[-1]*5% ->  | H79: =R86C8*RC[-5] ->  | I79: =RC[-3]-RC[-2]-RC[-1] ->  | J79: =RC[-1]-RC[-5] ->  | L79: HQ | M79: 206894 | N79: 229684 | O79: 10345 | P79: =RC[-3]-RC[-1]-RC[-2] -> 2467006.9 | Q79: =R86C17*RC[-4] -> 3000383.6278659259 | R79: =RC[-1]*5% -> 450057.54417988885 | S79: =R86C19*RC[-5] -> 108517.5 | T79: =RC[-3]-RC[-2]-RC[-1] -> 2441808.583686037 | U79: =RC[-1]-RC[-5] -> -25198.316313962918 | W79: HQ | X79: 195686 | Y79: 237328 | Z79: 9784 | AA79: =RC[-3]-RC[-1]-RC[-2] -> 0 | AB79: =R86C28*RC[-4] -> 875000000 | AC79: =RC[-1]*5% -> 131250000 | AD79: =R86C19*RC[-5] -> 1.8 | AE79: =RC[-3]-RC[-2]-RC[-1] -> 743749998.20000005 | AF79: =RC[-1]-RC[-5] -> 743749998.20000005 | AH79: HQ | AI79: 148038 | AJ79: 204386 | AK79: 7402 | AL79: =RC[-3]-RC[-1]-RC[-2] -> 0.54999999999999982 | AM79: =R86C39*RC[-4] -> 875000000 | AN79: =RC[-1]*5% -> 131250000 | AO79: =R86C19*RC[-5] -> 1.8 | AP79: =RC[-3]-RC[-2]-RC[-1] -> 743749998.20000005 | AQ79: =RC[-1]-RC[-5] -> 743749997.6500001 | AS79: HQ | AT79: 63254 | AU79: 209664 | AV79: 3163 | AW79: =RC[-3]-RC[-1]-RC[-2] -> 0.54999999999999982 | AX79: =R86C50*RC[-4] -> 875000000 | AY79: =RC[-1]*5% -> 131250000 | AZ79: =R86C19*RC[-5] -> 1.8 | BA79: =RC[-3]-RC[-2]-RC[-1] -> 743749998.20000005 | BB79: =RC[-1]-RC[-5] -> 743749997.6500001 | BD79: HQ | BE79: 33065 | BF79: 179270 | BG79: 1653 | BH79: =RC[-3]-RC[-1]-RC[-2] -> 0.54999999999999982 | BI79: =R86C61*RC[-4] -> 875000000 | BJ79: =RC[-1]*5% -> 131250000 | BK79: =R86C19*RC[-5] -> 1.8 | BL79: =RC[-3]-RC[-2]-RC[-1] -> 743749998.20000005 | BM79: =RC[-1]-RC[-5] -> 743749997.6500001 | BO79: HQ | BP79: 0 | BQ79: 0 | BR79: 0 | BS79: =RC[-3]-RC[-1]-RC[-2] -> 0.54999999999999982 | BT79: =R86C72*RC[-4] -> 875000000 | BU79: =RC[-1]*5% -> 131250000 | BV79: =R86C8*RC[-5] -> 1.8 | BW79: =RC[-3]-RC[-2]-RC[-1] -> 743749998.20000005 | BX79: =RC[-1]-RC[-5] -> 743749997.6500001 | BZ79: HQ | CA79: 0 | CB79: 0 | CC79: 0 | CD79: =RC[-3]-RC[-1]-RC[-2] -> 0.54999999999999982 | CE79: =R86C83*RC[-4] -> 875000000 | CF79: =RC[-1]*5% -> 131250000 | CG79: =R86C19*RC[-5] -> 1.8 | CH79: =RC[-3]-RC[-2]-RC[-1] -> 743749998.20000005 | CI79: =RC[-1]-RC[-5] -> 743749997.6500001 | CK79: HQ | CL79: 0 | CM79: 0 | CN79: 0 | CO79: =RC[-3]-RC[-1]-RC[-2] -> 0.54999999999999982 | CP79: =R86C94*RC[-4] -> 875000000 | CQ79: =RC[-1]*5% -> 131250000 | CR79: =R86C19*RC[-5] -> 1.8 | CS79: =RC[-3]-RC[-2]-RC[-1] -> 743749998.20000005 | CT79: =RC[-1]-RC[-5] -> 743749997.6500001 | CV79: HQ | CW79: 0 | CX79: 0 | CY79: 0 | CZ79: =RC[-3]-RC[-1]-RC[-2] -> 0.54999999999999982 | DA79: =R86C105*RC[-4] -> 875000000 | DB79: =RC[-1]*5% -> 131250000 | DC79: =R86C19*RC[-5] -> 1.8 | DD79: =RC[-3]-RC[-2]-RC[-1] -> 743749998.20000005 | DE79: =RC[-1]-RC[-5] -> 743749997.6500001 | DG79: HQ | DH79: 0 | DI79: 0 | DJ79: 0 | DK79: =RC[-3]-RC[-1]-RC[-2] -> 0.54999999999999982 | DL79: =R86C116*RC[-4] -> 807692307.69230771 | DM79: =RC[-1]*5% -> 121153846.15384614 | DN79: =R86C19*RC[-5] -> 1.8 | DO79: =RC[-3]-RC[-2]-RC[-1] -> 686538459.73846161 | DP79: =RC[-1]-RC[-5] -> 686538459.18846166 | DR79: HQ | DS79: 0 | DT79: 0 | DU79: 0 | DV79: =RC[-3]-RC[-1]-RC[-2] -> 0.54999999999999982 | DW79: =R86C127*RC[-4] -> 875000000 | DX79: =RC[-1]*5% -> 131250000 | DY79: =R86C19*RC[-5] -> 1.8 | DZ79: =RC[-3]-RC[-2]-RC[-1] -> 743749998.20000005 | EA79: =RC[-1]-RC[-5] -> 743749997.6500001 | EC79: HQ | ED79: =RC[-132]+RC[-121]+RC[-110]+RC[-99]+RC[-88]+RC[-77]+RC[-66]+RC[-55]+RC[-44]+RC[-33]+RC[-22]+RC[-11] ->  | EE79: =RC[-132]+RC[-121]+RC[-110]+RC[-99]+RC[-88]+RC[-77]+RC[-66]+RC[-55]+RC[-44]+RC[-33]+RC[-22]+RC[-11] ->  | EF79: =RC[-132]+RC[-121]+RC[-110]+RC[-99]+RC[-88]+RC[-77]+RC[-66]+RC[-55]+RC[-44]+RC[-33]+RC[-22]+RC[-11] ->  | EG79: =RC[-132]+RC[-121]+RC[-110]+RC[-99]+RC[-88]+RC[-77]+RC[-66]+RC[-55]+RC[-44]+RC[-33]+RC[-22]+RC[-11] ->  | EH79: =RC[-132]+RC[-121]+RC[-110]+RC[-99]+RC[-88]+RC[-77]+RC[-66]+RC[-55]+RC[-44]+RC[-33]+RC[-22]+RC[-11] ->  | EI79: =RC[-132]+RC[-121]+RC[-110]+RC[-99]+RC[-88]+RC[-77]+RC[-66]+RC[-55]+RC[-44]+RC[-33]+RC[-22]+RC[-11] ->  | EJ79: =RC[-132]+RC[-121]+RC[-110]+RC[-99]+RC[-88]+RC[-77]+RC[-66]+RC[-55]+RC[-44]+RC[-33]+RC[-22]+RC[-11] ->  | EK79: =RC[-132]+RC[-121]+RC[-110]+RC[-99]+RC[-88]+RC[-77]+RC[-66]+RC[-55]+RC[-44]+RC[-33]+RC[-22]+RC[-11] ->  | EL79: =RC[-132]+RC[-121]+RC[-110]+RC[-99]+RC[-88]+RC[-77]+RC[-66]+RC[-55]+RC[-44]+RC[-33]+RC[-22]+RC[-11] -> 
A80: Tổng | B80: =SUM(R[-5]C:R[-1]C) -> 3551128896 | C80: =SUM(R[-5]C:R[-1]C) -> -619983 | D80: =SUM(R[-5]C:R[-1]C) -> 532669334.39999998 | E80: =SUM(R[-5]C:R[-1]C) -> 3019079544.5999999 | F80: =SUM(R[-5]C:R[-1]C) -> 3499999999.9999995 | G80: =SUM(R[-5]C:R[-1]C) -> 525000000 | H80: =SUM(R[-5]C:R[-1]C) -> -557984.69999999995 | I80: =SUM(R[-5]C:R[-1]C) -> 2975557984.6999998 | J80: =SUM(R[-5]C:R[-1]C) -> -43521559.899999849 | L80: Tổng | M80: =SUM(R[-5]C:R[-1]C) -> 3551128896 | N80: =SUM(R[-5]C:R[-1]C) -> -619983 | O80: =SUM(R[-5]C:R[-1]C) -> 532669334.39999998 | P80: =SUM(R[-5]C:R[-1]C) -> 3019079544.5999999 | Q80: =SUM(R[-5]C:R[-1]C) -> 3499999999.9999995 | R80: =SUM(R[-5]C:R[-1]C) -> 525000000 | S80: =SUM(R[-5]C:R[-1]C) -> -557984.69999999995 | T80: =SUM(R[-5]C:R[-1]C) -> 2975557984.6999998 | U80: =SUM(R[-5]C:R[-1]C) -> -43521559.899999849 | W80: Tổng | X80: =SUM(R[-5]C:R[-1]C) -> 12 | Y80: =SUM(R[-5]C:R[-1]C) -> 9 | Z80: =SUM(R[-5]C:R[-1]C) -> 2.35 | AA80: =SUM(R[-5]C:R[-1]C) -> 0.64999999999999991 | AB80: =SUM(R[-5]C:R[-1]C) -> 3500000000 | AC80: =SUM(R[-5]C:R[-1]C) -> 525000000 | AD80: =SUM(R[-5]C:R[-1]C) -> 8.1 | AE80: =SUM(R[-5]C:R[-1]C) -> 2974999991.9000006 | AF80: =SUM(R[-5]C:R[-1]C) -> 2974999991.2500005 | AH80: Tổng | AI80: =SUM(R[-5]C:R[-1]C) -> 12 | AJ80: =SUM(R[-5]C:R[-1]C) -> 9 | AK80: =SUM(R[-5]C:R[-1]C) -> 1.7999999999999998 | AL80: =SUM(R[-5]C:R[-1]C) -> 1.1999999999999997 | AM80: =SUM(R[-5]C:R[-1]C) -> 3500000000 | AN80: =SUM(R[-5]C:R[-1]C) -> 525000000 | AO80: =SUM(R[-5]C:R[-1]C) -> 8.1 | AP80: =SUM(R[-5]C:R[-1]C) -> 2974999991.9000006 | AQ80: =SUM(R[-5]C:R[-1]C) -> 2974999990.7000003 | AS80: Tổng | AT80: =SUM(R[-5]C:R[-1]C) -> 12 | AU80: =SUM(R[-5]C:R[-1]C) -> 9 | AV80: =SUM(R[-5]C:R[-1]C) -> 1.7999999999999998 | AW80: =SUM(R[-5]C:R[-1]C) -> 1.1999999999999997 | AX80: =SUM(R[-5]C:R[-1]C) -> 3500000000 | AY80: =SUM(R[-5]C:R[-1]C) -> 525000000 | AZ80: =SUM(R[-5]C:R[-1]C) -> 8.1 | BA80: =SUM(R[-5]C:R[-1]C) -> 2974999991.9000006 | BB80: =SUM(R[-5]C:R[-1]C) -> 2974999990.7000003 | BD80: Tổng | BE80: =SUM(R[-5]C:R[-1]C) -> 12 | BF80: =SUM(R[-5]C:R[-1]C) -> 9 | BG80: =SUM(R[-5]C:R[-1]C) -> 1.7999999999999998 | BH80: =SUM(R[-5]C:R[-1]C) -> 1.1999999999999997 | BI80: =SUM(R[-5]C:R[-1]C) -> 3500000000 | BJ80: =SUM(R[-5]C:R[-1]C) -> 525000000 | BK80: =SUM(R[-5]C:R[-1]C) -> 8.1 | BL80: =SUM(R[-5]C:R[-1]C) -> 2974999991.9000006 | BM80: =SUM(R[-5]C:R[-1]C) -> 2974999990.7000003 | BO80: Tổng | BP80: =SUM(R[-5]C:R[-1]C) -> 12 | BQ80: =SUM(R[-5]C:R[-1]C) -> 9 | BR80: =SUM(R[-5]C:R[-1]C) -> 1.7999999999999998 | BS80: =SUM(R[-5]C:R[-1]C) -> 1.1999999999999997 | BT80: =SUM(R[-5]C:R[-1]C) -> 3500000000 | BU80: =SUM(R[-5]C:R[-1]C) -> 525000000 | BV80: =SUM(R[-5]C:R[-1]C) -> 8.1 | BW80: =SUM(R[-5]C:R[-1]C) -> 2974999991.9000006 | BX80: =SUM(R[-5]C:R[-1]C) -> 2974999990.7000003 | BZ80: Tổng | CA80: =SUM(R[-5]C:R[-1]C) -> 12 | CB80: =SUM(R[-5]C:R[-1]C) -> 9 | CC80: =SUM(R[-5]C:R[-1]C) -> 1.7999999999999998 | CD80: =SUM(R[-5]C:R[-1]C) -> 1.1999999999999997 | CE80: =SUM(R[-5]C:R[-1]C) -> 3500000000 | CF80: =SUM(R[-5]C:R[-1]C) -> 525000000 | CG80: =SUM(R[-5]C:R[-1]C) -> 8.1 | CH80: =SUM(R[-5]C:R[-1]C) -> 2974999991.9000006 | CI80: =SUM(R[-5]C:R[-1]C) -> 2974999990.7000003 | CK80: Tổng | CL80: =SUM(R[-5]C:R[-1]C) -> 12 | CM80: =SUM(R[-5]C:R[-1]C) -> 9 | CN80: =SUM(R[-5]C:R[-1]C) -> 1.7999999999999998 | CO80: =SUM(R[-5]C:R[-1]C) -> 1.1999999999999997 | CP80: =SUM(R[-5]C:R[-1]C) -> 3500000000 | CQ80: =SUM(R[-5]C:R[-1]C) -> 525000000 | CR80: =SUM(R[-5]C:R[-1]C) -> 8.1 | CS80: =SUM(R[-5]C:R[-1]C) -> 2974999991.9000006 | CT80: =SUM(R[-5]C:R[-1]C) -> 2974999990.7000003 | CV80: Tổng | CW80: =SUM(R[-5]C:R[-1]C) -> 12 | CX80: =SUM(R[-5]C:R[-1]C) -> 9 | CY80: =SUM(R[-5]C:R[-1]C) -> 1.7999999999999998 | CZ80: =SUM(R[-5]C:R[-1]C) -> 1.1999999999999997 | DA80: =SUM(R[-5]C:R[-1]C) -> 3500000000 | DB80: =SUM(R[-5]C:R[-1]C) -> 525000000 | DC80: =SUM(R[-5]C:R[-1]C) -> 8.1 | DD80: =SUM(R[-5]C:R[-1]C) -> 2974999991.9000006 | DE80: =SUM(R[-5]C:R[-1]C) -> 2974999990.7000003 | DG80: Tổng | DH80: =SUM(R[-5]C:R[-1]C) -> 13 | DI80: =SUM(R[-5]C:R[-1]C) -> 9 | DJ80: =SUM(R[-5]C:R[-1]C) -> 1.9499999999999997 | DK80: =SUM(R[-5]C:R[-1]C) -> 2.0499999999999994 | DL80: =SUM(R[-5]C:R[-1]C) -> 3500000000 | DM80: =SUM(R[-5]C:R[-1]C) -> 525000000 | DN80: =SUM(R[-5]C:R[-1]C) -> 8.1 | DO80: =SUM(R[-5]C:R[-1]C) -> 2974999991.9000001 | DP80: =SUM(R[-5]C:R[-1]C) -> 2974999989.8500004 | DR80: Tổng | DS80: =SUM(R[-5]C:R[-1]C) -> 12 | DT80: =SUM(R[-5]C:R[-1]C) -> 9 | DU80: =SUM(R[-5]C:R[-1]C) -> 1.7999999999999998 | DV80: =SUM(R[-5]C:R[-1]C) -> 1.1999999999999997 | DW80: =SUM(R[-5]C:R[-1]C) -> 3500000000 | DX80: =SUM(R[-5]C:R[-1]C) -> 525000000 | DY80: =SUM(R[-5]C:R[-1]C) -> 8.1 | DZ80: =SUM(R[-5]C:R[-1]C) -> 2974999991.9000006 | EA80: =SUM(R[-5]C:R[-1]C) -> 2974999990.7000003 | EC80: Tổng | ED80: =SUM(R[-5]C:R[-1]C) -> 7102257913 | EE80: =SUM(R[-5]C:R[-1]C) -> -1239876 | EF80: =SUM(R[-5]C:R[-1]C) -> 1065338687.5000002 | EG80: =SUM(R[-5]C:R[-1]C) -> 6038159101.4999962 | EH80: =SUM(R[-5]C:R[-1]C) -> 42000000000 | EI80: =SUM(R[-5]C:R[-1]C) -> 6300000000 | EJ80: =SUM(R[-5]C:R[-1]C) -> -1115888.4000000006 | EK80: =SUM(R[-5]C:R[-1]C) -> 35701115888.400009 | EL80: =SUM(R[-5]C:R[-1]C) -> 29662956786.900002
E82: Số liệu theo biên bản đối soát thực tế với Viettel | P82: Số liệu theo biên bản đối soát thực tế với Viettel | AA82: Số liệu theo biên bản đối soát thực tế với Viettel | AL82: Số liệu theo biên bản đối soát thực tế với Viettel | AW82: Số liệu theo biên bản đối soát thực tế với Viettel | BH82: Số liệu theo biên bản đối soát thực tế với Viettel | BS82: Số liệu theo biên bản đối soát thực tế với Viettel | CD82: Số liệu theo biên bản đối soát thực tế với Viettel | CO82: Số liệu theo biên bản đối soát thực tế với Viettel | CZ82: Số liệu theo biên bản đối soát thực tế với Viettel | DK82: Số liệu theo biên bản đối soát thực tế với Viettel | DV82: Số liệu theo biên bản đối soát thực tế với Viettel
E83: Doanh thu | G83: MT vượt | P83: Doanh thu | R83: MT vượt | AA83: Doanh thu | AC83: MT vượt | AL83: Doanh thu | AN83: MT vượt | AW83: Doanh thu | AY83: MT vượt | BH83: Doanh thu | BJ83: MT vượt | BS83: Doanh thu | BU83: MT vượt | CD83: Doanh thu | CF83: MT vượt | CO83: Doanh thu | CQ83: MT vượt | CZ83: Doanh thu | DB83: MT vượt | DK83: Doanh thu | DM83: MT vượt | DV83: Doanh thu | DX83: MT vượt
E84: Doanh thu hệ thống | F84: =R[-4]C[-4] -> 3551128896 | G84: MT hệ thống | H84: =R[-4]C[-5] -> 10 | P84: Doanh thu hệ thống | Q84: =R[-4]C[-4] -> 3551128896 | R84: MT hệ thống | S84: =R[-4]C[-5] -> 10 | AA84: Doanh thu hệ thống | AB84: =R[-4]C[-4] -> 12 | AC84: MT hệ thống | AD84: =R[-4]C[-5] -> 10 | AL84: Doanh thu hệ thống | AM84: =R[-4]C[-4] -> 12 | AN84: MT hệ thống | AO84: =R[-4]C[-5] -> 10 | AW84: Doanh thu hệ thống | AX84: =R[-4]C[-4] -> 12 | AY84: MT hệ thống | AZ84: =R[-4]C[-5] -> 10 | BH84: Doanh thu hệ thống | BI84: =R[-4]C[-4] -> 12 | BJ84: MT hệ thống | BK84: =R[-4]C[-5] -> 10 | BS84: Doanh thu hệ thống | BT84: =R[-4]C[-4] -> 12 | BU84: MT hệ thống | BV84: =R[-4]C[-5] -> 10 | CD84: Doanh thu hệ thống | CE84: =R[-4]C[-4] -> 12 | CF84: MT hệ thống | CG84: =R[-4]C[-5] -> 10 | CO84: Doanh thu hệ thống | CP84: =R[-4]C[-4] -> 12 | CQ84: MT hệ thống | CR84: =R[-4]C[-5] -> 10 | CZ84: Doanh thu hệ thống | DA84: =R[-4]C[-4] -> 12 | DB84: MT hệ thống | DC84: =R[-4]C[-5] -> 10 | DK84: Doanh thu hệ thống | DL84: =R[-4]C[-4] -> 13 | DM84: MT hệ thống | DN84: =R[-4]C[-5] -> 10 | DV84: Doanh thu hệ thống | DW84: =R[-4]C[-4] -> 12 | DX84: MT hệ thống | DY84: =R[-4]C[-5] -> 10
E85: Doanh thu thực tế | F85: 3500000000 | G85: MT thực tế | H85: 9 | P85: Doanh thu thực tế | Q85: 3500000000 | R85: MT thực tế | S85: 9 | AA85: Doanh thu thực tế | AB85: 3500000000 | AC85: MT thực tế | AD85: 9 | AL85: Doanh thu thực tế | AM85: 3500000000 | AN85: MT thực tế | AO85: 9 | AW85: Doanh thu thực tế | AX85: 3500000000 | AY85: MT thực tế | AZ85: 9 | BH85: Doanh thu thực tế | BI85: 3500000000 | BJ85: MT thực tế | BK85: 9 | BS85: Doanh thu thực tế | BT85: 3500000000 | BU85: MT thực tế | BV85: 9 | CD85: Doanh thu thực tế | CE85: 3500000000 | CF85: MT thực tế | CG85: 9 | CO85: Doanh thu thực tế | CP85: 3500000000 | CQ85: MT thực tế | CR85: 9 | CZ85: Doanh thu thực tế | DA85: 3500000000 | DB85: MT thực tế | DC85: 9 | DK85: Doanh thu thực tế | DL85: 3500000000 | DM85: MT thực tế | DN85: 9 | DV85: Doanh thu thực tế | DW85: 3500000000 | DX85: MT thực tế | DY85: 9
E86: DT QT/DT HT | F86: =R[-1]C/R[-2]C -> 0.9856020726091943 | G86: MT QT/ HT | H86: =R[-1]C/R[-2]C -> 0.9 | P86: DT QT/DT HT | Q86: =R[-1]C/R[-2]C -> 0.9856020726091943 | R86: MT QT/ HT | S86: =R[-1]C/R[-2]C -> 0.9 | AA86: DT QT/DT HT | AB86: =R[-1]C/R[-2]C -> 291666666.66666669 | AC86: MT QT/ HT | AD86: =R[-1]C/R[-2]C -> 0.9 | AL86: DT QT/DT HT | AM86: =R[-1]C/R[-2]C -> 291666666.66666669 | AN86: MT QT/ HT | AO86: =R[-1]C/R[-2]C -> 0.9 | AW86: DT QT/DT HT | AX86: =R[-1]C/R[-2]C -> 291666666.66666669 | AY86: MT QT/ HT | AZ86: =R[-1]C/R[-2]C -> 0.9 | BH86: DT QT/DT HT | BI86: =R[-1]C/R[-2]C -> 291666666.66666669 | BJ86: MT QT/ HT | BK86: =R[-1]C/R[-2]C -> 0.9 | BS86: DT QT/DT HT | BT86: =R[-1]C/R[-2]C -> 291666666.66666669 | BU86: MT QT/ HT | BV86: =R[-1]C/R[-2]C -> 0.9 | CD86: DT QT/DT HT | CE86: =R[-1]C/R[-2]C -> 291666666.66666669 | CF86: MT QT/ HT | CG86: =R[-1]C/R[-2]C -> 0.9 | CO86: DT QT/DT HT | CP86: =R[-1]C/R[-2]C -> 291666666.66666669 | CQ86: MT QT/ HT | CR86: =R[-1]C/R[-2]C -> 0.9 | CZ86: DT QT/DT HT | DA86: =R[-1]C/R[-2]C -> 291666666.66666669 | DB86: MT QT/ HT | DC86: =R[-1]C/R[-2]C -> 0.9 | DK86: DT QT/DT HT | DL86: =R[-1]C/R[-2]C -> 269230769.23076922 | DM86: MT QT/ HT | DN86: =R[-1]C/R[-2]C -> 0.9 | DV86: DT QT/DT HT | DW86: =R[-1]C/R[-2]C -> 291666666.66666669 | DX86: MT QT/ HT | DY86: =R[-1]C/R[-2]C -> 0.9
E87: Tỷ lệ thất thoát | F87: =100%-R[-1]C -> 1.4397927390805698E-2 | G87: Tỷ lệ chênh lệch | H87: =100%-R[-1]C -> 9.9999999999999978E-2 | P87: Tỷ lệ thất thoát | Q87: =100%-R[-1]C -> 1.4397927390805698E-2 | R87: Tỷ lệ chênh lệch | S87: =100%-R[-1]C -> 9.9999999999999978E-2 | AA87: Tỷ lệ thất thoát | AB87: =100%-R[-1]C -> -291666665.66666669 | AC87: Tỷ lệ chênh lệch | AD87: =100%-R[-1]C -> 9.9999999999999978E-2 | AL87: Tỷ lệ thất thoát | AM87: =100%-R[-1]C -> -291666665.66666669 | AN87: Tỷ lệ chênh lệch | AO87: =100%-R[-1]C -> 9.9999999999999978E-2 | AW87: Tỷ lệ thất thoát | AX87: =100%-R[-1]C -> -291666665.66666669 | AY87: Tỷ lệ chênh lệch | AZ87: =100%-R[-1]C -> 9.9999999999999978E-2 | BH87: Tỷ lệ thất thoát | BI87: =100%-R[-1]C -> -291666665.66666669 | BJ87: Tỷ lệ chênh lệch | BK87: =100%-R[-1]C -> 9.9999999999999978E-2 | BS87: Tỷ lệ thất thoát | BT87: =100%-R[-1]C -> -291666665.66666669 | BU87: Tỷ lệ chênh lệch | BV87: =100%-R[-1]C -> 9.9999999999999978E-2 | CD87: Tỷ lệ thất thoát | CE87: =100%-R[-1]C -> -291666665.66666669 | CF87: Tỷ lệ chênh lệch | CG87: =100%-R[-1]C -> 9.9999999999999978E-2 | CO87: Tỷ lệ thất thoát | CP87: =100%-R[-1]C -> -291666665.66666669 | CQ87: Tỷ lệ chênh lệch | CR87: =100%-R[-1]C -> 9.9999999999999978E-2 | CZ87: Tỷ lệ thất thoát | DA87: =100%-R[-1]C -> -291666665.66666669 | DB87: Tỷ lệ chênh lệch | DC87: =100%-R[-1]C -> 9.9999999999999978E-2 | DK87: Tỷ lệ thất thoát | DL87: =100%-R[-1]C -> -269230768.23076922 | DM87: Tỷ lệ chênh lệch | DN87: =100%-R[-1]C -> 9.9999999999999978E-2 | DV87: Tỷ lệ thất thoát | DW87: =100%-R[-1]C -> -291666665.66666669 | DX87: Tỷ lệ chênh lệch | DY87: =100%-R[-1]C -> 9.9999999999999978E-2
E88: Doanh thu khuyến khích | P88: Doanh thu khuyến khích | AA88: Doanh thu khuyến khích | AL88: Doanh thu khuyến khích | AW88: Doanh thu khuyến khích | BH88: Doanh thu khuyến khích | BS88: Doanh thu khuyến khích | CD88: Doanh thu khuyến khích | CO88: Doanh thu khuyến khích | CZ88: Doanh thu khuyến khích | DK88: Doanh thu khuyến khích | DV88: Doanh thu khuyến khích
A93: 6x66/GTEL/2015
A94: Tháng 1 | L94: Tháng 2 | W94: Tháng 3 | AH94: Tháng 4 | AS94: Tháng 5 | BD94: Tháng 6 | BO94: Tháng 7 | BZ94: Tháng 8 | CK94: Tháng 9 | CV94: Tháng 10 | DG94: Tháng 11 | DR94: Tháng 12 | EC94: Lũy kế đến tháng báo cáo
A95: Tên đối tác | B95: Số liệu hệ thống/tạm tính | F95: Số liệu quyết toán theo biên bản đối soát | J95: C/lệch Quyết toán - Tạm tính | L95: Tên đối tác | M95: Số liệu hệ thống/tạm tính | Q95: Số liệu quyết toán theo biên bản đối soát | U95: C/lệch Quyết toán - Tạm tính | W95: Tên đối tác | X95: Số liệu hệ thống/tạm tính | AB95: Số liệu quyết toán theo biên bản đối soát | AF95: C/lệch Quyết toán - Tạm tính | AH95: Tên đối tác | AI95: Số liệu hệ thống/tạm tính | AM95: Số liệu quyết toán theo biên bản đối soát | AQ95: C/lệch Quyết toán - Tạm tính | AS95: Tên đối tác | AT95: Số liệu hệ thống/tạm tính | AX95: Số liệu quyết toán theo biên bản đối soát | BB95: C/lệch Quyết toán - Tạm tính | BD95: Tên đối tác | BE95: Số liệu hệ thống/tạm tính | BI95: Số liệu quyết toán theo biên bản đối soát | BM95: C/lệch Quyết toán - Tạm tính | BO95: Tên đối tác | BP95: Số liệu hệ thống/tạm tính | BT95: Số liệu quyết toán theo biên bản đối soát | BX95: C/lệch Quyết toán - Tạm tính | BZ95: Tên đối tác | CA95: Số liệu hệ thống/tạm tính | CE95: Số liệu quyết toán theo biên bản đối soát | CI95: C/lệch Quyết toán - Tạm tính | CK95: Tên đối tác | CL95: Số liệu hệ thống/tạm tính | CP95: Số liệu quyết toán theo biên bản đối soát | CT95: C/lệch Quyết toán - Tạm tính | CV95: Tên đối tác | CW95: Số liệu hệ thống/tạm tính | DA95: Số liệu quyết toán theo biên bản đối soát | DE95: C/lệch Quyết toán - Tạm tính | DG95: Tên đối tác | DH95: Số liệu hệ thống/tạm tính | DL95: Số liệu quyết toán theo biên bản đối soát | DP95: C/lệch Quyết toán - Tạm tính | DR95: Tên đối tác | DS95: Số liệu hệ thống/tạm tính | DW95: Số liệu quyết toán theo biên bản đối soát | EA95: C/lệch Quyết toán - Tạm tính | EC95: Tên đối tác | ED95: Số liệu hệ thống/tạm tính | EH95: Số liệu quyết toán theo biên bản đối soát | EL95: C/lệch Quyết toán - Tạm tính
B96: Doanh thu | C96: MT vượt | D96: Trả đối tác | E96: DT về đơn vị | F96: Doanh thu | G96: Trả đối tác | H96: MT | I96: DT về đơn vị | M96: Doanh thu | N96: MT vượt | O96: Trả đối tác | P96: DT về đơn vị | Q96: Doanh thu | R96: Trả đối tác | S96: MT | T96: DT về đơn vị | X96: Doanh thu | Y96: MT vượt | Z96: Trả đối tác | AA96: DT về đơn vị | AB96: Doanh thu | AC96: Trả đối tác | AD96: MT | AE96: DT về đơn vị | AI96: Doanh thu | AJ96: MT vượt | AK96: Trả đối tác | AL96: DT về đơn vị | AM96: Doanh thu | AN96: Trả đối tác | AO96: MT | AP96: DT về đơn vị | AT96: Doanh thu | AU96: MT vượt | AV96: Trả đối tác | AW96: DT về đơn vị | AX96: Doanh thu | AY96: Trả đối tác | AZ96: MT | BA96: DT về đơn vị | BE96: Doanh thu | BF96: MT vượt | BG96: Trả đối tác | BH96: DT về đơn vị | BI96: Doanh thu | BJ96: Trả đối tác | BK96: MT | BL96: DT về đơn vị | BP96: Doanh thu | BQ96: MT vượt | BR96: Trả đối tác | BS96: DT về đơn vị | BT96: Doanh thu | BU96: Trả đối tác | BV96: MT | BW96: DT về đơn vị | CA96: Doanh thu | CB96: MT vượt | CC96: Trả đối tác | CD96: DT về đơn vị | CE96: Doanh thu | CF96: Trả đối tác | CG96: MT | CH96: DT về đơn vị | CL96: Doanh thu | CM96: MT vượt | CN96: Trả đối tác | CO96: DT về đơn vị | CP96: Doanh thu | CQ96: Trả đối tác | CR96: MT | CS96: DT về đơn vị | CW96: Doanh thu | CX96: MT vượt | CY96: Trả đối tác | CZ96: DT về đơn vị | DA96: Doanh thu | DB96: Trả đối tác | DC96: MT | DD96: DT về đơn vị | DH96: Doanh thu | DI96: MT vượt | DJ96: Trả đối tác | DK96: DT về đơn vị | DL96: Doanh thu | DM96: Trả đối tác | DN96: MT | DO96: DT về đơn vị | DS96: Doanh thu | DT96: MT vượt | DU96: Trả đối tác | DV96: DT về đơn vị | DW96: Doanh thu | DX96: Trả đối tác | DY96: MT | DZ96: DT về đơn vị | ED96: Doanh thu | EE96: MT vượt | EF96: Trả đối tác | EG96: DT về đơn vị | EH96: Doanh thu | EI96: Trả đối tác | EJ96: MT | EK96: DT về đơn vị
B97: (1) | C97: (2) | D97: (3) = (1) *15% | E97: (4) = (1) - (3) - (2) | F97: (5) | G97: (6) | H97: (7) | I97: (8) = (5) - (6) - (7) | J97: (9) = (4) - (8) | M97: (1) | N97: (2) = ( MO - MT) *91 | O97: (3) = (1) *15% | P97: (4) = (1) - (3) - (2) | Q97: (5) | R97: (6) | S97: (7) | T97: (8) = (5) - (6) - (7) | U97: (9) = (4) - (8) | X97: (1) | Y97: (2) = ( MO - MT) *91 | Z97: (3) = (1) *15% | AA97: (4) = (1) - (3) - (2) | AB97: (5) | AC97: (6) | AD97: (7) | AE97: (8) = (5) - (6) - (7) | AF97: (9) = (4) - (8) | AI97: (1) | AJ97: (2) = ( MO - MT) *91 | AK97: (3) = (1) *15% | AL97: (4) = (1) - (3) - (2) | AM97: (5) | AN97: (6) | AO97: (7) | AP97: (8) = (5) - (6) - (7) | AQ97: (9) = (4) - (8) | AT97: (1) | AU97: (2) = ( MO - MT) *91 | AV97: (3) = (1) *15% | AW97: (4) = (1) - (3) - (2) | AX97: (5) | AY97: (6) | AZ97: (7) | BA97: (8) = (5) - (6) - (7) | BB97: (9) = (4) - (8) | BE97: (1) | BF97: (2) = ( MO - MT) *91 | BG97: (3) = (1) *15% | BH97: (4) = (1) - (3) - (2) | BI97: (5) | BJ97: (6) | BK97: (7) | BL97: (8) = (5) - (6) - (7) | BM97: (9) = (4) - (8) | BP97: (1) | BQ97: (2) | BR97: (3) = (1) *15% | BS97: (4) = (1) - (3) - (2) | BT97: (5) | BU97: (6) | BV97: (7) | BW97: (8) = (5) - (6) - (7) | BX97: (9) = (4) - (8) | CA97: (1) | CB97: (2) = ( MO - MT) *91 | CC97: (3) = (1) *15% | CD97: (4) = (1) - (3) - (2) | CE97: (5) | CF97: (6) | CG97: (7) | CH97: (8) = (5) - (6) - (7) | CI97: (9) = (4) - (8) | CL97: (1) | CM97: (2) = ( MO - MT) *91 | CN97: (3) = (1) *15% | CO97: (4) = (1) - (3) - (2) | CP97: (5) | CQ97: (6) | CR97: (7) | CS97: (8) = (5) - (6) - (7) | CT97: (9) = (4) - (8) | CW97: (1) | CX97: (2) = ( MO - MT) *91 | CY97: (3) = (1) *15% | CZ97: (4) = (1) - (3) - (2) | DA97: (5) | DB97: (6) | DC97: (7) | DD97: (8) = (5) - (6) - (7) | DE97: (9) = (4) - (8) | DH97: (1) | DI97: (2) = ( MO - MT) *91 | DJ97: (3) = (1) *15% | DK97: (4) = (1) - (3) - (2) | DL97: (5) | DM97: (6) | DN97: (7) | DO97: (8) = (5) - (6) - (7) | DP97: (9) = (4) - (8) | DS97: (1) | DT97: (2) = ( MO - MT) *91 | DU97: (3) = (1) *15% | DV97: (4) = (1) - (3) - (2) | DW97: (5) | DX97: (6) | DY97: (7) | DZ97: (8) = (5) - (6) - (7) | EA97: (9) = (4) - (8) | ED97: (1) | EE97: (2) = ( MO - MT) *91 | EF97: (3) = (1) *15% | EG97: (4) = (1) - (3) - (2) | EH97: (5) | EI97: (6) | EJ97: (7) | EK97: (8) = (5) - (6) - (7) | EL97: (9) = (4) - (8)
A98: SUBCPS | B98: 436416 | C98: 8463 | D98: 21821 | E98: =RC[-3]-RC[-1]-RC[-2] ->  | F98: =R109C6*RC[-4] ->  | G98: =RC[-1]*5% ->  | H98: =R109C8*RC[-5] ->  | I98: =RC[-3]-RC[-2]-RC[-1] ->  | J98: =RC[-1]-RC[-5] ->  | L98: SUBCPS | M98: 364772 | N98: 7553 | O98: 18239 | P98: =RC[-3]-RC[-1]-RC[-2] -> 2467006.9 | Q98: =R109C17*RC[-4] -> 3000383.6278659259 | R98: =RC[-1]*5% -> 450057.54417988885 | S98: =R109C19*RC[-5] -> 108517.5 | T98: =RC[-3]-RC[-2]-RC[-1] -> 2441808.583686037 | U98: =RC[-1]-RC[-5] -> -25198.316313962918 | W98: SUBCPS | X98: 478557 | Y98: 66794 | Z98: 23928 | AA98: =RC[-3]-RC[-1]-RC[-2] -> 0 | AB98: =R109C28*RC[-4] -> 875000000 | AC98: =RC[-1]*5% -> 131250000 | AD98: =R109C19*RC[-5] -> 1.8 | AE98: =RC[-3]-RC[-2]-RC[-1] -> 743749998.20000005 | AF98: =RC[-1]-RC[-5] -> 743749998.20000005 | AH98: SUBCPS | AI98: 413686 | AJ98: 8099 | AK98: 20684 | AL98: =RC[-3]-RC[-1]-RC[-2] -> 0.54999999999999982 | AM98: =R109C39*RC[-4] -> 875000000 | AN98: =RC[-1]*5% -> 131250000 | AO98: =R109C19*RC[-5] -> 1.8 | AP98: =RC[-3]-RC[-2]-RC[-1] -> 743749998.20000005 | AQ98: =RC[-1]-RC[-5] -> 743749997.6500001 | AS98: SUBCPS | AT98: 295490 | AU98: 5915 | AV98: 14774 | AW98: =RC[-3]-RC[-1]-RC[-2] -> 0.54999999999999982 | AX98: =R109C50*RC[-4] -> 875000000 | AY98: =RC[-1]*5% -> 131250000 | AZ98: =R109C19*RC[-5] -> 1.8 | BA98: =RC[-3]-RC[-2]-RC[-1] -> 743749998.20000005 | BB98: =RC[-1]-RC[-5] -> 743749997.6500001 | BD98: SUBCPS | BE98: 586434 | BF98: 11648 | BG98: 29322 | BH98: =RC[-3]-RC[-1]-RC[-2] -> 0.54999999999999982 | BI98: =R109C61*RC[-4] -> 875000000 | BJ98: =RC[-1]*5% -> 131250000 | BK98: =R109C19*RC[-5] -> 1.8 | BL98: =RC[-3]-RC[-2]-RC[-1] -> 743749998.20000005 | BM98: =RC[-1]-RC[-5] -> 743749997.6500001 | BO98: SUBCPS | BP98: 0 | BQ98: 0 | BR98: 0 | BS98: =RC[-3]-RC[-1]-RC[-2] -> 0.54999999999999982 | BT98: =R109C72*RC[-4] -> 875000000 | BU98: =RC[-1]*5% -> 131250000 | BV98: =R109C8*RC[-5] -> 1.8 | BW98: =RC[-3]-RC[-2]-RC[-1] -> 743749998.20000005 | BX98: =RC[-1]-RC[-5] -> 743749997.6500001 | BZ98: SUBCPS | CA98: 0 | CB98: 0 | CC98: 0 | CD98: =RC[-3]-RC[-1]-RC[-2] -> 0.54999999999999982 | CE98: =R109C83*RC[-4] -> 875000000 | CF98: =RC[-1]*5% -> 131250000 | CG98: =R109C19*RC[-5] -> 1.8 | CH98: =RC[-3]-RC[-2]-RC[-1] -> 743749998.20000005 | CI98: =RC[-1]-RC[-5] -> 743749997.6500001 | CK98: SUBCPS | CL98: 0 | CM98: 0 | CN98: 0 | CO98: =RC[-3]-RC[-1]-RC[-2] -> 0.54999999999999982 | CP98: =R109C94*RC[-4] -> 875000000 | CQ98: =RC[-1]*5% -> 131250000 | CR98: =R109C19*RC[-5] -> 1.8 | CS98: =RC[-3]-RC[-2]-RC[-1] -> 743749998.20000005 | CT98: =RC[-1]-RC[-5] -> 743749997.6500001 | CV98: SUBCPS | CW98: 0 | CX98: 0 | CY98: 0 | CZ98: =RC[-3]-RC[-1]-RC[-2] -> 0.54999999999999982 | DA98: =R109C105*RC[-4] -> 875000000 | DB98: =RC[-1]*5% -> 131250000 | DC98: =R109C19*RC[-5] -> 1.8 | DD98: =RC[-3]-RC[-2]-RC[-1] -> 743749998.20000005 | DE98: =RC[-1]-RC[-5] -> 743749997.6500001 | DG98: SUBCPS | DH98: 0 | DI98: 0 | DJ98: 0 | DK98: =RC[-3]-RC[-1]-RC[-2] -> 0.54999999999999982 | DL98: =R109C116*RC[-4] -> 807692307.69230771 | DM98: =RC[-1]*5% -> 121153846.15384614 | DN98: =R109C19*RC[-5] -> 1.8 | DO98: =RC[-3]-RC[-2]-RC[-1] -> 686538459.73846161 | DP98: =RC[-1]-RC[-5] -> 686538459.18846166 | DR98: SUBCPS | DS98: 0 | DT98: 0 | DU98: 0 | DV98: =RC[-3]-RC[-1]-RC[-2] -> 0.54999999999999982 | DW98: =R109C127*RC[-4] -> 875000000 | DX98: =RC[-1]*5% -> 131250000 | DY98: =R109C19*RC[-5] -> 1.8 | DZ98: =RC[-3]-RC[-2]-RC[-1] -> 743749998.20000005 | EA98: =RC[-1]-RC[-5] -> 743749997.6500001 | EC98: SUBCPS | ED98: =RC[-132]+RC[-121]+RC[-110]+RC[-99]+RC[-88]+RC[-77]+RC[-66]+RC[-55]+RC[-44]+RC[-33]+RC[-22]+RC[-11] ->  | EE98: =RC[-132]+RC[-121]+RC[-110]+RC[-99]+RC[-88]+RC[-77]+RC[-66]+RC[-55]+RC[-44]+RC[-33]+RC[-22]+RC[-11] ->  | EF98: =RC[-132]+RC[-121]+RC[-110]+RC[-99]+RC[-88]+RC[-77]+RC[-66]+RC[-55]+RC[-44]+RC[-33]+RC[-22]+RC[-11] ->  | EG98: =RC[-132]+RC[-121]+RC[-110]+RC[-99]+RC[-88]+RC[-77]+RC[-66]+RC[-55]+RC[-44]+RC[-33]+RC[-22]+RC[-11] ->  | EH98: =RC[-132]+RC[-121]+RC[-110]+RC[-99]+RC[-88]+RC[-77]+RC[-66]+RC[-55]+RC[-44]+RC[-33]+RC[-22]+RC[-11] ->  | EI98: =RC[-132]+RC[-121]+RC[-110]+RC[-99]+RC[-88]+RC[-77]+RC[-66]+RC[-55]+RC[-44]+RC[-33]+RC[-22]+RC[-11] ->  | EJ98: =RC[-132]+RC[-121]+RC[-110]+RC[-99]+RC[-88]+RC[-77]+RC[-66]+RC[-55]+RC[-44]+RC[-33]+RC[-22]+RC[-11] ->  | EK98: =RC[-132]+RC[-121]+RC[-110]+RC[-99]+RC[-88]+RC[-77]+RC[-66]+RC[-55]+RC[-44]+RC[-33]+RC[-22]+RC[-11] ->  | EL98: =RC[-132]+RC[-121]+RC[-110]+RC[-99]+RC[-88]+RC[-77]+RC[-66]+RC[-55]+RC[-44]+RC[-33]+RC[-22]+RC[-11] -> 
A99: LUCKY_FONE | B99: 282051 | C99: 80717 | D99: 14103 | E99: =RC[-3]-RC[-1]-RC[-2] ->  | F99: =R109C6*RC[-4] ->  | G99: =RC[-1]*5% ->  | H99: =R109C8*RC[-5] ->  | I99: =RC[-3]-RC[-2]-RC[-1] ->  | J99: =RC[-1]-RC[-5] ->  | L99: LUCKY_FONE | M99: 226471 | N99: 55783 | O99: 11324 | P99: =RC[-3]-RC[-1]-RC[-2] -> 2467006.9 | Q99: =R109C17*RC[-4] -> 3000383.6278659259 | R99: =RC[-1]*5% -> 450057.54417988885 | S99: =R109C19*RC[-5] -> 108517.5 | T99: =RC[-3]-RC[-2]-RC[-1] -> 2441808.583686037 | U99: =RC[-1]-RC[-5] -> -25198.316313962918 | W99: LUCKY_FONE | X99: 264927 | Y99: 90909 | Z99: 13246 | AA99: =RC[-3]-RC[-1]-RC[-2] -> 0 | AB99: =R109C28*RC[-4] -> 875000000 | AC99: =RC[-1]*5% -> 131250000 | AD99: =R109C19*RC[-5] -> 1.8 | AE99: =RC[-3]-RC[-2]-RC[-1] -> 743749998.20000005 | AF99: =RC[-1]-RC[-5] -> 743749998.20000005 | AH99: LUCKY_FONE | AI99: 194832 | AJ99: 26845 | AK99: 9742 | AL99: =RC[-3]-RC[-1]-RC[-2] -> 0.54999999999999982 | AM99: =R109C39*RC[-4] -> 875000000 | AN99: =RC[-1]*5% -> 131250000 | AO99: =R109C19*RC[-5] -> 1.8 | AP99: =RC[-3]-RC[-2]-RC[-1] -> 743749998.20000005 | AQ99: =RC[-1]-RC[-5] -> 743749997.6500001 | AS99: LUCKY_FONE | AT99: 221859 | AU99: 196560 | AV99: 11093 | AW99: =RC[-3]-RC[-1]-RC[-2] -> 0.54999999999999982 | AX99: =R109C50*RC[-4] -> 875000000 | AY99: =RC[-1]*5% -> 131250000 | AZ99: =R109C19*RC[-5] -> 1.8 | BA99: =RC[-3]-RC[-2]-RC[-1] -> 743749998.20000005 | BB99: =RC[-1]-RC[-5] -> 743749997.6500001 | BD99: LUCKY_FONE | BE99: 106181 | BF99: 78169 | BG99: 5309 | BH99: =RC[-3]-RC[-1]-RC[-2] -> 0.54999999999999982 | BI99: =R109C61*RC[-4] -> 875000000 | BJ99: =RC[-1]*5% -> 131250000 | BK99: =R109C19*RC[-5] -> 1.8 | BL99: =RC[-3]-RC[-2]-RC[-1] -> 743749998.20000005 | BM99: =RC[-1]-RC[-5] -> 743749997.6500001 | BO99: LUCKY_FONE | BP99: 0 | BQ99: 0 | BR99: 0 | BS99: =RC[-3]-RC[-1]-RC[-2] -> 0.54999999999999982 | BT99: =R109C72*RC[-4] -> 875000000 | BU99: =RC[-1]*5% -> 131250000 | BV99: =R109C8*RC[-5] -> 1.8 | BW99: =RC[-3]-RC[-2]-RC[-1] -> 743749998.20000005 | BX99: =RC[-1]-RC[-5] -> 743749997.6500001 | BZ99: LUCKY_FONE | CA99: 0 | CB99: 0 | CC99: 0 | CD99: =RC[-3]-RC[-1]-RC[-2] -> 0.54999999999999982 | CE99: =R109C83*RC[-4] -> 875000000 | CF99: =RC[-1]*5% -> 131250000 | CG99: =R109C19*RC[-5] -> 1.8 | CH99: =RC[-3]-RC[-2]-RC[-1] -> 743749998.20000005 | CI99: =RC[-1]-RC[-5] -> 743749997.6500001 | CK99: LUCKY_FONE | CL99: 0 | CM99: 0 | CN99: 0 | CO99: =RC[-3]-RC[-1]-RC[-2] -> 0.54999999999999982 | CP99: =R109C94*RC[-4] -> 875000000 | CQ99: =RC[-1]*5% -> 131250000 | CR99: =R109C19*RC[-5] -> 1.8 | CS99: =RC[-3]-RC[-2]-RC[-1] -> 743749998.20000005 | CT99: =RC[-1]-RC[-5] -> 743749997.6500001 | CV99: LUCKY_FONE | CW99: 0 | CX99: 0 | CY99: 0 | CZ99: =RC[-3]-RC[-1]-RC[-2] -> 0.54999999999999982 | DA99: =R109C105*RC[-4] -> 875000000 | DB99: =RC[-1]*5% -> 131250000 | DC99: =R109C19*RC[-5] -> 1.8 | DD99: =RC[-3]-RC[-2]-RC[-1] -> 743749998.20000005 | DE99: =RC[-1]-RC[-5] -> 743749997.6500001 | DG99: LUCKY_FONE | DH99: 0 | DI99: 0 | DJ99: 0 | DK99: =RC[-3]-RC[-1]-RC[-2] -> 0.54999999999999982 | DL99: =R109C116*RC[-4] -> 807692307.69230771 | DM99: =RC[-1]*5% -> 121153846.15384614 | DN99: =R109C19*RC[-5] -> 1.8 | DO99: =RC[-3]-RC[-2]-RC[-1] -> 686538459.73846161 | DP99: =RC[-1]-RC[-5] -> 686538459.18846166 | DR99: LUCKY_FONE | DS99: 0 | DT99: 0 | DU99: 0 | DV99: =RC[-3]-RC[-1]-RC[-2] -> 0.54999999999999982 | DW99: =R109C127*RC[-4] -> 875000000 | DX99: =RC[-1]*5% -> 131250000 | DY99: =R109C19*RC[-5] -> 1.8 | DZ99: =RC[-3]-RC[-2]-RC[-1] -> 743749998.20000005 | EA99: =RC[-1]-RC[-5] -> 743749997.6500001 | EC99: LUCKY_FONE | ED99: =RC[-132]+RC[-121]+RC[-110]+RC[-99]+RC[-88]+RC[-77]+RC[-66]+RC[-55]+RC[-44]+RC[-33]+RC[-22]+RC[-11] ->  | EE99: =RC[-132]+RC[-121]+RC[-110]+RC[-99]+RC[-88]+RC[-77]+RC[-66]+RC[-55]+RC[-44]+RC[-33]+RC[-22]+RC[-11] ->  | EF99: =RC[-132]+RC[-121]+RC[-110]+RC[-99]+RC[-88]+RC[-77]+RC[-66]+RC[-55]+RC[-44]+RC[-33]+RC[-22]+RC[-11] ->  | EG99: =RC[-132]+RC[-121]+RC[-110]+RC[-99]+RC[-88]+RC[-77]+RC[-66]+RC[-55]+RC[-44]+RC[-33]+RC[-22]+RC[-11] ->  | EH99: =RC[-132]+RC[-121]+RC[-110]+RC[-99]+RC[-88]+RC[-77]+RC[-66]+RC[-55]+RC[-44]+RC[-33]+RC[-22]+RC[-11] ->  | EI99: =RC[-132]+RC[-121]+RC[-110]+RC[-99]+RC[-88]+RC[-77]+RC[-66]+RC[-55]+RC[-44]+RC[-33]+RC[-22]+RC[-11] ->  | EJ99: =RC[-132]+RC[-121]+RC[-110]+RC[-99]+RC[-88]+RC[-77]+RC[-66]+RC[-55]+RC[-44]+RC[-33]+RC[-22]+RC[-11] ->  | EK99: =RC[-132]+RC[-121]+RC[-110]+RC[-99]+RC[-88]+RC[-77]+RC[-66]+RC[-55]+RC[-44]+RC[-33]+RC[-22]+RC[-11] ->  | EL99: =RC[-132]+RC[-121]+RC[-110]+RC[-99]+RC[-88]+RC[-77]+RC[-66]+RC[-55]+RC[-44]+RC[-33]+RC[-22]+RC[-11] -> 
A100: TT PTKD | B100: 38822 | C100: 1001 | D100: 1941 | E100: =RC[-3]-RC[-1]-RC[-2] ->  | F100: =R109C6*RC[-4] ->  | G100: =RC[-1]*5% ->  | H100: =R109C8*RC[-5] ->  | I100: =RC[-3]-RC[-2]-RC[-1] ->  | J100: =RC[-1]-RC[-5] ->  | L100: TT PTKD | M100: 6002 | N100: 10006 | O100: 300 | P100: =RC[-3]-RC[-1]-RC[-2] -> 2467006.9 | Q100: =R109C17*RC[-4] -> 3000383.6278659259 | R100: =RC[-1]*5% -> 450057.54417988885 | S100: =R109C19*RC[-5] -> 108517.5 | T100: =RC[-3]-RC[-2]-RC[-1] -> 2441808.583686037 | U100: =RC[-1]-RC[-5] -> -25198.316313962918 | W100: TT PTKD | X100: 78912 | Y100: 3467944 | Z100: 3946 | AA100: =RC[-3]-RC[-1]-RC[-2] -> 0 | AB100: =R109C28*RC[-4] -> 875000000 | AC100: =RC[-1]*5% -> 131250000 | AD100: =R109C19*RC[-5] -> 1.8 | AE100: =RC[-3]-RC[-2]-RC[-1] -> 743749998.20000005 | AF100: =RC[-1]-RC[-5] -> 743749998.20000005 | AH100: TT PTKD | AI100: 135178 | AJ100: 3192521 | AK100: 6759 | AL100: =RC[-3]-RC[-1]-RC[-2] -> 0.54999999999999982 | AM100: =R109C39*RC[-4] -> 875000000 | AN100: =RC[-1]*5% -> 131250000 | AO100: =R109C19*RC[-5] -> 1.8 | AP100: =RC[-3]-RC[-2]-RC[-1] -> 743749998.20000005 | AQ100: =RC[-1]-RC[-5] -> 743749997.6500001 | AS100: TT PTKD | AT100: 0 | AU100: 0 | AV100: 0 | AW100: =RC[-3]-RC[-1]-RC[-2] -> 0.54999999999999982 | AX100: =R109C50*RC[-4] -> 875000000 | AY100: =RC[-1]*5% -> 131250000 | AZ100: =R109C19*RC[-5] -> 1.8 | BA100: =RC[-3]-RC[-2]-RC[-1] -> 743749998.20000005 | BB100: =RC[-1]-RC[-5] -> 743749997.6500001 | BD100: TT PTKD | BE100: 8454 | BF100: 20930 | BG100: 423 | BH100: =RC[-3]-RC[-1]-RC[-2] -> 0.54999999999999982 | BI100: =R109C61*RC[-4] -> 875000000 | BJ100: =RC[-1]*5% -> 131250000 | BK100: =R109C19*RC[-5] -> 1.8 | BL100: =RC[-3]-RC[-2]-RC[-1] -> 743749998.20000005 | BM100: =RC[-1]-RC[-5] -> 743749997.6500001 | BO100: TT PTKD | BP100: 0 | BQ100: 0 | BR100: 0 | BS100: =RC[-3]-RC[-1]-RC[-2] -> 0.54999999999999982 | BT100: =R109C72*RC[-4] -> 875000000 | BU100: =RC[-1]*5% -> 131250000 | BV100: =R109C8*RC[-5] -> 1.8 | BW100: =RC[-3]-RC[-2]-RC[-1] -> 743749998.20000005 | BX100: =RC[-1]-RC[-5] -> 743749997.6500001 | BZ100: TT PTKD | CA100: 0 | CB100: 0 | CC100: 0 | CD100: =RC[-3]-RC[-1]-RC[-2] -> 0.54999999999999982 | CE100: =R109C83*RC[-4] -> 875000000 | CF100: =RC[-1]*5% -> 131250000 | CG100: =R109C19*RC[-5] -> 1.8 | CH100: =RC[-3]-RC[-2]-RC[-1] -> 743749998.20000005 | CI100: =RC[-1]-RC[-5] -> 743749997.6500001 | CK100: TT PTKD | CL100: 0 | CM100: 0 | CN100: 0 | CO100: =RC[-3]-RC[-1]-RC[-2] -> 0.54999999999999982 | CP100: =R109C94*RC[-4] -> 875000000 | CQ100: =RC[-1]*5% -> 131250000 | CR100: =R109C19*RC[-5] -> 1.8 | CS100: =RC[-3]-RC[-2]-RC[-1] -> 743749998.20000005 | CT100: =RC[-1]-RC[-5] -> 743749997.6500001 | CV100: TT PTKD | CW100: 0 | CX100: 0 | CY100: 0 | CZ100: =RC[-3]-RC[-1]-RC[-2] -> 0.54999999999999982 | DA100: =R109C105*RC[-4] -> 875000000 | DB100: =RC[-1]*5% -> 131250000 | DC100: =R109C19*RC[-5] -> 1.8 | DD100: =RC[-3]-RC[-2]-RC[-1] -> 743749998.20000005 | DE100: =RC[-1]-RC[-5] -> 743749997.6500001 | DG100: TT PTKD | DH100: 0 | DI100: 0 | DJ100: 0 | DK100: =RC[-3]-RC[-1]-RC[-2] -> 0.54999999999999982 | DL100: =R109C116*RC[-4] -> 807692307.69230771 | DM100: =RC[-1]*5% -> 121153846.15384614 | DN100: =R109C19*RC[-5] -> 1.8 | DO100: =RC[-3]-RC[-2]-RC[-1] -> 686538459.73846161 | DP100: =RC[-1]-RC[-5] -> 686538459.18846166 | DR100: TT PTKD | DS100: 0 | DT100: 0 | DU100: 0 | DV100: =RC[-3]-RC[-1]-RC[-2] -> 0.54999999999999982 | DW100: =R109C127*RC[-4] -> 875000000 | DX100: =RC[-1]*5% -> 131250000 | DY100: =R109C19*RC[-5] -> 1.8 | DZ100: =RC[-3]-RC[-2]-RC[-1] -> 743749998.20000005 | EA100: =RC[-1]-RC[-5] -> 743749997.6500001 | EC100: TT PTKD | ED100: =RC[-132]+RC[-121]+RC[-110]+RC[-99]+RC[-88]+RC[-77]+RC[-66]+RC[-55]+RC[-44]+RC[-33]+RC[-22]+RC[-11] ->  | EE100: =RC[-132]+RC[-121]+RC[-110]+RC[-99]+RC[-88]+RC[-77]+RC[-66]+RC[-55]+RC[-44]+RC[-33]+RC[-22]+RC[-11] ->  | EF100: =RC[-132]+RC[-121]+RC[-110]+RC[-99]+RC[-88]+RC[-77]+RC[-66]+RC[-55]+RC[-44]+RC[-33]+RC[-22]+RC[-11] ->  | EG100: =RC[-132]+RC[-121]+RC[-110]+RC[-99]+RC[-88]+RC[-77]+RC[-66]+RC[-55]+RC[-44]+RC[-33]+RC[-22]+RC[-11] ->  | EH100: =RC[-132]+RC[-121]+RC[-110]+RC[-99]+RC[-88]+RC[-77]+RC[-66]+RC[-55]+RC[-44]+RC[-33]+RC[-22]+RC[-11] ->  | EI100: =RC[-132]+RC[-121]+RC[-110]+RC[-99]+RC[-88]+RC[-77]+RC[-66]+RC[-55]+RC[-44]+RC[-33]+RC[-22]+RC[-11] ->  | EJ100: =RC[-132]+RC[-121]+RC[-110]+RC[-99]+RC[-88]+RC[-77]+RC[-66]+RC[-55]+RC[-44]+RC[-33]+RC[-22]+RC[-11] ->  | EK100: =RC[-132]+RC[-121]+RC[-110]+RC[-99]+RC[-88]+RC[-77]+RC[-66]+RC[-55]+RC[-44]+RC[-33]+RC[-22]+RC[-11] ->  | EL100: =RC[-132]+RC[-121]+RC[-110]+RC[-99]+RC[-88]+RC[-77]+RC[-66]+RC[-55]+RC[-44]+RC[-33]+RC[-22]+RC[-11] -> 
A101: TT PTND | B101: 3343687 | C101: 22932 | D101: 167184 | E101: =RC[-3]-RC[-1]-RC[-2] ->  | F101: =R109C6*RC[-4] ->  | G101: =RC[-1]*5% ->  | H101: =R109C8*RC[-5] ->  | I101: =RC[-3]-RC[-2]-RC[-1] ->  | J101: =RC[-1]-RC[-5] ->  | L101: TT PTND | M101: 2908720 | N101: 20930 | O101: 145436 | P101: =RC[-3]-RC[-1]-RC[-2] -> 2467006.9 | Q101: =R109C17*RC[-4] -> 3000383.6278659259 | R101: =RC[-1]*5% -> 450057.54417988885 | S101: =R109C19*RC[-5] -> 108517.5 | T101: =RC[-3]-RC[-2]-RC[-1] -> 2441808.583686037 | U101: =RC[-1]-RC[-5] -> -25198.316313962918 | W101: TT PTND | X101: 3391324 | Y101: 32851 | Z101: 169566 | AA101: =RC[-3]-RC[-1]-RC[-2] -> 0 | AB101: =R109C28*RC[-4] -> 875000000 | AC101: =RC[-1]*5% -> 131250000 | AD101: =R109C19*RC[-5] -> 1.8 | AE101: =RC[-3]-RC[-2]-RC[-1] -> 743749998.20000005 | AF101: =RC[-1]-RC[-5] -> 743749998.20000005 | AH101: TT PTND | AI101: 2935664 | AJ101: 24570 | AK101: 146783 | AL101: =RC[-3]-RC[-1]-RC[-2] -> 0.54999999999999982 | AM101: =R109C39*RC[-4] -> 875000000 | AN101: =RC[-1]*5% -> 131250000 | AO101: =R109C19*RC[-5] -> 1.8 | AP101: =RC[-3]-RC[-2]-RC[-1] -> 743749998.20000005 | AQ101: =RC[-1]-RC[-5] -> 743749997.6500001 | AS101: TT PTND | AT101: 2974376 | AU101: 1739465 | AV101: 148719 | AW101: =RC[-3]-RC[-1]-RC[-2] -> 0.54999999999999982 | AX101: =R109C50*RC[-4] -> 875000000 | AY101: =RC[-1]*5% -> 131250000 | AZ101: =R109C19*RC[-5] -> 1.8 | BA101: =RC[-3]-RC[-2]-RC[-1] -> 743749998.20000005 | BB101: =RC[-1]-RC[-5] -> 743749997.6500001 | BD101: TT PTND | BE101: 3980872 | BF101: 40859 | BG101: 199044 | BH101: =RC[-3]-RC[-1]-RC[-2] -> 0.54999999999999982 | BI101: =R109C61*RC[-4] -> 875000000 | BJ101: =RC[-1]*5% -> 131250000 | BK101: =R109C19*RC[-5] -> 1.8 | BL101: =RC[-3]-RC[-2]-RC[-1] -> 743749998.20000005 | BM101: =RC[-1]-RC[-5] -> 743749997.6500001 | BO101: TT PTND | BP101: 0 | BQ101: 0 | BR101: 0 | BS101: =RC[-3]-RC[-1]-RC[-2] -> 0.54999999999999982 | BT101: =R109C72*RC[-4] -> 875000000 | BU101: =RC[-1]*5% -> 131250000 | BV101: =R109C8*RC[-5] -> 1.8 | BW101: =RC[-3]-RC[-2]-RC[-1] -> 743749998.20000005 | BX101: =RC[-1]-RC[-5] -> 743749997.6500001 | BZ101: TT PTND | CA101: 0 | CB101: 0 | CC101: 0 | CD101: =RC[-3]-RC[-1]-RC[-2] -> 0.54999999999999982 | CE101: =R109C83*RC[-4] -> 875000000 | CF101: =RC[-1]*5% -> 131250000 | CG101: =R109C19*RC[-5] -> 1.8 | CH101: =RC[-3]-RC[-2]-RC[-1] -> 743749998.20000005 | CI101: =RC[-1]-RC[-5] -> 743749997.6500001 | CK101: TT PTND | CL101: 0 | CM101: 0 | CN101: 0 | CO101: =RC[-3]-RC[-1]-RC[-2] -> 0.54999999999999982 | CP101: =R109C94*RC[-4] -> 875000000 | CQ101: =RC[-1]*5% -> 131250000 | CR101: =R109C19*RC[-5] -> 1.8 | CS101: =RC[-3]-RC[-2]-RC[-1] -> 743749998.20000005 | CT101: =RC[-1]-RC[-5] -> 743749997.6500001 | CV101: TT PTND | CW101: 0 | CX101: 0 | CY101: 0 | CZ101: =RC[-3]-RC[-1]-RC[-2] -> 0.54999999999999982 | DA101: =R109C105*RC[-4] -> 875000000 | DB101: =RC[-1]*5% -> 131250000 | DC101: =R109C19*RC[-5] -> 1.8 | DD101: =RC[-3]-RC[-2]-RC[-1] -> 743749998.20000005 | DE101: =RC[-1]-RC[-5] -> 743749997.6500001 | DG101: TT PTND | DH101: 0 | DI101: 0 | DJ101: 0 | DK101: =RC[-3]-RC[-1]-RC[-2] -> 0.54999999999999982 | DL101: =R109C116*RC[-4] -> 807692307.69230771 | DM101: =RC[-1]*5% -> 121153846.15384614 | DN101: =R109C19*RC[-5] -> 1.8 | DO101: =RC[-3]-RC[-2]-RC[-1] -> 686538459.73846161 | DP101: =RC[-1]-RC[-5] -> 686538459.18846166 | DR101: TT PTND | DS101: 0 | DT101: 0 | DU101: 0 | DV101: =RC[-3]-RC[-1]-RC[-2] -> 0.54999999999999982 | DW101: =R109C127*RC[-4] -> 875000000 | DX101: =RC[-1]*5% -> 131250000 | DY101: =R109C19*RC[-5] -> 1.8 | DZ101: =RC[-3]-RC[-2]-RC[-1] -> 743749998.20000005 | EA101: =RC[-1]-RC[-5] -> 743749997.6500001 | EC101: TT PTND | ED101: =RC[-132]+RC[-121]+RC[-110]+RC[-99]+RC[-88]+RC[-77]+RC[-66]+RC[-55]+RC[-44]+RC[-33]+RC[-22]+RC[-11] ->  | EE101: =RC[-132]+RC[-121]+RC[-110]+RC[-99]+RC[-88]+RC[-77]+RC[-66]+RC[-55]+RC[-44]+RC[-33]+RC[-22]+RC[-11] ->  | EF101: =RC[-132]+RC[-121]+RC[-110]+RC[-99]+RC[-88]+RC[-77]+RC[-66]+RC[-55]+RC[-44]+RC[-33]+RC[-22]+RC[-11] ->  | EG101: =RC[-132]+RC[-121]+RC[-110]+RC[-99]+RC[-88]+RC[-77]+RC[-66]+RC[-55]+RC[-44]+RC[-33]+RC[-22]+RC[-11] ->  | EH101: =RC[-132]+RC[-121]+RC[-110]+RC[-99]+RC[-88]+RC[-77]+RC[-66]+RC[-55]+RC[-44]+RC[-33]+RC[-22]+RC[-11] ->  | EI101: =RC[-132]+RC[-121]+RC[-110]+RC[-99]+RC[-88]+RC[-77]+RC[-66]+RC[-55]+RC[-44]+RC[-33]+RC[-22]+RC[-11] ->  | EJ101: =RC[-132]+RC[-121]+RC[-110]+RC[-99]+RC[-88]+RC[-77]+RC[-66]+RC[-55]+RC[-44]+RC[-33]+RC[-22]+RC[-11] ->  | EK101: =RC[-132]+RC[-121]+RC[-110]+RC[-99]+RC[-88]+RC[-77]+RC[-66]+RC[-55]+RC[-44]+RC[-33]+RC[-22]+RC[-11] ->  | EL101: =RC[-132]+RC[-121]+RC[-110]+RC[-99]+RC[-88]+RC[-77]+RC[-66]+RC[-55]+RC[-44]+RC[-33]+RC[-22]+RC[-11] -> 
A102: HQ | B102: 55338 | C102: 17927 | D102: 2767 | E102: =RC[-3]-RC[-1]-RC[-2] ->  | F102: =R109C6*RC[-4] ->  | G102: =RC[-1]*5% ->  | H102: =R109C8*RC[-5] ->  | I102: =RC[-3]-RC[-2]-RC[-1] ->  | J102: =RC[-1]-RC[-5] ->  | L102: HQ | M102: 67633 | N102: 21021 | O102: 3382 | P102: =RC[-3]-RC[-1]-RC[-2] -> 2467006.9 | Q102: =R109C17*RC[-4] -> 3000383.6278659259 | R102: =RC[-1]*5% -> 450057.54417988885 | S102: =R109C19*RC[-5] -> 108517.5 | T102: =RC[-3]-RC[-2]-RC[-1] -> 2441808.583686037 | U102: =RC[-1]-RC[-5] -> -25198.316313962918 | W102: HQ | X102: 71251 | Y102: 22750 | Z102: 3563 | AA102: =RC[-3]-RC[-1]-RC[-2] -> 0 | AB102: =R109C28*RC[-4] -> 875000000 | AC102: =RC[-1]*5% -> 131250000 | AD102: =R109C19*RC[-5] -> 1.8 | AE102: =RC[-3]-RC[-2]-RC[-1] -> 743749998.20000005 | AF102: =RC[-1]-RC[-5] -> 743749998.20000005 | AH102: HQ | AI102: 40645 | AJ102: 19292 | AK102: 2032 | AL102: =RC[-3]-RC[-1]-RC[-2] -> 0.54999999999999982 | AM102: =R109C39*RC[-4] -> 875000000 | AN102: =RC[-1]*5% -> 131250000 | AO102: =R109C19*RC[-5] -> 1.8 | AP102: =RC[-3]-RC[-2]-RC[-1] -> 743749998.20000005 | AQ102: =RC[-1]-RC[-5] -> 743749997.6500001 | AS102: HQ | AT102: 47214 | AU102: 20475 | AV102: 2361 | AW102: =RC[-3]-RC[-1]-RC[-2] -> 0.54999999999999982 | AX102: =R109C50*RC[-4] -> 875000000 | AY102: =RC[-1]*5% -> 131250000 | AZ102: =R109C19*RC[-5] -> 1.8 | BA102: =RC[-3]-RC[-2]-RC[-1] -> 743749998.20000005 | BB102: =RC[-1]-RC[-5] -> 743749997.6500001 | BD102: HQ | BE102: 19791 | BF102: 14287 | BG102: 990 | BH102: =RC[-3]-RC[-1]-RC[-2] -> 0.54999999999999982 | BI102: =R109C61*RC[-4] -> 875000000 | BJ102: =RC[-1]*5% -> 131250000 | BK102: =R109C19*RC[-5] -> 1.8 | BL102: =RC[-3]-RC[-2]-RC[-1] -> 743749998.20000005 | BM102: =RC[-1]-RC[-5] -> 743749997.6500001 | BO102: HQ | BP102: 0 | BQ102: 0 | BR102: 0 | BS102: =RC[-3]-RC[-1]-RC[-2] -> 0.54999999999999982 | BT102: =R109C72*RC[-4] -> 875000000 | BU102: =RC[-1]*5% -> 131250000 | BV102: =R109C8*RC[-5] -> 1.8 | BW102: =RC[-3]-RC[-2]-RC[-1] -> 743749998.20000005 | BX102: =RC[-1]-RC[-5] -> 743749997.6500001 | BZ102: HQ | CA102: 0 | CB102: 0 | CC102: 0 | CD102: =RC[-3]-RC[-1]-RC[-2] -> 0.54999999999999982 | CE102: =R109C83*RC[-4] -> 875000000 | CF102: =RC[-1]*5% -> 131250000 | CG102: =R109C19*RC[-5] -> 1.8 | CH102: =RC[-3]-RC[-2]-RC[-1] -> 743749998.20000005 | CI102: =RC[-1]-RC[-5] -> 743749997.6500001 | CK102: HQ | CL102: 0 | CM102: 0 | CN102: 0 | CO102: =RC[-3]-RC[-1]-RC[-2] -> 0.54999999999999982 | CP102: =R109C94*RC[-4] -> 875000000 | CQ102: =RC[-1]*5% -> 131250000 | CR102: =R109C19*RC[-5] -> 1.8 | CS102: =RC[-3]-RC[-2]-RC[-1] -> 743749998.20000005 | CT102: =RC[-1]-RC[-5] -> 743749997.6500001 | CV102: HQ | CW102: 0 | CX102: 0 | CY102: 0 | CZ102: =RC[-3]-RC[-1]-RC[-2] -> 0.54999999999999982 | DA102: =R109C105*RC[-4] -> 875000000 | DB102: =RC[-1]*5% -> 131250000 | DC102: =R109C19*RC[-5] -> 1.8 | DD102: =RC[-3]-RC[-2]-RC[-1] -> 743749998.20000005 | DE102: =RC[-1]-RC[-5] -> 743749997.6500001 | DG102: HQ | DH102: 0 | DI102: 0 | DJ102: 0 | DK102: =RC[-3]-RC[-1]-RC[-2] -> 0.54999999999999982 | DL102: =R109C116*RC[-4] -> 807692307.69230771 | DM102: =RC[-1]*5% -> 121153846.15384614 | DN102: =R109C19*RC[-5] -> 1.8 | DO102: =RC[-3]-RC[-2]-RC[-1] -> 686538459.73846161 | DP102: =RC[-1]-RC[-5] -> 686538459.18846166 | DR102: HQ | DS102: 0 | DT102: 0 | DU102: 0 | DV102: =RC[-3]-RC[-1]-RC[-2] -> 0.54999999999999982 | DW102: =R109C127*RC[-4] -> 875000000 | DX102: =RC[-1]*5% -> 131250000 | DY102: =R109C19*RC[-5] -> 1.8 | DZ102: =RC[-3]-RC[-2]-RC[-1] -> 743749998.20000005 | EA102: =RC[-1]-RC[-5] -> 743749997.6500001 | EC102: HQ | ED102: =RC[-132]+RC[-121]+RC[-110]+RC[-99]+RC[-88]+RC[-77]+RC[-66]+RC[-55]+RC[-44]+RC[-33]+RC[-22]+RC[-11] ->  | EE102: =RC[-132]+RC[-121]+RC[-110]+RC[-99]+RC[-88]+RC[-77]+RC[-66]+RC[-55]+RC[-44]+RC[-33]+RC[-22]+RC[-11] ->  | EF102: =RC[-132]+RC[-121]+RC[-110]+RC[-99]+RC[-88]+RC[-77]+RC[-66]+RC[-55]+RC[-44]+RC[-33]+RC[-22]+RC[-11] ->  | EG102: =RC[-132]+RC[-121]+RC[-110]+RC[-99]+RC[-88]+RC[-77]+RC[-66]+RC[-55]+RC[-44]+RC[-33]+RC[-22]+RC[-11] ->  | EH102: =RC[-132]+RC[-121]+RC[-110]+RC[-99]+RC[-88]+RC[-77]+RC[-66]+RC[-55]+RC[-44]+RC[-33]+RC[-22]+RC[-11] ->  | EI102: =RC[-132]+RC[-121]+RC[-110]+RC[-99]+RC[-88]+RC[-77]+RC[-66]+RC[-55]+RC[-44]+RC[-33]+RC[-22]+RC[-11] ->  | EJ102: =RC[-132]+RC[-121]+RC[-110]+RC[-99]+RC[-88]+RC[-77]+RC[-66]+RC[-55]+RC[-44]+RC[-33]+RC[-22]+RC[-11] ->  | EK102: =RC[-132]+RC[-121]+RC[-110]+RC[-99]+RC[-88]+RC[-77]+RC[-66]+RC[-55]+RC[-44]+RC[-33]+RC[-22]+RC[-11] ->  | EL102: =RC[-132]+RC[-121]+RC[-110]+RC[-99]+RC[-88]+RC[-77]+RC[-66]+RC[-55]+RC[-44]+RC[-33]+RC[-22]+RC[-11] -> 
A103: Tổng | B103: =SUM(R[-5]C:R[-1]C) -> 3551128896 | C103: =SUM(R[-5]C:R[-1]C) -> -619983 | D103: =SUM(R[-5]C:R[-1]C) -> 532669334.39999998 | E103: =SUM(R[-5]C:R[-1]C) -> 3019079544.5999999 | F103: =SUM(R[-5]C:R[-1]C) -> 3499999999.9999995 | G103: =SUM(R[-5]C:R[-1]C) -> 525000000 | H103: =SUM(R[-5]C:R[-1]C) -> -557984.69999999995 | I103: =SUM(R[-5]C:R[-1]C) -> 2975557984.6999998 | J103: =SUM(R[-5]C:R[-1]C) -> -43521559.899999849 | L103: Tổng | M103: =SUM(R[-5]C:R[-1]C) -> 3551128896 | N103: =SUM(R[-5]C:R[-1]C) -> -619983 | O103: =SUM(R[-5]C:R[-1]C) -> 532669334.39999998 | P103: =SUM(R[-5]C:R[-1]C) -> 3019079544.5999999 | Q103: =SUM(R[-5]C:R[-1]C) -> 3499999999.9999995 | R103: =SUM(R[-5]C:R[-1]C) -> 525000000 | S103: =SUM(R[-5]C:R[-1]C) -> -557984.69999999995 | T103: =SUM(R[-5]C:R[-1]C) -> 2975557984.6999998 | U103: =SUM(R[-5]C:R[-1]C) -> -43521559.899999849 | W103: Tổng | X103: =SUM(R[-5]C:R[-1]C) -> 12 | Y103: =SUM(R[-5]C:R[-1]C) -> 9 | Z103: =SUM(R[-5]C:R[-1]C) -> 2.35 | AA103: =SUM(R[-5]C:R[-1]C) -> 0.64999999999999991 | AB103: =SUM(R[-5]C:R[-1]C) -> 3500000000 | AC103: =SUM(R[-5]C:R[-1]C) -> 525000000 | AD103: =SUM(R[-5]C:R[-1]C) -> 8.1 | AE103: =SUM(R[-5]C:R[-1]C) -> 2974999991.9000006 | AF103: =SUM(R[-5]C:R[-1]C) -> 2974999991.2500005 | AH103: Tổng | AI103: =SUM(R[-5]C:R[-1]C) -> 12 | AJ103: =SUM(R[-5]C:R[-1]C) -> 9 | AK103: =SUM(R[-5]C:R[-1]C) -> 1.7999999999999998 | AL103: =SUM(R[-5]C:R[-1]C) -> 1.1999999999999997 | AM103: =SUM(R[-5]C:R[-1]C) -> 3500000000 | AN103: =SUM(R[-5]C:R[-1]C) -> 525000000 | AO103: =SUM(R[-5]C:R[-1]C) -> 8.1 | AP103: =SUM(R[-5]C:R[-1]C) -> 2974999991.9000006 | AQ103: =SUM(R[-5]C:R[-1]C) -> 2974999990.7000003 | AS103: Tổng | AT103: =SUM(R[-5]C:R[-1]C) -> 12 | AU103: =SUM(R[-5]C:R[-1]C) -> 9 | AV103: =SUM(R[-5]C:R[-1]C) -> 1.7999999999999998 | AW103: =SUM(R[-5]C:R[-1]C) -> 1.1999999999999997 | AX103: =SUM(R[-5]C:R[-1]C) -> 3500000000 | AY103: =SUM(R[-5]C:R[-1]C) -> 525000000 | AZ103: =SUM(R[-5]C:R[-1]C) -> 8.1 | BA103: =SUM(R[-5]C:R[-1]C) -> 2974999991.9000006 | BB103: =SUM(R[-5]C:R[-1]C) -> 2974999990.7000003 | BD103: Tổng | BE103: =SUM(R[-5]C:R[-1]C) -> 12 | BF103: =SUM(R[-5]C:R[-1]C) -> 9 | BG103: =SUM(R[-5]C:R[-1]C) -> 1.7999999999999998 | BH103: =SUM(R[-5]C:R[-1]C) -> 1.1999999999999997 | BI103: =SUM(R[-5]C:R[-1]C) -> 3500000000 | BJ103: =SUM(R[-5]C:R[-1]C) -> 525000000 | BK103: =SUM(R[-5]C:R[-1]C) -> 8.1 | BL103: =SUM(R[-5]C:R[-1]C) -> 2974999991.9000006 | BM103: =SUM(R[-5]C:R[-1]C) -> 2974999990.7000003 | BO103: Tổng | BP103: =SUM(R[-5]C:R[-1]C) -> 12 | BQ103: =SUM(R[-5]C:R[-1]C) -> 9 | BR103: =SUM(R[-5]C:R[-1]C) -> 1.7999999999999998 | BS103: =SUM(R[-5]C:R[-1]C) -> 1.1999999999999997 | BT103: =SUM(R[-5]C:R[-1]C) -> 3500000000 | BU103: =SUM(R[-5]C:R[-1]C) -> 525000000 | BV103: =SUM(R[-5]C:R[-1]C) -> 8.1 | BW103: =SUM(R[-5]C:R[-1]C) -> 2974999991.9000006 | BX103: =SUM(R[-5]C:R[-1]C) -> 2974999990.7000003 | BZ103: Tổng | CA103: =SUM(R[-5]C:R[-1]C) -> 12 | CB103: =SUM(R[-5]C:R[-1]C) -> 9 | CC103: =SUM(R[-5]C:R[-1]C) -> 1.7999999999999998 | CD103: =SUM(R[-5]C:R[-1]C) -> 1.1999999999999997 | CE103: =SUM(R[-5]C:R[-1]C) -> 3500000000 | CF103: =SUM(R[-5]C:R[-1]C) -> 525000000 | CG103: =SUM(R[-5]C:R[-1]C) -> 8.1 | CH103: =SUM(R[-5]C:R[-1]C) -> 2974999991.9000006 | CI103: =SUM(R[-5]C:R[-1]C) -> 2974999990.7000003 | CK103: Tổng | CL103: =SUM(R[-5]C:R[-1]C) -> 12 | CM103: =SUM(R[-5]C:R[-1]C) -> 9 | CN103: =SUM(R[-5]C:R[-1]C) -> 1.7999999999999998 | CO103: =SUM(R[-5]C:R[-1]C) -> 1.1999999999999997 | CP103: =SUM(R[-5]C:R[-1]C) -> 3500000000 | CQ103: =SUM(R[-5]C:R[-1]C) -> 525000000 | CR103: =SUM(R[-5]C:R[-1]C) -> 8.1 | CS103: =SUM(R[-5]C:R[-1]C) -> 2974999991.9000006 | CT103: =SUM(R[-5]C:R[-1]C) -> 2974999990.7000003 | CV103: Tổng | CW103: =SUM(R[-5]C:R[-1]C) -> 12 | CX103: =SUM(R[-5]C:R[-1]C) -> 9 | CY103: =SUM(R[-5]C:R[-1]C) -> 1.7999999999999998 | CZ103: =SUM(R[-5]C:R[-1]C) -> 1.1999999999999997 | DA103: =SUM(R[-5]C:R[-1]C) -> 3500000000 | DB103: =SUM(R[-5]C:R[-1]C) -> 525000000 | DC103: =SUM(R[-5]C:R[-1]C) -> 8.1 | DD103: =SUM(R[-5]C:R[-1]C) -> 2974999991.9000006 | DE103: =SUM(R[-5]C:R[-1]C) -> 2974999990.7000003 | DG103: Tổng | DH103: =SUM(R[-5]C:R[-1]C) -> 13 | DI103: =SUM(R[-5]C:R[-1]C) -> 9 | DJ103: =SUM(R[-5]C:R[-1]C) -> 1.9499999999999997 | DK103: =SUM(R[-5]C:R[-1]C) -> 2.0499999999999994 | DL103: =SUM(R[-5]C:R[-1]C) -> 3500000000 | DM103: =SUM(R[-5]C:R[-1]C) -> 525000000 | DN103: =SUM(R[-5]C:R[-1]C) -> 8.1 | DO103: =SUM(R[-5]C:R[-1]C) -> 2974999991.9000001 | DP103: =SUM(R[-5]C:R[-1]C) -> 2974999989.8500004 | DR103: Tổng | DS103: =SUM(R[-5]C:R[-1]C) -> 12 | DT103: =SUM(R[-5]C:R[-1]C) -> 9 | DU103: =SUM(R[-5]C:R[-1]C) -> 1.7999999999999998 | DV103: =SUM(R[-5]C:R[-1]C) -> 1.1999999999999997 | DW103: =SUM(R[-5]C:R[-1]C) -> 3500000000 | DX103: =SUM(R[-5]C:R[-1]C) -> 525000000 | DY103: =SUM(R[-5]C:R[-1]C) -> 8.1 | DZ103: =SUM(R[-5]C:R[-1]C) -> 2974999991.9000006 | EA103: =SUM(R[-5]C:R[-1]C) -> 2974999990.7000003 | EC103: Tổng | ED103: =SUM(R[-5]C:R[-1]C) -> 7102257913 | EE103: =SUM(R[-5]C:R[-1]C) -> -1239876 | EF103: =SUM(R[-5]C:R[-1]C) -> 1065338687.5000002 | EG103: =SUM(R[-5]C:R[-1]C) -> 6038159101.4999962 | EH103: =SUM(R[-5]C:R[-1]C) -> 42000000000 | EI103: =SUM(R[-5]C:R[-1]C) -> 6300000000 | EJ103: =SUM(R[-5]C:R[-1]C) -> -1115888.4000000006 | EK103: =SUM(R[-5]C:R[-1]C) -> 35701115888.400009 | EL103: =SUM(R[-5]C:R[-1]C) -> 29662956786.900002
E105: Số liệu theo biên bản đối soát thực tế với Viettel | P105: Số liệu theo biên bản đối soát thực tế với Viettel | AA105: Số liệu theo biên bản đối soát thực tế với Viettel | AL105: Số liệu theo biên bản đối soát thực tế với Viettel | AW105: Số liệu theo biên bản đối soát thực tế với Viettel | BH105: Số liệu theo biên bản đối soát thực tế với Viettel | BS105: Số liệu theo biên bản đối soát thực tế với Viettel | CD105: Số liệu theo biên bản đối soát thực tế với Viettel | CO105: Số liệu theo biên bản đối soát thực tế với Viettel | CZ105: Số liệu theo biên bản đối soát thực tế với Viettel | DK105: Số liệu theo biên bản đối soát thực tế với Viettel | DV105: Số liệu theo biên bản đối soát thực tế với Viettel
E106: Doanh thu | G106: MT vượt | P106: Doanh thu | R106: MT vượt | AA106: Doanh thu | AC106: MT vượt | AL106: Doanh thu | AN106: MT vượt | AW106: Doanh thu | AY106: MT vượt | BH106: Doanh thu | BJ106: MT vượt | BS106: Doanh thu | BU106: MT vượt | CD106: Doanh thu | CF106: MT vượt | CO106: Doanh thu | CQ106: MT vượt | CZ106: Doanh thu | DB106: MT vượt | DK106: Doanh thu | DM106: MT vượt | DV106: Doanh thu | DX106: MT vượt
E107: Doanh thu hệ thống | F107: =R[-4]C[-4] -> 3551128896 | G107: MT hệ thống | H107: =R[-4]C[-5] -> 10 | P107: Doanh thu hệ thống | Q107: =R[-4]C[-4] -> 3551128896 | R107: MT hệ thống | S107: =R[-4]C[-5] -> 10 | AA107: Doanh thu hệ thống | AB107: =R[-4]C[-4] -> 12 | AC107: MT hệ thống | AD107: =R[-4]C[-5] -> 10 | AL107: Doanh thu hệ thống | AM107: =R[-4]C[-4] -> 12 | AN107: MT hệ thống | AO107: =R[-4]C[-5] -> 10 | AW107: Doanh thu hệ thống | AX107: =R[-4]C[-4] -> 12 | AY107: MT hệ thống | AZ107: =R[-4]C[-5] -> 10 | BH107: Doanh thu hệ thống | BI107: =R[-4]C[-4] -> 12 | BJ107: MT hệ thống | BK107: =R[-4]C[-5] -> 10 | BS107: Doanh thu hệ thống | BT107: =R[-4]C[-4] -> 12 | BU107: MT hệ thống | BV107: =R[-4]C[-5] -> 10 | CD107: Doanh thu hệ thống | CE107: =R[-4]C[-4] -> 12 | CF107: MT hệ thống | CG107: =R[-4]C[-5] -> 10 | CO107: Doanh thu hệ thống | CP107: =R[-4]C[-4] -> 12 | CQ107: MT hệ thống | CR107: =R[-4]C[-5] -> 10 | CZ107: Doanh thu hệ thống | DA107: =R[-4]C[-4] -> 12 | DB107: MT hệ thống | DC107: =R[-4]C[-5] -> 10 | DK107: Doanh thu hệ thống | DL107: =R[-4]C[-4] -> 13 | DM107: MT hệ thống | DN107: =R[-4]C[-5] -> 10 | DV107: Doanh thu hệ thống | DW107: =R[-4]C[-4] -> 12 | DX107: MT hệ thống | DY107: =R[-4]C[-5] -> 10
E108: Doanh thu thực tế | F108: 3500000000 | G108: MT thực tế | H108: 9 | P108: Doanh thu thực tế | Q108: 3500000000 | R108: MT thực tế | S108: 9 | AA108: Doanh thu thực tế | AB108: 3500000000 | AC108: MT thực tế | AD108: 9 | AL108: Doanh thu thực tế | AM108: 3500000000 | AN108: MT thực tế | AO108: 9 | AW108: Doanh thu thực tế | AX108: 3500000000 | AY108: MT thực tế | AZ108: 9 | BH108: Doanh thu thực tế | BI108: 3500000000 | BJ108: MT thực tế | BK108: 9 | BS108: Doanh thu thực tế | BT108: 3500000000 | BU108: MT thực tế | BV108: 9 | CD108: Doanh thu thực tế | CE108: 3500000000 | CF108: MT thực tế | CG108: 9 | CO108: Doanh thu thực tế | CP108: 3500000000 | CQ108: MT thực tế | CR108: 9 | CZ108: Doanh thu thực tế | DA108: 3500000000 | DB108: MT thực tế | DC108: 9 | DK108: Doanh thu thực tế | DL108: 3500000000 | DM108: MT thực tế | DN108: 9 | DV108: Doanh thu thực tế | DW108: 3500000000 | DX108: MT thực tế | DY108: 9
E109: DT QT/DT HT | F109: =R[-1]C/R[-2]C -> 0.9856020726091943 | G109: MT QT/ HT | H109: =R[-1]C/R[-2]C -> 0.9 | P109: DT QT/DT HT | Q109: =R[-1]C/R[-2]C -> 0.9856020726091943 | R109: MT QT/ HT | S109: =R[-1]C/R[-2]C -> 0.9 | AA109: DT QT/DT HT | AB109: =R[-1]C/R[-2]C -> 291666666.66666669 | AC109: MT QT/ HT | AD109: =R[-1]C/R[-2]C -> 0.9 | AL109: DT QT/DT HT | AM109: =R[-1]C/R[-2]C -> 291666666.66666669 | AN109: MT QT/ HT | AO109: =R[-1]C/R[-2]C -> 0.9 | AW109: DT QT/DT HT | AX109: =R[-1]C/R[-2]C -> 291666666.66666669 | AY109: MT QT/ HT | AZ109: =R[-1]C/R[-2]C -> 0.9 | BH109: DT QT/DT HT | BI109: =R[-1]C/R[-2]C -> 291666666.66666669 | BJ109: MT QT/ HT | BK109: =R[-1]C/R[-2]C -> 0.9 | BS109: DT QT/DT HT | BT109: =R[-1]C/R[-2]C -> 291666666.66666669 | BU109: MT QT/ HT | BV109: =R[-1]C/R[-2]C -> 0.9 | CD109: DT QT/DT HT | CE109: =R[-1]C/R[-2]C -> 291666666.66666669 | CF109: MT QT/ HT | CG109: =R[-1]C/R[-2]C -> 0.9 | CO109: DT QT/DT HT | CP109: =R[-1]C/R[-2]C -> 291666666.66666669 | CQ109: MT QT/ HT | CR109: =R[-1]C/R[-2]C -> 0.9 | CZ109: DT QT/DT HT | DA109: =R[-1]C/R[-2]C -> 291666666.66666669 | DB109: MT QT/ HT | DC109: =R[-1]C/R[-2]C -> 0.9 | DK109: DT QT/DT HT | DL109: =R[-1]C/R[-2]C -> 269230769.23076922 | DM109: MT QT/ HT | DN109: =R[-1]C/R[-2]C -> 0.9 | DV109: DT QT/DT HT | DW109: =R[-1]C/R[-2]C -> 291666666.66666669 | DX109: MT QT/ HT | DY109: =R[-1]C/R[-2]C -> 0.9
E110: Tỷ lệ thất thoát | F110: =100%-R[-1]C -> 1.4397927390805698E-2 | G110: Tỷ lệ chênh lệch | H110: =100%-R[-1]C -> 9.9999999999999978E-2 | P110: Tỷ lệ thất thoát | Q110: =100%-R[-1]C -> 1.4397927390805698E-2 | R110: Tỷ lệ chênh lệch | S110: =100%-R[-1]C -> 9.9999999999999978E-2 | AA110: Tỷ lệ thất thoát | AB110: =100%-R[-1]C -> -291666665.66666669 | AC110: Tỷ lệ chênh lệch | AD110: =100%-R[-1]C -> 9.9999999999999978E-2 | AL110: Tỷ lệ thất thoát | AM110: =100%-R[-1]C -> -291666665.66666669 | AN110: Tỷ lệ chênh lệch | AO110: =100%-R[-1]C -> 9.9999999999999978E-2 | AW110: Tỷ lệ thất thoát | AX110: =100%-R[-1]C -> -291666665.66666669 | AY110: Tỷ lệ chênh lệch | AZ110: =100%-R[-1]C -> 9.9999999999999978E-2 | BH110: Tỷ lệ thất thoát | BI110: =100%-R[-1]C -> -291666665.66666669 | BJ110: Tỷ lệ chênh lệch | BK110: =100%-R[-1]C -> 9.9999999999999978E-2 | BS110: Tỷ lệ thất thoát | BT110: =100%-R[-1]C -> -291666665.66666669 | BU110: Tỷ lệ chênh lệch | BV110: =100%-R[-1]C -> 9.9999999999999978E-2 | CD110: Tỷ lệ thất thoát | CE110: =100%-R[-1]C -> -291666665.66666669 | CF110: Tỷ lệ chênh lệch | CG110: =100%-R[-1]C -> 9.9999999999999978E-2 | CO110: Tỷ lệ thất thoát | CP110: =100%-R[-1]C -> -291666665.66666669 | CQ110: Tỷ lệ chênh lệch | CR110: =100%-R[-1]C -> 9.9999999999999978E-2 | CZ110: Tỷ lệ thất thoát | DA110: =100%-R[-1]C -> -291666665.66666669 | DB110: Tỷ lệ chênh lệch | DC110: =100%-R[-1]C -> 9.9999999999999978E-2 | DK110: Tỷ lệ thất thoát | DL110: =100%-R[-1]C -> -269230768.23076922 | DM110: Tỷ lệ chênh lệch | DN110: =100%-R[-1]C -> 9.9999999999999978E-2 | DV110: Tỷ lệ thất thoát | DW110: =100%-R[-1]C -> -291666665.66666669 | DX110: Tỷ lệ chênh lệch | DY110: =100%-R[-1]C -> 9.9999999999999978E-2
E111: Doanh thu khuyến khích | P111: Doanh thu khuyến khích | AA111: Doanh thu khuyến khích | AL111: Doanh thu khuyến khích | AW111: Doanh thu khuyến khích | BH111: Doanh thu khuyến khích | BS111: Doanh thu khuyến khích | CD111: Doanh thu khuyến khích | CO111: Doanh thu khuyến khích | CZ111: Doanh thu khuyến khích | DK111: Doanh thu khuyến khích | DV111: Doanh thu khuyến khích
A116: 6x66/TỔNG/2015
A117: Tháng 1 | L117: Tháng 2 | W117: Tháng 3 | AH117: Tháng 4 | AS117: Tháng 5 | BD117: Tháng 6 | BO117: Tháng 7 | BZ117: Tháng 8 | CK117: Tháng 9 | CV117: Tháng 10 | DG117: Tháng 11 | DR117: Tháng 12 | EC117: Lũy kế đến tháng báo cáo
A118: Tên đối tác | B118: Số liệu hệ thống/tạm tính | F118: Số liệu quyết toán theo biên bản đối soát | J118: C/lệch Quyết toán - Tạm tính | L118: Tên đối tác | M118: Số liệu hệ thống/tạm tính | Q118: Số liệu quyết toán theo biên bản đối soát | U118: C/lệch Quyết toán - Tạm tính | W118: Tên đối tác | X118: Số liệu hệ thống/tạm tính | AB118: Số liệu quyết toán theo biên bản đối soát | AF118: C/lệch Quyết toán - Tạm tính | AH118: Tên đối tác | AI118: Số liệu hệ thống/tạm tính | AM118: Số liệu quyết toán theo biên bản đối soát | AQ118: C/lệch Quyết toán - Tạm tính | AS118: Tên đối tác | AT118: Số liệu hệ thống/tạm tính | AX118: Số liệu quyết toán theo biên bản đối soát | BB118: C/lệch Quyết toán - Tạm tính | BD118: Tên đối tác | BE118: Số liệu hệ thống/tạm tính | BI118: Số liệu quyết toán theo biên bản đối soát | BM118: C/lệch Quyết toán - Tạm tính | BO118: Tên đối tác | BP118: Số liệu hệ thống/tạm tính | BT118: Số liệu quyết toán theo biên bản đối soát | BX118: C/lệch Quyết toán - Tạm tính | BZ118: Tên đối tác | CA118: Số liệu hệ thống/tạm tính | CE118: Số liệu quyết toán theo biên bản đối soát | CI118: C/lệch Quyết toán - Tạm tính | CK118: Tên đối tác | CL118: Số liệu hệ thống/tạm tính | CP118: Số liệu quyết toán theo biên bản đối soát | CT118: C/lệch Quyết toán - Tạm tính | CV118: Tên đối tác | CW118: Số liệu hệ thống/tạm tính | DA118: Số liệu quyết toán theo biên bản đối soát | DE118: C/lệch Quyết toán - Tạm tính | DG118: Tên đối tác | DH118: Số liệu hệ thống/tạm tính | DL118: Số liệu quyết toán theo biên bản đối soát | DP118: C/lệch Quyết toán - Tạm tính | DR118: Tên đối tác | DS118: Số liệu hệ thống/tạm tính | DW118: Số liệu quyết toán theo biên bản đối soát | EA118: C/lệch Quyết toán - Tạm tính | EC118: Tên đối tác | ED118: Số liệu hệ thống/tạm tính | EH118: Số liệu quyết toán theo biên bản đối soát | EL118: C/lệch Quyết toán - Tạm tính
B119: Doanh thu | C119: MT vượt | D119: Trả đối tác | E119: DT về đơn vị | F119: Doanh thu | G119: Trả đối tác | H119: MT | I119: DT về đơn vị | M119: Doanh thu | N119: MT vượt | O119: Trả đối tác | P119: DT về đơn vị | Q119: Doanh thu | R119: Trả đối tác | S119: MT | T119: DT về đơn vị | X119: Doanh thu | Y119: MT vượt | Z119: Trả đối tác | AA119: DT về đơn vị | AB119: Doanh thu | AC119: Trả đối tác | AD119: MT | AE119: DT về đơn vị | AI119: Doanh thu | AJ119: MT vượt | AK119: Trả đối tác | AL119: DT về đơn vị | AM119: Doanh thu | AN119: Trả đối tác | AO119: MT | AP119: DT về đơn vị | AT119: Doanh thu | AU119: MT vượt | AV119: Trả đối tác | AW119: DT về đơn vị | AX119: Doanh thu | AY119: Trả đối tác | AZ119: MT | BA119: DT về đơn vị | BE119: Doanh thu | BF119: MT vượt | BG119: Trả đối tác | BH119: DT về đơn vị | BI119: Doanh thu | BJ119: Trả đối tác | BK119: MT | BL119: DT về đơn vị | BP119: Doanh thu | BQ119: MT vượt | BR119: Trả đối tác | BS119: DT về đơn vị | BT119: Doanh thu | BU119: Trả đối tác | BV119: MT | BW119: DT về đơn vị | CA119: Doanh thu | CB119: MT vượt | CC119: Trả đối tác | CD119: DT về đơn vị | CE119: Doanh thu | CF119: Trả đối tác | CG119: MT | CH119: DT về đơn vị | CL119: Doanh thu | CM119: MT vượt | CN119: Trả đối tác | CO119: DT về đơn vị | CP119: Doanh thu | CQ119: Trả đối tác | CR119: MT | CS119: DT về đơn vị | CW119: Doanh thu | CX119: MT vượt | CY119: Trả đối tác | CZ119: DT về đơn vị | DA119: Doanh thu | DB119: Trả đối tác | DC119: MT | DD119: DT về đơn vị | DH119: Doanh thu | DI119: MT vượt | DJ119: Trả đối tác | DK119: DT về đơn vị | DL119: Doanh thu | DM119: Trả đối tác | DN119: MT | DO119: DT về đơn vị | DS119: Doanh thu | DT119: MT vượt | DU119: Trả đối tác | DV119: DT về đơn vị | DW119: Doanh thu | DX119: Trả đối tác | DY119: MT | DZ119: DT về đơn vị | ED119: Doanh thu | EE119: MT vượt | EF119: Trả đối tác | EG119: DT về đơn vị | EH119: Doanh thu | EI119: Trả đối tác | EJ119: MT | EK119: DT về đơn vị
B120: (1) | C120: (2) | D120: (3) = (1) *15% | E120: (4) = (1) - (3) - (2) | F120: (5) | G120: (6) | H120: (7) | I120: (8) = (5) - (6) - (7) | J120: (9) = (4) - (8) | M120: (1) | N120: (2) = ( MO - MT) *91 | O120: (3) = (1) *15% | P120: (4) = (1) - (3) - (2) | Q120: (5) | R120: (6) | S120: (7) | T120: (8) = (5) - (6) - (7) | U120: (9) = (4) - (8) | X120: (1) | Y120: (2) = ( MO - MT) *91 | Z120: (3) = (1) *15% | AA120: (4) = (1) - (3) - (2) | AB120: (5) | AC120: (6) | AD120: (7) | AE120: (8) = (5) - (6) - (7) | AF120: (9) = (4) - (8) | AI120: (1) | AJ120: (2) = ( MO - MT) *91 | AK120: (3) = (1) *15% | AL120: (4) = (1) - (3) - (2) | AM120: (5) | AN120: (6) | AO120: (7) | AP120: (8) = (5) - (6) - (7) | AQ120: (9) = (4) - (8) | AT120: (1) | AU120: (2) = ( MO - MT) *91 | AV120: (3) = (1) *15% | AW120: (4) = (1) - (3) - (2) | AX120: (5) | AY120: (6) | AZ120: (7) | BA120: (8) = (5) - (6) - (7) | BB120: (9) = (4) - (8) | BE120: (1) | BF120: (2) = ( MO - MT) *91 | BG120: (3) = (1) *15% | BH120: (4) = (1) - (3) - (2) | BI120: (5) | BJ120: (6) | BK120: (7) | BL120: (8) = (5) - (6) - (7) | BM120: (9) = (4) - (8) | BP120: (1) | BQ120: (2) | BR120: (3) = (1) *15% | BS120: (4) = (1) - (3) - (2) | BT120: (5) | BU120: (6) | BV120: (7) | BW120: (8) = (5) - (6) - (7) | BX120: (9) = (4) - (8) | CA120: (1) | CB120: (2) = ( MO - MT) *91 | CC120: (3) = (1) *15% | CD120: (4) = (1) - (3) - (2) | CE120: (5) | CF120: (6) | CG120: (7) | CH120: (8) = (5) - (6) - (7) | CI120: (9) = (4) - (8) | CL120: (1) | CM120: (2) = ( MO - MT) *91 | CN120: (3) = (1) *15% | CO120: (4) = (1) - (3) - (2) | CP120: (5) | CQ120: (6) | CR120: (7) | CS120: (8) = (5) - (6) - (7) | CT120: (9) = (4) - (8) | CW120: (1) | CX120: (2) = ( MO - MT) *91 | CY120: (3) = (1) *15% | CZ120: (4) = (1) - (3) - (2) | DA120: (5) | DB120: (6) | DC120: (7) | DD120: (8) = (5) - (6) - (7) | DE120: (9) = (4) - (8) | DH120: (1) | DI120: (2) = ( MO - MT) *91 | DJ120: (3) = (1) *15% | DK120: (4) = (1) - (3) - (2) | DL120: (5) | DM120: (6) | DN120: (7) | DO120: (8) = (5) - (6) - (7) | DP120: (9) = (4) - (8) | DS120: (1) | DT120: (2) = ( MO - MT) *91 | DU120: (3) = (1) *15% | DV120: (4) = (1) - (3) - (2) | DW120: (5) | DX120: (6) | DY120: (7) | DZ120: (8) = (5) - (6) - (7) | EA120: (9) = (4) - (8) | ED120: (1) | EE120: (2) = ( MO - MT) *91 | EF120: (3) = (1) *15% | EG120: (4) = (1) - (3) - (2) | EH120: (5) | EI120: (6) | EJ120: (7) | EK120: (8) = (5) - (6) - (7) | EL120: (9) = (4) - (8)
A121: HQ | B121: 4191784 | C121: 22021475 | D121: 209590 | E121: =RC[-3]-RC[-1]-RC[-2] ->  | F121: =R132C6*RC[-4] ->  | G121: =RC[-1]*5% ->  | H121: =R132C8*RC[-5] ->  | I121: =RC[-3]-RC[-2]-RC[-1] ->  | J121: =RC[-1]-RC[-5] ->  | L121: HQ | M121: 3603506 | N121: 19851486 | O121: 180175 | P121: =RC[-3]-RC[-1]-RC[-2] -> 2467006.9 | Q121: =R132C17*RC[-4] -> 3000383.6278659259 | R121: =RC[-1]*5% -> 450057.54417988885 | S121: =R132C19*RC[-5] -> 108517.5 | T121: =RC[-3]-RC[-2]-RC[-1] -> 2441808.583686037 | U121: =RC[-1]-RC[-5] -> -25198.316313962918 | W121: HQ | X121: 3432476 | Y121: 20930249 | Z121: 171624 | AA121: =RC[-3]-RC[-1]-RC[-2] -> 0 | AB121: =R132C28*RC[-4] -> 875000000 | AC121: =RC[-1]*5% -> 131250000 | AD121: =R132C19*RC[-5] -> 1.8 | AE121: =RC[-3]-RC[-2]-RC[-1] -> 743749998.20000005 | AF121: =RC[-1]-RC[-5] -> 743749998.20000005 | AH121: HQ | AI121: 3289653 | AJ121: 20255522 | AK121: 164483 | AL121: =RC[-3]-RC[-1]-RC[-2] -> 0.54999999999999982 | AM121: =R132C39*RC[-4] -> 875000000 | AN121: =RC[-1]*5% -> 131250000 | AO121: =R132C19*RC[-5] -> 1.8 | AP121: =RC[-3]-RC[-2]-RC[-1] -> 743749998.20000005 | AQ121: =RC[-1]-RC[-5] -> 743749997.6500001 | AS121: HQ | AT121: 3369026 | AU121: 22715521 | AV121: 168452 | AW121: =RC[-3]-RC[-1]-RC[-2] -> 0.54999999999999982 | AX121: =R132C50*RC[-4] -> 875000000 | AY121: =RC[-1]*5% -> 131250000 | AZ121: =R132C19*RC[-5] -> 1.8 | BA121: =RC[-3]-RC[-2]-RC[-1] -> 743749998.20000005 | BB121: =RC[-1]-RC[-5] -> 743749997.6500001 | BD121: HQ | BE121: 2833337 | BF121: 23046030 | BG121: 141667 | BH121: =RC[-3]-RC[-1]-RC[-2] -> 0.54999999999999982 | BI121: =R132C61*RC[-4] -> 875000000 | BJ121: =RC[-1]*5% -> 131250000 | BK121: =R132C19*RC[-5] -> 1.8 | BL121: =RC[-3]-RC[-2]-RC[-1] -> 743749998.20000005 | BM121: =RC[-1]-RC[-5] -> 743749997.6500001 | BO121: HQ | BP121: 0 | BQ121: 0 | BR121: 0 | BS121: =RC[-3]-RC[-1]-RC[-2] -> 0.54999999999999982 | BT121: =R132C72*RC[-4] -> 875000000 | BU121: =RC[-1]*5% -> 131250000 | BV121: =R132C8*RC[-5] -> 1.8 | BW121: =RC[-3]-RC[-2]-RC[-1] -> 743749998.20000005 | BX121: =RC[-1]-RC[-5] -> 743749997.6500001 | BZ121: HQ | CA121: 0 | CB121: 0 | CC121: 0 | CD121: =RC[-3]-RC[-1]-RC[-2] -> 0.54999999999999982 | CE121: =R132C83*RC[-4] -> 875000000 | CF121: =RC[-1]*5% -> 131250000 | CG121: =R132C19*RC[-5] -> 1.8 | CH121: =RC[-3]-RC[-2]-RC[-1] -> 743749998.20000005 | CI121: =RC[-1]-RC[-5] -> 743749997.6500001 | CK121: HQ | CL121: 0 | CM121: 0 | CN121: 0 | CO121: =RC[-3]-RC[-1]-RC[-2] -> 0.54999999999999982 | CP121: =R132C94*RC[-4] -> 875000000 | CQ121: =RC[-1]*5% -> 131250000 | CR121: =R132C19*RC[-5] -> 1.8 | CS121: =RC[-3]-RC[-2]-RC[-1] -> 743749998.20000005 | CT121: =RC[-1]-RC[-5] -> 743749997.6500001 | CV121: HQ | CW121: 0 | CX121: 0 | CY121: 0 | CZ121: =RC[-3]-RC[-1]-RC[-2] -> 0.54999999999999982 | DA121: =R132C105*RC[-4] -> 875000000 | DB121: =RC[-1]*5% -> 131250000 | DC121: =R132C19*RC[-5] -> 1.8 | DD121: =RC[-3]-RC[-2]-RC[-1] -> 743749998.20000005 | DE121: =RC[-1]-RC[-5] -> 743749997.6500001 | DG121: HQ | DH121: 0 | DI121: 0 | DJ121: 0 | DK121: =RC[-3]-RC[-1]-RC[-2] -> 0.54999999999999982 | DL121: =R132C116*RC[-4] -> 807692307.69230771 | DM121: =RC[-1]*5% -> 121153846.15384614 | DN121: =R132C19*RC[-5] -> 1.8 | DO121: =RC[-3]-RC[-2]-RC[-1] -> 686538459.73846161 | DP121: =RC[-1]-RC[-5] -> 686538459.18846166 | DR121: HQ | DS121: 0 | DT121: 0 | DU121: 0 | DV121: =RC[-3]-RC[-1]-RC[-2] -> 0.54999999999999982 | DW121: =R132C127*RC[-4] -> 875000000 | DX121: =RC[-1]*5% -> 131250000 | DY121: =R132C19*RC[-5] -> 1.8 | DZ121: =RC[-3]-RC[-2]-RC[-1] -> 743749998.20000005 | EA121: =RC[-1]-RC[-5] -> 743749997.6500001 | EC121: HQ | ED121: =RC[-132]+RC[-121]+RC[-110]+RC[-99]+RC[-88]+RC[-77]+RC[-66]+RC[-55]+RC[-44]+RC[-33]+RC[-22]+RC[-11] ->  | EE121: =RC[-132]+RC[-121]+RC[-110]+RC[-99]+RC[-88]+RC[-77]+RC[-66]+RC[-55]+RC[-44]+RC[-33]+RC[-22]+RC[-11] ->  | EF121: =RC[-132]+RC[-121]+RC[-110]+RC[-99]+RC[-88]+RC[-77]+RC[-66]+RC[-55]+RC[-44]+RC[-33]+RC[-22]+RC[-11] ->  | EG121: =RC[-132]+RC[-121]+RC[-110]+RC[-99]+RC[-88]+RC[-77]+RC[-66]+RC[-55]+RC[-44]+RC[-33]+RC[-22]+RC[-11] ->  | EH121: =RC[-132]+RC[-121]+RC[-110]+RC[-99]+RC[-88]+RC[-77]+RC[-66]+RC[-55]+RC[-44]+RC[-33]+RC[-22]+RC[-11] ->  | EI121: =RC[-132]+RC[-121]+RC[-110]+RC[-99]+RC[-88]+RC[-77]+RC[-66]+RC[-55]+RC[-44]+RC[-33]+RC[-22]+RC[-11] ->  | EJ121: =RC[-132]+RC[-121]+RC[-110]+RC[-99]+RC[-88]+RC[-77]+RC[-66]+RC[-55]+RC[-44]+RC[-33]+RC[-22]+RC[-11] ->  | EK121: =RC[-132]+RC[-121]+RC[-110]+RC[-99]+RC[-88]+RC[-77]+RC[-66]+RC[-55]+RC[-44]+RC[-33]+RC[-22]+RC[-11] ->  | EL121: =RC[-132]+RC[-121]+RC[-110]+RC[-99]+RC[-88]+RC[-77]+RC[-66]+RC[-55]+RC[-44]+RC[-33]+RC[-22]+RC[-11] -> 
A122: LUCKY_FONE | B122: 32214018 | C122: 4672374 | D122: 1610702 | E122: =RC[-3]-RC[-1]-RC[-2] ->  | F122: =R132C6*RC[-4] ->  | G122: =RC[-1]*5% ->  | H122: =R132C8*RC[-5] ->  | I122: =RC[-3]-RC[-2]-RC[-1] ->  | J122: =RC[-1]-RC[-5] ->  | L122: LUCKY_FONE | M122: 24114719 | N122: 3182998 | O122: 1205737 | P122: =RC[-3]-RC[-1]-RC[-2] -> 2467006.9 | Q122: =R132C17*RC[-4] -> 3000383.6278659259 | R122: =RC[-1]*5% -> 450057.54417988885 | S122: =R132C19*RC[-5] -> 108517.5 | T122: =RC[-3]-RC[-2]-RC[-1] -> 2441808.583686037 | U122: =RC[-1]-RC[-5] -> -25198.316313962918 | W122: LUCKY_FONE | X122: 27313405 | Y122: 3855029 | Z122: 1365669 | AA122: =RC[-3]-RC[-1]-RC[-2] -> 0 | AB122: =R132C28*RC[-4] -> 875000000 | AC122: =RC[-1]*5% -> 131250000 | AD122: =R132C19*RC[-5] -> 1.8 | AE122: =RC[-3]-RC[-2]-RC[-1] -> 743749998.20000005 | AF122: =RC[-1]-RC[-5] -> 743749998.20000005 | AH122: LUCKY_FONE | AI122: 25899078 | AJ122: 3645898 | AK122: 1294955 | AL122: =RC[-3]-RC[-1]-RC[-2] -> 0.54999999999999982 | AM122: =R132C39*RC[-4] -> 875000000 | AN122: =RC[-1]*5% -> 131250000 | AO122: =R132C19*RC[-5] -> 1.8 | AP122: =RC[-3]-RC[-2]-RC[-1] -> 743749998.20000005 | AQ122: =RC[-1]-RC[-5] -> 743749997.6500001 | AS122: LUCKY_FONE | AT122: 27170069 | AU122: 4551911 | AV122: 1358503 | AW122: =RC[-3]-RC[-1]-RC[-2] -> 0.54999999999999982 | AX122: =R132C50*RC[-4] -> 875000000 | AY122: =RC[-1]*5% -> 131250000 | AZ122: =R132C19*RC[-5] -> 1.8 | BA122: =RC[-3]-RC[-2]-RC[-1] -> 743749998.20000005 | BB122: =RC[-1]-RC[-5] -> 743749997.6500001 | BD122: LUCKY_FONE | BE122: 24644671 | BF122: 3484572 | BG122: 1232233 | BH122: =RC[-3]-RC[-1]-RC[-2] -> 0.54999999999999982 | BI122: =R132C61*RC[-4] -> 875000000 | BJ122: =RC[-1]*5% -> 131250000 | BK122: =R132C19*RC[-5] -> 1.8 | BL122: =RC[-3]-RC[-2]-RC[-1] -> 743749998.20000005 | BM122: =RC[-1]-RC[-5] -> 743749997.6500001 | BO122: LUCKY_FONE | BP122: 0 | BQ122: 0 | BR122: 0 | BS122: =RC[-3]-RC[-1]-RC[-2] -> 0.54999999999999982 | BT122: =R132C72*RC[-4] -> 875000000 | BU122: =RC[-1]*5% -> 131250000 | BV122: =R132C8*RC[-5] -> 1.8 | BW122: =RC[-3]-RC[-2]-RC[-1] -> 743749998.20000005 | BX122: =RC[-1]-RC[-5] -> 743749997.6500001 | BZ122: LUCKY_FONE | CA122: 0 | CB122: 0 | CC122: 0 | CD122: =RC[-3]-RC[-1]-RC[-2] -> 0.54999999999999982 | CE122: =R132C83*RC[-4] -> 875000000 | CF122: =RC[-1]*5% -> 131250000 | CG122: =R132C19*RC[-5] -> 1.8 | CH122: =RC[-3]-RC[-2]-RC[-1] -> 743749998.20000005 | CI122: =RC[-1]-RC[-5] -> 743749997.6500001 | CK122: LUCKY_FONE | CL122: 0 | CM122: 0 | CN122: 0 | CO122: =RC[-3]-RC[-1]-RC[-2] -> 0.54999999999999982 | CP122: =R132C94*RC[-4] -> 875000000 | CQ122: =RC[-1]*5% -> 131250000 | CR122: =R132C19*RC[-5] -> 1.8 | CS122: =RC[-3]-RC[-2]-RC[-1] -> 743749998.20000005 | CT122: =RC[-1]-RC[-5] -> 743749997.6500001 | CV122: LUCKY_FONE | CW122: 0 | CX122: 0 | CY122: 0 | CZ122: =RC[-3]-RC[-1]-RC[-2] -> 0.54999999999999982 | DA122: =R132C105*RC[-4] -> 875000000 | DB122: =RC[-1]*5% -> 131250000 | DC122: =R132C19*RC[-5] -> 1.8 | DD122: =RC[-3]-RC[-2]-RC[-1] -> 743749998.20000005 | DE122: =RC[-1]-RC[-5] -> 743749997.6500001 | DG122: LUCKY_FONE | DH122: 0 | DI122: 0 | DJ122: 0 | DK122: =RC[-3]-RC[-1]-RC[-2] -> 0.54999999999999982 | DL122: =R132C116*RC[-4] -> 807692307.69230771 | DM122: =RC[-1]*5% -> 121153846.15384614 | DN122: =R132C19*RC[-5] -> 1.8 | DO122: =RC[-3]-RC[-2]-RC[-1] -> 686538459.73846161 | DP122: =RC[-1]-RC[-5] -> 686538459.18846166 | DR122: LUCKY_FONE | DS122: 0 | DT122: 0 | DU122: 0 | DV122: =RC[-3]-RC[-1]-RC[-2] -> 0.54999999999999982 | DW122: =R132C127*RC[-4] -> 875000000 | DX122: =RC[-1]*5% -> 131250000 | DY122: =R132C19*RC[-5] -> 1.8 | DZ122: =RC[-3]-RC[-2]-RC[-1] -> 743749998.20000005 | EA122: =RC[-1]-RC[-5] -> 743749997.6500001 | EC122: LUCKY_FONE | ED122: =RC[-132]+RC[-121]+RC[-110]+RC[-99]+RC[-88]+RC[-77]+RC[-66]+RC[-55]+RC[-44]+RC[-33]+RC[-22]+RC[-11] ->  | EE122: =RC[-132]+RC[-121]+RC[-110]+RC[-99]+RC[-88]+RC[-77]+RC[-66]+RC[-55]+RC[-44]+RC[-33]+RC[-22]+RC[-11] ->  | EF122: =RC[-132]+RC[-121]+RC[-110]+RC[-99]+RC[-88]+RC[-77]+RC[-66]+RC[-55]+RC[-44]+RC[-33]+RC[-22]+RC[-11] ->  | EG122: =RC[-132]+RC[-121]+RC[-110]+RC[-99]+RC[-88]+RC[-77]+RC[-66]+RC[-55]+RC[-44]+RC[-33]+RC[-22]+RC[-11] ->  | EH122: =RC[-132]+RC[-121]+RC[-110]+RC[-99]+RC[-88]+RC[-77]+RC[-66]+RC[-55]+RC[-44]+RC[-33]+RC[-22]+RC[-11] ->  | EI122: =RC[-132]+RC[-121]+RC[-110]+RC[-99]+RC[-88]+RC[-77]+RC[-66]+RC[-55]+RC[-44]+RC[-33]+RC[-22]+RC[-11] ->  | EJ122: =RC[-132]+RC[-121]+RC[-110]+RC[-99]+RC[-88]+RC[-77]+RC[-66]+RC[-55]+RC[-44]+RC[-33]+RC[-22]+RC[-11] ->  | EK122: =RC[-132]+RC[-121]+RC[-110]+RC[-99]+RC[-88]+RC[-77]+RC[-66]+RC[-55]+RC[-44]+RC[-33]+RC[-22]+RC[-11] ->  | EL122: =RC[-132]+RC[-121]+RC[-110]+RC[-99]+RC[-88]+RC[-77]+RC[-66]+RC[-55]+RC[-44]+RC[-33]+RC[-22]+RC[-11] -> 
A123: SUBCPS | B123: 27715642 | C123: 924104 | D123: 1385782 | E123: =RC[-3]-RC[-1]-RC[-2] ->  | F123: =R132C6*RC[-4] ->  | G123: =RC[-1]*5% ->  | H123: =R132C8*RC[-5] ->  | I123: =RC[-3]-RC[-2]-RC[-1] ->  | J123: =RC[-1]-RC[-5] ->  | L123: SUBCPS | M123: 20445895 | N123: 1654406 | O123: 1022296 | P123: =RC[-3]-RC[-1]-RC[-2] -> 2467006.9 | Q123: =R132C17*RC[-4] -> 3000383.6278659259 | R123: =RC[-1]*5% -> 450057.54417988885 | S123: =R132C19*RC[-5] -> 108517.5 | T123: =RC[-3]-RC[-2]-RC[-1] -> 2441808.583686037 | U123: =RC[-1]-RC[-5] -> -25198.316313962918 | W123: SUBCPS | X123: 24055704 | Y123: 755845 | Z123: 1202785 | AA123: =RC[-3]-RC[-1]-RC[-2] -> 0 | AB123: =R132C28*RC[-4] -> 875000000 | AC123: =RC[-1]*5% -> 131250000 | AD123: =R132C19*RC[-5] -> 1.8 | AE123: =RC[-3]-RC[-2]-RC[-1] -> 743749998.20000005 | AF123: =RC[-1]-RC[-5] -> 743749998.20000005 | AH123: SUBCPS | AI123: 23679837 | AJ123: 665482 | AK123: 1183991 | AL123: =RC[-3]-RC[-1]-RC[-2] -> 0.54999999999999982 | AM123: =R132C39*RC[-4] -> 875000000 | AN123: =RC[-1]*5% -> 131250000 | AO123: =R132C19*RC[-5] -> 1.8 | AP123: =RC[-3]-RC[-2]-RC[-1] -> 743749998.20000005 | AQ123: =RC[-1]-RC[-5] -> 743749997.6500001 | AS123: SUBCPS | AT123: 24376237 | AU123: 695058 | AV123: 1218812 | AW123: =RC[-3]-RC[-1]-RC[-2] -> 0.54999999999999982 | AX123: =R132C50*RC[-4] -> 875000000 | AY123: =RC[-1]*5% -> 131250000 | AZ123: =R132C19*RC[-5] -> 1.8 | BA123: =RC[-3]-RC[-2]-RC[-1] -> 743749998.20000005 | BB123: =RC[-1]-RC[-5] -> 743749997.6500001 | BD123: SUBCPS | BE123: 24370901 | BF123: 678314 | BG123: 1218546 | BH123: =RC[-3]-RC[-1]-RC[-2] -> 0.54999999999999982 | BI123: =R132C61*RC[-4] -> 875000000 | BJ123: =RC[-1]*5% -> 131250000 | BK123: =R132C19*RC[-5] -> 1.8 | BL123: =RC[-3]-RC[-2]-RC[-1] -> 743749998.20000005 | BM123: =RC[-1]-RC[-5] -> 743749997.6500001 | BO123: SUBCPS | BP123: 0 | BQ123: 0 | BR123: 0 | BS123: =RC[-3]-RC[-1]-RC[-2] -> 0.54999999999999982 | BT123: =R132C72*RC[-4] -> 875000000 | BU123: =RC[-1]*5% -> 131250000 | BV123: =R132C8*RC[-5] -> 1.8 | BW123: =RC[-3]-RC[-2]-RC[-1] -> 743749998.20000005 | BX123: =RC[-1]-RC[-5] -> 743749997.6500001 | BZ123: SUBCPS | CA123: 0 | CB123: 0 | CC123: 0 | CD123: =RC[-3]-RC[-1]-RC[-2] -> 0.54999999999999982 | CE123: =R132C83*RC[-4] -> 875000000 | CF123: =RC[-1]*5% -> 131250000 | CG123: =R132C19*RC[-5] -> 1.8 | CH123: =RC[-3]-RC[-2]-RC[-1] -> 743749998.20000005 | CI123: =RC[-1]-RC[-5] -> 743749997.6500001 | CK123: SUBCPS | CL123: 0 | CM123: 0 | CN123: 0 | CO123: =RC[-3]-RC[-1]-RC[-2] -> 0.54999999999999982 | CP123: =R132C94*RC[-4] -> 875000000 | CQ123: =RC[-1]*5% -> 131250000 | CR123: =R132C19*RC[-5] -> 1.8 | CS123: =RC[-3]-RC[-2]-RC[-1] -> 743749998.20000005 | CT123: =RC[-1]-RC[-5] -> 743749997.6500001 | CV123: SUBCPS | CW123: 0 | CX123: 0 | CY123: 0 | CZ123: =RC[-3]-RC[-1]-RC[-2] -> 0.54999999999999982 | DA123: =R132C105*RC[-4] -> 875000000 | DB123: =RC[-1]*5% -> 131250000 | DC123: =R132C19*RC[-5] -> 1.8 | DD123: =RC[-3]-RC[-2]-RC[-1] -> 743749998.20000005 | DE123: =RC[-1]-RC[-5] -> 743749997.6500001 | DG123: SUBCPS | DH123: 0 | DI123: 0 | DJ123: 0 | DK123: =RC[-3]-RC[-1]-RC[-2] -> 0.54999999999999982 | DL123: =R132C116*RC[-4] -> 807692307.69230771 | DM123: =RC[-1]*5% -> 121153846.15384614 | DN123: =R132C19*RC[-5] -> 1.8 | DO123: =RC[-3]-RC[-2]-RC[-1] -> 686538459.73846161 | DP123: =RC[-1]-RC[-5] -> 686538459.18846166 | DR123: SUBCPS | DS123: 0 | DT123: 0 | DU123: 0 | DV123: =RC[-3]-RC[-1]-RC[-2] -> 0.54999999999999982 | DW123: =R132C127*RC[-4] -> 875000000 | DX123: =RC[-1]*5% -> 131250000 | DY123: =R132C19*RC[-5] -> 1.8 | DZ123: =RC[-3]-RC[-2]-RC[-1] -> 743749998.20000005 | EA123: =RC[-1]-RC[-5] -> 743749997.6500001 | EC123: SUBCPS | ED123: =RC[-132]+RC[-121]+RC[-110]+RC[-99]+RC[-88]+RC[-77]+RC[-66]+RC[-55]+RC[-44]+RC[-33]+RC[-22]+RC[-11] ->  | EE123: =RC[-132]+RC[-121]+RC[-110]+RC[-99]+RC[-88]+RC[-77]+RC[-66]+RC[-55]+RC[-44]+RC[-33]+RC[-22]+RC[-11] ->  | EF123: =RC[-132]+RC[-121]+RC[-110]+RC[-99]+RC[-88]+RC[-77]+RC[-66]+RC[-55]+RC[-44]+RC[-33]+RC[-22]+RC[-11] ->  | EG123: =RC[-132]+RC[-121]+RC[-110]+RC[-99]+RC[-88]+RC[-77]+RC[-66]+RC[-55]+RC[-44]+RC[-33]+RC[-22]+RC[-11] ->  | EH123: =RC[-132]+RC[-121]+RC[-110]+RC[-99]+RC[-88]+RC[-77]+RC[-66]+RC[-55]+RC[-44]+RC[-33]+RC[-22]+RC[-11] ->  | EI123: =RC[-132]+RC[-121]+RC[-110]+RC[-99]+RC[-88]+RC[-77]+RC[-66]+RC[-55]+RC[-44]+RC[-33]+RC[-22]+RC[-11] ->  | EJ123: =RC[-132]+RC[-121]+RC[-110]+RC[-99]+RC[-88]+RC[-77]+RC[-66]+RC[-55]+RC[-44]+RC[-33]+RC[-22]+RC[-11] ->  | EK123: =RC[-132]+RC[-121]+RC[-110]+RC[-99]+RC[-88]+RC[-77]+RC[-66]+RC[-55]+RC[-44]+RC[-33]+RC[-22]+RC[-11] ->  | EL123: =RC[-132]+RC[-121]+RC[-110]+RC[-99]+RC[-88]+RC[-77]+RC[-66]+RC[-55]+RC[-44]+RC[-33]+RC[-22]+RC[-11] -> 
A124: TT PTKD | B124: 5874290 | C124: 10549360 | D124: 293714 | E124: =RC[-3]-RC[-1]-RC[-2] ->  | F124: =R132C6*RC[-4] ->  | G124: =RC[-1]*5% ->  | H124: =R132C8*RC[-5] ->  | I124: =RC[-3]-RC[-2]-RC[-1] ->  | J124: =RC[-1]-RC[-5] ->  | L124: TT PTKD | M124: 5732748 | N124: 59922989 | O124: 286638 | P124: =RC[-3]-RC[-1]-RC[-2] -> 2467006.9 | Q124: =R132C17*RC[-4] -> 3000383.6278659259 | R124: =RC[-1]*5% -> 450057.54417988885 | S124: =R132C19*RC[-5] -> 108517.5 | T124: =RC[-3]-RC[-2]-RC[-1] -> 2441808.583686037 | U124: =RC[-1]-RC[-5] -> -25198.316313962918 | W124: TT PTKD | X124: 4925097 | Y124: 16161208 | Z124: 246254 | AA124: =RC[-3]-RC[-1]-RC[-2] -> 0 | AB124: =R132C28*RC[-4] -> 875000000 | AC124: =RC[-1]*5% -> 131250000 | AD124: =R132C19*RC[-5] -> 1.8 | AE124: =RC[-3]-RC[-2]-RC[-1] -> 743749998.20000005 | AF124: =RC[-1]-RC[-5] -> 743749998.20000005 | AH124: TT PTKD | AI124: 4469741 | AJ124: 32061338 | AK124: 223488 | AL124: =RC[-3]-RC[-1]-RC[-2] -> 0.54999999999999982 | AM124: =R132C39*RC[-4] -> 875000000 | AN124: =RC[-1]*5% -> 131250000 | AO124: =R132C19*RC[-5] -> 1.8 | AP124: =RC[-3]-RC[-2]-RC[-1] -> 743749998.20000005 | AQ124: =RC[-1]-RC[-5] -> 743749997.6500001 | AS124: TT PTKD | AT124: 4205784 | AU124: 32126723 | AV124: 210289 | AW124: =RC[-3]-RC[-1]-RC[-2] -> 0.54999999999999982 | AX124: =R132C50*RC[-4] -> 875000000 | AY124: =RC[-1]*5% -> 131250000 | AZ124: =R132C19*RC[-5] -> 1.8 | BA124: =RC[-3]-RC[-2]-RC[-1] -> 743749998.20000005 | BB124: =RC[-1]-RC[-5] -> 743749997.6500001 | BD124: TT PTKD | BE124: 4046304 | BF124: 31591696 | BG124: 202316 | BH124: =RC[-3]-RC[-1]-RC[-2] -> 0.54999999999999982 | BI124: =R132C61*RC[-4] -> 875000000 | BJ124: =RC[-1]*5% -> 131250000 | BK124: =R132C19*RC[-5] -> 1.8 | BL124: =RC[-3]-RC[-2]-RC[-1] -> 743749998.20000005 | BM124: =RC[-1]-RC[-5] -> 743749997.6500001 | BO124: TT PTKD | BP124: 0 | BQ124: 0 | BR124: 0 | BS124: =RC[-3]-RC[-1]-RC[-2] -> 0.54999999999999982 | BT124: =R132C72*RC[-4] -> 875000000 | BU124: =RC[-1]*5% -> 131250000 | BV124: =R132C8*RC[-5] -> 1.8 | BW124: =RC[-3]-RC[-2]-RC[-1] -> 743749998.20000005 | BX124: =RC[-1]-RC[-5] -> 743749997.6500001 | BZ124: TT PTKD | CA124: 0 | CB124: 0 | CC124: 0 | CD124: =RC[-3]-RC[-1]-RC[-2] -> 0.54999999999999982 | CE124: =R132C83*RC[-4] -> 875000000 | CF124: =RC[-1]*5% -> 131250000 | CG124: =R132C19*RC[-5] -> 1.8 | CH124: =RC[-3]-RC[-2]-RC[-1] -> 743749998.20000005 | CI124: =RC[-1]-RC[-5] -> 743749997.6500001 | CK124: TT PTKD | CL124: 0 | CM124: 0 | CN124: 0 | CO124: =RC[-3]-RC[-1]-RC[-2] -> 0.54999999999999982 | CP124: =R132C94*RC[-4] -> 875000000 | CQ124: =RC[-1]*5% -> 131250000 | CR124: =R132C19*RC[-5] -> 1.8 | CS124: =RC[-3]-RC[-2]-RC[-1] -> 743749998.20000005 | CT124: =RC[-1]-RC[-5] -> 743749997.6500001 | CV124: TT PTKD | CW124: 0 | CX124: 0 | CY124: 0 | CZ124: =RC[-3]-RC[-1]-RC[-2] -> 0.54999999999999982 | DA124: =R132C105*RC[-4] -> 875000000 | DB124: =RC[-1]*5% -> 131250000 | DC124: =R132C19*RC[-5] -> 1.8 | DD124: =RC[-3]-RC[-2]-RC[-1] -> 743749998.20000005 | DE124: =RC[-1]-RC[-5] -> 743749997.6500001 | DG124: TT PTKD | DH124: 0 | DI124: 0 | DJ124: 0 | DK124: =RC[-3]-RC[-1]-RC[-2] -> 0.54999999999999982 | DL124: =R132C116*RC[-4] -> 807692307.69230771 | DM124: =RC[-1]*5% -> 121153846.15384614 | DN124: =R132C19*RC[-5] -> 1.8 | DO124: =RC[-3]-RC[-2]-RC[-1] -> 686538459.73846161 | DP124: =RC[-1]-RC[-5] -> 686538459.18846166 | DR124: TT PTKD | DS124: 0 | DT124: 0 | DU124: 0 | DV124: =RC[-3]-RC[-1]-RC[-2] -> 0.54999999999999982 | DW124: =R132C127*RC[-4] -> 875000000 | DX124: =RC[-1]*5% -> 131250000 | DY124: =R132C19*RC[-5] -> 1.8 | DZ124: =RC[-3]-RC[-2]-RC[-1] -> 743749998.20000005 | EA124: =RC[-1]-RC[-5] -> 743749997.6500001 | EC124: TT PTKD | ED124: =RC[-132]+RC[-121]+RC[-110]+RC[-99]+RC[-88]+RC[-77]+RC[-66]+RC[-55]+RC[-44]+RC[-33]+RC[-22]+RC[-11] ->  | EE124: =RC[-132]+RC[-121]+RC[-110]+RC[-99]+RC[-88]+RC[-77]+RC[-66]+RC[-55]+RC[-44]+RC[-33]+RC[-22]+RC[-11] ->  | EF124: =RC[-132]+RC[-121]+RC[-110]+RC[-99]+RC[-88]+RC[-77]+RC[-66]+RC[-55]+RC[-44]+RC[-33]+RC[-22]+RC[-11] ->  | EG124: =RC[-132]+RC[-121]+RC[-110]+RC[-99]+RC[-88]+RC[-77]+RC[-66]+RC[-55]+RC[-44]+RC[-33]+RC[-22]+RC[-11] ->  | EH124: =RC[-132]+RC[-121]+RC[-110]+RC[-99]+RC[-88]+RC[-77]+RC[-66]+RC[-55]+RC[-44]+RC[-33]+RC[-22]+RC[-11] ->  | EI124: =RC[-132]+RC[-121]+RC[-110]+RC[-99]+RC[-88]+RC[-77]+RC[-66]+RC[-55]+RC[-44]+RC[-33]+RC[-22]+RC[-11] ->  | EJ124: =RC[-132]+RC[-121]+RC[-110]+RC[-99]+RC[-88]+RC[-77]+RC[-66]+RC[-55]+RC[-44]+RC[-33]+RC[-22]+RC[-11] ->  | EK124: =RC[-132]+RC[-121]+RC[-110]+RC[-99]+RC[-88]+RC[-77]+RC[-66]+RC[-55]+RC[-44]+RC[-33]+RC[-22]+RC[-11] ->  | EL124: =RC[-132]+RC[-121]+RC[-110]+RC[-99]+RC[-88]+RC[-77]+RC[-66]+RC[-55]+RC[-44]+RC[-33]+RC[-22]+RC[-11] -> 
A125: TT PTND | B125: 465371785 | C125: 16210594 | D125: 23268589 | E125: =RC[-3]-RC[-1]-RC[-2] ->  | F125: =R132C6*RC[-4] ->  | G125: =RC[-1]*5% ->  | H125: =R132C8*RC[-5] ->  | I125: =RC[-3]-RC[-2]-RC[-1] ->  | J125: =RC[-1]-RC[-5] ->  | L125: TT PTND | M125: 385867735 | N125: 11041042 | O125: 19293388 | P125: =RC[-3]-RC[-1]-RC[-2] -> 2467006.9 | Q125: =R132C17*RC[-4] -> 3000383.6278659259 | R125: =RC[-1]*5% -> 450057.54417988885 | S125: =R132C19*RC[-5] -> 108517.5 | T125: =RC[-3]-RC[-2]-RC[-1] -> 2441808.583686037 | U125: =RC[-1]-RC[-5] -> -25198.316313962918 | W125: TT PTND | X125: 450375721 | Y125: 17017141 | Z125: 22518785 | AA125: =RC[-3]-RC[-1]-RC[-2] -> 0 | AB125: =R132C28*RC[-4] -> 875000000 | AC125: =RC[-1]*5% -> 131250000 | AD125: =R132C19*RC[-5] -> 1.8 | AE125: =RC[-3]-RC[-2]-RC[-1] -> 743749998.20000005 | AF125: =RC[-1]-RC[-5] -> 743749998.20000005 | AH125: TT PTND | AI125: 417612041 | AJ125: 14646251 | AK125: 20880602 | AL125: =RC[-3]-RC[-1]-RC[-2] -> 0.54999999999999982 | AM125: =R132C39*RC[-4] -> 875000000 | AN125: =RC[-1]*5% -> 131250000 | AO125: =R132C19*RC[-5] -> 1.8 | AP125: =RC[-3]-RC[-2]-RC[-1] -> 743749998.20000005 | AQ125: =RC[-1]-RC[-5] -> 743749997.6500001 | AS125: TT PTND | AT125: 465017931 | AU125: 17933351 | AV125: 23250897 | AW125: =RC[-3]-RC[-1]-RC[-2] -> 0.54999999999999982 | AX125: =R132C50*RC[-4] -> 875000000 | AY125: =RC[-1]*5% -> 131250000 | AZ125: =R132C19*RC[-5] -> 1.8 | BA125: =RC[-3]-RC[-2]-RC[-1] -> 743749998.20000005 | BB125: =RC[-1]-RC[-5] -> 743749997.6500001 | BD125: TT PTND | BE125: 671323049 | BF125: 18548788 | BG125: 33566153 | BH125: =RC[-3]-RC[-1]-RC[-2] -> 0.54999999999999982 | BI125: =R132C61*RC[-4] -> 875000000 | BJ125: =RC[-1]*5% -> 131250000 | BK125: =R132C19*RC[-5] -> 1.8 | BL125: =RC[-3]-RC[-2]-RC[-1] -> 743749998.20000005 | BM125: =RC[-1]-RC[-5] -> 743749997.6500001 | BO125: TT PTND | BP125: 0 | BQ125: 0 | BR125: 0 | BS125: =RC[-3]-RC[-1]-RC[-2] -> 0.54999999999999982 | BT125: =R132C72*RC[-4] -> 875000000 | BU125: =RC[-1]*5% -> 131250000 | BV125: =R132C8*RC[-5] -> 1.8 | BW125: =RC[-3]-RC[-2]-RC[-1] -> 743749998.20000005 | BX125: =RC[-1]-RC[-5] -> 743749997.6500001 | BZ125: TT PTND | CA125: 0 | CB125: 0 | CC125: 0 | CD125: =RC[-3]-RC[-1]-RC[-2] -> 0.54999999999999982 | CE125: =R132C83*RC[-4] -> 875000000 | CF125: =RC[-1]*5% -> 131250000 | CG125: =R132C19*RC[-5] -> 1.8 | CH125: =RC[-3]-RC[-2]-RC[-1] -> 743749998.20000005 | CI125: =RC[-1]-RC[-5] -> 743749997.6500001 | CK125: TT PTND | CL125: 0 | CM125: 0 | CN125: 0 | CO125: =RC[-3]-RC[-1]-RC[-2] -> 0.54999999999999982 | CP125: =R132C94*RC[-4] -> 875000000 | CQ125: =RC[-1]*5% -> 131250000 | CR125: =R132C19*RC[-5] -> 1.8 | CS125: =RC[-3]-RC[-2]-RC[-1] -> 743749998.20000005 | CT125: =RC[-1]-RC[-5] -> 743749997.6500001 | CV125: TT PTND | CW125: 0 | CX125: 0 | CY125: 0 | CZ125: =RC[-3]-RC[-1]-RC[-2] -> 0.54999999999999982 | DA125: =R132C105*RC[-4] -> 875000000 | DB125: =RC[-1]*5% -> 131250000 | DC125: =R132C19*RC[-5] -> 1.8 | DD125: =RC[-3]-RC[-2]-RC[-1] -> 743749998.20000005 | DE125: =RC[-1]-RC[-5] -> 743749997.6500001 | DG125: TT PTND | DH125: 0 | DI125: 0 | DJ125: 0 | DK125: =RC[-3]-RC[-1]-RC[-2] -> 0.54999999999999982 | DL125: =R132C116*RC[-4] -> 807692307.69230771 | DM125: =RC[-1]*5% -> 121153846.15384614 | DN125: =R132C19*RC[-5] -> 1.8 | DO125: =RC[-3]-RC[-2]-RC[-1] -> 686538459.73846161 | DP125: =RC[-1]-RC[-5] -> 686538459.18846166 | DR125: TT PTND | DS125: 0 | DT125: 0 | DU125: 0 | DV125: =RC[-3]-RC[-1]-RC[-2] -> 0.54999999999999982 | DW125: =R132C127*RC[-4] -> 875000000 | DX125: =RC[-1]*5% -> 131250000 | DY125: =R132C19*RC[-5] -> 1.8 | DZ125: =RC[-3]-RC[-2]-RC[-1] -> 743749998.20000005 | EA125: =RC[-1]-RC[-5] -> 743749997.6500001 | EC125: TT PTND | ED125: =RC[-132]+RC[-121]+RC[-110]+RC[-99]+RC[-88]+RC[-77]+RC[-66]+RC[-55]+RC[-44]+RC[-33]+RC[-22]+RC[-11] ->  | EE125: =RC[-132]+RC[-121]+RC[-110]+RC[-99]+RC[-88]+RC[-77]+RC[-66]+RC[-55]+RC[-44]+RC[-33]+RC[-22]+RC[-11] ->  | EF125: =RC[-132]+RC[-121]+RC[-110]+RC[-99]+RC[-88]+RC[-77]+RC[-66]+RC[-55]+RC[-44]+RC[-33]+RC[-22]+RC[-11] ->  | EG125: =RC[-132]+RC[-121]+RC[-110]+RC[-99]+RC[-88]+RC[-77]+RC[-66]+RC[-55]+RC[-44]+RC[-33]+RC[-22]+RC[-11] ->  | EH125: =RC[-132]+RC[-121]+RC[-110]+RC[-99]+RC[-88]+RC[-77]+RC[-66]+RC[-55]+RC[-44]+RC[-33]+RC[-22]+RC[-11] ->  | EI125: =RC[-132]+RC[-121]+RC[-110]+RC[-99]+RC[-88]+RC[-77]+RC[-66]+RC[-55]+RC[-44]+RC[-33]+RC[-22]+RC[-11] ->  | EJ125: =RC[-132]+RC[-121]+RC[-110]+RC[-99]+RC[-88]+RC[-77]+RC[-66]+RC[-55]+RC[-44]+RC[-33]+RC[-22]+RC[-11] ->  | EK125: =RC[-132]+RC[-121]+RC[-110]+RC[-99]+RC[-88]+RC[-77]+RC[-66]+RC[-55]+RC[-44]+RC[-33]+RC[-22]+RC[-11] ->  | EL125: =RC[-132]+RC[-121]+RC[-110]+RC[-99]+RC[-88]+RC[-77]+RC[-66]+RC[-55]+RC[-44]+RC[-33]+RC[-22]+RC[-11] -> 
A126: Tổng | B126: =SUM(R[-5]C:R[-1]C) -> 3551128896 | C126: =SUM(R[-5]C:R[-1]C) -> -619983 | D126: =SUM(R[-5]C:R[-1]C) -> 532669334.39999998 | E126: =SUM(R[-5]C:R[-1]C) -> 3019079544.5999999 | F126: =SUM(R[-5]C:R[-1]C) -> 3499999999.9999995 | G126: =SUM(R[-5]C:R[-1]C) -> 525000000 | H126: =SUM(R[-5]C:R[-1]C) -> -557984.69999999995 | I126: =SUM(R[-5]C:R[-1]C) -> 2975557984.6999998 | J126: =SUM(R[-5]C:R[-1]C) -> -43521559.899999849 | L126: Tổng | M126: =SUM(R[-5]C:R[-1]C) -> 3551128896 | N126: =SUM(R[-5]C:R[-1]C) -> -619983 | O126: =SUM(R[-5]C:R[-1]C) -> 532669334.39999998 | P126: =SUM(R[-5]C:R[-1]C) -> 3019079544.5999999 | Q126: =SUM(R[-5]C:R[-1]C) -> 3499999999.9999995 | R126: =SUM(R[-5]C:R[-1]C) -> 525000000 | S126: =SUM(R[-5]C:R[-1]C) -> -557984.69999999995 | T126: =SUM(R[-5]C:R[-1]C) -> 2975557984.6999998 | U126: =SUM(R[-5]C:R[-1]C) -> -43521559.899999849 | W126: Tổng | X126: =SUM(R[-5]C:R[-1]C) -> 12 | Y126: =SUM(R[-5]C:R[-1]C) -> 9 | Z126: =SUM(R[-5]C:R[-1]C) -> 2.35 | AA126: =SUM(R[-5]C:R[-1]C) -> 0.64999999999999991 | AB126: =SUM(R[-5]C:R[-1]C) -> 3500000000 | AC126: =SUM(R[-5]C:R[-1]C) -> 525000000 | AD126: =SUM(R[-5]C:R[-1]C) -> 8.1 | AE126: =SUM(R[-5]C:R[-1]C) -> 2974999991.9000006 | AF126: =SUM(R[-5]C:R[-1]C) -> 2974999991.2500005 | AH126: Tổng | AI126: =SUM(R[-5]C:R[-1]C) -> 12 | AJ126: =SUM(R[-5]C:R[-1]C) -> 9 | AK126: =SUM(R[-5]C:R[-1]C) -> 1.7999999999999998 | AL126: =SUM(R[-5]C:R[-1]C) -> 1.1999999999999997 | AM126: =SUM(R[-5]C:R[-1]C) -> 3500000000 | AN126: =SUM(R[-5]C:R[-1]C) -> 525000000 | AO126: =SUM(R[-5]C:R[-1]C) -> 8.1 | AP126: =SUM(R[-5]C:R[-1]C) -> 2974999991.9000006 | AQ126: =SUM(R[-5]C:R[-1]C) -> 2974999990.7000003 | AS126: Tổng | AT126: =SUM(R[-5]C:R[-1]C) -> 12 | AU126: =SUM(R[-5]C:R[-1]C) -> 9 | AV126: =SUM(R[-5]C:R[-1]C) -> 1.7999999999999998 | AW126: =SUM(R[-5]C:R[-1]C) -> 1.1999999999999997 | AX126: =SUM(R[-5]C:R[-1]C) -> 3500000000 | AY126: =SUM(R[-5]C:R[-1]C) -> 525000000 | AZ126: =SUM(R[-5]C:R[-1]C) -> 8.1 | BA126: =SUM(R[-5]C:R[-1]C) -> 2974999991.9000006 | BB126: =SUM(R[-5]C:R[-1]C) -> 2974999990.7000003 | BD126: Tổng | BE126: =SUM(R[-5]C:R[-1]C) -> 12 | BF126: =SUM(R[-5]C:R[-1]C) -> 9 | BG126: =SUM(R[-5]C:R[-1]C) -> 1.7999999999999998 | BH126: =SUM(R[-5]C:R[-1]C) -> 1.1999999999999997 | BI126: =SUM(R[-5]C:R[-1]C) -> 3500000000 | BJ126: =SUM(R[-5]C:R[-1]C) -> 525000000 | BK126: =SUM(R[-5]C:R[-1]C) -> 8.1 | BL126: =SUM(R[-5]C:R[-1]C) -> 2974999991.9000006 | BM126: =SUM(R[-5]C:R[-1]C) -> 2974999990.7000003 | BO126: Tổng | BP126: =SUM(R[-5]C:R[-1]C) -> 12 | BQ126: =SUM(R[-5]C:R[-1]C) -> 9 | BR126: =SUM(R[-5]C:R[-1]C) -> 1.7999999999999998 | BS126: =SUM(R[-5]C:R[-1]C) -> 1.1999999999999997 | BT126: =SUM(R[-5]C:R[-1]C) -> 3500000000 | BU126: =SUM(R[-5]C:R[-1]C) -> 525000000 | BV126: =SUM(R[-5]C:R[-1]C) -> 8.1 | BW126: =SUM(R[-5]C:R[-1]C) -> 2974999991.9000006 | BX126: =SUM(R[-5]C:R[-1]C) -> 2974999990.7000003 | BZ126: Tổng | CA126: =SUM(R[-5]C:R[-1]C) -> 12 | CB126: =SUM(R[-5]C:R[-1]C) -> 9 | CC126: =SUM(R[-5]C:R[-1]C) -> 1.7999999999999998 | CD126: =SUM(R[-5]C:R[-1]C) -> 1.1999999999999997 | CE126: =SUM(R[-5]C:R[-1]C) -> 3500000000 | CF126: =SUM(R[-5]C:R[-1]C) -> 525000000 | CG126: =SUM(R[-5]C:R[-1]C) -> 8.1 | CH126: =SUM(R[-5]C:R[-1]C) -> 2974999991.9000006 | CI126: =SUM(R[-5]C:R[-1]C) -> 2974999990.7000003 | CK126: Tổng | CL126: =SUM(R[-5]C:R[-1]C) -> 12 | CM126: =SUM(R[-5]C:R[-1]C) -> 9 | CN126: =SUM(R[-5]C:R[-1]C) -> 1.7999999999999998 | CO126: =SUM(R[-5]C:R[-1]C) -> 1.1999999999999997 | CP126: =SUM(R[-5]C:R[-1]C) -> 3500000000 | CQ126: =SUM(R[-5]C:R[-1]C) -> 525000000 | CR126: =SUM(R[-5]C:R[-1]C) -> 8.1 | CS126: =SUM(R[-5]C:R[-1]C) -> 2974999991.9000006 | CT126: =SUM(R[-5]C:R[-1]C) -> 2974999990.7000003 | CV126: Tổng | CW126: =SUM(R[-5]C:R[-1]C) -> 12 | CX126: =SUM(R[-5]C:R[-1]C) -> 9 | CY126: =SUM(R[-5]C:R[-1]C) -> 1.7999999999999998 | CZ126: =SUM(R[-5]C:R[-1]C) -> 1.1999999999999997 | DA126: =SUM(R[-5]C:R[-1]C) -> 3500000000 | DB126: =SUM(R[-5]C:R[-1]C) -> 525000000 | DC126: =SUM(R[-5]C:R[-1]C) -> 8.1 | DD126: =SUM(R[-5]C:R[-1]C) -> 2974999991.9000006 | DE126: =SUM(R[-5]C:R[-1]C) -> 2974999990.7000003 | DG126: Tổng | DH126: =SUM(R[-5]C:R[-1]C) -> 13 | DI126: =SUM(R[-5]C:R[-1]C) -> 9 | DJ126: =SUM(R[-5]C:R[-1]C) -> 1.9499999999999997 | DK126: =SUM(R[-5]C:R[-1]C) -> 2.0499999999999994 | DL126: =SUM(R[-5]C:R[-1]C) -> 3500000000 | DM126: =SUM(R[-5]C:R[-1]C) -> 525000000 | DN126: =SUM(R[-5]C:R[-1]C) -> 8.1 | DO126: =SUM(R[-5]C:R[-1]C) -> 2974999991.9000001 | DP126: =SUM(R[-5]C:R[-1]C) -> 2974999989.8500004 | DR126: Tổng | DS126: =SUM(R[-5]C:R[-1]C) -> 12 | DT126: =SUM(R[-5]C:R[-1]C) -> 9 | DU126: =SUM(R[-5]C:R[-1]C) -> 1.7999999999999998 | DV126: =SUM(R[-5]C:R[-1]C) -> 1.1999999999999997 | DW126: =SUM(R[-5]C:R[-1]C) -> 3500000000 | DX126: =SUM(R[-5]C:R[-1]C) -> 525000000 | DY126: =SUM(R[-5]C:R[-1]C) -> 8.1 | DZ126: =SUM(R[-5]C:R[-1]C) -> 2974999991.9000006 | EA126: =SUM(R[-5]C:R[-1]C) -> 2974999990.7000003 | EC126: Tổng | ED126: =SUM(R[-5]C:R[-1]C) -> 7102257913 | EE126: =SUM(R[-5]C:R[-1]C) -> -1239876 | EF126: =SUM(R[-5]C:R[-1]C) -> 1065338687.5000002 | EG126: =SUM(R[-5]C:R[-1]C) -> 6038159101.4999962 | EH126: =SUM(R[-5]C:R[-1]C) -> 42000000000 | EI126: =SUM(R[-5]C:R[-1]C) -> 6300000000 | EJ126: =SUM(R[-5]C:R[-1]C) -> -1115888.4000000006 | EK126: =SUM(R[-5]C:R[-1]C) -> 35701115888.400009 | EL126: =SUM(R[-5]C:R[-1]C) -> 29662956786.900002
E128: Số liệu theo biên bản đối soát thực tế với Viettel | P128: Số liệu theo biên bản đối soát thực tế với Viettel | AA128: Số liệu theo biên bản đối soát thực tế với Viettel | AL128: Số liệu theo biên bản đối soát thực tế với Viettel | AW128: Số liệu theo biên bản đối soát thực tế với Viettel | BH128: Số liệu theo biên bản đối soát thực tế với Viettel | BS128: Số liệu theo biên bản đối soát thực tế với Viettel | CD128: Số liệu theo biên bản đối soát thực tế với Viettel | CO128: Số liệu theo biên bản đối soát thực tế với Viettel | CZ128: Số liệu theo biên bản đối soát thực tế với Viettel | DK128: Số liệu theo biên bản đối soát thực tế với Viettel | DV128: Số liệu theo biên bản đối soát thực tế với Viettel
E129: Doanh thu | G129: MT vượt | P129: Doanh thu | R129: MT vượt | AA129: Doanh thu | AC129: MT vượt | AL129: Doanh thu | AN129: MT vượt | AW129: Doanh thu | AY129: MT vượt | BH129: Doanh thu | BJ129: MT vượt | BS129: Doanh thu | BU129: MT vượt | CD129: Doanh thu | CF129: MT vượt | CO129: Doanh thu | CQ129: MT vượt | CZ129: Doanh thu | DB129: MT vượt | DK129: Doanh thu | DM129: MT vượt | DV129: Doanh thu | DX129: MT vượt
E130: Doanh thu hệ thống | F130: =R[-4]C[-4] -> 3551128896 | G130: MT hệ thống | H130: =R[-4]C[-5] -> 10 | P130: Doanh thu hệ thống | Q130: =R[-4]C[-4] -> 3551128896 | R130: MT hệ thống | S130: =R[-4]C[-5] -> 10 | AA130: Doanh thu hệ thống | AB130: =R[-4]C[-4] -> 12 | AC130: MT hệ thống | AD130: =R[-4]C[-5] -> 10 | AL130: Doanh thu hệ thống | AM130: =R[-4]C[-4] -> 12 | AN130: MT hệ thống | AO130: =R[-4]C[-5] -> 10 | AW130: Doanh thu hệ thống | AX130: =R[-4]C[-4] -> 12 | AY130: MT hệ thống | AZ130: =R[-4]C[-5] -> 10 | BH130: Doanh thu hệ thống | BI130: =R[-4]C[-4] -> 12 | BJ130: MT hệ thống | BK130: =R[-4]C[-5] -> 10 | BS130: Doanh thu hệ thống | BT130: =R[-4]C[-4] -> 12 | BU130: MT hệ thống | BV130: =R[-4]C[-5] -> 10 | CD130: Doanh thu hệ thống | CE130: =R[-4]C[-4] -> 12 | CF130: MT hệ thống | CG130: =R[-4]C[-5] -> 10 | CO130: Doanh thu hệ thống | CP130: =R[-4]C[-4] -> 12 | CQ130: MT hệ thống | CR130: =R[-4]C[-5] -> 10 | CZ130: Doanh thu hệ thống | DA130: =R[-4]C[-4] -> 12 | DB130: MT hệ thống | DC130: =R[-4]C[-5] -> 10 | DK130: Doanh thu hệ thống | DL130: =R[-4]C[-4] -> 13 | DM130: MT hệ thống | DN130: =R[-4]C[-5] -> 10 | DV130: Doanh thu hệ thống | DW130: =R[-4]C[-4] -> 12 | DX130: MT hệ thống | DY130: =R[-4]C[-5] -> 10
E131: Doanh thu thực tế | F131: 3500000000 | G131: MT thực tế | H131: 9 | P131: Doanh thu thực tế | Q131: 3500000000 | R131: MT thực tế | S131: 9 | AA131: Doanh thu thực tế | AB131: 3500000000 | AC131: MT thực tế | AD131: 9 | AL131: Doanh thu thực tế | AM131: 3500000000 | AN131: MT thực tế | AO131: 9 | AW131: Doanh thu thực tế | AX131: 3500000000 | AY131: MT thực tế | AZ131: 9 | BH131: Doanh thu thực tế | BI131: 3500000000 | BJ131: MT thực tế | BK131: 9 | BS131: Doanh thu thực tế | BT131: 3500000000 | BU131: MT thực tế | BV131: 9 | CD131: Doanh thu thực tế | CE131: 3500000000 | CF131: MT thực tế | CG131: 9 | CO131: Doanh thu thực tế | CP131: 3500000000 | CQ131: MT thực tế | CR131: 9 | CZ131: Doanh thu thực tế | DA131: 3500000000 | DB131: MT thực tế | DC131: 9 | DK131: Doanh thu thực tế | DL131: 3500000000 | DM131: MT thực tế | DN131: 9 | DV131: Doanh thu thực tế | DW131: 3500000000 | DX131: MT thực tế | DY131: 9
E132: DT QT/DT HT | F132: =R[-1]C/R[-2]C -> 0.9856020726091943 | G132: MT QT/ HT | H132: =R[-1]C/R[-2]C -> 0.9 | P132: DT QT/DT HT | Q132: =R[-1]C/R[-2]C -> 0.9856020726091943 | R132: MT QT/ HT | S132: =R[-1]C/R[-2]C -> 0.9 | AA132: DT QT/DT HT | AB132: =R[-1]C/R[-2]C -> 291666666.66666669 | AC132: MT QT/ HT | AD132: =R[-1]C/R[-2]C -> 0.9 | AL132: DT QT/DT HT | AM132: =R[-1]C/R[-2]C -> 291666666.66666669 | AN132: MT QT/ HT | AO132: =R[-1]C/R[-2]C -> 0.9 | AW132: DT QT/DT HT | AX132: =R[-1]C/R[-2]C -> 291666666.66666669 | AY132: MT QT/ HT | AZ132: =R[-1]C/R[-2]C -> 0.9 | BH132: DT QT/DT HT | BI132: =R[-1]C/R[-2]C -> 291666666.66666669 | BJ132: MT QT/ HT | BK132: =R[-1]C/R[-2]C -> 0.9 | BS132: DT QT/DT HT | BT132: =R[-1]C/R[-2]C -> 291666666.66666669 | BU132: MT QT/ HT | BV132: =R[-1]C/R[-2]C -> 0.9 | CD132: DT QT/DT HT | CE132: =R[-1]C/R[-2]C -> 291666666.66666669 | CF132: MT QT/ HT | CG132: =R[-1]C/R[-2]C -> 0.9 | CO132: DT QT/DT HT | CP132: =R[-1]C/R[-2]C -> 291666666.66666669 | CQ132: MT QT/ HT | CR132: =R[-1]C/R[-2]C -> 0.9 | CZ132: DT QT/DT HT | DA132: =R[-1]C/R[-2]C -> 291666666.66666669 | DB132: MT QT/ HT | DC132: =R[-1]C/R[-2]C -> 0.9 | DK132: DT QT/DT HT | DL132: =R[-1]C/R[-2]C -> 269230769.23076922 | DM132: MT QT/ HT | DN132: =R[-1]C/R[-2]C -> 0.9 | DV132: DT QT/DT HT | DW132: =R[-1]C/R[-2]C -> 291666666.66666669 | DX132: MT QT/ HT | DY132: =R[-1]C/R[-2]C -> 0.9
E133: Tỷ lệ thất thoát | F133: =100%-R[-1]C -> 1.4397927390805698E-2 | G133: Tỷ lệ chênh lệch | H133: =100%-R[-1]C -> 9.9999999999999978E-2 | P133: Tỷ lệ thất thoát | Q133: =100%-R[-1]C -> 1.4397927390805698E-2 | R133: Tỷ lệ chênh lệch | S133: =100%-R[-1]C -> 9.9999999999999978E-2 | AA133: Tỷ lệ thất thoát | AB133: =100%-R[-1]C -> -291666665.66666669 | AC133: Tỷ lệ chênh lệch | AD133: =100%-R[-1]C -> 9.9999999999999978E-2 | AL133: Tỷ lệ thất thoát | AM133: =100%-R[-1]C -> -291666665.66666669 | AN133: Tỷ lệ chênh lệch | AO133: =100%-R[-1]C -> 9.9999999999999978E-2 | AW133: Tỷ lệ thất thoát | AX133: =100%-R[-1]C -> -291666665.66666669 | AY133: Tỷ lệ chênh lệch | AZ133: =100%-R[-1]C -> 9.9999999999999978E-2 | BH133: Tỷ lệ thất thoát | BI133: =100%-R[-1]C -> -291666665.66666669 | BJ133: Tỷ lệ chênh lệch | BK133: =100%-R[-1]C -> 9.9999999999999978E-2 | BS133: Tỷ lệ thất thoát | BT133: =100%-R[-1]C -> -291666665.66666669 | BU133: Tỷ lệ chênh lệch | BV133: =100%-R[-1]C -> 9.9999999999999978E-2 | CD133: Tỷ lệ thất thoát | CE133: =100%-R[-1]C -> -291666665.66666669 | CF133: Tỷ lệ chênh lệch | CG133: =100%-R[-1]C -> 9.9999999999999978E-2 | CO133: Tỷ lệ thất thoát | CP133: =100%-R[-1]C -> -291666665.66666669 | CQ133: Tỷ lệ chênh lệch | CR133: =100%-R[-1]C -> 9.9999999999999978E-2 | CZ133: Tỷ lệ thất thoát | DA133: =100%-R[-1]C -> -291666665.66666669 | DB133: Tỷ lệ chênh lệch | DC133: =100%-R[-1]C -> 9.9999999999999978E-2 | DK133: Tỷ lệ thất thoát | DL133: =100%-R[-1]C -> -269230768.23076922 | DM133: Tỷ lệ chênh lệch | DN133: =100%-R[-1]C -> 9.9999999999999978E-2 | DV133: Tỷ lệ thất thoát | DW133: =100%-R[-1]C -> -291666665.66666669 | DX133: Tỷ lệ chênh lệch | DY133: =100%-R[-1]C -> 9.9999999999999978E-2
E134: Doanh thu khuyến khích | P134: Doanh thu khuyến khích | AA134: Doanh thu khuyến khích | AL134: Doanh thu khuyến khích | AW134: Doanh thu khuyến khích | BH134: Doanh thu khuyến khích | BS134: Doanh thu khuyến khích | CD134: Doanh thu khuyến khích | CO134: Doanh thu khuyến khích | CZ134: Doanh thu khuyến khích | DK134: Doanh thu khuyến khích | DV134: Doanh thu khuyến khích